"filename","nome","titolo","anno","chunk","DIL"
"Battaglia_Giacinto-La_lega_lombarda-1834","Battaglia Giacinto","La lega lombarda","1834","﻿LA LEGA LOMBARDA Da' Torchi di Luigi Nervetti. LA LEGA LOMBARDA ROMANZO CON NOTE ISTORICHE DUE PAROLE","NO"
"Battaglia_Giacinto-La_lega_lombarda-1834","Battaglia Giacinto","La lega lombarda","1834","Otto anni fa composi un Romanzo intitolato Gelimele e il diedi alle stampe. Non piacque né al pubblico, né ai critici, e doveva essere così per più ragioni. Nondimeno, in poco tempo l'edizione fu esaurita, altra delle tante prove die i libri ebe più presto si vendono non sono sempre i più buoni.","NO"
"Battaglia_Giacinto-La_lega_lombarda-1834","Battaglia Giacinto","La lega lombarda","1834","Alcuni anni dopo un libraio, bramoso di farne una ristampa, m' invitò a correggere il mio romanzo nella sua parte più difettosa. l'esposizione. Io m' accinsi all'opera; ma quale fu mai la mia sorpresa quando, recatomi dal libraio col mio lavoro bello e terminato, e tutto baldo di dover fra poco vedere impastato sugli angoli della città, se non Finterò mio nome almeno le mie iniziali, trovai chiuso a sprange il negozio dell'amico!","NO"
"Battaglia_Giacinto-La_lega_lombarda-1834","Battaglia Giacinto","La lega lombarda","1834","Chiesi di lui a Tizio e a Sempronio e mi venne detto che un bel mattino sul fresco ei s'era dato quato quato a viaggiare per prender aria, onde per un pezzo non avrebbe pensato a pubblicare ne libri nuovi, ne libri vecchi. Tornato a casa tutto sconfortato, come per consolarmi, presi a scorrere un'altra volta il mio romanzo rifatto — e, forse di soverchio indulgente verso uno de' primi miei pochi lavori, parvemi che per un merito solo non fosse egli affatto indegno dell'attenzione di una frazione qualunque del pubblico; epperò, dalli e ridalli, mi decisi a riprodurlo sotto la nuova presente sua forma. Ora il lettore mi chiederà qual sia questo merito che dar può al mio povero libro il diritto di comparire al pubblico ristampato in un elegante 52° con carta velina e caratteri nuovi?","NO"
"Battaglia_Giacinto-La_lega_lombarda-1834","Battaglia Giacinto","La lega lombarda","1834","Io rispondo: Il mio romanzo è tessutole bene o male non dico, sull'epoca la più. gloriosa, la più splendida, la più cavalleresca della nostra storia Lombarda.","NO"
"Battaglia_Giacinto-La_lega_lombarda-1834","Battaglia Giacinto","La lega lombarda","1834","A quest'ora apparvero fra noi tanti e tanti romanzi, novelle e racconti da farne un monte; parte roba eccellente parte roba mediocre, parte ecc., non un solo però di tanti romanzi attinse a quelle sacre pagine de' nostri fasti ch'io con mano veramente profana frugai per trarne il pochetto di buono che Condensi nel mio. Senonché a questo punto taluno mi interrompe per cantarmi in musica le solite lagnanze contro il romanzo storico e dirmi tante e tante cose da far abborrire non il mio che è uno scarabocchio, ma anche i più belli di Walter-Scott. Io non entro in una questione già fritta e rifritta in otto o dieci prefazioni pel meno, in otto o dieci articoli di giornale, in otto o dieci opuscoli; ma alle tante dette finora aggiungo quattro sole parole.","NO"
"Battaglia_Giacinto-La_lega_lombarda-1834","Battaglia Giacinto","La lega lombarda","1834","O quegli che si dedica alla lettura de' romanzi storici non legge altri libri di storia (come avviene di solito) e in siffatto caso acquisterà colla lettura de' romanzi delle idee di storia che altrimenti non avrebbe mai acquistate, e ciò sarà un bene, siano anco imperfette queste idee, perché del certo gli e meglio avere idee imperfette di una cosa che non averne affatto: o quegli che legge romanzi storici legge anche libri di storia, e in questo secondo caso egli ha mezzo di rettifica re le sue idee, di trovare in isbaglio il romanziere, di farci il critico addosso; e ciò sarà un altro bene, perché nousolo prenderà maggior amore agli studii storici, ma si abituerà a mettere del criterio e dell'analisi nelle sue letture, Io però son persuaso che quella gente che fa gran lettura di romanzi non legge altri libri; sono persuaso che in questo caso meglio è che i romanzi che e' si leggono siano storici anziché non storici, perché nei primi può contenersi tutto il buono dei secondi, più il proprio loro buono, vale a dire quelle perfette o imperfette cognizioni positive di storia che essi contengono; sono persuaso finalmente che le menti frivole e volgari, quelle che di solito leggono per mero solazzo e passatempo, se non s'inducono a prendere qualche amore alla lettura della storia colla lettura de' romanzi storici, non vi si inducono mai più in. altro qualsiasi modo. Non dico altro su questo argomento perché ora mi viene al pensiero che il mio non è intitolato Romanzo Storico ma bensì, Romanzo con Note Storiche.","NO"
"Battaglia_Giacinto-La_lega_lombarda-1834","Battaglia Giacinto","La lega lombarda","1834","Vedete mo se fui astuto! Ho battuta la vìa di mezzo e così non ho arrischiato di irritare né i fautori, ne i detrattori del romanzo storico; non i primi perché nel mio romanzo si contiene tanta storia che basti ad accontentarli; non i secondi, perché o la storia che contiensi nel mio libercolo non e falsata e alla buon'ora, non v'ha più luogo alla critica; od è falsata e non mi si può dar taccia perocché vicino al veleno ho messo l'antidoto, ossia le note storiche tolte di pianta da un autore riputatissimo, e sì estese e sì spesse che non v' è cenno di storia nel romanzo che non sia o corroborato o rettificato nella nota relativa.","NO"
"Battaglia_Giacinto-La_lega_lombarda-1834","Battaglia Giacinto","La lega lombarda","1834","Dunque, signori lettori e signori critici Ma penso che è inutile che più a lungo m' affanni perché non è gran fatto difficile che il mio povero romanzo non abbia ne lettori, ne critici.","YES"
"Battaglia_Giacinto-La_lega_lombarda-1834","Battaglia Giacinto","La lega lombarda","1834","Tout Jlèchissoit, tout trembloit, et Frécléric pouvoit croire que désormais son trofie etoit fonde sur Ics bases les plus inébranlables. SlM. Sism. Hist. des Rep. IU «tutti gli uomini hanno una patria; tu sei figlio della spelonca».","NO"
"Battaglia_Giacinto-La_lega_lombarda-1834","Battaglia Giacinto","La lega lombarda","1834","Udovaldo, l'ottuagenario dell'alpe, accompagna queste parole con una lagrima; la sua fronte è segnata dalle rughe di aspri disagi sofferti. Egli siede nella sua capanna. Curvato sul bastone dell'esigilo, più che gli anni pesano al profugo rimembranze di passale sventure.","NO"
"Battaglia_Giacinto-La_lega_lombarda-1834","Battaglia Giacinto","La lega lombarda","1834","«Tutti gli uomini hanno una patria; tu sei figlio della spelonca». Ei parla ad un giovinetto, bello come l'orgoglio della innocenza, cui negre e innanellate scendono lungo le guance le chiome; l'azzurro delle languide pupille esprime l'entusiasmo della giovinezza. Egli è in silenzio, ovvero la parola sfiora le rosee sue labbra: egli sta contemplando la mestizia del vecchio che a lui volge la parola.","NO"
"Battaglia_Giacinto-La_lega_lombarda-1834","Battaglia Giacinto","La lega lombarda","1834","— figlio figlio del mio figlio, ecco li tuoi averi: la pietà degli uomini, una capanna, e fra breve le ceneri dell'amoroso tuo avo. Però sei ricco, immensamente ricco, perché sei innocente...; e per gli innocenti il mondo intero è una casa». Uno sguardo affettuoso come quello de' Serafini fiso nel radiante aspetto dell'Eterno, contempla il volto venerabile del vecchio.","NO"
"Battaglia_Giacinto-La_lega_lombarda-1834","Battaglia Giacinto","La lega lombarda","1834","Geltrude, la giovinetta della valle, siede ai fianchi d' Ildovaldo. — a Padre, padre mio! ella esclama, deve ei forse abbandonarmi nel giorno del mio dolore?","NO"
"Battaglia_Giacinto-La_lega_lombarda-1834","Battaglia Giacinto","La lega lombarda","1834","Fia forse che il fratello dell'amor mio mi lasci nel mezzo della spelonca, esposta alle fiere del bosco, alla fame? Stava per piangere la giovinetta, quando Ildovaldo la baciò in fronte, onde la sua mestizia si cambiò in un dolce sorriso. Nel'primo inverno del suo esiglio, Ildovaldo in compagnia del piccolo Giselfo erasi un dì recato d' intorno elemosinando e supplicando la pietà degli uomini.","YES"
"Battaglia_Giacinto-La_lega_lombarda-1834","Battaglia Giacinto","La lega lombarda","1834","Faceva ritorno al suo selvaggio tugurio — Era freddo freddo — Il soffio del vento della notte attraverso i rami degli alberi aveva agghiacciate le stille rugiadose di un'aurora serena. La terra era coperta da un immenso bianco strato, più tristo del colore de' funerali, perché sulla solitaria pianura dominava un silenzio profondo, e solo dal letto fumicante dei casolari aizavasi il grido del gallo assiderato, e fra i rami della quercia carichi di neve udivasi il gracidare del corvo, che sbatteva le negre sue ali, indi s'accosciava. Infoscavano l'aria i larghi fiocchi della neve cadente.","NO"
"Battaglia_Giacinto-La_lega_lombarda-1834","Battaglia Giacinto","La lega lombarda","1834","Ildovaldo camminava lento per l'età, e Giselfo, il tenero suo nipote, il sosteneva, e assieme scendevano nella valle. Un erto, alpestre sentiero guidava attraverso le nudi rupi della spelonca. — «E siffatta la gloria degli uomini; l'orgoglio della state, poi il gelo e il silenzio dei verno».","NO"
"Battaglia_Giacinto-La_lega_lombarda-1834","Battaglia Giacinto","La lega lombarda","1834","Così parlava il vecchio, quando udì un gemito soffocato. Anche il giovinetto soffermossi e tenne chiuso il respiro nel petto, e il dito posato sulle labbra. Il gemito fiocco si udì un'altra volta... «È qui presso, v","NO"
"Battaglia_Giacinto-La_lega_lombarda-1834","Battaglia Giacinto","La lega lombarda","1834","Un'altra volta ancora, e videro entrambi giacente pallida, discinta una donna che già aveva il color della morte sulle gote e gli occhi semispenti, e tardo e faticoso mandava il fiato. Negli empiti del male che la opprimeva, ella stringevasi al seno, e tentava involgere nei proprj cenciosi panni una bambina, che quasi pareva per puerile istinto le rubasse il tiepore della vita. Quelle due infelici si baciavano., e s'abbracciavano, poiché la pargoletta erasi avvinta al collo della madre, e sulle guance di lei premeva le irrigidite sue guance.","NO"
"Battaglia_Giacinto-La_lega_lombarda-1834","Battaglia Giacinto","La lega lombarda","1834","— Pietà - prese a dire la donna moribonda. Il suo sguardo incontrò lo sguardo contristato del vecchio. — Pietà - disse ancora con fioca voce; e Ildovaldo inchinatosi tentò alzarla, ma indarno.","NO"
"Battaglia_Giacinto-La_lega_lombarda-1834","Battaglia Giacinto","La lega lombarda","1834","La bambina chiese pane, e il piccolo Giselda prese a ristorarla con latte, e le porse un tozzo, poi corse ansioso alla donna; e pianse perché il vecchio s'affannava di non poter soccorrere la misera. Ildovaldo piega a terra il ginocchio, appoggia ambe le mani sul suo bastone, volge. ai Cielo piene di lagrime le pupille, piange e prega.","NO"
"Battaglia_Giacinto-La_lega_lombarda-1834","Battaglia Giacinto","La lega lombarda","1834","Giselfo ora corre alla bambina, ora alla madre, e questa ajuta coi suoi teneri affetti, e quella copre e ricopre colle sue vesti, ne, benché seminudo il pietoso sente la rigidezza dell'aria. Ma già manda l'ultimo gemito la madre moribonda. La mia figlia, la tenera mia Geltrude» esclama.","NO"
"Battaglia_Giacinto-La_lega_lombarda-1834","Battaglia Giacinto","La lega lombarda","1834","La sua tremante voce termina con un sospiro cui succede un lungo e tristo silenzio. Il giovinetto con occhio smarrito già fissava il volto e le labbra bianche di un cadavere cui faceva funebre coperta la neve cadente. Nel fondo della valle, ai piedi di un cipresso, colle istesse sue mani il vecchio Ildovaldo scavò la lussa all'estinta.","NO"
"Battaglia_Giacinto-La_lega_lombarda-1834","Battaglia Giacinto","La lega lombarda","1834","Calava sotto terra la spoglia della misera, mentre la bambina seduta sulla zolla funerea sorrideva ne' suoi innocenti trastulli, accennando al dormire della madre. Il vecchio contristato eresse una croce sulla sepoltura, e vicino ad essa proferì la preghiera de' trapassati; onde la pace eterna scese sulla tomba dell'estinta madre di Geltrude. Passarono due lustri da quel triste giorno, e da quel giorno il vecchio Ildovaldo fu padre a Geltrude; e il giovinetto Giselfo mai non colse selvatico frutto senza porgerlo con amoroso sorriso alla sorella de' primi suoi anni.","NO"
"Battaglia_Giacinto-La_lega_lombarda-1834","Battaglia Giacinto","La lega lombarda","1834","Ildovaldo possiede una capanna, abbietto tugurio dell'innocenza e della virtù. Tive egli i lunghi e penosi giorni. e unico conforto al cuor suo arrecano gli scherzi di due giovanetti, che verso il cadere del sole, quando la terra veste le tinte della mestizia, s'aggirano lieti intorno a lui, seduto sotto il frondame di una vecchia quercia.","NO"
"Battaglia_Giacinto-La_lega_lombarda-1834","Battaglia Giacinto","La lega lombarda","1834","Ingrandiscono essi pieni di angelica bellezza. Però Giselfo sta sovente pensoso in silenzio, e fisa le negre pupille della vergine. Un affanno ignoto entrò nel suo cuore.","NO"
"Battaglia_Giacinto-La_lega_lombarda-1834","Battaglia Giacinto","La lega lombarda","1834","Talora arde per strana vivezza. e irrequieto sembra sia avido di far prove di prodezze. Egli non è più vago de' fiorellini della valle, o del passero solitario; queste sue vaghezze svanirono cogli anni.","NO"
"Battaglia_Giacinto-La_lega_lombarda-1834","Battaglia Giacinto","La lega lombarda","1834","Ora egli è pensoso e pallido, e solo allora ha le gote tinte da bel vermiglio, quando s'affissa nelle nere pupille della giovinetta sua compagna. Stassi le lunghe ore sulla cima di una rupe; immobile, pieno dei suoi pensieri, mira lo spettacolo di una natura maestosa benché rozza, e contempla il sorgere del mattino; quando, col zeffiro di un 1 aurora serena, giunse al suo orecchio un canto dolcissimo. «Come il giunco privo della rugiada, io languisco privo dell'oggetto de' miei sospiri: come la rosa lambita dal venticello, io provo una gioja celeste quando sono ticina all'oggetto de' miei sospiri..,, Oh angelo d' amore!","NO"
"Battaglia_Giacinto-La_lega_lombarda-1834","Battaglia Giacinto","La lega lombarda","1834","— la mia esistenza si è confusa colla tua. — Io non posso vivere che nel pensiero del tuo amore. Senza il pensiero del tuo amore io languisco come il giunco privo della rugiada...»","NO"
"Battaglia_Giacinto-La_lega_lombarda-1834","Battaglia Giacinto","La lega lombarda","1834","Giselfo porta in giro lo sguardo dalla cima della rupe. Un fuoco veemente gli arde nel seno; immobile col gesto sembrava udito avesse la voce di uno spirito dell'aria. Girò tre volte lo sguardo scintillante... Nel fondo della valle, sotta l'ombra di una quercia vide Geltrude.","NO"
"Battaglia_Giacinto-La_lega_lombarda-1834","Battaglia Giacinto","La lega lombarda","1834","Impallidì, rattenne quasi il respiro; poi scese dalla rupe, attraversò la valle, e giunse ai piedi della giovinetta... Il suo labbro, imbiancato dall'agitazione, non sa articolare un accento: l'occhio suo manda faville. — Egli strinse la destra della bella Geltrude e la fissò silenzioso.","NO"
"Battaglia_Giacinto-La_lega_lombarda-1834","Battaglia Giacinto","La lega lombarda","1834","Lo sguardo della fanciulla, le sue membra incurvate, immobili, esprimono una sorpresa celeste. Ella sospirò, e Giselfo pieno del suo caldo affetto se la strinse fra le braccia e posò le labbra sulle smorte labbra di lei. Un raggio di sole, fendendo il frondame della quercia, feri io quell'istante Io sguardo del giovinetto e gP infuse una pura virtù.","NO"
"Battaglia_Giacinto-La_lega_lombarda-1834","Battaglia Giacinto","La lega lombarda","1834","Sul sasso del deserto, i due amanti si giurarono eterno amore. L'aure del mattino sereno si confusero colle loro tenere parole, e la maestà della nuda natura rese più sacro il voto dei loro cuori. La terra vesti un'altra volta il tesoro delle sue bellezze.","NO"
"Battaglia_Giacinto-La_lega_lombarda-1834","Battaglia Giacinto","La lega lombarda","1834","Un' altra volta il tiepido raggio del sole sfavillò sui colli verdeggianti, e gli allegri concenti delle zampogne pastorali confuse coi canti degli augelletti salutarono la nuova primavera. — È bello il mondo, e la natura si sveglia co' suoi mille sorrisi! Noi soli, o mio padre, sìam mesti.","YES"
"Battaglia_Giacinto-La_lega_lombarda-1834","Battaglia Giacinto","La lega lombarda","1834","Tu sempre sospiri, e mai la tua pupilla volgesi al Cielo che non sia velata da una lagrima... Io sono la tua figlia diletta... e al tuo dolore m' attristo; però me pure un affanno preme, e anche le mie guancie spesso bagna il pianto. Mi fastidiano i sollazzi, il canto mi noja...","NO"
"Battaglia_Giacinto-La_lega_lombarda-1834","Battaglia Giacinto","La lega lombarda","1834","Il bel sentiero della valle, i zampilli e le lucide arene del torrente, l'azzurro del Cielo in una notte serena più non sono li miei diletti. Non amo che il vecchio mio padre... non adoro che il vecchio mio padre...» Ciò detto tacque la giovinetta ed arrossi: l'anima sua pura come l'alitar del venticello sui fiori, si palesò: il vecchio la guardò, poi la strinse ai seno, la baciò, e sulla maestà del suo volto si dipinsero gli affetti che lo compresero in queir istante.","NO"
"Battaglia_Giacinto-La_lega_lombarda-1834","Battaglia Giacinto","La lega lombarda","1834","Entra Giselfo. Porta sulle spalle un capriolo ferito dalle sue freccie. Pieno d' innocente orgoglio depone la preda, e sembra chiedere al vecchio suo padre il primo premio del suo valore, un sorriso.","NO"
"Battaglia_Giacinto-La_lega_lombarda-1834","Battaglia Giacinto","La lega lombarda","1834","Il secondo? un bacio di Geltrude. Entrambi si gettarono ai piedi di Ildovaldo... Una parola sta per escire dalle loro labbra; ma tremanti fissano lo sguardo sorpreso del vecchio...","NO"
"Battaglia_Giacinto-La_lega_lombarda-1834","Battaglia Giacinto","La lega lombarda","1834","— «Padre, padre, esclamano, benedici il nostro amore, pronunzia le parole della nostra eterna felicità, e un tuo sorriso ci guidi uniti sul cammino della vita, onde con te sia l'immenso amore di una famiglia». Guardavali Ildovaldo, né la placidezza del suo volto crasi menomamente turbata. — «Sul sasso del deserto, rispose egli, al cospetto del Cielo, dimani col sorgere della luna mangeremo le carni che le tue mani ci apprestarono per la prima volta, o Giselfo, e colà forse Iddio benedirà la prima opera del tuo valore.","NO"
"Battaglia_Giacinto-La_lega_lombarda-1834","Battaglia Giacinto","La lega lombarda","1834","Dimani, giorno di alta mestizia, caleremo nella valle, piangeremo insieme sopra un tumulo: piangeremo insieme il giorno che ricorda F alta mestizia de' nostri fratelli. Poi si proferirà un sacro e solenne giuramento.» Così disse il vecchio, e li due giovanetti ammutolirono, e si guardarono immobili.","NO"
"Battaglia_Giacinto-La_lega_lombarda-1834","Battaglia Giacinto","La lega lombarda","1834","Sul sasso del deserto, al cospetto del Cielo fu il desco, lldovaldo parve compreso da un dolore misterioso, e con più affetto si strinse al seno li suoi teneri compagni. Era un tramonto triste, senza soilio c aura, senza canto d' augello o stormir di fronda: mestizia somma copriva la spelonca. L'ultimo raggio del sole rosseggiava sulle creste del monte, e quella tinta quasi sanguigna pareva indicasse il mistero di una grave sventura.","NO"
"Battaglia_Giacinto-La_lega_lombarda-1834","Battaglia Giacinto","La lega lombarda","1834","Indi a un istante sorgeva la luna, e il fioco suo chiarore destava nell'anima una mestizia profonda, come alloraché si mira il pallore del volto di un cadavere! Attraverso alla spelonca si spandevano le lunghe ombre delle macchie e degli alberi annosi, e finalmente studia uno strido; lo strido del gufo dalle crepature delle rupi, mesto come la voce della desolazione. Scendono lenti e silenziosi nel fondo della vallea il vecchio e i due giovinetti; giungono presso alla riva del torrente ove sorge uà 1 elevata zolla, e una croce a mezzo rovesciata dai venti che non rispettano i simboli del dolore degli uomini.","NO"
"Battaglia_Giacinto-La_lega_lombarda-1834","Battaglia Giacinto","La lega lombarda","1834","— a Qui, qui, ove posano le ossa della madre tua, si fa a dire il vecchio rivolto a Geltrude, qui ove si aggira 1' ombra di un trapassato, sul tumulo di un'estinta, sia lo sfogo di ogni mia angoscia. Parlerò, o fanciulli, e voi udirete storie di sangue e di malanni: parlerò, e se un'infausta luce brillerà ne' miei sguardi, non prendavi spavento; solo piangete e contristatevi.» Ildovaldo era animato da uno spirito solenne e caldo, onde la sua voce suonò terribile tanto, che quasi impauriti tremarono i due giovinetti, e strettisi fra di loro, guardarono il vecchio che calmatosi, si assise, e parlò. i fratelli hanno uccìso i fratelli Manzoni, Carmag.","NO"
"Battaglia_Giacinto-La_lega_lombarda-1834","Battaglia Giacinto","La lega lombarda","1834","Tr. — u –L alla cima dell'alpe ove s'erge la nostra capanna, abbassato in giro lo sguardo al di là della valle si vede di lontano una deserta pianura. Sorgeva ivi un dì una popolosa e grande città: Milano, la diletta mia patria.","YES"
"Battaglia_Giacinto-La_lega_lombarda-1834","Battaglia Giacinto","La lega lombarda","1834","— Il suo popolo viveva felice come i primi popoli del mondo; e pel valore de' suoi soldati ne andava grandeggiando la gloria e la potenza cagione d' invidia alle terre vicine (i) «Impegnavansi quindi frequenti guerre contro di essa, che valorosa contava una vittoria ogni battaglia, ed ogni vittoria arricchivasi di una conquista. Ma poi fu colpita da un flagello terribile, e ai giorni della nostra letizia succedettero giorni di sangue, e l'orgoglio della nostra possanza si fiaccò fra le stragi e in mezzo alla desolazione.","NO"
"Battaglia_Giacinto-La_lega_lombarda-1834","Battaglia Giacinto","La lega lombarda","1834","«Un potente d' Europa (2), il cui nome suonerà lungamente famoso per fortunate crudeltà, per alti trionfi e clamorose sconfitte, Federico Primo, soprannominato Barbarossa, dall'alto del suo trono mirò bieco la ricchezza de' superbi Milanesi, colpevoli di non aver saputo abbastanza nascondere la loro crescente grandezza. «Bramoso di cingere la corona imperiale, infiammato dal desio delia gloria, si volse a' suoi cento Baroni, i quali al suo cenno si armarono (3), e dalie verdeggianti valli delle Alpi (4) discesero seguiti dagli innumerevoli battaglioni d' Allemagna; e le belle pianure della Lombardia in pria coperte dalle dorate ondeggianti messi, sfavillarono di guerrieri e d' assiepate alabarde. «Abbandonarono spaventati i pastori le capanne, e cacciandosi innanzi le greggie e le mandre, implorarono la pietà e la protezione de' castelli e delle città murate (5).","NO"
"Battaglia_Giacinto-La_lega_lombarda-1834","Battaglia Giacinto","La lega lombarda","1834","«Le nostre porte si aprirono alle turbe di questi miseri, e i nostri soldati corsero ad affrontare il formidabile straniero. Ma a nulla valsero i nostri cento incontro ai mille di un possente le cui parole erano giuramenti di sangue, i cui giuramenti erano sentenze di morte. I fratelli dei fratelli corsero ad appiattarsi sotto le acquile dell'Impero e pieni di snaturato desìo di vendetta, i Lombardi si armarono contro i Lombardi, e Milano ben presto più non fidò che nel valore e nella costanza de' suoi, nella fortezza delle proprie muraglie, e nella clemenza del Cielo.","NO"
"Battaglia_Giacinto-La_lega_lombarda-1834","Battaglia Giacinto","La lega lombarda","1834","- Fummo circondati dai nemici. Dall'alto delle nostre torri misuravano li suoi accampamenti, che per tutto l'immenso circuito delle mura si estendevano, onde non un solo adito, non un solo spazio di un jugero restava scoperto di soldati e di macchine guerresche (v). - Combatteremo come la tigre accanto ai suoi novelli: unica guaina alle nostre spade sarà il petto dei nostri nemici (cantavano i nostri guerrieri dalle torri della minacciata città): unica nostra tomba saranno le rovine della nostra patria, e la nostra fronte lorda di sangue, non si chinerà che in seno alle libere nostre spose.","YES"
"Battaglia_Giacinto-La_lega_lombarda-1834","Battaglia Giacinto","La lega lombarda","1834","«Fugnavansi aspri conflitti, e la sorte delle armi non di rado coronava il disperato valore dei nostri (8). Io stesso già ormai vecchio cadente, vestii in que' giorni le antiche mie armi e con tremante mano affrontai i pericoli della guerra. Io stesso, io stesso in que' giorni atterrai nemici, e un Dio meco pugnava _, perché pugnava per una patria.","NO"
"Battaglia_Giacinto-La_lega_lombarda-1834","Battaglia Giacinto","La lega lombarda","1834","Dall'alto delle bastite, miravanci le nostre donne, e mandando grida di entusiasmo celavansi i loro pargoletti in grembo, onde non venisse meno la forza de' padri, ed affetti troppo teneri non affiacchissero la nostra rabbia guerriera. SECONDA. 35","NO"
"Battaglia_Giacinto-La_lega_lombarda-1834","Battaglia Giacinto","La lega lombarda","1834","Ma invano si sparsero torrenti di sangue, si ammucchiarono cadaveri su cadaveri! Lo sdegno del nostro nemico raddoppiavasi se noi vincitori, accendevasi se vinti (9). Egli erasi strappato dalla fronte il serto reale, e dinanzi ai suoi baroni, al cospetto dell'intero esercito aveva giurato di più non cingere quell'insegna del suo potere, se prima non cambiava Milano in un mucchio di pietre, i valorosi suoi cittadini in una turba di profughi mendichi.","NO"
