"filename","nome","titolo","anno","chunk","DIL"
"Battaglia_Giacinto-La_lega_lombarda-1834","Battaglia Giacinto","La lega lombarda","1834","È un vaneggiamento necessario, forse una gioia immaginaria in mezzo agli orrori di una tristezza verace. Ma poi un altro pia odioso inganno della sua mente le mostra intorno a Lei vaganti una folla di pallidi spettri, onde impaurita ella nasconde il volto nelle mani e stassi immobile come che paventi destare con un sospiro quel tetro silenzio che la circonda. Si asside, e sta muta e immobile compresa dal suo dolore.","NO"
"Battaglia_Giacinto-La_lega_lombarda-1834","Battaglia Giacinto","La lega lombarda","1834","Talora s'aggira e pensa a vincer sé stessa e il suo vano terrore, confortandosi colla speranza che ha nel fondo del cuore, destata in lei da un senso arcano. Ella preme contro alle labbra un piccolo dipinto. «.","NO"
"Battaglia_Giacinto-La_lega_lombarda-1834","Battaglia Giacinto","La lega lombarda","1834","Fino dal giorno della prima sua disgrazia glielo aveva appeso al collo la sua madre moribonda. Ne era il ritratto. Baciavalo la fanciulla, e provava un conforto sì dolce che scemava lo spavento di una solitudine triste, quasi avesse compagna una tenera genitrice.","YES"
"Battaglia_Giacinto-La_lega_lombarda-1834","Battaglia Giacinto","La lega lombarda","1834","Passeggiando pel sotterraneo in un momento di mestizia, aveva Geltrude fermato lo sguardo sopra un avello, il cui coperchio portava scolpiti alcuni caratteri: h Le ceneri della superba Irene: così volle un Conte, m Presso a quell'avello sporgeva un foglio a varie ripiegature, logoro dall'umidità e dal tempo, però sufficientemente leggibile... Fosse una storia di sangue?... disse Geltrude fra se, i presentimenti sono gravi... la mano mi trema nei sollevarlo...» Prese il foglio, si assise vicina alla luce della lanterna, e lesse: «ed aveva abbandonata da pochi giorni la mia famiglia: avea bagnata di pianto la faccia delle mie sorelle, e del vecchio mio padre... e in compagnia dell'amoroso mio sposo mi era recata nel nuovo castello.","NO"
"Battaglia_Giacinto-La_lega_lombarda-1834","Battaglia Giacinto","La lega lombarda","1834","Dal momento eh' io aveva conosciuto Ovaldo, era succeduto un cambiamento nel mio modo d' esistere; perché mi pareva non poter essere felice, che dove egli trovavasi, e non sentire vera dolcezza di affetti che accanto a lui. E il mio Ovaldo, bello come il primo pensiero d' amore, ardente come il genio dell'entusiasmo non avrebbe voluto respirare che ne' miei respiri, e vedere che negli amorosi miei sguardi... Venne finalmente il giorno dei nostri sponsali... e chi detto m' avrebbe che non il primo giorno della mia vera felicità doveva esser quello, bensì il primo d' ogni mia crudele sventura?...","YES"
"Battaglia_Giacinto-La_lega_lombarda-1834","Battaglia Giacinto","La lega lombarda","1834","Il signore del castello provò invidia del nostro ardente amore, ovvero troppo amia m ir* 1 wa misera bellezza., Da quell'istante il crudele potò accogliere nella mente un orrendo progetto .... ed in pochi giorni io vidi languire il mio Ovaldo.","NO"
"Battaglia_Giacinto-La_lega_lombarda-1834","Battaglia Giacinto","La lega lombarda","1834","La floridezza delle sue gote giovanili cambiossi ad un tratto nel livido pallore della morte, finché oppresso da un male che lentamente il struggeva dovette abbandonarsi al letto... Io gli stava sempre al fianco, il stringeva ogni istante al mio seno; il baciava e il ribaciava mille volte... Fissava con amorosa pietà le sue pupille, ma indarno, poiché più non iscorgeva in esse la usata viva limpidezza, bensì vedevate torbide, immobili: e sempre velate dalle lagrime... Accorse il medico del contado... Con voce sommessa, e guardingo quasi temesse essere da altri udito... «È avvelenato, mi disse, vedremo se non è impossibile il guarirlo.» Io non risposi, bensì caddi fra le braccia del mio Ovaido, e piansi, e piansi amaramente; e anche il mio Ovaldo pianse. E perché non morimmo entrambi in quel momento di sollazzevole effusione?","NO"
"Battaglia_Giacinto-La_lega_lombarda-1834","Battaglia Giacinto","La lega lombarda","1834","«Verso sera venne un sacerdote nella stanza del malato... Il buon Ovaldo rassegnato al suo estremo destino, ricevette quietamente gli ultimi santi ufficii della Religione... Io mi era gettata ginocchione ai piedi del letto, senza quasi mi sapessi ove trovarmi, e proferiva continue preci, né mai con tanto fervore rammentai la bontà del Cielo, e ne implorai un atomo di favore...","NO"
"Battaglia_Giacinto-La_lega_lombarda-1834","Battaglia Giacinto","La lega lombarda","1834","Ma già il male opprimeva all'eccesso il miserabile; però mi alzai e me gli trassi più vicina. Egli mi aveva presa la destra colla sua mano tutta bianca, scarna e già infreddita. Mi fissò, provossi a parlarmi... ma volse altrove la faccia e spirò.","NO"
"Battaglia_Giacinto-La_lega_lombarda-1834","Battaglia Giacinto","La lega lombarda","1834","Ignoro che avvenne di me in quell'istante, solo rammento che pochi giorni dopo la mia disgrazia furonmi lieve consolazione le lagrime di una sciagurata; perché il signore del castello, il carnefice del mio marito, aveva una moglie... bella, virtuosa come il sorriso dell'innocenza, gentile come il color d' una rosa. Egli non la amava, ovvero abboriva una virtù che era un tacito rimprovero alla perversila della iniqua sua anima. Ei favea ripudiala e gettata nel mio carcere, assieme a una pargoletta sua figlia, senza palesare per quale delitto quando sarà fatta la volontà del Signore.","NO"
"Battaglia_Giacinto-La_lega_lombarda-1834","Battaglia Giacinto","La lega lombarda","1834","Io morirò nelle tenebre di una prigione, ma almeno potrò volgere al Cielo F ultimo sguardo con la confidenza di una povera infelice estinta pel dolore di una disgrazia crudele, e anche per difendere la propria virtù contro il delitto... Le genti del contado piangeranno la meschina Castellana, crudelmente privata dell'amoroso marito e nel fiore degli anni lasciata morire di dolore nel fondo di una prigione. Sarà fatta la volontà del Signore, perché l'anima mia andrà a congiungersi coli' anima di quell'altra misera vittima dello stesso tiranno; mentre è indubitato che quell'infelice donna da lui barbaramente ripudiata e cacciata dal castello, abbandonata senza conforto, debbe essere perita oppressa dalle proprie sventure. Oh!","NO"
"Battaglia_Giacinto-La_lega_lombarda-1834","Battaglia Giacinto","La lega lombarda","1834","almeno dopo morte sarà con noi quella pace e quella santa consolazione, che entrambe abbiamo invano implorata durante questa vita di guai! «... Io rammento ancora quel giorno funesto.","YES"
"Battaglia_Giacinto-La_lega_lombarda-1834","Battaglia Giacinto","La lega lombarda","1834","Rammento ancora che ella mi aveva stretta al collo, né più voleva lasciarmi sebbene si tentasse strapparmela dal seno per violenza; pareva a tei che prolungandomi i suoi abbracci avrebbe potuto abbreviare gli amari istanti della sua sventura. «Irene, ella mi diceva, noi non ci rivedremo mai più; la mia figlia bambina non potrà più aggrapparsi al tuo collo. Quando siederà nel mezzo del deserto, ella mi chiederà dell'amorosa «sua Irene, ed io piangerò sul a suo volto, perché penserò che mi hanno strappata dal tuo seno.» Finalmente fu d' uopo dargli l'ultimo bacio.","NO"
"Battaglia_Giacinto-La_lega_lombarda-1834","Battaglia Giacinto","La lega lombarda","1834","Oh quanto affetto avrei io voluto trasfondere in quel bacio!... Oh da quanto affanno sentii opprimermi il cuore allo schiudere dell'ultimo abbraccio!... Fu silenzio: e il barbaro nostro custode e l'inumano suo figlio sparsero essi pure una lagrima ai vedere la misera nascondersi il volto bagnato di pianto sulle guance della pargoletta che stringevasi al seno, indi con celere passo attraversare il ponte levatoio, ed abbandonare per sempre il castello.»","NO"
"Battaglia_Giacinto-La_lega_lombarda-1834","Battaglia Giacinto","La lega lombarda","1834","Geltrude ha repentinamente sollevate le pupille dal foglio, e sentissi il respiro affannato da una piena di affetti; però non pianse, ma ancora rimase muta e immobile; lesse di nuovo e con sguardo ansioso le ultime linee, e provò d' improvviso nell'anima un duolo indistinto, misto a una strana confusa letizia. Ella provossi a leggere un altro brano del foglio... - E dal giorno ch'io era stata chiusa in questa prigione, non aveva più udito parlare dell'infelice moglie del Conte, sì barbaramente espulsa dal castello.","YES"
"Battaglia_Giacinto-La_lega_lombarda-1834","Battaglia Giacinto","La lega lombarda","1834","Certamente ella doveva cader vittima della propria disgrazia, perché ne il nudo sasso della spelonca poteva essere letto, ne il pane accattato da capanna in capanna poteva esser cibo alla meschina... Forse ella è già morta stringendosi al seno la tenera sua pargoletta; forse nel momento dell'ultimo suo sospiro ha invocato un mio bacio, e la meschina non avrà potuto morire che stretta fra le tenere braccia dell'amorosa sua Gertrude» ... Nella sventura la sorpresa di un pensiero o altamente tetro o lieto altamente, infonde una vitalità tutta propria: sorge nell'animo un conflitto di affetti sì violento che induce al pianto: e si piange o per sventura o per gioia, poiché il pianto non è figlio solamente del dolore, bensì è il prodotto di un interno orgasmo qualunque.","YES"
"Battaglia_Giacinto-La_lega_lombarda-1834","Battaglia Giacinto","La lega lombarda","1834","Geltrude alzò la mano verso la fronte, come che sgombrar volesse la nebbia di un sogno confuso... Sollevò dal foglio le pupille, guardò intorno lentamente poi sospirò e un sorriso spuntato sulle sue labbra, indicò la turbazione strana del suo animo. La prima volta in sua vita, ella pensava esisterle un padre, e la mente sua vedeasi costretta a connettere a quest'idea altri disgustosi significati, onde la misera lasciò cadere il foglio, poi piegatasi sulle proprie ginocchia, cadde col corpo attraverso al freddo marmo dell'avello... Momento tristo di perfetto silenzio col corredo di una fievole luce, di informi vòlte, e di una tomba! Ma poi ergevasi lentamente sopra se stessa, e sgombrando dal volto le lunghe chiome bagnate di pianto, figgeva le luci immobili al suolo, pensosa, languente, piena di una inconcepibile tenerezza.","NO"
"Battaglia_Giacinto-La_lega_lombarda-1834","Battaglia Giacinto","La lega lombarda","1834","Improvvisamente si udì uno strepito lieve dal fondo del sotterraneo, simile al dimoversi di un chiavistello. La porta si aperse ad un fioco raggio di luce, s'innoltrò con dubbio legger passo un giovinetto, vestito di nera armadura con negre piume ondeggianti sulT elmo. Alzò la visiera, e girò intorno due sguardi rapidi anziosi, esprimenti tutto l'orgasmo di un'anima nel vigore di un'alta passione...","NO"
"Battaglia_Giacinto-La_lega_lombarda-1834","Battaglia Giacinto","La lega lombarda","1834","Formava mirabile contrasto colla pallidezza delle sue guance il contorno della bruna cintura dell'elmo, e non vedeasi il vivo incarnato delle labbra, perché le aveva convulse, quasi bianche. Egli gettò all'indietro il mantello, e colla destra sollevò accanto al proprio volto una lanterna difesa da trasparente cristallo: si accostò alla donzella prostrata colla faccia nascosta nelle palme, in silenzio profondo. Al mirarla tremò il giovinetto cavaliero e trasse a stento la voce dal petto, perché pareva che un dolore intenso lo affannasse.","NO"
"Battaglia_Giacinto-La_lega_lombarda-1834","Battaglia Giacinto","La lega lombarda","1834","Ma poi profferì una parola con accento fioco e tardo... «Geltrude, Geltrude.» La vergine sollevò lentamente il capo, aprì gli occhi come scossa da un incanto. Mise un sospiro affannato, quando il giovinetto, ripetendo il suo nome, con sorriso d' ansietà prese a guardarla fissamente in volto. In quel istante parve a Geltrude che la voce del Cielo suonato avesse intorno a lei con tutta la sua divina armonia.","NO"
"Battaglia_Giacinto-La_lega_lombarda-1834","Battaglia Giacinto","La lega lombarda","1834","Ella stava fra le braccia del suo Giselfo ed ogni idea di sua passata sventura era spenta in quell'istante di celeste e verginale voluttà. Se non che, ad un tratto si udì dietro il cancello uno strepito di ferri e di rapidi passi. Entrò furibondo con spada sguainata il conte Guido, e corse verso il giovine cavaliero, il quale già erasi messo a difesa della fanciulla armato di spada contro il terribile suo assalitore.","NO"
"Battaglia_Giacinto-La_lega_lombarda-1834","Battaglia Giacinto","La lega lombarda","1834","Le vòlte tenebrose del sotterraneo mandarono un suono di accozzate laiiie e di strida indi, udiasi un fioco accento di dolore; il suolo fu sparso di sangue, la lanterna del sotterraneo cadde rovesciata e spenta, e profonda oscurità dominò; ne più altro suonò che un sordo stropiccio di alcuni intenti a trascinar seco loro un ferito; poi più non s'udì fragor di armi, o grido, tranne un lagno flebile, e rotto da singulti. Accorse la gente del castello chiamata dallo strepito, e vide colle vesti intrise di sangue, col molle seno aperto da una ferita, e il bei volto coperto di mortale pallore, la misera Geltrude stesa ai piedi del Conte, il quale con un ginocchio piegato e colle chiome irte, guardavasi cupamente d' attorno, poi mirava la donzella intenta a baciare una piccola effigie pendentegli dal collo. Ella proferiva nomi indistinti: Giselfo, il... padre.","NO"
"Battaglia_Giacinto-La_lega_lombarda-1834","Battaglia Giacinto","La lega lombarda","1834","— Chinava il capo suir insanguinato petto e mandava l'ultimo sospiro... Il conte Guido stette in silenzio un istante sorpreso da tetri pensieri, fin quando mormorò fra le labbra le ultime parole della giovinetta, e fissò lo squarcio nel piccolo dipinto, poi sorse tostamente, quasi spaventato o come acceso da una forza infernale, e gridò: Oh sventura, ho uccisa la mia figlia, Di nuovo ammutolì, e s'aggirò tentone pel sotterraneo come che stesse in mezzo a tenebre fitte, mentre il circondava vivissima luce.","NO"
"Battaglia_Giacinto-La_lega_lombarda-1834","Battaglia Giacinto","La lega lombarda","1834","Fermossi e stette immobile, cogli occhi spalancali, oppresso da affanno mortale dalle livide gote grondavagli sudore, e con ambe le mani strette al capo tenevasi avvinghiate le chiome. Un' altra volta gridò: «Oh sventura! ho uccisa la mia figlia, indi si ricompose in atto di cupa calma e stette silenzioso, immobile, collo sguardo rivolto all'insanguinato cadavere della donzella","NO"
"Battaglia_Giacinto-La_lega_lombarda-1834","Battaglia Giacinto","La lega lombarda","1834",".. Non vi sono tenebre come quelle che velano la mente. Byron.","NO"
"Battaglia_Giacinto-La_lega_lombarda-1834","Battaglia Giacinto","La lega lombarda","1834","Corsaro. Innalzate il canto della vittoria, o prodi figli dell'Olona. Iddio ha ritirata la mano del suo sdegno dal capo de' profughi...","NO"
"Battaglia_Giacinto-La_lega_lombarda-1834","Battaglia Giacinto","La lega lombarda","1834","Il valore vinse il tiranno orgoglio... Innalzate il canto della vittoria, o prodi figli dell'Olona: avete cinto il serto degli eroi, perché le vostre campagne furono coperte dai cadaveri de' vostri fiumi corsero i rosseggiane fiotti del loro sangue... Sotto le insegne de' collegati Lombardi erano rientrati i raminghi Milanesi nelle mine della loro caduta città...","NO"
"Battaglia_Giacinto-La_lega_lombarda-1834","Battaglia Giacinto","La lega lombarda","1834","Erano surte novellamente le mura e le torri merlate, e i templi e le pacìfiche case. Intanto per la settima volta, con un settimo esercito, scendeva minaccioso delle Alpi lo Svevo imperatore, e nembi di armati, e mille e mille cavalieri (1) gonfi d' insano orgoglio additavano sogghignando i campi delle loro passate vittorie a già preparavano Talloro onde cingere novellamente i loro elmi. Ma stolti!","NO"
"Battaglia_Giacinto-La_lega_lombarda-1834","Battaglia Giacinto","La lega lombarda","1834","Le loro spade non avevano per anco toccate le spade de' prodi Lombardi, e fra i colli del bellissimo paese non eransi ancora udite le grida delle nuove battaglie. La risorta Milano aveva armati i prodi suoi mille. La sacra insegna del Carroccio era risorta e i prodi suoi mille, posando la destra sugli altari del Signore, avevano giurato di spargere il loro sangue in difesa del patrio stendardo (2).","NO"
"Battaglia_Giacinto-La_lega_lombarda-1834","Battaglia Giacinto","La lega lombarda","1834","Armi di negre armi, montati sopra superbi palafreni, anche i cavalieri della morte s'unirono alle altre schiere. Avevano abbracciate e baciate le mogli amorose e i cari pargoletti. Avevano innalzate al Signore le loro preghiere nelle chiese riedificate della loro città, e col sorgere del sole novello dovevano combattere per le mogli amorose, pei cari pargoletti e per le chiese riedificate della loro città.","NO"
"Battaglia_Giacinto-La_lega_lombarda-1834","Battaglia Giacinto","La lega lombarda","1834","Procedeano silenziosi e serrati i battaglioni dei forti, e nessun accento d' orgoglio s'alzava, perché denno essere calmi e pacali gli animi di que' guerrieri che vanno a stornare la strage e l'incendio dal tetto domestico, e non da insano orgoglio accesi. Attraverso il lontano orizzonte già traspariva una riga rossigna di luce, e sui boschi, e sulle spiagge alpestri spargevasi a poco a poco una confusa tinta melanconica, quando arrivarono gli armati Milanesi su di una vasta pianura (3). S' arrestarono, perché, col sorgere dell'aurora, si doveva celebrare il santo Sagrifìzio della Messa.","NO"
"Battaglia_Giacinto-La_lega_lombarda-1834","Battaglia Giacinto","La lega lombarda","1834","Piegarono il ginocchio i guerrieri in cupo contegno di divozione intorno all'altare portato dal Carroccio. Su di quello il Sacerdote già aveva cominciata la sacra funzione: in mezzo allo sfolgorar delle armi, fra le venerabili sue dita già sorgeva l'Ostia sacrosanta, e a terra prostrato, battendosi il petto, umiliavasi ognuno dinanzi alle memorie del divino Sagrifìzio... quando s'udì una voce lontana... «scendono, scendono, s'avanzano,» Era il grido de' corridori, e delle scolte, che avevano veduto il nemico; e il primo raggio del sole aveva schiarito una immensa lontana nube di polve.","NO"
"Battaglia_Giacinto-La_lega_lombarda-1834","Battaglia Giacinto","La lega lombarda","1834","- Scendono, scendono, s'avanzano v ripeterono più d 1 appresso le scambiate voci, ma nessun volto s'impallidì, e anzi ogni soldato si accese di coraggio insolito, perché il Sacerdote li aveva benedetti con una santa Reliquia; e dopo era stata proferita con voce unanime una preghiera... a Onnipossente Iddio, x dà lena alla destra del tuo popolo, benedici le sue armi, veglia sul capo delle sue spose e de' suoi figli: egli combatte pei tuoi altari, e per una patria riporta colle benedizioni del tuo santo Vicario.» Indi e uno sorte le schiere, si erano ordinile tranquillamente con aspetto terribile, e colle aste abbassate aveano mosso incontro all'esercito nemico. Si udirono fischi di arrotate spade, e cigolio di alabarde spezzate, e grida di rabbia, e voci profonde di feriti, schiacciati dalle zampe de' cavalli.","NO"
"Battaglia_Giacinto-La_lega_lombarda-1834","Battaglia Giacinto","La lega lombarda","1834","L'urto più vigoroso de' nemici fu spinto contro la sacra insegna dei Milanesi, che torreggiava ancor baldanzosa colia rosseggiante sua bandiera 9 né il raggio del sole aveva cessato dal scintillare sull'aureo altare e sulli arnesi divini. Ma già cadevano i forti sui forti, e la folla de' combattenti si diradava, e il terreno ingombravasi di cadaveri e bagnavasi di sangue, e un susurro cupo s'udia spandersi da schiera a schiera come l'accento della disperazione, che tosto poi veniva soffocato da un lungo grido da mille voci ripetuto: u Moriremo per la patria, m Furono spaventosi a vedersi avanzarsi simile ad una falange di spiriti tenebrosi, i mille cavalieri della morte messi al galoppo, avvolti da una nube di polve di mezzo alla quale scintillavano le spade e 1' acciaro degli elmi e delle corazze.","NO"
"Battaglia_Giacinto-La_lega_lombarda-1834","Battaglia Giacinto","La lega lombarda","1834","Il nitrito de' loro destrieri si diffuse acuto e feroce come la voce di un sanguinoso trionfo. Ogni loro colpo die morte, ogni loro passo calpestò un cadavere; e fu singolare venterà che il nerbo de* nemici sapesse a tempo serrarsi, ed opporre all'urto dell'infuriata coorte una quadrata imponente massa aspra di ferree punte. Ma poi si guatarono un istante i combattenti, e come vinti da una possa misteriosa, colle armi sospese ammutolirono con un silenzio di terrore che indi ad un tratto fu rotto quando un prode con cinerea sciarpa ad armacollo balzò il primo del tenebroso battaglione.","NO"
"Battaglia_Giacinto-La_lega_lombarda-1834","Battaglia Giacinto","La lega lombarda","1834","Acceso da ardente furore, montato sopra un cavallo già grondante sangue e sudore, tutto avvolto nelle brunite armi, con visiera calata, innalza un grido alto ed acuto come il sibilo dello spirito delle battaglie; la sua voce di guerra è la parola Giuliano, spezza di un colpo la lancia nel petto di un nemico, e al lampo dalla sua spada roteante impallidiscono mille volti nemici finché tosto a suoi gridi fan eco mille altre voci «Moriremo per la patria» e mille altri tremendi seguono 1' esempio di quel prode, e il frastuono della pugna spandesi assordante e terribile. Si curvano le schiere nemiche, si confondono travolvono; e già i fuggenti s'inciampano e si urtano coi fuggenti, gettano le armi, e dilatando il disordine e lo spavento, danno intera la vittoria ai Lombardi. Vinsero, vinsero i prodi Milanesi... Alzate il canto del trionfo o valorosi figli dell'Olona.","NO"
"Battaglia_Giacinto-La_lega_lombarda-1834","Battaglia Giacinto","La lega lombarda","1834","Cingete le corone delli eroi, perché le vostre campagne furono coperte dei cadaveri dei vostri trafitti nemici, e colle azzurre onde de' vostri fiumi corsero i rosseggiantì fiotti del loro sangue. Il sole della vostra gloria non sarà ancor tramontato, e, novelle figlie del Giordano, le vostre donne esciranno dalle mura della risorta città, cinte di festose ghirlande, e seguiranno in processione i venerabili Sacerdoti colle sacrosante Reliquie innalzate e canteranno gì' inni del trionfo, e benediranno quelle mani che hanno ferito il petto dello straniero, disceso col desio di recare il lutto e la strage nelle vostre famiglie. Dall'alto delle mura il popolo in folla spingerà lontano lo sguardo, avido di scoprire i patrii stendardi e le schiere sfolgoranti dei valorosi suoi figli...","NO"
"Battaglia_Giacinto-La_lega_lombarda-1834","Battaglia Giacinto","La lega lombarda","1834","Oh dolci ad udirsi i suoni de' patri oricalchi, accompagnati dai lieti canti della vittoria!... Belle a vedersi le patrie falangi coli' alloro piantato fra le svolazzanti piume degli elmi. Riedevano gli armati Milanesi: primi si avanzavano i battaglioni denominati della Città, ed erano quattro, uno di ogni quartiero Camminavano a piedi, armati di alabarde e di lunghe pesanti spade, e difesi da corazze e da robusti elmi e scudi; bella e vigorosa gente, avvezza alle fatiche, intrepida ai perigli.","NO"
"Battaglia_Giacinto-La_lega_lombarda-1834","Battaglia Giacinto","La lega lombarda","1834","Seguivano poi i carri colmi d' armi e di macchine da guerra. In mezzo stava la turba immensa de' prigionieri, e il suono delle loro catene confondevasi coi lieti squilli delle trombe... Venivano di poi i cavalieri del Carroccio, scelta, nobile gioventù, splendente per ricchi addobbi e terse armature. Nel loro centro torreggiava la grande insegna ai piedi della quale stava piantato, con tutta la pompa del rito il santo altare, sostenuto da un carro ricca meni e coperto da fregi color di porpora, strascinato da quattro paia di buoi coperti da rosseggiane bardature.","NO"
"Battaglia_Giacinto-La_lega_lombarda-1834","Battaglia Giacinto","La lega lombarda","1834","Ultimo seguiva lo squadrone denominato della Morte. — Bel'o fra tutti, un giovinetto montato sopra superbo palafreno, colla maestà di un orgoglio gentile, precedeva la terribile falange. Sosteneva colla destra una logora bandiera sormontata dall'insegna dell'Impero... e la abbassava, e s'inchinava con bel garbo al suonar degli applausi popolari, perché dall'alto delle mura avevano eccheggiato mille e mille voci... «Viva il figlio del prode Giuliano; viva il valoroso Giselfo de' Valsecchi.» Sui terrazzi e sugli spalti le giovinette e le donne leggiadre sì adunano, si assiepano e gareggiando col vezzo della loro ridente età, si affollano e si curvano onde mirare il bel volto del cavaliero, le negre innanellate sue chiome, le labbra porporine, e il gentile contegno, e al vederlo provano in petto un segreto senso di ammirazione e di geniale amore; i vecchi venerabili, pel desio di contemplare quegli che il primo aveva aditala la via della vittoria ai loro figli, quasi dimenticano di guardare i loro figli reduci dalla grande fortunata battaglia.","NO"
