"filename","nome","titolo","anno","chunk","DIL"
"di_Carpenetto_Daisy-Le_due_offerte-1929","di Carpenetto Daisy","Le due offerte","1929","Ma anch’io giudico Elena bellissima. Renato è convinto della mia completa guarigione. — In pochi giorni sei diventata un’altra donna.","YES"
"di_Carpenetto_Daisy-Le_due_offerte-1929","di Carpenetto Daisy","Le due offerte","1929","Egli si rallegra del mutamento che lo libera all’improvviso da troppi rimorsi. Durante la mia malattia è diventato un altro uomo: piú tenero, piú paziente, piú vicino. Se il tradimento persiste egli riveste le sue menzogne con tanta apparenza di verità da farmi, a tratti, credere che l’incubo sia passato...","YES"
"di_Carpenetto_Daisy-Le_due_offerte-1929","di Carpenetto Daisy","Le due offerte","1929","La casa ci aspettava, chiara di fiori. Tutta la primavera è penetrata all’improvviso nelle stanze con la vivacità profumata di molti petali diversi. L’aria è tiepida.","NO"
"di_Carpenetto_Daisy-Le_due_offerte-1929","di Carpenetto Daisy","Le due offerte","1929","Le torri di Firenze spiccano, nitidissime, sul cielo violentato e scosso dal tramonto. Le campane suonano l’Ave Maria. L’annunzio sereno che segna la fine del giorno mi appaga quasi fosse una promessa di pace.","NO"
"di_Carpenetto_Daisy-Le_due_offerte-1929","di Carpenetto Daisy","Le due offerte","1929","Il ritorno nella propria dimora è sempre dolce, amico. Renato ha promesso di condurmi al teatro, domani sera. — Hai bisogno di distrarti, Minú, di vedere gente.","NO"
"di_Carpenetto_Daisy-Le_due_offerte-1929","di Carpenetto Daisy","Le due offerte","1929","Voglio che tu sia allegra come una volta. Sarei tentata di modificare la sua frase: — Come «prima»? Invece gli sorrido.","YES"
"di_Carpenetto_Daisy-Le_due_offerte-1929","di Carpenetto Daisy","Le due offerte","1929","Perché inasprirci con le parole. Le parole sono sempre nemiche dell’anima. Stasera Renato non esce.","YES"
"di_Carpenetto_Daisy-Le_due_offerte-1929","di Carpenetto Daisy","Le due offerte","1929","Desidera che io vada a letto presto per riposarmi ancora. Sono la sua bambina ammalata: cura il mio cibo, evita le correnti d’aria, m’impone di rivedere il medico. Ricorda anche la mia anima?","YES"
"di_Carpenetto_Daisy-Le_due_offerte-1929","di Carpenetto Daisy","Le due offerte","1929","Forse. Dopo di aver creduto per anni nella sua passione io mi accontento adesso con gratitudine della sua tenerezza. I piccoli baci rapidi che sfiorano la mia fronte appagano piú del piacere.","YES"
"di_Carpenetto_Daisy-Le_due_offerte-1929","di Carpenetto Daisy","Le due offerte","1929","Del resto io sono troppo debole per desiderare tutto l’amore. E l’amore appartiene ancora all’altra, alla mia nemica. Lo sento.","YES"
"di_Carpenetto_Daisy-Le_due_offerte-1929","di Carpenetto Daisy","Le due offerte","1929","* * * Stamani ho letto sul giornale, nella rubrica «Mondanità» che Renato è andato a teatro con sua moglie. Questo piccolo, logico, apparentemente insignificante dettaglio mi ha fatto un male immenso. Egli me lo ha nascosto.","NO"
"di_Carpenetto_Daisy-Le_due_offerte-1929","di Carpenetto Daisy","Le due offerte","1929","Perché? Soltanto gli avvenimenti piacevoli della nostra esistenza, quelli che danno gioia e godimento, sono degni di sotterfugio e di menzogna. Gli altri, naturali, possono essere gridati a tutti, conosciuti da tutti.","YES"
"di_Carpenetto_Daisy-Le_due_offerte-1929","di Carpenetto Daisy","Le due offerte","1929","Renato ha provato piacere nell’andare a teatro con Minú, un piacere cosí grande da avvertire la necessità di celarmelo? Sono dunque già diventata per lui una seconda moglie, troppo gelosa, troppo esigente, alla quale si vogliono riprendere, attraverso il silenzio, i diritti concessi? Renato tace adesso con me come troppe volte egli ha taciuto con Minú, per me.","YES"
"di_Carpenetto_Daisy-Le_due_offerte-1929","di Carpenetto Daisy","Le due offerte","1929","A quale donna sarà finalmente concesso di conoscere tutta la verità, tutta la vita dell’uomo che le appartiene per diritto o per amore? Non ho saputo reprimere il mio rimprovero. Quando egli è venuto oggi a trovarmi la verità è nata dalle mie labbra, malgrado me stessa.","YES"
"di_Carpenetto_Daisy-Le_due_offerte-1929","di Carpenetto Daisy","Le due offerte","1929","Egli si è difeso. Il represso rancore gli recava fastidio. — Minú aveva invitato a pranzo degli amici.","NO"
"di_Carpenetto_Daisy-Le_due_offerte-1929","di Carpenetto Daisy","Le due offerte","1929","Dopo, questi, hanno insistito per andare a teatro. Non ho potuto ribellarmi, credimi. Del resto non credo di aver commesso una colpa grave.","NO"
"di_Carpenetto_Daisy-Le_due_offerte-1929","di Carpenetto Daisy","Le due offerte","1929","— Tutt’altro! Figurati. Il dolore mi rende cattiva.","NO"
"di_Carpenetto_Daisy-Le_due_offerte-1929","di Carpenetto Daisy","Le due offerte","1929","— Spiegati, Nora, subito. Non sopporto il tuo silenzio nemico... Se Renato non sopporta il mio silenzio perché devo tollerare il suo?","YES"
"di_Carpenetto_Daisy-Le_due_offerte-1929","di Carpenetto Daisy","Le due offerte","1929","Tutto questo mi appare infinitamente ingiusto. — Non ti serbo rancore per essere stato a teatro con tua moglie, ma per avermelo celato. Io non ti nascondo nulla della mia esistenza che è chiara, limpida, tua... — Potevo imaginare che questo piccolo dettaglio ti avrebbe interessata?...","NO"
"di_Carpenetto_Daisy-Le_due_offerte-1929","di Carpenetto Daisy","Le due offerte","1929","— Ah! Non l’imaginavi? Allora sei poco perspicace, caro mio.","NO"
"di_Carpenetto_Daisy-Le_due_offerte-1929","di Carpenetto Daisy","Le due offerte","1929","Mentre intuisco quanto rapidamente le parole velenose creano l’abisso, sento che nessuna forza umana m’impedirà di pronunziarle. I nervi sono logorati. Non reggono piú.","NO"
"di_Carpenetto_Daisy-Le_due_offerte-1929","di Carpenetto Daisy","Le due offerte","1929","Essi si risolvono in sillabe ammalate di acredine. — Se ho taciuto di essere stato a teatro con mia moglie è stato unicamente per non farti soffrire. Sei tanto gelosa... — La mia gelosia ti reca dunque fastidio?","NO"
"di_Carpenetto_Daisy-Le_due_offerte-1929","di Carpenetto Daisy","Le due offerte","1929","— No, cara. Desidero soltanto evitarti un dolore inutile. Senza dubbio Renato dimentica la sua gelosia morbosa, che lo rende irriconoscibile iniettando nel suo sguardo tutte le luci della demenza.","NO"
"di_Carpenetto_Daisy-Le_due_offerte-1929","di Carpenetto Daisy","Le due offerte","1929","Devo proprio essere io sola a credere, ad abdicare, a confortare? Nessuno, nemmeno Renato, riuscirà ad intuire il martirio che mi sfinisce? Sono sopratutto molto stanca: anche il mio amore naufraga in questa stanchezza.","NO"
"di_Carpenetto_Daisy-Le_due_offerte-1929","di Carpenetto Daisy","Le due offerte","1929","Egli cerca invano di discolparsi con l’umiltà di un bambino. — Siamo tornati a casa subito dopo lo spettacolo. Avevo sonno.","NO"
"di_Carpenetto_Daisy-Le_due_offerte-1929","di Carpenetto Daisy","Le due offerte","1929","Il teatro non mi diverte. Gli amici, una vecchia coppia noiosa, non sono certamente riusciti a renderlo piú attraente con la loro compagnia. Temo di aver sbadigliato varie volte.","NO"
"di_Carpenetto_Daisy-Le_due_offerte-1929","di Carpenetto Daisy","Le due offerte","1929","Parole, parole, parole. Il dubbio persiste. Renato non rievoca piú Minú quasi ella gli fosse diventata all’improvviso troppo sacra per contaminarla con delle sillabe.","YES"
"di_Carpenetto_Daisy-Le_due_offerte-1929","di Carpenetto Daisy","Le due offerte","1929","Ricorriamo all’amore fisico come i bimbi ricorrono ai giochi. È avvilente la certezza che il desiderio rinasce e s’impone anche quando le anime sono ammalate ed i cervelli nemici. Renato mi ama con furore.","NO"
"di_Carpenetto_Daisy-Le_due_offerte-1929","di Carpenetto Daisy","Le due offerte","1929","La sua golosità non si è attenuata. Mi accarezza, mi domina, come se io fossi una cosa creata per il suo piacere. Non pronunzia parole.","NO"
"di_Carpenetto_Daisy-Le_due_offerte-1929","di Carpenetto Daisy","Le due offerte","1929","Egli è troppo attento alla propria gioia. Rivedo il volto che io conosco, che Minú conosce. Sopporto la sua crudele tentazione di annientare senza compiere un moto di ribellione.","YES"
"di_Carpenetto_Daisy-Le_due_offerte-1929","di Carpenetto Daisy","Le due offerte","1929","Sono un’automa. La voluttà nasce in me, malgrado me stessa, ma è triste. Quella di Renato è violenta, vendicativa.","NO"
"di_Carpenetto_Daisy-Le_due_offerte-1929","di Carpenetto Daisy","Le due offerte","1929","Non osiamo guardarci. Un’insolita stanchezza ci prende all’improvviso e somiglia al sonno. Le nostre palpebre sono abbassate.","NO"
"di_Carpenetto_Daisy-Le_due_offerte-1929","di Carpenetto Daisy","Le due offerte","1929","Se le menzogne esistono fra di noi esse ricadono su di noi, senza pietà. Chi ci concederà la liberazione di un urlo? Perché abbiamo attossicato anche i corpi fino a renderli nostri nemici?","YES"
"di_Carpenetto_Daisy-Le_due_offerte-1929","di Carpenetto Daisy","Le due offerte","1929","Siamo delusi: è inutile ostinarci nel voler negare questa verità distruttrice: — Nora! Il mio nome mi scuote. Apro gli occhi per fissare Renato.","YES"
"di_Carpenetto_Daisy-Le_due_offerte-1929","di Carpenetto Daisy","Le due offerte","1929","Intuisco ch’egli sopporta con fatica la malinconia. Lo accarezzo perché egli chiede le mie carezze, ma le mani sono passive, distratte. Renato è pallido, invecchiato.","NO"
"di_Carpenetto_Daisy-Le_due_offerte-1929","di Carpenetto Daisy","Le due offerte","1929","Ricordo con tristezza quanto ho desiderato di morire per lui... Sono tentata di confessargli il mio folle proposito e convincerlo, cosí, della mia passione. Un attimo. Tutto mi appare inutile, anche la morte.","NO"
"di_Carpenetto_Daisy-Le_due_offerte-1929","di Carpenetto Daisy","Le due offerte","1929","Gli amanti si prendono si abbandonano, si riprendono ancora, senza lasciare una traccia del loro amore nel mondo. Le leggi sono state fatte per i secoli e non per gli uomini. Le ribellioni dei solitari sono soltanto dei piccoli gridi sterili e vani subito soffocati dagli urli della massa.","NO"
"di_Carpenetto_Daisy-Le_due_offerte-1929","di Carpenetto Daisy","Le due offerte","1929","— Nora, ti voglio tanto bene... La voce accorata di Renato mi commuove. Lo avvinghio fra le mie braccia.","NO"
"di_Carpenetto_Daisy-Le_due_offerte-1929","di Carpenetto Daisy","Le due offerte","1929","Che cosa posso fare per me, per lui, per la nostra pace? Renato mi ama quanto io lo amo e siamo entrambi profondamente infelici. * * * Renato è di pessimo umore: il sarto gli ha portato un vestito difettoso, la cuoca gli ha preparato una colazione non di suo gusto.","YES"
"di_Carpenetto_Daisy-Le_due_offerte-1929","di Carpenetto Daisy","Le due offerte","1929","Egli si è irritato per queste sciocchezze come l’ho raramente veduto irritarsi per gravi difficoltà. Gli uomini sono troppi schiavi delle piccole noie materiali: non le sopportano. Ogni minima contrarietà assume ai loro occhi una importanza eccessiva.","YES"
"di_Carpenetto_Daisy-Le_due_offerte-1929","di Carpenetto Daisy","Le due offerte","1929","I loro nervi sono a fior di pelle e scattano per un’inezia. Commuoverebbero se, a tratti, non apparissero ridicoli. La donna ch’essi hanno scelto per moglie deve accettare in silenzio questi malcontenti, senza ribellarsi mai, senza mai atteggiarsi a vittima, vigilando di continuo il loro benessere, il loro appetito, poiché da simili inezie, che a molti potrebbero apparire superflue, dipende in gran parte l’armonia della vita coniugale.","NO"
"di_Carpenetto_Daisy-Le_due_offerte-1929","di Carpenetto Daisy","Le due offerte","1929","L’amante, invece, possiede tutti i privilegi. Essa non è la custode della monotona esistenza quotidiana, lenta, povera, fatta di gesti piú che di avvenimenti: li conosce e li avvicina soltanto durante le loro ore migliori. Essa vede l’uomo «fuori di casa».","NO"
"di_Carpenetto_Daisy-Le_due_offerte-1929","di Carpenetto Daisy","Le due offerte","1929","Appena varcata la soglia della dimora tutti gli uomini diventano, all’improvviso allegri e loquaci. Io stessa mi sono sorpresa, piú di una volta, per il mutamento immediato di Renato non appena egli si trova circondato da estranei. L’altra, Nora, (è bizzarro che io possa scrivere il suo nome con tanta semplicità) non imagina, per esempio, che una colazione possa mutare l’umore di Renato.","NO"
"di_Carpenetto_Daisy-Le_due_offerte-1929","di Carpenetto Daisy","Le due offerte","1929","Forse ne rimarrebbe sorpresa. La missione della moglie è malinconica, vincolata alla dedizione. Come tutte le cose che impongono una continuità la vita coniugale è faticosamente triste.","YES"
"di_Carpenetto_Daisy-Le_due_offerte-1929","di Carpenetto Daisy","Le due offerte","1929","Noi provvediamo al necessario, le amanti offrono il superfluo: sono quindi facilmente vittoriose. A volte le invidio. Se conoscessero la nostra vera esistenza esse proverebbero magari un attimo di rimorso nell’attirare i mariti fuori della loro casa.","YES"
"di_Carpenetto_Daisy-Le_due_offerte-1929","di Carpenetto Daisy","Le due offerte","1929","Renato mi ha pregato di telefonare al sarto affinché venga a riprendere l’abito. Dimenticando questa sua commissione provocherei una collera improvvisa. Desidera che io viva di lui, per lui, anche quando egli mi tradisce.","YES"
"di_Carpenetto_Daisy-Le_due_offerte-1929","di Carpenetto Daisy","Le due offerte","1929","Eppure Renato non è cattivo... Mia madre è partita ieri. Avverto la sua mancanza. La presenza degli «altri» è diventata necessaria.","YES"
"di_Carpenetto_Daisy-Le_due_offerte-1929","di Carpenetto Daisy","Le due offerte","1929","Soltanto la gioia sopporta l’intimità assoluta. Il silenzio confinato fra due esseri diffidenti è penoso, ostile. Renato da qualche giorno adopera un profumo che io non gli conoscevo.","YES"
"di_Carpenetto_Daisy-Le_due_offerte-1929","di Carpenetto Daisy","Le due offerte","1929","È diventato piú accurato nel suo abbigliamento, piú raffinato nei dettagli del suo vestire. L’osservo e taccio. L’«altra» lo domina perfino in questi piccoli particolari intimi con la prepotenza di una padrona, mentre io devo rassegnarmi ad essere soltanto la sua schiava.","YES"
"di_Carpenetto_Daisy-Le_due_offerte-1929","di Carpenetto Daisy","Le due offerte","1929","Fino a quando? Ho confidato nel tempo. Adesso mi accorgo che anche il tempo mi è nemico.","NO"
"di_Carpenetto_Daisy-Le_due_offerte-1929","di Carpenetto Daisy","Le due offerte","1929","Le ribellioni sono vane. La sofferenza è troppo diffusa in me. Come i mutilati si rassegnano a vivere con un braccio od una gamba di meno io devo rassegnarmi a vivere priva dell’amore di Renato.","YES"
"di_Carpenetto_Daisy-Le_due_offerte-1929","di Carpenetto Daisy","Le due offerte","1929","La gente non vede. Tutti credono che io sia ancora la Minú di una volta, allegra, spensierata, felice. Accettano la mia maschera, con semplicità, senza discuterla.","YES"
"di_Carpenetto_Daisy-Le_due_offerte-1929","di Carpenetto Daisy","Le due offerte","1929","Anch’io, del resto, non mi soffermo ad imaginare il tormento forse celato dalla maschera di quelli che mi circondano. L’umanità è tristemente schiava dell’egoismo: la generosità è un’esuberanza gioconda concessa agli adolescenti ed ai privilegiati. La vita è lunga!","NO"
"di_Carpenetto_Daisy-Le_due_offerte-1929","di Carpenetto Daisy","Le due offerte","1929","Non bisogna esaurirsi nel dolore quando si desidera vivere fino al limite prefisso dal destino. A tratti, il mutamento avvenuto in me mi spaventa. Rimango sorpresa nell’osservare che il mio corpo non ne reca le traccie.","YES"
"di_Carpenetto_Daisy-Le_due_offerte-1929","di Carpenetto Daisy","Le due offerte","1929","Anche il mio volto mente allora? Non è dunque vero che lo sguardo sia lo specchio dell’anima? Ho la sensazione precisa che la mia anima sia assai vecchia, ch’essa abbia vissuto varie esistenze e che tutte le esistenze successive le abbiano rubato un poco della sua freschezza, un poco della sua spontaneità.","YES"
"di_Carpenetto_Daisy-Le_due_offerte-1929","di Carpenetto Daisy","Le due offerte","1929","Costretta al silenzio io non so piú parlare. Se Renato pretendesse la mia assoluta sincerità non saprei piú donargliela. La voce del cuore si è spenta.","YES"
"di_Carpenetto_Daisy-Le_due_offerte-1929","di Carpenetto Daisy","Le due offerte","1929","L’altra voce, fatta di suoni, è povera, fugace come un’eco. Chi tradisce deve sopportare le conseguenze del tradimento. Renato mi ha lasciata bambina e mi ritrova donna.","YES"
"di_Carpenetto_Daisy-Le_due_offerte-1929","di Carpenetto Daisy","Le due offerte","1929","Le bambine sono sempre migliori. * * * Sono giunta quassú, sola, in cerca di pace. Renato non ha compreso questo mio improvviso abbandono.","YES"
"di_Carpenetto_Daisy-Le_due_offerte-1929","di Carpenetto Daisy","Le due offerte","1929","Mi ha detto: — Se io fossi sofferente ti desidererei vicina per guarire accanto a te. Sei la mia serenità. Sei il mio riposo.","NO"
"di_Carpenetto_Daisy-Le_due_offerte-1929","di Carpenetto Daisy","Le due offerte","1929","Ed invece tu ti allontani dal mio amore quasi esso fosse un tuo nemico. Perché? Che cosa ti ho fatto?","NO"
"di_Carpenetto_Daisy-Le_due_offerte-1929","di Carpenetto Daisy","Le due offerte","1929","Non ho voluto rispondergli: — Ma io sono ammalata di te, di Minú. Anche l’amore può assumere, talvolta, il viso di un nemico. Sono sfinita.","NO"
"di_Carpenetto_Daisy-Le_due_offerte-1929","di Carpenetto Daisy","Le due offerte","1929","Non mi condannare. Ho bisogno di silenzio. Forse ho bisogno di dimenticarti.","NO"
"di_Carpenetto_Daisy-Le_due_offerte-1929","di Carpenetto Daisy","Le due offerte","1929","La quiete di Assisi è mistica, immensa. Gli uomini non profanano il luogo dei santi. Il desiderio non intorbida la patria dell’anima.","NO"
"di_Carpenetto_Daisy-Le_due_offerte-1929","di Carpenetto Daisy","Le due offerte","1929","Le campane si sbrigliano sulla campagna ondeggiante, ricca di ulivi: il loro suono è limpido, sicuro, padrone della pianura sulla quale sorvola con la prepotenza di un’aquila imperiale. Alcune case sono illuminate: piccoli chiarori timidi che tremano nel buio. Non si odono voci.","NO"
"di_Carpenetto_Daisy-Le_due_offerte-1929","di Carpenetto Daisy","Le due offerte","1929","Non si accolgono lamenti. I bimbi ed i vecchi sono certamente sereni: le donne devono credere nel loro amore poiché non esistono minacciosi pericoli. La città avvelenatrice e seduttrice è lontanissima: riesco a non rievocarla.","YES"
"di_Carpenetto_Daisy-Le_due_offerte-1929","di Carpenetto Daisy","Le due offerte","1929","Nella piccola sala da pranzo pochi forestieri mangiano in fretta per coricarsi di buon’ora. Mi hanno fissata con sorpresa. Forse non comprendono perché io, italiana, sia giunta quassú...","YES"
"di_Carpenetto_Daisy-Le_due_offerte-1929","di Carpenetto Daisy","Le due offerte","1929","Rileggo una lettera dei miei suoceri triste e delusa. Temo ch’essi sappiano o intuiscano il mio peccato poiché mi consigliano di sposarmi. È la prima volta che una simile idea attraversa il loro cervello: devono averne sofferto.","YES"
"di_Carpenetto_Daisy-Le_due_offerte-1929","di Carpenetto Daisy","Le due offerte","1929","— Non puoi vivere sola, Nora. Sei troppo giovane, troppo indifesa. Se tu trovassi un uomo veramente degno di te dovresti legarti a lui...","NO"
"di_Carpenetto_Daisy-Le_due_offerte-1929","di Carpenetto Daisy","Le due offerte","1929","Anche Carlo saprebbe comprenderti... Poveri, generosi vecchi! Avendo l’orrore della colpa essi preferiscono un nuovo legame, una rinnovata esistenza. Io ho trovato l’uomo che mi ama: egli è legato.","YES"
"di_Carpenetto_Daisy-Le_due_offerte-1929","di Carpenetto Daisy","Le due offerte","1929","Per questo legame io mi sfinisco, mi ammalo e temo di non poter piú continuare a vivere soltanto di tormento. La forza che io m’illudevo di possedere si è esaurita. Sono umilmente sfinita.","NO"
"di_Carpenetto_Daisy-Le_due_offerte-1929","di Carpenetto Daisy","Le due offerte","1929","L’amore fisico dimentica la vita: nella sua irrompente ingordigia esso travolge tutto vincendo anche l’anima attraverso la prepotenza del piacere. L’amore piú vero, fatto sopratutto di cuore, è fragile, vitale come il pulsare di una vena, rabbrividisce per una parola, si ammala per un sospetto. A tutti, a tutto, esso concede il diritto di fargli del male.","NO"
"di_Carpenetto_Daisy-Le_due_offerte-1929","di Carpenetto Daisy","Le due offerte","1929","Io amo Renato con l’anima, adesso, come non supponevo di poterlo amare. La morbosità torbida dei primi tempi si è trasformata in una piú intensa morbosità di cervello. Soffro.","NO"
"di_Carpenetto_Daisy-Le_due_offerte-1929","di Carpenetto Daisy","Le due offerte","1929","Tento inutilmente di ribellarmi allo spasimo nuovo. La mia viltà mi fa talvolta rimpiangere di aver incontrato Renato dopo tanti anni di lontananza. Se egli fosse rimasto per me soltanto un buon amico d’infanzia io potrei adesso voler bene a Minú... Minú.","NO"
"di_Carpenetto_Daisy-Le_due_offerte-1929","di Carpenetto Daisy","Le due offerte","1929","Ancora Minú. Sempre Minú. Ella domina i miei pensieri come il cielo domina la terra.","YES"
"di_Carpenetto_Daisy-Le_due_offerte-1929","di Carpenetto Daisy","Le due offerte","1929","Non l’odio piú, non cerco piú di combatterla. Ogni ribellione sarebbe puerile: la moglie vince. Fino a quando durerà questo incubo?","YES"
"di_Carpenetto_Daisy-Le_due_offerte-1929","di Carpenetto Daisy","Le due offerte","1929","Soltanto la fine della passione riuscirà ad acquetarmi. Ma io non voglio che la passione si spenga... È la mia unica ragione di esistere: anche il tormento fa vivere, anche la febbre conserva in vita l’ammalato. Renato mi aveva promesso di scrivermi subito una lunga lettera: invece mi ha telegrafato.","YES"
"di_Carpenetto_Daisy-Le_due_offerte-1929","di Carpenetto Daisy","Le due offerte","1929","Benché io gli avessi detto di voler rimanere sola speravo ch’egli mi avrebbe raggiunta. Firenze, i suoi affari, lo trattengono. In questo ultimo periodo vari, pericolosi malintesi sono sorti fra di noi.","NO"
"di_Carpenetto_Daisy-Le_due_offerte-1929","di Carpenetto Daisy","Le due offerte","1929","Renato non sopporta la malinconia. Il mio assolutismo lo affatica. Dopo di aver cercato di convincermi con la dolcezza, egli si irrita all’improvviso e pretende il mio amore.","YES"
"di_Carpenetto_Daisy-Le_due_offerte-1929","di Carpenetto Daisy","Le due offerte","1929","Spera di assopire il cervello nella voluttà. S’illude. Sono minacciata: se io non mi trasformo, se io non freno la mia inquietudine, lo perderò a poco a poco, giorno per giorno, seguendo il mesto destino della piccola moglie bionda.","YES"
"di_Carpenetto_Daisy-Le_due_offerte-1929","di Carpenetto Daisy","Le due offerte","1929","Anche per il migliore degli uomini l’amante rappresenta soprattutto la pace, il sogno: il sogno non possiede le esigenze della realtà. Come spiegare a Renato che quando un’amante ama follemente ella crede di possedere tutti i diritti di una moglie? E quanto sia difficile scindere il sogno dalla realtà poiché i limiti sono appena tracciati?","YES"
"di_Carpenetto_Daisy-Le_due_offerte-1929","di Carpenetto Daisy","Le due offerte","1929","L’inattesa lucidità mi esaspera. Imagino l’avvenire, indovino i dolori che stanno in agguato ed avverto di non potere fare nulla per evitarli. Il destino che deve compiersi si compie: tutti i destini sono infinitamente tristi.","NO"
"di_Carpenetto_Daisy-Le_due_offerte-1929","di Carpenetto Daisy","Le due offerte","1929","Ed intanto i miei suoceri, poveri vecchietti stanchi ed ingenui, mi consigliano di sposare. Per rasserenarli (i miei suoceri, come i bimbi chiedono soltanto di essere rasserenati) dovrei rispondere loro che io vivo ancora e soltanto del ricordo di Carlo. Non so essere vile.","YES"
"di_Carpenetto_Daisy-Le_due_offerte-1929","di Carpenetto Daisy","Le due offerte","1929","Il matrimonio? Votare la mia esistenza ad un essere indifferente quando sono crudelmente posseduta e dilaniata da un uomo che non potrà mai essere mio marito? Ironia.","YES"
"di_Carpenetto_Daisy-Le_due_offerte-1929","di Carpenetto Daisy","Le due offerte","1929","Malinconia. La notte è profonda. Le campane tacciono.","NO"
"di_Carpenetto_Daisy-Le_due_offerte-1929","di Carpenetto Daisy","Le due offerte","1929","Fra poco i frati si alzeranno per recitare le loro candide preci mattutine. Invidio l’ardore che li anima poiché la mia fede è vacillante, ammalata. Anche la fede è stata distrutta dall’amore.","YES"
"di_Carpenetto_Daisy-Le_due_offerte-1929","di Carpenetto Daisy","Le due offerte","1929","Per non soffrire il mio cosciente stato di peccato ho preferito credere meno, dubitare, non ricordare. Adesso mi ritrovo miseramente sola, indifesa. * * * Ho ricevuto una lettera da Giorgia la quale mi annunzia il suo arrivo.","YES"
"di_Carpenetto_Daisy-Le_due_offerte-1929","di Carpenetto Daisy","Le due offerte","1929","Giorgia è una mia cuginetta di vent’anni. L’ho lasciata quando ella era ancora una bambina. Sono impaziente di rivederla.","NO"
"di_Carpenetto_Daisy-Le_due_offerte-1929","di Carpenetto Daisy","Le due offerte","1929","L’imagino un poco goffa, un poco impacciata, molto timida. Vive sempre in provincia. Sua madre me l’affida per qualche tempo con la speranza che io possa trovarle un marito.","YES"
