"filename","nome","titolo","anno","chunk","DIL"
"di_Carpenetto_Daisy-Le_due_offerte-1929","di Carpenetto Daisy","Le due offerte","1929","Io ho trascorso molti anni a Napoli: gli anni di guerra quando tu eri al fronte... I miei primi sogni sono sbocciati cosí, in quelle notti snervanti, estive, dinanzi alla cupa immensità del cielo e dell’acqua. Fin da allora io ho creduto nella felicità che oggi posseggo.","NO"
"di_Carpenetto_Daisy-Le_due_offerte-1929","di Carpenetto Daisy","Le due offerte","1929","Quando la vita promette tanto intensamente essa ha il dovere di mantenere... Renato ha rievocato con entusiasmo la sua guerra: io ho rievocato con nostalgia la mia infanzia. I ricordi, moltiplicandosi, si avvicinavano a noi prendendo forma e colore attraverso le sillabe.","NO"
"di_Carpenetto_Daisy-Le_due_offerte-1929","di Carpenetto Daisy","Le due offerte","1929","Tutto quello che avevamo sofferto e goduto prima d’incontrarci riappariva dinanzi ai nostri occhi con una grazia velata, forse stanca. Resa lievemente ebra dalla musica e dallo «champagne» io esageravo il fascino del passato, involontariamente, come una mamma esagera la bellezza di una fata nel descriverla alla propria creatura. Renato mi ascoltava sorridendo, indulgente.","NO"
"di_Carpenetto_Daisy-Le_due_offerte-1929","di Carpenetto Daisy","Le due offerte","1929","È stato questo suo sorriso vago a farmi intuire ad un tratto quanto i suoi ricordi fossero piú intensi e numerosi? Li ho temuti. Mi sono resa conto all’improvviso di ignorare la sua esistenza.","YES"
"di_Carpenetto_Daisy-Le_due_offerte-1929","di Carpenetto Daisy","Le due offerte","1929","Per quali corpi egli ha tremato prima di possedere il mio con orgasmo? Quali nomi femminili hanno racchiuso la sua felicità per un’ora, per un giorno, per un anno? A quali donne egli ha concesso il diritto di sentirsi amate da lui?","YES"
"di_Carpenetto_Daisy-Le_due_offerte-1929","di Carpenetto Daisy","Le due offerte","1929","La postuma gelosia inattesa distruggeva anche il ricordo di Minú poiché essa diventava una creatura viva, concreta, accanto ai troppi fantasmi evanescenti. I fantasmi sono sempre pericolosi: la loro nebulosità consente tutti i sogni, riveste tutte le forme. — Torniamo in albergo, Renato.","YES"
"di_Carpenetto_Daisy-Le_due_offerte-1929","di Carpenetto Daisy","Le due offerte","1929","La presenza degli estranei mi recava fastidio: troppa allegria intorno a me, troppi sguardi che mi fissavano con curiosità distratta. Nella nostra stanza piccola, semplice, silenziosa spettatrice di altri amori, io mi sono abbandonata alla passione con frenesia malsana, animata da un aspro desiderio di vincere, vendicandomi delle «altre». Ma l’anima, non paga, chiedeva anch’essa di essere soddisfatta.","YES"
"di_Carpenetto_Daisy-Le_due_offerte-1929","di Carpenetto Daisy","Le due offerte","1929","Credendo che le domande potessero guarirmi, ho finto di essere serena per non destare i sospetti di Renato e sapere di piú. Gli ho chiesto molti dettagli sulle sue passate avventure. Egli, rassegnato, mi ha risposto senza dare un’eccessiva importanza alle sue parole.","NO"
"di_Carpenetto_Daisy-Le_due_offerte-1929","di Carpenetto Daisy","Le due offerte","1929","Una donna cattiva gli ha rubato la sua fede d’adolescente, avvelenando la prima giovinezza; una donna buona, amata, è scomparsa dalla sua esistenza quando ha intuito di potergli fare un male grave. — Dimmi i loro nomi, Renato... — Perché mi chiedi questo? — Per conoscerti meglio e di piú...","NO"
"di_Carpenetto_Daisy-Le_due_offerte-1929","di Carpenetto Daisy","Le due offerte","1929","Renato, insonnolito, pronunzia i due nomi che suscitano immediatamente due imagini allettanti e nemiche. — Erano belle? Brune?","YES"
"di_Carpenetto_Daisy-Le_due_offerte-1929","di Carpenetto Daisy","Le due offerte","1929","Ostinata nella volontà di ferirmi io insisto. Renato mi risponde ancora. Ha ragione.","NO"
"di_Carpenetto_Daisy-Le_due_offerte-1929","di Carpenetto Daisy","Le due offerte","1929","Non può supporre che io provi tanta voluttà nel creare un sicuro dolore. Parliamo a lungo, suo malgrado. Le sillabe adesso sono appena mormorate.","NO"
"di_Carpenetto_Daisy-Le_due_offerte-1929","di Carpenetto Daisy","Le due offerte","1929","Malinconia. Per una reazione forse cattiva io ricordo Carlo. — Anche Carlo mi diceva un giorno che è facile dimenticare il proprio passato quando s’incontra l’amore.","YES"
"di_Carpenetto_Daisy-Le_due_offerte-1929","di Carpenetto Daisy","Le due offerte","1929","Egli mi amava tanto! Renato non risponde; intuisco di aver provocato in lui la mia stessa sofferenza. Impallidisce lievemente, mi fissa con rimprovero, spegne la luce all’improvviso.","YES"
"di_Carpenetto_Daisy-Le_due_offerte-1929","di Carpenetto Daisy","Le due offerte","1929","Ci sentiamo lontani l’uno dall’altra: fantasmi ci dividono e lampeggiano nel buio. Sento ch’egli si muove irrequieto. Non mi riavvicino a lui.","NO"
"di_Carpenetto_Daisy-Le_due_offerte-1929","di Carpenetto Daisy","Le due offerte","1929","Gli serbo rancore. Il passato ha distrutto perfino il desiderio? Ci assopiamo cosí senza aver scambiato altre frasi.","YES"
"di_Carpenetto_Daisy-Le_due_offerte-1929","di Carpenetto Daisy","Le due offerte","1929","Io sono l’unica colpevole. Perché giocare con il passato come se esso fosse un bambino buono? Il passato è sempre in agguato, disposto a lanciare le sue freccie avvelenate: esso si vendica di essere scomparso, apparentemente sepolto, inquinando il presente e l’avvenire.","NO"
"di_Carpenetto_Daisy-Le_due_offerte-1929","di Carpenetto Daisy","Le due offerte","1929","I nomi delle due donne mi ritornarono nell’anima. Renato li ricorda spesso? Le rimpiange?","YES"
"di_Carpenetto_Daisy-Le_due_offerte-1929","di Carpenetto Daisy","Le due offerte","1929","Ho la sensazione che molti dei nostri legami si siano spezzati all’improvviso, vinti dalla prepotenza di altri legami piú antichi. A tutte le creature che si amano dovrebbe essere concesso il privilegio di poter distruggere le giornate vissute prima d’incontrarsi: sono inutili e lasciano una lividura che duole. — Renato...","YES"
"di_Carpenetto_Daisy-Le_due_offerte-1929","di Carpenetto Daisy","Le due offerte","1929","Egli dorme. Perché l’ho fatto soffrire? Domani egli ritorna accanto a sua moglie.","YES"
"di_Carpenetto_Daisy-Le_due_offerte-1929","di Carpenetto Daisy","Le due offerte","1929","Le mie ore ricominceranno ad essere solitarie, lunghissime. Desidererei attendere l’alba con lui, nelle sue braccia: entrambi svegli e coscienti degli attimi che fuggono per non ritornare piú. * * * Renato è tornato.","YES"
"di_Carpenetto_Daisy-Le_due_offerte-1929","di Carpenetto Daisy","Le due offerte","1929","Ho cercato con intensità morbosa i segni lasciati sul suo volto, nella sua anima dall’altra donna. Egli mi ha abbracciata con tenerezza. Sembra piú sereno.","NO"
"di_Carpenetto_Daisy-Le_due_offerte-1929","di Carpenetto Daisy","Le due offerte","1929","Ha tentato di convincermi della sua assoluta necessità di recarsi a Ravenna; è caduto in varie contraddizioni che ho finto di non rilevare. — Adesso spero di poter godere qualche giorno di riposo. — Ne hai bisogno.","NO"
"di_Carpenetto_Daisy-Le_due_offerte-1929","di Carpenetto Daisy","Le due offerte","1929","— Perché? La mia affermazione l’insospettisce. — Sei stanco.","NO"
"di_Carpenetto_Daisy-Le_due_offerte-1929","di Carpenetto Daisy","Le due offerte","1929","Impacciato si alza, gesticola, avvicinandosi alla scrivania dove lo attende un pacco di lettere giunte durante le sua assenza: vuol nascondermi il suo volto. Ed ignora che io l’ho già osservato, scrutato, compreso. — Balbi ha telefonato?","YES"
"di_Carpenetto_Daisy-Le_due_offerte-1929","di Carpenetto Daisy","Le due offerte","1929","— Verrà domani. — Hai ritirato i quattrini dalla Banca? — Sí.","NO"
"di_Carpenetto_Daisy-Le_due_offerte-1929","di Carpenetto Daisy","Le due offerte","1929","La nostra monotona vita coniugale ricomincia, lenta, affaticata. È sera. Elena dorme.","NO"
"di_Carpenetto_Daisy-Le_due_offerte-1929","di Carpenetto Daisy","Le due offerte","1929","Annunzio a Renato il probabile arrivo di mia madre fra pochi giorni. — Davvero? Ne sono lietissimo.","NO"
"di_Carpenetto_Daisy-Le_due_offerte-1929","di Carpenetto Daisy","Le due offerte","1929","Renato non ha mai gradito eccessivamente la compagnia di mia madre e adesso accoglie con piacere la notizia della sua visita soltanto perché imagina che accanto a lei io mi sentirò meno sola e lui sarà piú libero di abbandonarmi senza provare rimorso. Quasi la libertà che io gli concedo non fosse assoluta! Sfoglio un libro: impercettibile rumore di pagine che passano fra le mie dita, ad una ad una, lentamente.","YES"
"di_Carpenetto_Daisy-Le_due_offerte-1929","di Carpenetto Daisy","Le due offerte","1929","Renato finge di leggere con attenzione il giornale. Le ore della sera sono le piú grevi poiché pretendono ed impongono l’intimità. — Il grammofono è sempre guasto, Minú?","YES"
"di_Carpenetto_Daisy-Le_due_offerte-1929","di Carpenetto Daisy","Le due offerte","1929","— Sí. — Occorre farlo aggiustare subito. Abbiamo bisogno di suoni, di voci, della compagnia di estranei, abbiamo bisogno di tutte le cose superflue per non avvertire il peso della nostra vuota solitudine.","YES"
"di_Carpenetto_Daisy-Le_due_offerte-1929","di Carpenetto Daisy","Le due offerte","1929","Raduno il mio triste coraggio. Non posso ammettere che questa situazione persista cosí a lungo; è indegna di noi, del nostro passato perfetto. Mi avvicino a Renato.","YES"
"di_Carpenetto_Daisy-Le_due_offerte-1929","di Carpenetto Daisy","Le due offerte","1929","Cerco di apparirgli dolce, comprensiva, quasi materna. — Perché ti ostini a mentire, ad ingannarmi? T’illudi forse che io non comprenda, non abbia intuito la verità?","NO"
"di_Carpenetto_Daisy-Le_due_offerte-1929","di Carpenetto Daisy","Le due offerte","1929","— Che cosa vuoi dire? Dal suono della sua voce avverto ch’egli intende mentire ancora, trincerandosi dietro le molte parole inutili come i bambini si nascondono dietro alla sedia della loro mamma quando hanno paura. Mi avvilisco ma tento di reagire.","YES"
"di_Carpenetto_Daisy-Le_due_offerte-1929","di Carpenetto Daisy","Le due offerte","1929","— Da qualche mese sei mutato, caro, troppo mutato... Mi sfuggi quasi io fossi una tua nemica, eviti di rimanere solo con me... Hai torto. Io ti posso compatire, perdonare... Ti amo sempre.","NO"
"di_Carpenetto_Daisy-Le_due_offerte-1929","di Carpenetto Daisy","Le due offerte","1929","Non muto... — No, Minú, tu non devi dire questo... Sei ingiusta. — Ah! sono ingiusta?","NO"
"di_Carpenetto_Daisy-Le_due_offerte-1929","di Carpenetto Daisy","Le due offerte","1929","Non lo supponevo davvero... Rido un breve riso nervoso. Un nodo di lacrime mi stringe la gola. Vorrei esprimere a Renato tutta la mia angoscia: non oso.","NO"
"di_Carpenetto_Daisy-Le_due_offerte-1929","di Carpenetto Daisy","Le due offerte","1929","Piango invece, senza sussulti. — Perché piangi, Minú, perché? Spiegati, te ne supplico...","NO"
"di_Carpenetto_Daisy-Le_due_offerte-1929","di Carpenetto Daisy","Le due offerte","1929","Appena pronunziata l’ultima frase egli, pentito, vorrebbe riprenderla. Renato non desidera la mia sincerità poiché intuisce che io «so». Teme la mia verità quanto io temo la sua menzogna.","YES"
"di_Carpenetto_Daisy-Le_due_offerte-1929","di Carpenetto Daisy","Le due offerte","1929","E forse soffre del male arrecatomi: una lieve sofferenza fatta di pietà e di egoismo. Se egli potesse tradirmi senza ferire il mio cuore, il tradimento gli recherebbe un piacere piú intenso. Sono la sua catena: una catena viva, tenacissima.","YES"
"di_Carpenetto_Daisy-Le_due_offerte-1929","di Carpenetto Daisy","Le due offerte","1929","— Calmati, Minú, rasserenati. Voglio che tu ritrovi la tua pace. Ne ho bisogno.","NO"
"di_Carpenetto_Daisy-Le_due_offerte-1929","di Carpenetto Daisy","Le due offerte","1929","— Hai bisogno di me? Sorrido, nuovamente fiduciosa. — Certamente, bambina...","NO"
"di_Carpenetto_Daisy-Le_due_offerte-1929","di Carpenetto Daisy","Le due offerte","1929","La speranza che l’«altra» non sia riuscita a conquistarlo fino a distruggermi mi concede un attimo di triste serenità. Esisto dunque ancora per lui, nel suo cuore? Non sono dunque soltanto un’ombra nemica?","YES"
"di_Carpenetto_Daisy-Le_due_offerte-1929","di Carpenetto Daisy","Le due offerte","1929","Le ombre non posseggono un’anima. Renato desidera che la mia anima guarisca. Gli sono grata anche di questo piccolo desiderio forse subito dimenticato.","YES"
"di_Carpenetto_Daisy-Le_due_offerte-1929","di Carpenetto Daisy","Le due offerte","1929","Mi lascio accarezzare, baciare. Sento ch’egli tenta d’intiepidire le mie mani gelide con le labbra, con le dita. Il silenzio è assoluto.","NO"
"di_Carpenetto_Daisy-Le_due_offerte-1929","di Carpenetto Daisy","Le due offerte","1929","La mia stanchezza non mi consente di parlare ancora. Del resto tutte le parole sono vane. Noi conosciamo la realtà anche se tentiamo di velarla e nasconderla a noi stessi con brevi riposi di tenerezza.","NO"
"di_Carpenetto_Daisy-Le_due_offerte-1929","di Carpenetto Daisy","Le due offerte","1929","Un trepido senso di rinascita mi avvolge. Guardo Renato. Il rancore è distrutto.","NO"
"di_Carpenetto_Daisy-Le_due_offerte-1929","di Carpenetto Daisy","Le due offerte","1929","La sofferenza persiste ma è tanto diffusa da non avvertirla quasi piú. Il mio respiro è lieve come quello di Elena. — Povero Renato... L’improvviso ed illogico slancio di compassione non gli reca sorpresa.","YES"
"di_Carpenetto_Daisy-Le_due_offerte-1929","di Carpenetto Daisy","Le due offerte","1929","Vorrebbe che io gli parlassi ancora per rasserenarlo e guarirlo: invece ammutolisco poiché le sillabe mi arrecano un impercettibile male fisico. Ci accorgiamo entrambi di essere due ammalati, prigionieri, che devono percorrere vicini, anche se stanchi, la strada incominciata. I cervelli sono torbidi, le anime sono mutate, i cuori sono incerti ma i piedi devono ancora condurre lontano... — Andiamo a letto, Minú.","NO"
"di_Carpenetto_Daisy-Le_due_offerte-1929","di Carpenetto Daisy","Le due offerte","1929","È tardi. Mi alzo barcollando. Sono un automa.","NO"
"di_Carpenetto_Daisy-Le_due_offerte-1929","di Carpenetto Daisy","Le due offerte","1929","Stanotte Renato mi ha dato ed ha preteso l’amore come «prima». Il piacere ha indotto le sue labbra a pronunziare parole di passione povere, incerte parole nate dalla carne che si ostinava a godere con me, per me, dopo di aver troppo goduto con un’altra donna. Egli ha tentato d’illudermi.","NO"
"di_Carpenetto_Daisy-Le_due_offerte-1929","di Carpenetto Daisy","Le due offerte","1929","Vigile, lucida spettatrice, ho misurato lo sforzo ch’egli compiva. Gliene sono riconoscente, con tristezza. La volontà non vince l’istinto.","NO"
"di_Carpenetto_Daisy-Le_due_offerte-1929","di Carpenetto Daisy","Le due offerte","1929","Il piacere è stato soltanto un pallido riflesso che ha appena ravvivato il ricordo. Adesso Renato dorme, persuaso di avermi convinta e guarita. L’osservo.","YES"
"di_Carpenetto_Daisy-Le_due_offerte-1929","di Carpenetto Daisy","Le due offerte","1929","Si agita nel sonno quasi una visione allettante lo tormentasse di continuo. Una sua mano mi ha sfiorata nell’incubo ingordo: è contratta. Che cosa vuole afferrare?","YES"
"di_Carpenetto_Daisy-Le_due_offerte-1929","di Carpenetto Daisy","Le due offerte","1929","Quale felicità desidera trattenere? La spiegazione non è avvenuta: sospesa appena incominciata essa ha lasciato in me tutta l’infinita mestizia delle cose incompiute. Cerco di rievocare le frasi pronunziate: poche, velate, prive di significato.","YES"
"di_Carpenetto_Daisy-Le_due_offerte-1929","di Carpenetto Daisy","Le due offerte","1929","Poiché i silenzi ci allontanavano l’uno dall’altra abbiamo tentato di ritrovarci attraverso la voluttà. Anche i corpi hanno mentito. Quando l’anima non è paga la carne non riesce ad assaporare il piacere completo... È giusto.","NO"
"di_Carpenetto_Daisy-Le_due_offerte-1929","di Carpenetto Daisy","Le due offerte","1929","Non posso addormentarmi. La certezza di non possedere completamente l’uomo che giace tanto vicino a me da penetrarmi con il suo calore, mi ossessiona. Quale donna tiene Renato?","NO"
"di_Carpenetto_Daisy-Le_due_offerte-1929","di Carpenetto Daisy","Le due offerte","1929","Ho l’accorata sensazione di essere sola. Non odo piú l’altro respiro. La notte è troppo buia per la mia malinconia.","NO"
"di_Carpenetto_Daisy-Le_due_offerte-1929","di Carpenetto Daisy","Le due offerte","1929","* * * La moglie possiede tutti i diritti: l’amante è sempre una ladra nel giudizio degli uomini, dinanzi alla legge. Anche quando la moglie non ha saputo accendere o trattenere l’amore del suo uomo, ella può e deve pretenderlo a voce alta poiché quest’amore, teoricamente, rimane suo, malgrado tutto. L’amante è povera, in faccia al mondo; possiede soltanto la sua passione e quella ch’essa ha suscitato: null’altro.","NO"
"di_Carpenetto_Daisy-Le_due_offerte-1929","di Carpenetto Daisy","Le due offerte","1929","La società le nega tutte le armi, tutti i diritti. La sua gelosia deve rimanere segreta, la sua sofferenza deve nascondersi come si nasconde la serpe velenosa. Se ella grida la folla l’ode e la condanna, se ella si vendica il pubblico sogghigna e si accanisce, se ella diventa madre il figlio è un misero essere destinato a soffrire per l’ostilità della gente beffarda che vede in lui, nella sua vita, sopratutto, l’espressione di una colpa indegna di perdono.","NO"
"di_Carpenetto_Daisy-Le_due_offerte-1929","di Carpenetto Daisy","Le due offerte","1929","La strada percorsa dall’amante è sempre deserta. Poiché tutti la valutano un’ingorda privilegiata nessuno si sofferma per offrirle un aiuto. Le lotte crudeli, i dolori opprimenti i rimorsi lancinanti non devono trasparire sul suo volto.","YES"
"di_Carpenetto_Daisy-Le_due_offerte-1929","di Carpenetto Daisy","Le due offerte","1929","L’invidia suscitata dall’amore rende gli uomini crudeli ed attenti. La loro intransigenza in quanto riguarda la morale è spesso, un meschino, inacidito rimpianto di non saper essere compiutamente immorali. Nella condanna si nasconde di frequente un desiderio torbido di peccato.","NO"
"di_Carpenetto_Daisy-Le_due_offerte-1929","di Carpenetto Daisy","Le due offerte","1929","La società impone la maschera poiché essa teme l’orrendo sghignazzo del volto nudo e sincero. Quante divinità resisterebbero al tempo se i piedestalli si frantumassero all’improvviso? L’amante è sola perché essa è sempre sincera.","NO"
"di_Carpenetto_Daisy-Le_due_offerte-1929","di Carpenetto Daisy","Le due offerte","1929","Non deve urlare. Non deve farsi udire mai. La risposta ai suoi lamenti sarebbe breve, logica, dettata dal cervello, nemica dell’anima: Perché hai preteso la passione di un uomo che non ti appartiene?","YES"
"di_Carpenetto_Daisy-Le_due_offerte-1929","di Carpenetto Daisy","Le due offerte","1929","Il torto è grande, devi scontarlo. La moglie vince come il sole vince le tenebre. Anche Minú vince, lo sento, benché in apparenza ella sia la vittima, la sacrificata.","YES"
"di_Carpenetto_Daisy-Le_due_offerte-1929","di Carpenetto Daisy","Le due offerte","1929","Renato mi ama, mi concede tutte le ore libere della sua giornata, mi ubriaca di parole e di passione, ma Minú impera sulla sua vita, senza ch’egli se ne accorga, dominatrice indiscussa. Ella porta il suo nome, cammina accanto a lui nella luce, gli ha dato un figlio, possiede il diritto di rimanergli vicina in tutte le piú dissimili circostanze della vita: ella è «la moglie». Perché negare queste verità?","YES"
"di_Carpenetto_Daisy-Le_due_offerte-1929","di Carpenetto Daisy","Le due offerte","1929","Esistono precise, immense, definite, e s’impongono quasi fossero creature vive. Sono piú forti di me, sono anche piú forti di Renato. Egli non le vuole ricordare.","YES"
"di_Carpenetto_Daisy-Le_due_offerte-1929","di Carpenetto Daisy","Le due offerte","1929","Tenta di ribellarsi al loro imperio con dei ragionamenti: si stanca inutilmente. Ieri mi ha detto: — Se tu non sei felice, se non ti appaghi di vivere con me nell’ombra, io abbandono tutti, tutto, per seguirti... — Anche Elena? Un attimo di tristezza leggera.","YES"
"di_Carpenetto_Daisy-Le_due_offerte-1929","di Carpenetto Daisy","Le due offerte","1929","— Sí, anche Elena... L’ho abbracciato con gratitudine. L’amore ringiovanisce Renato: egli è un fanciullo cieco il quale, non ammettendo ostacoli, non conosce divieti. Sogna di poter vivere accanto a me una nuova libertà in città sconosciute.","YES"
"di_Carpenetto_Daisy-Le_due_offerte-1929","di Carpenetto Daisy","Le due offerte","1929","Si appaga di questi sogni che lo placano illudendolo. I legami esistono. Il cerchio d’oro che egli porta al suo dito non s’infrange.","YES"
"di_Carpenetto_Daisy-Le_due_offerte-1929","di Carpenetto Daisy","Le due offerte","1929","Io l’osservo con rassegnata mestizia. Renato non si accorge quanto spesso guardo la mano che reca il simbolo della nostra prigionia... Non ho accettato la sua offerta.","NO"
"di_Carpenetto_Daisy-Le_due_offerte-1929","di Carpenetto Daisy","Le due offerte","1929","Il male è in noi: non possiamo guarirne. La distanza non lo annullerebbe. Perché condurlo, quasi fosse un bambino ammalato, in città sconosciute e moltiplicarlo con il rimorso?","YES"
"di_Carpenetto_Daisy-Le_due_offerte-1929","di Carpenetto Daisy","Le due offerte","1929","Lontano da Elena egli rimpiangerebbe la sua creatura, lontano da Minú egli rievocherebbe involontariamente sua moglie arricchendola di qualità che forse ella non ha mai posseduto, mentre io diventerei, suo malgrado, giorno per giorno, la nemica che lo ha indotto ad allontanarsi dalla casa con una promessa di gioia impossibile a mantenersi. Renato mi stima, ha la necessità di credermi buona. Se io lo obbligassi a fuggire (il furto impone sempre la viltà della fuga) egli pur amando il mio corpo e la mia anima disprezzerebbe il mio gesto: sono i gesti che dominano il mondo innalzando e distruggendo gli uomini.","YES"
"di_Carpenetto_Daisy-Le_due_offerte-1929","di Carpenetto Daisy","Le due offerte","1929","Questa lucidità mi sfinisce. Io mi vedo come un ammalato affacciato alla finestra vede i passanti che camminano nella strada. La mia strada è buia.","NO"
"di_Carpenetto_Daisy-Le_due_offerte-1929","di Carpenetto Daisy","Le due offerte","1929","I lampioni accesi da mani distratte sono pochi e pallidi: creano piccole chiazze di luce bianca. Non scorgo soglie ospitali dinanzi alle quali potermi riposare. L’ombra che mi avvolge è densa.","YES"
"di_Carpenetto_Daisy-Le_due_offerte-1929","di Carpenetto Daisy","Le due offerte","1929","Renato ignorerà il nuovo tormento poiché ho il dovere di fargli credere che io sono felice. Avendo rifiutato la sua offerta di libertà (egli era disposto ad abbandonare anche Elena!) non posso adesso imprecare contro la prigionia voluta da me, pretesa da me.","YES"
"di_Carpenetto_Daisy-Le_due_offerte-1929","di Carpenetto Daisy","Le due offerte","1929","Sono stata buona? Sono stata vile? Non lo so.","NO"
"di_Carpenetto_Daisy-Le_due_offerte-1929","di Carpenetto Daisy","Le due offerte","1929","Non so piú nulla. Il mio cervello è svuotato. Soltanto i nervi esistono in me per vibrare e tendersi...","NO"
"di_Carpenetto_Daisy-Le_due_offerte-1929","di Carpenetto Daisy","Le due offerte","1929","Domani Renato vuol condurmi in campagna, al sole. Egli intuisce quanto io sono ammalata e si ostina nel volermi guarire. È buono, troppo buono: questa bontà mi rende debole.","YES"
"di_Carpenetto_Daisy-Le_due_offerte-1929","di Carpenetto Daisy","Le due offerte","1929","Non posseggo nessuna ragione che m’induca a reagire. Ed io non posso dire a Renato: — La mia malattia ha un nome breve; si chiama Minú... * * * La lettera dimenticata da Renato sulla scrivania mi ha attirato come attira talvolta la verità. Non ho saputo né voluto resistere all’insano, improvviso desiderio di leggerla.","YES"
"di_Carpenetto_Daisy-Le_due_offerte-1929","di Carpenetto Daisy","Le due offerte","1929","Sentivo che era stata scritta dall’«altra», riconoscevo la calligrafia alta, angolosa, intravista per un attimo mentre Renato faceva la sua valigia. La casa era deserta. Mio marito non sarebbe ritornato certamente prima dell’ora di cena.","YES"
"di_Carpenetto_Daisy-Le_due_offerte-1929","di Carpenetto Daisy","Le due offerte","1929","Le mie dita tremavano un poco nell’indugio. La realtà spaventa sempre nell’atto di avvicinarla, conoscerla, toccarla con le mani e con il cuore: essa è troppo nemica del sogno per non incutere timore. Ho letto la lettera.","NO"
"di_Carpenetto_Daisy-Le_due_offerte-1929","di Carpenetto Daisy","Le due offerte","1929","Adesso l’anima mi duole. Tutti i sospetti di questi ultimi mesi erano preferibili alla certezza che mi soffoca. «L’altra» esiste, ama Renato, si chiama Nora.","YES"
"di_Carpenetto_Daisy-Le_due_offerte-1929","di Carpenetto Daisy","Le due offerte","1929","Il foglio è già vecchio di qualche giorno: da Ferrara ella gli scrive di raggiungerla a Ravenna. — Nella solitudine dell’antica città tetra, noi godremo con l’entusiasmo di due adolescenti tutto l’amore... Tutto l’amore! L’amore ch’essa ruba a me, senza pietà, in ogni ora, lasciandomi disperatamente sola e smarrita...","YES"
