"filename","nome","titolo","anno","chunk","DIL"
"Donati_Cesare-Per_un_gomitolo-1858","Donati Cesare","Per un gomitolo","1858","Non era appena uscita Teresa da una parte, che dall' altra comparve la padrona. Io era desideroso di vederla in viso per istudiarne la fisonomia, ma non si tosto i nostri occhi s'incontrarono che un reciproco oh di sorpresa ci sfuggi contemporaneamente dal labbro. Io mi trovava faccia a faccia colla fruttaiuola che un tempo teneva bottega dirimpetto alla casa d' Isolina, e non potevo comprendere per qual guisa ella si trovasse in uno stato di agiatezza troppo superiore alla sua condizione.","NO"
"Donati_Cesare-Per_un_gomitolo-1858","Donati Cesare","Per un gomitolo","1858","Mi accorsi ben presto che la mia presenza inaspettata non aveva prodotto un effetto molto favorevole sulla fruttaiuola, perché essa, con un fare impacciato e con visibile freddezza, mi disse: Chi non muor si rivede. - Davvero, l'è proprio cosi. Ma guardate un po' le combinazioni di questo mondo: ieri avrò veduto per lo meno una dozzina di camere, e non doveva trovar nulla che mi andasse a verso per venire ad abitare con voi.","NO"
"Donati_Cesare-Per_un_gomitolo-1858","Donati Cesare","Per un gomitolo","1858","Se sapeste quanto sono contento!... Anch' io lo sarei.... davvero.... pigionali come lei non se ne trovan dappertutto, ma.... Che cosa? Ecco.... me ne dispiace proprio.... ma non saprei dove metterla.","YES"
"Donati_Cesare-Per_un_gomitolo-1858","Donati Cesare","Per un gomitolo","1858","- Non sapreste dove mettermi? O che vuol dire che la vostra donna di servizio mi fece vedere tre camere da appigionarsi? Non vorrei credere che vi dispiacesse di tenermi in casa vostra.","NO"
"Donati_Cesare-Per_un_gomitolo-1858","Donati Cesare","Per un gomitolo","1858","Ma le pare, Dio mio? Allora?.... È perchè....","YES"
"Donati_Cesare-Per_un_gomitolo-1858","Donati Cesare","Per un gomitolo","1858","Teresa non sapeva che io avessi già impegnata la mia parola con altri. Teresa entrava per l' appunto, facendo strada al facchino e avviandosi francamente verso la camera che io aveva scelta. disse la fruttaiola imbarazzatis Teresa, sima, il baule deve essere riportato giù.","NO"
"Donati_Cesare-Per_un_gomitolo-1858","Donati Cesare","Per un gomitolo","1858","Ma la non m'ha detto dianzi di far mettere la roba nella camera del signore? L'imbarazzo della povera donna cresceva a dismisura per questa risposta di Teresa, talchè io che intesi la ragione della freddezza della fruttaiuola, e del suo rifiuto a darmi la camera, dissi al facchino: - Posa intanto quel baule costà e aspettami: e voi, rivolgendomi alla fruttaiuola, se voleste passare con me in un'altra camera, avrei a dirvi due parole. Posciachè fummo soli, mi feci a narrarle colla maggior sincerità tutto quello che era passato fra me e Isolina, sebbene fossi certo che ella ne dovesse sapere più di me.","NO"
"Donati_Cesare-Per_un_gomitolo-1858","Donati Cesare","Per un gomitolo","1858","Scesi quindi a descriverle coi colori più vivi lo stato tormentoso in cui mi trovava dacchè avevo saputo Isolina malata all'ospedale, e finii con confessarle sapere che quest'ultima abitava nella medesima casa, e che appunto per ciò mi era risoluto a prendervi una camera. La mia lunga orazione, esposta con quella vivacità che era naturale in quel momento, parve far effetto sull'animo della fruttaiuola, perloché, io sempre più animato, soggiunsi: - Ed ora che sapete tutto, e conoscete quanto siano rette le mie intenzioni verso Isolina, spero non avrete più difficoltà a considerarmi come di famiglia. - Con tutto il piacere, anco per il bene di quella povera figliuola, che da tanti mesi non ha un momento di requie, e per via sua, sa ella ?","NO"
"Donati_Cesare-Per_un_gomitolo-1858","Donati Cesare","Per un gomitolo","1858","La va a lavorare a giornata da certi signori, ma signori per bene, veh! Gliela ho procurata io codesta casa e.... E quando ritornerà?","YES"
"Donati_Cesare-Per_un_gomitolo-1858","Donati Cesare","Per un gomitolo","1858","Verso sera. Questo mi dispiace davvero; come farò ora a passare la giornata? Si vede proprio che amore e pazienza non vanno d'accordo.","YES"
"Donati_Cesare-Per_un_gomitolo-1858","Donati Cesare","Per un gomitolo","1858","La vada nella su' stanza a mettere in ordine le sue robe, e vedrà che il tempo passa presto. Io debbo andarmene perchè ho lasciato solo a bottega il mio ragazzo, e non vorrei mi facesse del male. È passata la stagione delle ciliege?","YES"
"Donati_Cesare-Per_un_gomitolo-1858","Donati Cesare","Per un gomitolo","1858","diss'io sorridendo maliziosamente. È passata davvero: ma che cred' ella che io venda sempre le frutte? Che!","NO"
"Donati_Cesare-Per_un_gomitolo-1858","Donati Cesare","Per un gomitolo","1858","Ora mi son nobilitata: i' fo la merciaia. Come? - Di certo.","NO"
"Donati_Cesare-Per_un_gomitolo-1858","Donati Cesare","Per un gomitolo","1858","Ed ecco come l'ando. Il cholèra fece male da una parte e bene dall'altra, almeno per me, perchè mandò all'altro mondo il mi' cognato che non aveva mai voluto aiutarci d'un quattrino, e siccome non fu in tempo di far testamento dovette lasciare a noi quel po' di ben di Dio che aveva accumulato quand'era vivo e' faceva il merciaio; noi si prese la bottega tal' e quale, e di frutta non se ne parlò più. Mi rallegro davvero.","YES"
"Donati_Cesare-Per_un_gomitolo-1858","Donati Cesare","Per un gomitolo","1858","Ed è un pezzo, eh? - Proprio dal giorno che andai a prendere Isolina all' ospedale. Ah, foste voi!","NO"
"Donati_Cesare-Per_un_gomitolo-1858","Donati Cesare","Per un gomitolo","1858","Me l'ero immaginato. Che vuol' ella? giacchè nostro Signore mi aveva mandato un po' di bene, pensai che era mio dovere d'aiutare quella povera ragazza, che proprio la lo merita.","YES"
"Donati_Cesare-Per_un_gomitolo-1858","Donati Cesare","Per un gomitolo","1858","Ma la lascio, perchè debbo scappare a bottega. Teresa, få mettere il baule del signore nella su' stanza. A rivedella, sor Enrico.","NO"
"Donati_Cesare-Per_un_gomitolo-1858","Donati Cesare","Per un gomitolo","1858","A rivederci - diss' io, ed entrai nella stanza contigua a quella d' Isolina. Non pensai neppure per ombra a mettere in assetto le mie robe, ma passai, tostochè fui lasciato solo, nella cameretta d' Isolina, e mi posi un' altra volta davanti alla campana di cristallo. Non è a credere quanto io fossi commosso a quella vista, e come il cuore mi balzasse di gioia all'idea di potere con una sola parola rendere la buona fanciulla alla felicità della sua prima giovinezza.","NO"
"Donati_Cesare-Per_un_gomitolo-1858","Donati Cesare","Per un gomitolo","1858","«Dentr'oggi, diceya fra me, dentr'oggi la parola magica sarà pronunziata, e tolto per sempre di qui questo cipresso, simbolo della morte. » Al pensiero di togliere il ramoscello del cipresso conficcato nella borraccina, successe, per impulso spontaneo, l'atto, e buttatolo per terra e calpestatolo co' piedi, mi sovvenne in buon punto dei semprevivi avuti pur dianzi dalla fioraia, e che io teneva tuttavia infilzati nell' occhiello del vestito. Ne staccai una ciocchettina colla massima cura, e l'accomodai si bene in luogo del ferale cipresso, da dar nell'occhio ad Isolina, non si tosto avesse messo piede nella camera.","YES"
"Donati_Cesare-Per_un_gomitolo-1858","Donati Cesare","Per un gomitolo","1858","Dopo aver errato in qua e in là per alcun tempo, rientrai in casa alla lesta perchè voleva esser testimonio oculare dell' effetto che Isolina avrebbe provato. Appena sentii picchiare alla porta, mi posi in vedetta dietro la bussola della mia camera. La prima cosa che fermò l' attenzione d' Isolina fu il cipresso che era sempre rimasto nel mezzo della stanza.","NO"
"Donati_Cesare-Per_un_gomitolo-1858","Donati Cesare","Per un gomitolo","1858","ło vidi improntarsi sul vago viso la cura penosa che la premeva nel raccattarlo da terra: ma allorchè si avvicinò al cassettone per rimetterlo al luogo primitivo, un sentimento di meraviglia mista a dispetto la fece rimanere col braccio teso, perchè ella non sa DONATI. 7 peva darsi ragione dell'avvenuta sostituzione. Io che ne seguiva ogni movimento, la vidi prendere in mano la piccola campana e avviarşi verso la porta ond'era entrata, chiamando ad alta voce Teresa per chiarire forse la cosa.","YES"
"Donati_Cesare-Per_un_gomitolo-1858","Donati Cesare","Per un gomitolo","1858","Non mi fu possibile di più frenarmi, e abbandonato in fretta il mio posto, mi trovai in faccia ad Isolina nel punto istesso in che questa era per uscire. - Isolina, mia diletta Isolina, - esclamai - io, io solo ho cambiato il cipresso coi semprevivi, perchè il nostro amore dovrà durare eternamente! Isolina non fece motto, ma mi guardó alquanto in viso come trasognata, e cadde svenuta frale mie braccia : Da diciotto mesi io faccio parte del corpo rispettabile, ma non sempre rispettato, dei mariti: e già un bel bambino riccioluto e paffutello è la delizia di mio padre, che potei risolvere ad abbandonare il villaggio nativo per ridursi in Firenze; ove ei vivrebbe benissimo se trovasse orecchie più compiacenti per ascoltare il racconto del suo famoso viaggio all'Isola dell Elba.","NO"
"Donati_Cesare-Per_un_gomitolo-1858","Donati Cesare","Per un gomitolo","1858","Giovanni mi risparmiò la briga di partecipargli il mio matrimonio con modi poco gentili, poiché parti improvvisamente per l'Egitto, ove farà quattrini a macca, mandando i mammalucchi all' altro mondo. L' onesta fruttaiuola è come di famiglia: viene di frequente a farci visita, e mi rammenta sempre le ciliegie che mi vendè. Isolina finalmente è la migliore delle mogli, e fa consistere il suo maggior piacere nel raccontare la storia de'suoi amori, che termina sempre accennando la piccola campana di cristallo collocata in bella mostra sul caminetto, ed aggiungendo con un grazioso sorriso : « Per un gomitolo noi siamo felici!","NO"
"Donati_Cesare-Per_un_gomitolo-1858","Donati Cesare","Per un gomitolo","1858",">>> NB. Sarà forse superfluo avvertire il lettore di non confondere il protagonista di questo racconto con l'autore, sebbene, il che non è senza esempi, si parli in prima persona. Un ciuco ribelle. Arturo Delcampo era uno di que' pochissimi che monna Fortuna prende a proteggere fin dalla nascita, perchè « uscito dal matern' alvo fuora » colla maggiore facilità, non mandò neppure quel solito piagnisteo di malaugurio che mandan gli altri appena schiusi gli occhi alla luce.","NO"
"Donati_Cesare-Per_un_gomitolo-1858","Donati Cesare","Per un gomitolo","1858","Cresciuto negli anni, al nostro Arturo non avvenne mai cosa che facesse a' calci con questo primo segno di vita avventurosa. I suoi genitori, ottime persone e passabilmente ricche, amavano sopra modo il primo frutto dei loro amori, e per dargliene una prova evidente, lui nato, non impastarono che femmine, le quali furono ben presto convenevolmente accasate. Arturo non aveva che ventiquattro anni quando, a breve intervallo, gli mori e padre e madre.","NO"
"Donati_Cesare-Per_un_gomitolo-1858","Donati Cesare","Per un gomitolo","1858","Di tale perdita ei fu oltre misura dolente, ma a confortarnelo in qualche guisa gli rimase la padronanza assoluta di un bel patrimonio, il quale per essere costituito in tanti buoni crediti fruttiferi non gli dava un imbarazzo al mondo. Di beni immobili il padre non gli lascio se non un ampio casamento in città, ed una bellissima villa, con alcuni poderi annessi, ove Arturo era uso passare qualche mese dell'anno. Nello stradone che metteva capo alla strada maestra passeggiava il nostro giovinotto, sul declinare di un bel giorno d'autunno, e precisamente in quell' ora nella quale i raggi del sol cadente imporporando l'estremo orizzonte, lasciano godere di una frescura che invita i briosi villeggianti ad uscire dalle loro ville.","NO"
"Donati_Cesare-Per_un_gomitolo-1858","Donati Cesare","Per un gomitolo","1858","Io non istarò ad indagare quali fossero i pensieri che gli mulinavano per il capo in quel momento. Era solo, in mezzo ad un perfetto silenzio, e forse avrà pensato al modo di spendere la pingue entrata, cosa che, per mia somma sventura, non mi ha dato fin qui veruna briga. Checchè ne sia, i suoi pensieri furono ad un tratto interrotti da un suono precipitato di campanelli, e dalle grida di una donna che chiamava soccorso a tulla gola.","NO"
"Donati_Cesare-Per_un_gomitolo-1858","Donati Cesare","Per un gomitolo","1858","Com'è ben naturale alzò gli occhi per iscoprirne la causa, e vide venire alla sua volta dalla strada maestra un ciuco attaccato ad una carretta, con tale una corsa da far onore a qualunque corridore. Forse che in quell'occasione la povera bestia aveva dimenticata la parte che doveva rappresentare nel mondo, e qualche grillo era passato pel suo capo asinino, della qual cosa non dovremmo in buona coscienza fargliene carico, quando molti animali che si dicono ragionevoli fanno altrettanto e peggio. Fatto accorto del pericolo che sovrastava a coloro che sedevano sul trespolo, Arturo si affretto ad accorrere, per impedire, se era possibile, che la bestia imbizzarrita procedendo lungo lo stradone, rovesciasse i suoi padroni sopra alcuni tronchi d'albero, che giacevano sul suolo alla rinfusa.","YES"
"Donati_Cesare-Per_un_gomitolo-1858","Donati Cesare","Per un gomitolo","1858","Invano! Non aveva fatto pochi passi, e già carretta, viaggiatori e ciuco erano raggruppati, avviluppati, quasi, coi pioppi giacenti, che non dovevano essere per certo il letto più soffice di questo mondo. In quattro salti si trovò in mezzo a quella specie di caos semovente, che poteva assomigliarsi per certi riguardi alla catastrofe di alcuni drammi francesi, ne'quali muoiono tutti, il suggeritore inclusive.","NO"
"Donati_Cesare-Per_un_gomitolo-1858","Donati Cesare","Per un gomitolo","1858","Un sordo ansare era succeduto al recente trambustio; le campanelle attaccate alla sonagliera del ciuco più non tintinnavano, e la donna più non mandava un lamento, perché nè la sua corporatura adiposa, nè la postura glielo permettevano. La carretta non potendo sormontare l' ostacolo d' una grossa radice d'albero, aveva dovuto capovolgersi mettendo sotto di sè la vecchia, e sotto la vecchia un garzoncello di contado, mentre la bestia impigliata fra le cinghie, il basto e le stanghe pareva mandasse gli aneliti estremi. Come è facile a immaginare bastó ad Arturo un istante per abbracciare coll' occhio tutti questi particolari, e per capire che l'aiuto doveva prestarsi al più soffrente de' mal capitati.","NO"
"Donati_Cesare-Per_un_gomitolo-1858","Donati Cesare","Per un gomitolo","1858","Era questi il povero contadinello, il quale vera mente poteva dirsi in uno stato da destar pietà fino alle pietre, poichè si trovava accasciato e compresso quant'era lungo dalla enorme circonferenza della donna, a cui il capitombolo non era stato favorevole per conservare la pudicizia. Bensi la prima idea che venne ad Arturo, fu di guardarsi d' attorno per vedere se qualche contadino fosse capitato opportunamente per levar lui d' impaccio; ma per quanto spingesse l'occhio innanzi a sé, non gli venne fatto di scorgere alcuno; talche penso, mal suo grado, di porgere esso una mano soccorritrice. Perchè Arturo non avesse bilanciato un istante, occorreva che la donna fosse stata giovane e bella, il contadino una dorata livrea, e il ciuco ribelle un cavallo puro sangue attaccato ad un elegante tilbury.","NO"
"Donati_Cesare-Per_un_gomitolo-1858","Donati Cesare","Per un gomitolo","1858","Allora ei si sarebbe fatto un pregio di lacerarsi le vesti e le polpe delle gambe fra i rami aguzzi caduti dalla potatura, per offrire più pronto il suo aiuto. Ciò prova che le medesime sventure ci commuovono non in ragione di quello che le sono veramente, ma piuttosto delle persone che ne vengono colpite. Deliberato adunque, con una magnanimità più presto unica che rara in un giovane elegante, di togliere dall' imbarazzo que poveri diavoli, tento in primo luogo di rimettere sulle ruote la carretta che copriva i due individui come.... può farlo una carretta capovolta: ma era fatica gettata perchè il ciuco colle sue cigne la teneva più che mai obbligata.","NO"
"Donati_Cesare-Per_un_gomitolo-1858","Donati Cesare","Per un gomitolo","1858","Per la qual cosa si rivolse dal lato di quest'ultimo, e strappato quello che non poteva sciogliere dell' umile bardatura, gli venne fatto di separare gli interessi della bestia da quelli della carretta, la quale non essendo più costretta, si rimise quasi per proprio impulso nello stato normale. Quindi diede mano alla vecchia, che sentendosi sollevata dalla pressione molesta cominciava a rivolgergli parole di ringraziamento. Bisogna convenire che Arturo duro non poca fatica prima di riporla su' due piedi, e nonostante che la tirasse, con quanta forza avesse nelle braccia, non sarebbe per certo riuscito si presto nell'intento, se non avesse trovato un potente aiuto nel villano, il quale si diede a far leva del proprio corpo puntando.","NO"
"Donati_Cesare-Per_un_gomitolo-1858","Donati Cesare","Per un gomitolo","1858","in terra mani e piedi, che ormai aveva sprigionato affatto. Dopo avere ringraziato Arturo con molta affezione, se non con frasi gelate e convenzionali, la buona donna si fece a rimproverare il ragazzotto, il quale un po'stordito per natura, un po'per la recente caduta, se ne stava in contemplazione colle braccia penzoloni e a bocca aperta. - Te l'aveva detto, monello, che tu n' dovevi stuzzicare sotto la coda quella povera bestia; ma già con te gli è l'istesso che parlare al muro, e dalli dalli se' po'ito a gambe all'aria.","NO"
"Donati_Cesare-Per_un_gomitolo-1858","Donati Cesare","Per un gomitolo","1858","Ve n'è sempre una di nuove delle su'scioccherie, sa ella? - disse poi rivolgendosi ad Arturo; e se non fosse per la buona anima di' su' babbo, che gli era un degno galantomo, i' l'arei mandato da un pezzo a buscarsene altrove. Ed ora che fa' tu costi ritto impalato?","NO"
"Donati_Cesare-Per_un_gomitolo-1858","Donati Cesare","Per un gomitolo","1858","O che s'ha a restare qui eternamente? A questa ripassata, il contadinello che non sembrava gran fatto commosso dai rimproveri della padrona, di cui forse conosceva il buon cuore, si avvicino, senza far motto, al ciuco per riattaccarlo alla carretta. Intanto la vecchia rimediando al disordine avvenuto nelle vestimenta, mezzo campagnuole e mezzo cittadinesche, e scuotendo qua e là la polvere che vi si era appiccicata, proseguiva animosamente con Arturo la conversazione, di cui sosteneva si può dire tutto il peso, e solo interrompeva tratto tratto per lagnarsi delle ammaccature, delle scalfitture solferte nella caduta.","YES"
"Donati_Cesare-Per_un_gomitolo-1858","Donati Cesare","Per un gomitolo","1858","Gli raccontò che si chiamava Menica, che dimorava dalla morte di suo marito, avve nuta ventidue anni avanti, in un poderetto discosto un paio di miglia da quelli d' Arturo; che sebbene giovane e corteggiata, non aveva mai voluto fare offesa alla memoria del defunto, nel quale finch' ei visse aveva posto molto amore; che stanca di viver sola in campagna, e poichè il sor Domenico se n'era ito al mondo di là senza lasciarle un rampollo, aveva chiamata presso di sè la figlia di suo fratello, della quale raccontava mirabilia della bontà e della bellezza, e cento altre cose su questo andare che ella seppe incastrare nel discorso come le pietruzze d'un mosaico, e che noi non ripeteremo... Le ciance di Menica avevano distratta l'attenzione del giovane dal campo in cui avveniva da qualche minuto una lotta accanita fra l' uomo ed il bruto: fra il contadino che puntando i piedi tirava il ciuco per la cavezza, e il povero animale che opponendo una resistenza passiva, se ne stava sdraiato quant'era lungo sul terreno, e pareva non si desse pensiero degli sforzi del nemico. Questi però impazientito dalle prove e riprove tentate senz'effetto per indurre ragionevolmente la bestia a rimettersi sotto al giogo, raccolse un grosso randello e cominciò a tempestarle il dorso di una sequela di colpi, che fece ben presto volgere il capo a coloro che se ne stavano in disparte. - Che c'è egli, Maso?","NO"
"Donati_Cesare-Per_un_gomitolo-1858","Donati Cesare","Per un gomitolo","1858","domandò Menica di malumore. E'c'è ch'un si vuol rizzare, rispose il contadino senza cessare di menare giú a diritta e a mancina. E' capitan tutte a noi oggi, riprese la vecchia tentennando il capo; quindi guardando Arturo soggiunse: - O come si fa egli adesso?","NO"
"Donati_Cesare-Per_un_gomitolo-1858","Donati Cesare","Per un gomitolo","1858","L'accento col quale Menica intono l'interrogazione fece accorto Arturo esser suo obbligo di non lasciare la grand' opera a mezzo, e come aveva aiutati i padroni, gli era giuoco forza dar mano anco alla bestia. Fatto adunque di necessità virtů, Arturo afferró le guide, e cominciò a tirar il ciuco per la testa, intanto che Maso prendendo il cignone del basto, lo coadiuvo mirabilmente si, che in poco d'ora il somarello stette ritto, ma soltanto su tre gambe, dappoichè la quarta avesse slogata nella caduta in modo da non poter reggere. Il partito migliore era dunque di rimetterlo nel primiero stato, e cosi fecero.","NO"
"Donati_Cesare-Per_un_gomitolo-1858","Donati Cesare","Per un gomitolo","1858","Ma la faccenda si complicava più che mai per questo avvenimento inatteso; e la vecchia riprincipiava a rimbrottare Maso, ed a lagnarsi dėlla sua mala sorte. Ed ora ci converrà far la guardia al ciuco fin Dio sa quando, e intanto la povera Agnese chi sa come s'inquieta per non vederci arrivare. - A momenti si fa buio, e qui non c'è un cane che possa darci aiuto.","YES"
"Donati_Cesare-Per_un_gomitolo-1858","Donati Cesare","Per un gomitolo","1858","E' ci vorrebbe un altro ciuco da attaccare alla carretta. - Andro io alla villa a chiamar Beco, e ci faremo prestare il cavallo del mugnaio, rispose Maso timidamente. - Si, bellino davvero!","NO"
"Donati_Cesare-Per_un_gomitolo-1858","Donati Cesare","Per un gomitolo","1858","ed io che ho a fare intanto sola su d'una strada? ma s'i' lo dico io che invece di cervello c'è dell'acqua in quella testaccia! E' c'è questo signore che vi terrà compagnia, rimbecco Maso.","YES"
"Donati_Cesare-Per_un_gomitolo-1858","Donati Cesare","Per un gomitolo","1858","-- Questo signore.... questo signore - ripiglio Menica con un tuono di voce che ben palesava non dispiacerle affatto il suggerimento del villano-dopo 7 che gli ha fatto tanto per noi, deve star qui ad uggirsi con me; dice il proverbio che la discrezione l'è la madre degli asini. Non è vero, signore? - Arturo, vedendo la mala parata, si affretto a risponderle: Mi dispiace davvero di non poter trarvi d'impaccio co'miei cavalli perchè ora non li ho in campagna: per altro posso accompagnarvi a casa eritornarmene poi qui coll' altro vostro contadino; cosi la nipote non avrà di che inquietarsi vedendo Maso senza di voi, dopo aver saputo che siete trabaltati.","NO"
"Donati_Cesare-Per_un_gomitolo-1858","Donati Cesare","Per un gomitolo","1858","- Quando non le faccia scomodo.... allora profitterò della sua bontà. Hai sentito, Maso? andro con questo signore, e tu aspetta qui fin che venga Beco col cavallo.","NO"
"Donati_Cesare-Per_un_gomitolo-1858","Donati Cesare","Per un gomitolo","1858","Bada bene di non addormentarti come se' solito, e di non farne qualcuna delle tue con questa povera bestia. - Andiamo, signore... - Eccomi pronto; -e in cosi dire Arturo le offri il braccio, perché il pensiero era corso alla nipote venuta di città. Menica bensi lo restitui ben presto alla realtà, rispondendo alla gentilezza, con un - che, che, le pare?","YES"
"Donati_Cesare-Per_un_gomitolo-1858","Donati Cesare","Per un gomitolo","1858","La ringrazio della su'attenzione, ma grazie a Dio non son tanto vecchia da non reggermi in gambe. È vero che son tutta ammaccata per via di quel maledetto rivoltolone, ma a camminare non mi dà noia.-Tale risposta agro dolce della vecchia lo fece accorto come l'esser nati in città non sia sufficiente per averne gli usi, e per non mostrare d'aver preso un qui pro quo, borbottò una scusa e lasciò che la vecchia adoperasse a su' piacere lo scilinguagnolo, camminandole silenzioso a lato. - Dopo aver camminato alquanto per la strada maestra, s'inoltrarono in un viottolo piuttosto stretto.","YES"
"Donati_Cesare-Per_un_gomitolo-1858","Donati Cesare","Per un gomitolo","1858","La buona donna par lava in quel momento del grande amore che ella portó a suo marito, ed accertava Arturo che per qualche tempo dopo la morte di lui le appariva ne' suoi sogni una specie di fantasima ravvolta in un bianco lenzuolo, che aveva tutte le sembianze del defunto; quando di tratto volgendo lo sguardo in fondo al viottolo, esclamò; Oh! eccola, eccola qui.... Chi, la fantasima?","NO"
"Donati_Cesare-Per_un_gomitolo-1858","Donati Cesare","Per un gomitolo","1858","domandò Arturo. --- No, mia, nipote, Agnese, che ci avrà scorto dalla finestra e ci viene incontro. Infatti una giovanetta veniva saltellando verso di loro, e la vecchia affrettandosi precedeva Arturo di qualche passo.","NO"
"Donati_Cesare-Per_un_gomitolo-1858","Donati Cesare","Per un gomitolo","1858","In fondo al viottolo si vedeva una casetta bianca colle persiane verdi. - Era la meta del piccolo viaggio. II.","NO"
"Donati_Cesare-Per_un_gomitolo-1858","Donati Cesare","Per un gomitolo","1858","Agnese. Chi si contenta gode, dice il proverbio, e dice bene perchè la moderazione nei desiderii è il segreto per conseguire la felicità della vita. Peccato che ai poveri non sia concesso di approfittarne, dappoichè il loro patrimonio si componga solamente di una miriade di desiderii, e tolti questi che rimarrebbe loro?","NO"
