"filename","nome","titolo","anno","chunk","DIL"
"Donati_Cesare-Per_un_gomitolo-1858","Donati Cesare","Per un gomitolo","1858","Ebbene, dunque, non volete darmi questa prova di amicizia che io vi domando? Maria stette un pochino pensosa, poi sentendo che la zia ritornava, si chino verso Paolo e gli disse in fretta. - Le dirò tutto un'altra volta, ora viene la zia.","NO"
"Donati_Cesare-Per_un_gomitolo-1858","Donati Cesare","Per un gomitolo","1858","E quando? La prima volta che saremo soli - e accompagnando le parole con uno sguardo pieno di espressione, si diede a maneggiar l'ago come se le fosse mancato il tempo per finire il compito. Paolo, poich'ebbe avuta questa promessa da Maria, si tirò in disparte rimettendosi al suo posto, acció Placida nell'entrare non s'accorgesse di nulla.","NO"
"Donati_Cesare-Per_un_gomitolo-1858","Donati Cesare","Per un gomitolo","1858","Precauzione inutile, perché la zia, come abbiamo già detto, aveva tutt'altro in capo che il pensiero di far la guardia alla nipote. Il signor Ernesto sale le scale - disse Placida entrando nella stanza. - Tanto meglio - rispose Paolo - cosi non avrò fatto il viaggio inutilmente; - e levatosi da sedere si avvio verso la camera di Ernesto.","NO"
"Donati_Cesare-Per_un_gomitolo-1858","Donati Cesare","Per un gomitolo","1858","Dopo quindici giorni di lontananza, coll' amicizia intrinseca che era sempre passata fra i due giovani, era assai naturale che Paolo s'aspettasse per parte d' Ernesto un ricevimento festevole e cordiale più dell' usato. Invece fu tutto l'opposto. Ernesto lo accolse nè più nè meno di quello che esigessero le convenienze, cosa che riesci a Paolo di non lieve molestia.","NO"
"Donati_Cesare-Per_un_gomitolo-1858","Donati Cesare","Per un gomitolo","1858","E siccome egli era di fare libero e lontano dalla simulazione, gliene mosse lagnanza, sebbene con modi urbani ed amichevoli. Che vuoi che ti dica, mio caro? In questi giorni sono tanto occupato che bisogna ben perdonarmi se non sono del mio solito umore.","YES"
"Donati_Cesare-Per_un_gomitolo-1858","Donati Cesare","Per un gomitolo","1858","Veramente io non ho voluto fartene troppo carico. Ho solamente inteso di mostrarti il mio dispiacere perchè mi pareva che tu non mi trattassi più colla consueta amicizia. ticano.","NO"
"Donati_Cesare-Per_un_gomitolo-1858","Donati Cesare","Per un gomitolo","1858","Ma ti pare? I. vecchi amici non si dimen Lo spero, sebbene generalmente avvenga il contrario; specialmente quando uno cambia stato inaspettatamente. glie?","YES"
"Donati_Cesare-Per_un_gomitolo-1858","Donati Cesare","Per un gomitolo","1858","Ah! dunque lo sai anco tu che prendo mo- Si, me ne ha detto qualche cosa Placida. Mentre stava aspettandoti abbiamo chiacchierato.","NO"
"Donati_Cesare-Per_un_gomitolo-1858","Donati Cesare","Per un gomitolo","1858","La mia incognita protettrice si è finalmente decisa. Te l'aveva detto io fin da principio, che la sarebb' ita a finire cosi? ma tu mi rispondesti che non ne volevi far nulla.","YES"
"Donati_Cesare-Per_un_gomitolo-1858","Donati Cesare","Per un gomitolo","1858","- Cambiano i saggi a seconda de' casi, dice il proverbio. Infatti le son fortune che non capitano tutti i giorni. Figurati che Amalia è ricca di meglio che dugentomila scudi, di cui sarò padrone un pochino anch' io.","YES"
"Donati_Cesare-Per_un_gomitolo-1858","Donati Cesare","Per un gomitolo","1858","È una bella somma, mi pare, per uno spiantato com'era io, non è vero? Eh, non lo nego; ma vorrei che oltre ai denari tu avessi la certezza di condurre una vita felice. Coi denari si fa tutto.","YES"
"Donati_Cesare-Per_un_gomitolo-1858","Donati Cesare","Per un gomitolo","1858","Ma quando mancassé la pace del cuore, po tresti esser ricco come Creso, e non l'avresti. - Oh perchè non dovrei esser felice, beato, se tu vuoi? Amalia mi ama perdutamente; è ricca, è buona, pone ogni suo studio nel prevenire il più piccolo de' miei desiderii; dunque !","YES"
"Donati_Cesare-Per_un_gomitolo-1858","Donati Cesare","Per un gomitolo","1858","- Ma l'ami tu egualmente? Sei ben çerto che nell'avvenire, quando avrai preso l' uso al vivere da signore, ti manterrai sempre senza pentimento pel passo che fai ora? - Quello che sarà non so, nè voglio cercare.","NO"
"Donati_Cesare-Per_un_gomitolo-1858","Donati Cesare","Per un gomitolo","1858","Ora sono contento, arcicontento, e basta; tanto più che se anco volessi ritirarmi non sarei più in tempo, perchè domani tutto dev' esser compiuto. Dunque, Paolo mio, puoi risparmiare il fiato, perchè il momento non è troppo propizio per le tue profezie. DONATI.","NO"
"Donati_Cesare-Per_un_gomitolo-1858","Donati Cesare","Per un gomitolo","1858","18 Quand' è cosi, non se ne parli più. - Dimmi un po'; vorrei dirti due parole per conto mio: puoi ascoltarle? Ma sicuro; e intanto mi proverò questo vestito nero, che mi deve andare una pittura.","NO"
"Donati_Cesare-Per_un_gomitolo-1858","Donati Cesare","Per un gomitolo","1858","Paolo fece un segno d' impazienza, ma nonostante prosegui : Che pensi tu di Placida? Placida? È una donna che monta sulle furie per ogni piccola cosa, un po' ciarliera, ma poi in fondo è una buona donna; anzi se tu dovessi prendere una stanza a pigione ti consiglio a tornar da lei, perchè chiude gli occhi in qualunque occasione.","YES"
"Donati_Cesare-Per_un_gomitolo-1858","Donati Cesare","Per un gomitolo","1858","Ma io voglio dire se tu la credi una donna Non saprei. È un po' strettino questo vestito, non ti pare? dabbene.","NO"
"Donati_Cesare-Per_un_gomitolo-1858","Donati Cesare","Per un gomitolo","1858","Come! in tutto il tempo che tu abiti in casa sua, non hai potuto farti un' idea della sua moralità? Io non comprendo davvero dove tu voglia andare a parare.","NO"
"Donati_Cesare-Per_un_gomitolo-1858","Donati Cesare","Per un gomitolo","1858","Maledetto sarto, bisogna rimetterci le mani, non v'è rimedio. Scusa, Paolo, che dicevi? - Insomma, quali intenzioni credi che abbia Placida sopra sua nipote?","YES"
"Donati_Cesare-Per_un_gomitolo-1858","Donati Cesare","Per un gomitolo","1858","Ah! ora capisco. In principio quand'io venni qui in casa, mi sembro che Placida cercasse ogni mezzo perch' io m' innamorassi di Maria.","YES"
"Donati_Cesare-Per_un_gomitolo-1858","Donati Cesare","Per un gomitolo","1858","Ma tu sai bene che io non ne feci nulta, e ti dissi già perchè. Prima di tutto la mi piaceva poco, e poi io ho sempre avuto una certa superbia che mi consigliava a mettermi colla classe alta. - Si, si, ora non si tratta di codesto.","NO"
"Donati_Cesare-Per_un_gomitolo-1858","Donati Cesare","Per un gomitolo","1858","Ma se vuoi sapere qualche cosa, conviene cominciare ab ovo. Peccato che questo vestito non mi torni: è tagliato cosi bene! Dunque come ti diceva, io feci il casto, e Placida allora cambio tuono e diventò severa, tanto più in questi ultimi mesi, nei quali cominciò a bazzicar per casa un cert'ometto, il quale sembra abbia delle pretensioni, delle viste, non so di che genere.... - Ah, v'è qualcuno adunque?","YES"
"Donati_Cesare-Per_un_gomitolo-1858","Donati Cesare","Per un gomitolo","1858","- interruppe Paolo con premura. Si, un vecchiotto, il quale sotto un ammanto di santità credo sia il peggior arnese che si possa dare nel genere umano. Brutto poi, come Dio comanda; insomma, il signor Pasquale, quello che abita qui sopra.. - Ed è a questo rettile che Placida vuol sagrificare l' innocente creatura?","YES"
"Donati_Cesare-Per_un_gomitolo-1858","Donati Cesare","Per un gomitolo","1858","lo credo, a dirl' a te, che la vecchia pensi di farvi sopra una bottega. Ma la nipote non ne vuol saper nulla, a giudicare da certe scene, di cui, senza volerlo, fui testimone auricolare. Racconta, racconta.","YES"
"Donati_Cesare-Per_un_gomitolo-1858","Donati Cesare","Per un gomitolo","1858","Un giorno io mé ne stava tranquillamente nella mia stanza, quando a un tratto sentii Placida alzare la voce. Un tale avvenimento era troppo ordinario perch' io dovessi farmene caso, se non che le grida di Placida andavano questa volta congiunte ai pianti di Maria. Io giurerei quasi che la vecchia la battesse.","NO"
"Donati_Cesare-Per_un_gomitolo-1858","Donati Cesare","Per un gomitolo","1858","-INFAME! Mi alzai per accorrere in aiuto della fanciulla, ma quando fui fuori della mia camera, mi fer mai un momento, e ascoltai Placida che diceva.... Il racconto di Ernesto fu interrotto da un servitore in livrea, che affacciandosi all' uscio gli disse con quell'accento monotono proprio del servidorame: « La signora é giù che aspetta.","NO"
"Donati_Cesare-Per_un_gomitolo-1858","Donati Cesare","Per un gomitolo","1858",">> A tali parole Ernesto prese in fretta il cappello e la mazza, e senza tampoco salutare Paolo s' avvió per uscire. Ma Paolo, cui premeva sapere che cosa aveva detto Placida, lo prese pel lembo del soprabito, e: Ebbene, che cosa diceva? - Perdona, mio caro, ma in questo momento non posso più trattenermi.","NO"
"Donati_Cesare-Per_un_gomitolo-1858","Donati Cesare","Per un gomitolo","1858","Ma pure.... - Eh, via ! - soggiunse Ernesto impazientito tirando a sè il vestito - ti fa torto esser tanto curioso dei pettegolezzi di donnicciole. A miglior occasione ti dirò tutto, non dubitare, a miglior occasione.","NO"
"Donati_Cesare-Per_un_gomitolo-1858","Donati Cesare","Per un gomitolo","1858","In cosi dire usci dalla camera, si avviò verso le scale, lasciando Paolo solo, che imprecava contro il povero servitore venuto in mal punto ad interrompere la conversazione. I pifferi di montagna. È proprio degli uomini, se da basso stato salgono in gran fortuna per qualche improvviso avvenimento, levarsi in superbia, e, quasi per farsi credere nati e cresciuti in mezzo all' opulenza e alle grandezze, sdegnare tutto ciò che può rammentare la loro origine.","YES"
"Donati_Cesare-Per_un_gomitolo-1858","Donati Cesare","Per un gomitolo","1858","Un esempio ne abbiamo avuto testè nel modo poco cortese col quale Ernesto accolse Paolo, che poteva dirsi, l' unico vero amico che avesse. Questi dal canto suo per quanto fosse abbastanza addentro nelle cose del mondo, non potè non restare dolente e meravigliato di un cambiamento cosi istantaneo in colui che l'aveva fin dall'infanzia fatto depositario di ogni suo segreto. Nonostante poichè la vera amicizia è indulgente, egli tentò, rimasto solo nella stanza, di farsi forza per obliare ciò che egli chiamava leggerezza dell' amico: e dacchè gli era avvenuto altre volte di trattenersi in casa benchè Ernesto non vi fosse, cosi si pose a sedere sur una poltrona, e prese a sfogliare per isvago un libro ornato di figure che per caso gli venne fra mano.","YES"
"Donati_Cesare-Per_un_gomitolo-1858","Donati Cesare","Per un gomitolo","1858","Ma tale occupazione essendo piú macchinale che altro, i suoi pensieri si fermarono ancora sull' ingrato soggetto, pòi sorvolando di cosa in cosa, come suol avvenire, si rivolsero a Maria e alla storiella interrotta nel meglio. Mentre egli stava rimuginando pel capo i mezzi da porsi in opera perchè la fanciulla potesse più agevolmente rivelargli ta causa vera della propria sofferenza, l'uscio si apri pianamente e Maria comparve. A quella vista il cuore di Paolo palpitò di gioia, e mosse verso di essa, che tutta conturbata nell' aspetto e vergognosa, gli fe' cenno colla mano di non far romore, aggiungendo a voce tremula e bassa: - Zitto, perch' egli è là.","NO"
"Donati_Cesare-Per_un_gomitolo-1858","Donati Cesare","Per un gomitolo","1858","Chi? Il signor Pasquale. - Ebbene, che monta?","NO"
"Donati_Cesare-Per_un_gomitolo-1858","Donati Cesare","Per un gomitolo","1858","Si è chiuso in camera con la zia. Certamente parlano di me. Di voi?","YES"
"Donati_Cesare-Per_un_gomitolo-1858","Donati Cesare","Per un gomitolo","1858","E perchè? a Ora le dirò tutto, signor Paolo: è questo il segreto che ho promesso di palesarle. Sono stata attenta per vedere quando usciva il signor Ernesto, e ho detto fra me: Se egli rimane, può darsi che trovi un momento per aprirgli l'animo mio.","NO"
"Donati_Cesare-Per_un_gomitolo-1858","Donati Cesare","Per un gomitolo","1858","Infatti l'ando cosi. Ma bisogna spicciarsi, perchè la zia non s'avvegga di nulla. Dite, dite pure, Maria; e qualunque sieno i vostri dolori, siate certa che io faro ogni sforzo per alleviarli.","YES"
"Donati_Cesare-Per_un_gomitolo-1858","Donati Cesare","Per un gomitolo","1858","Il Signore la rimeriti per tutto il bene che mi fanno le sue parole. Ella sa che il povero babho morendo mi lasciò sola al mondo, mentr' io era ancora bambina, in mano della zia Placida. Oh quanta differenza dal bene di babbo e mamma, ai mali trattamenti della zia.","YES"
"Donati_Cesare-Per_un_gomitolo-1858","Donati Cesare","Per un gomitolo","1858","Nonostante io li sopportai sempre * con pazienza e non le persi mai il rispetto. Una volta essa fu malata gravemente, tanto che il medico l'aveva bell'e spedita, ed io a piangere, a disperarmi, a passar le notti accanto al suo letto, perchè la non mancasse di nulla, finchè fu guarita. - Buona creatura !","NO"
"Donati_Cesare-Per_un_gomitolo-1858","Donati Cesare","Per un gomitolo","1858","Quand' io divenni grandicella, mia zia cambio ad un tratto maniere con me, senza che io ne intendessi il motivo. Incominció a mostrarsi affabile, amorevole; mi rivesti di nuovo due o tre volte da capo a piedi, e andava sempre ripetendomi che io doveva essere l'appoggio della sua vecchiaia. In quel tempo venne in casa nostra il sor Ernesto, e la zia voleva a forza che io andassi nella sua camera a tenergli compagnia, la diceva, sebbene esso non ne avesse mai mostrato desiderio.","NO"
"Donati_Cesare-Per_un_gomitolo-1858","Donati Cesare","Per un gomitolo","1858","Io aveva paura a trovarmi sola con un uomo e poi mi pareva che non istesse bene; non è egli vero? Certamente, quando non sia per un buon fine, come sarebbe, per esempio, di noi due ora. Sicuro; e poi con lei è differente.","NO"
"Donati_Cesare-Per_un_gomitolo-1858","Donati Cesare","Per un gomitolo","1858","Perchè? Perchè.... lo so io il perchè, ma non voglio dirlo. Via, Marietta, ditelo a me.","NO"
"Donati_Cesare-Per_un_gomitolo-1858","Donati Cesare","Per un gomitolo","1858","No, no, tanto gli è inutile: gliene dirò poi.... intanto tiro innanzi. Quando la zia vide che io non voleva darle retta a proposito del sor Ernesto, ridiventò cattiva e tornò á malmenarmi senza carità, e un giorno che la mi picchiava col manico della scopa e che io gridava come un' anima dannata, il sor Pasquale che abita al piano di sopra, accorse allo strepito. Entrato in casa, comincio colla su' voce melliflua a placare la zia, e a me fece un mondo di carezze, promettendomi che se fossi stata savia, com' egli diceva, e' m'avrebbe fatto di molto bene.","YES"
"Donati_Cesare-Per_un_gomitolo-1858","Donati Cesare","Per un gomitolo","1858","A dir il vero la fisonomia del sor Pasquale mi era sempre stata antipatica, e tutte le volte che ei scendeva da noi, io mi rincantucciavo per non vederlo; ma in quel momento che parlava con tanta bontà dopo avermi salvato dalla rabbia di mia zia, mi pareva un altro. M' affidai a lui ciecamente, e considerandolo come mio secondo padre, gli raccontai tutte le pretese di mia zia, ed egli disapprovando la condotta di lei mi disse che gliene avrebbe tenuto parola. D'allora in poi egli venne tutti i giorni a farci una visita, e molte volte per un pretesto o per un altro, si tratteneva a lungo in camera con la zia, la quale era per lui, contro il suo solito, piena di premure.","NO"
"Donati_Cesare-Per_un_gomitolo-1858","Donati Cesare","Per un gomitolo","1858","Passato un certo tempo, mi accorsi che tutte le volte che e' veniva in casa nostra, la zia o se ne andava in un'altra stanza, od usciva a dirittura di casa per lasciarci soli. Allora il signor Pasquale si faceva tutto cerimonioso con me, e mi teneva certi discorsi, e faceva cert' atti che non si convenivano alla sua età, e che mi facevano diventar rossa fino al bianco degli occhi.... Allora per togliermi questo nuovo tormento di dosso, non seppi far di meglio che avvertirne mia zia, la quale invece di darmi ragione mi rimproverò aspramente pei miei scrupoli da scimunita, e mi ammoni che mi guardassi bene dal disgustare il signor Pasquale, perchè era uomo che aveva molti denari e che avrebbe potuto fare la mia fortuna.","YES"
"Donati_Cesare-Per_un_gomitolo-1858","Donati Cesare","Per un gomitolo","1858","Io non seppi dapprima che cosa voléssero dire quelle parole di mia zia, ma poco dopo le proposte che mi fece chiaramente il signor Pasquale mi aprirono gli occhi: i' gli risposi come doveva, e poichè mia zia non era li per impedirmelo, lo misi bravamente fuori dell'uscio. Quando la zia torno, io non osai dirle nulla dell' accaduto, perchè veramente allorchè va sulle furie la mi fa paura, ma il signor Pasquale che non si sapeva dar pace venne giù e mi conció pel di delle feste. E che fece allora vostra zia ?","NO"
"Donati_Cesare-Per_un_gomitolo-1858","Donati Cesare","Per un gomitolo","1858","La se lo può immaginare! Me ne disse, me ne disse.... e non mi lasciò più ben avere; e anche or ora prima che la venisse qui, mi ha maltrattato in modo, che se durava ancora un poco, non so davvero come la sarebb' ita a finire. - E ora che pensate di fare, mia cara Maria?","NO"
"Donati_Cesare-Per_un_gomitolo-1858","Donati Cesare","Per un gomitolo","1858","- Non saprei. Paolo, sebbene lasciasse terminare il racconto senza far motto, pure aveva dato segno più volte di essere profondamente commosso e indignato. A lui, più esperto delle male arti del mondo, si presentavano chiare e lampanti le perfidie di Placida *e le sozze brame di Pasquale.","YES"
"Donati_Cesare-Per_un_gomitolo-1858","Donati Cesare","Per un gomitolo","1858","Gli pareva già che quell' innocente fanciulla, per la quale egli sentiva un affetto verace e puro, stesse per cadere nel laccio che le veniva teso con tanta insistenza e in tante guise, per la qual cosa allorchè essa ebbe finito di parlare, mille idee gli si affollarono alla mente, mille affetti gli facevano tumulto nel cuore. Ei misurava la stanza a passo concitato, e discorreva nella mente il più acconcio mezzo per togliere dal pericolo l'amata donzella. Di tratto si arresta dinanzi a Maria, le prende con tremito convulso una mano fra le sue, e le dice con tenerissima.","NO"
"Donati_Cesare-Per_un_gomitolo-1858","Donati Cesare","Per un gomitolo","1858","voce: Maria, mi amate voi? A tale inaspettata interrogazione, che era peraltro, quasi direi, la conseguenza dei pensieri che agitavano Paolo in quel momento, Maria alzò le sue nere pupille verso di lui, nell'atto più tenero che mai și possa, e non rispose verbo, perchè la piena dell' affetto le faceva impedimento. Il cuore che ama indovina spesse fiate, e a Paolo basto quello sguardo a fargli comprendere che era riamato, e non da quel momento soltanto; per lo che stretta al seno la fanciulla che sembrava rapita in lui, le disse : - Coraggio, Maria, noi saremo felici.","NO"
"Donati_Cesare-Per_un_gomitolo-1858","Donati Cesare","Per un gomitolo","1858","A questo punto si apri l'uscio con fracasso, e comparve Placida seguíta da Pasquale. Sul volto di questa donna era dipinto l'odio verso la nipote, e una gioia crudele per averla colta, a suo avviso, in fallo. F Ecco- esclamò - rivolgendosi a Pasquale, ecco la ragazza virtuosa per la quale la spende la su' protezione.","NO"
"Donati_Cesare-Per_un_gomitolo-1858","Donati Cesare","Per un gomitolo","1858","A raccontarlo non si crederebbe. Sola in camera con un giovinotto! E poi la fa la smorfiosa, la innocentina per gabbare il mondo.","YES"
"Donati_Cesare-Per_un_gomitolo-1858","Donati Cesare","Per un gomitolo","1858","Maą i gonzi si gabbano, io no. L'ha a sapere tutto il vicinato della bella condotta che tieni in compenso dei continui sagrifizi che faccio per te, e non so chi mi tenga.... In cosi dire si fe' innanzi colla mano alzata verso Maria, la quale mezzo tramortita dallo spavento, si era avvicinata più che mai a Paolo. Ma questi s' interpose a tempo, e afferrato il braccio alla vecchia: - Guardatevi - le grido - di torcerle un capello, perchè guai a voi!","NO"
"Donati_Cesare-Per_un_gomitolo-1858","Donati Cesare","Per un gomitolo","1858","Placida fu alcun poco sconcertata dall'atto e dalle parole del giovane, ma ripreso ben tosto animo esclamò: O ella come c'entra a far da padrone? La mi ringrazi piuttosto se in premio del suo bel procedere io non lo cacci di casa mia. Maria è mia nipote, ed io posso farne quel che mi pare e mi piace.","NO"
"Donati_Cesare-Per_un_gomitolo-1858","Donati Cesare","Per un gomitolo","1858","So quel che ne volete fare; conosco gli infami vostri disegni, e crediate che soltanto perl' amore che le porto, io non corro difilato ai tribunali ove non sareste sola a render conto dell' opere vostre. Queste ultime parole scossero Pasquale, il quale aveva simulato fin qui un santo orrore per quello che aveva dinanzi agli occhi, e vedendo la mala parata, cercava di svignarsela. Ma Paolo gl' impedi l'uscita, e aggiunse: - No, signore, ella non deve partire, se prima non conosce le mie intenzioni verso Maria, poiché ci ha trovati soli in questa camera; tanto più che le serviranno di regola per l'avvenire....","NO"
"Donati_Cesare-Per_un_gomitolo-1858","Donati Cesare","Per un gomitolo","1858","Maria sarà mia moglie ! e! 4 Queste parole pronunziate con quella forza che solo può derivare da una coscienza pura e da un fermo proposito, avrebbero imposto riverenza e gratitudine a un animo non chiuso affatto a ogni sentimento di bene; ma Placida che, come abbiamo veduto, aveva fatto i suoi conti sulla nipote, non fece mostra di accomodarsi alla generosa proposta di Paolo.","NO"
"Donati_Cesare-Per_un_gomitolo-1858","Donati Cesare","Per un gomitolo","1858","Peraltro nel momento cotale risoluzione di lui le giunse siffattamente improvvisa, da farle morire in gola le parole e attutire alquanto, almeno per quanto appariva al di fuori, la rabbia che la divorava. Di guisa che cambiato tuono in un subito, e preso un certo fare contrito che le stava bene come una corona di rose in capo ad una bertuccia, replicò : Sa Dio se io volessi il bene di questa figliuola, ma i giovinotti d' oggigiorno son lesti a promettere, e poi quando si tratta di mantenere,... qui mi casca l'asino. secco.","NO"
"Donati_Cesare-Per_un_gomitolo-1858","Donati Cesare","Per un gomitolo","1858","Per codesto ci penso io - ribattè Paolo secco - Sta tutto bene; ma anch' io.... - Come unica parente.... - soggiunse con voce melliflua il bravo sor Pasquale. Paolo fece conto che predicassero a' porri, come suol dirsi, e senza degnarli d' uno sguardo si volse a Maria che tutta paurosa del presente e temente per l'avvenire, se ne stava rincantucciata e piangendo a cald' occhi. La prese con affetto per mano e le sussurrò all'orecchio « Domani voi non sarete più in questa casa, ve lo giuro!","NO"
"Donati_Cesare-Per_un_gomitolo-1858","Donati Cesare","Per un gomitolo","1858","» Quindi lasciando gli altri insalutati se ne usci. Incertezze. A quanti di voi, o leggitori cortesi, è avvenuto nel corso della vita di éssere spinti per un lato a la sciarvi trasportare da sentimenti generosi, mentre dall' altro la mancanza di averi vi teneva le mani legate?","YES"
"Donati_Cesare-Per_un_gomitolo-1858","Donati Cesare","Per un gomitolo","1858","A molti certamente, poichè i più vorrebbero quando non possono, pronti poi a dimenticare di aver voluto allorquando toccano la potenza. Se cosi è, v'immaginerete di leggieri quel che brulicava nella mente di Paolo appena ebbe lasciato Maria. Al dabben giovane la scena di cui non ha guari era stato si può dire il protagonista, aveva fatto l'effetto di uno scatto di molla, che imprime il moto a un ingegnoso meccanismo.","YES"
"Donati_Cesare-Per_un_gomitolo-1858","Donati Cesare","Per un gomitolo","1858","Il suo amore per Maria, latente fino a quel punto, s' ingiganti come per incanto, coadiuvato potentemente dalla nobiltà dell' animo suo che rifuggiva da quanto v' ha di brutto e di sozzo in questa povera creta. Nato artista per natura, sebbene egli tentasse con ogni argomento di persuadere del contrario sè e gli altri, era condannato a fare dell' arte questione di pane, copiando i concetti altrui, anzichè improntare i propri col vigore del genio. Quindi era gran mercè se i magri guadagni che ritraeva da questo martirio giornaliero, gli bastavano per trar innanzi la vita propria, della madre e della sorella, nè di raro gli avveniva di trovarsi corto a numerario tanto, da dover tirar giù alla lesta una vergine di Raffaello o di Guido, e sagrificarla alla venalità di qualche trafficante in oggetti di belle arti, genía parassita che per lo più pretende guadagnare ottanta su cento.","NO"
"Donati_Cesare-Per_un_gomitolo-1858","Donati Cesare","Per un gomitolo","1858","In tale stato di cose è chiaro ch'egli per un lato non poteva nè voleva recedere d'un passo dall' impegno contratto, mentre d'altra parte non sapeva a qual partito s' appiglierebbe per trarsi d'impaccio. Mille pensieri diversi gli s' aggiravano per la mente, mille proponimenti si andavano succedendo l'uno all' altro, come le imagini a traverso d' un cristallo di lanterna magica, e tutti erano rigettati, quale perchè inattuabile, quale perchè insufficiente. Giammai Paolo aveva desiderato più che in quest'occasione di esser ricco, per lo che dando campo nel suo cervello d'amante alle più strane fantasie, si figurava già di essere una specie di Rotschild o di Nabab indiano, e nuotare nell'oro fino a mezza gamba.","YES"
