"filename","nome","titolo","anno","chunk","DIL"
"Donati_Cesare-Per_un_gomitolo-1858","Donati Cesare","Per un gomitolo","1858","PER UN GOMITOLO! ARTE E NATURA E DIRITTO E ROVESCIO TRE RACCONTI DI CESARE DONATI. FIRENZE.","NO"
"Donati_Cesare-Per_un_gomitolo-1858","Donati Cesare","Per un gomitolo","1858","Siccome io ti voglio un ben dell' anima, ho còlto a volo l' occasione per dartene segno, ponendo il tuo nome in fronte a questo mio libricciuolo. Il quale, benchè lontano le mille miglia dalle severe discipline intorno a cui affatichi con tanta lode il molto ingegno sortito da natura, non ti riuscirà discaro, spero, se lo terrai come testimonio di quell' amicizia che non verrà mai meno nel mio cuore. Ben è vero che avrei dovuto chiedertene avanti licenza, qual si suole fra coloro che stanno su convenevoli; ma, a dirla tal quale, fui indotto a far teco a confidenza, e dalla nota cortesia dell' animo tuo, e più dal considerare come a questo mondo si commettano tante male azioni senza domandarne al paziente la permissione, da render tollerabile l'arbitrio che mi prendo, il quale alla fin de conti lascia il tempo che trova.","NO"
"Donati_Cesare-Per_un_gomitolo-1858","Donati Cesare","Per un gomitolo","1858","Ad ogni modo se la non t' andasse a versi io non saprei proprio come riparare, chè quel che è fatto è fatto; tutt' al più ti posso permettere, se buon ti pare, di tenere la presente come una solenne dichiarazione che ti tolga di dosso ogni responsabilità personale. Addio. Firenze, Giugno 1858. tutto Tuo C.","NO"
"Donati_Cesare-Per_un_gomitolo-1858","Donati Cesare","Per un gomitolo","1858","DONATI. PER UN GOMITOLO! La caduta dei gravi.","NO"
"Donati_Cesare-Per_un_gomitolo-1858","Donati Cesare","Per un gomitolo","1858","Gli stranieri ci proverbiano col dolce far niente che si pianta li come una barriera insormontabile ad impedirci il moto, l'agitazione della vita. Ben lungi dall' impugnare l'esistenza di un tal difetto, sebbene non giunto al grado che i nostri amorevoli fratelli del vecchio continente vorrebbero dare a credere, son d' opinione peraltro che la maggior parte della colpa debba ricadere sul tepore del nostro sole, sull'azzurro del nostro cielo, sulle ridenti campagne, sulle pittoresche colline. - Io sfido il laborioso figlio d'Albione a vivere a Napoli, a Firenze, od a Nizza un paio d' anni senza provare un rilassamento nel sistema nervoso, notevole al segno da farlo passeggiare colle mani in tasca per ore ed ore, amoreggiando la grotta di Capri, o i colli « popolati di case e di oliveti >> che circondano, come d' una ghirlanda nuziale, la vaga regina d' Etruria.","NO"
"Donati_Cesare-Per_un_gomitolo-1858","Donati Cesare","Per un gomitolo","1858","Ora, se gli stranieri istessi modificano la propria natura per l'influsso del nostro clima, a forziori lo dovrem noi nati e cresciuti nel bel paese. Vedo bene che, a cui piacesse addentrarsi un po'più in là della scorza, non mancherebbero argomenti per dirmi contro, e fors' anco per provarmi con sodezza che l'arte e la ferma volontà posson trionfare della natura, che i nostri gloriosi antenati respiravano le stesse aure e facevano di gran belle cose, e che insomma la nostra inerzia procede da ben altre cagioni. E sia pure.","YES"
"Donati_Cesare-Per_un_gomitolo-1858","Donati Cesare","Per un gomitolo","1858","Ma a me importa solamente giustificare me stesso: per il che lasciando da banda tutte coteste ragioni buone e cattive, mi basta stabilire come nella comune inazione sia naturalissimo che anch' io porti a zonzo qualche volta il mio corpiciattolo, senza uno intento fisso nel cervello, oltre quello di passar il tempo. Ed era appunto in uno di questi giorni di svogliatezza che io, dopo aver gettato da un lato, piuttosto con mala grazia, l' indigesta mole del digesto che mi stava aperto dinanzi, dopo aver tentato inutilmente di leggere qualche ottava della divina Gerusalemme, dopo aver acceso un sigaro di virginia e averlo trovato cattivo, pensai, per disperato, di fare una passeggiata per la città, per vedere se quell' andare attorno mi giovasse a qualche cosa. Io dubito forte che tutta quell' uggia che m'era entrata in corpo fosse figlia legittima della penuria di moneta in cui allora io mi trovava, poichè mio padre sapendo di dover essere da un giorno all' altro in Firenze, aveva preferito portarmi da sė il solito assegno mensuale.","NO"
"Donati_Cesare-Per_un_gomitolo-1858","Donati Cesare","Per un gomitolo","1858","Checchè sia di ciò, è un fatto che il percorrere a mio bell' agio le vie popolose o deserte della metropoli, il poter vivere un quarto d'ora pensoso nè d'altrui nè di me stesso, mi fece il più gran bene. È cosi raro in questa bassa terra il potersi dimenticare! Seguitai dunque per un pezzo a questo modo, senza sapere dove sarei andato a cascare, finchè mi abbattei ad una bottega dov'erano esposti dei giocattoli da fanciulli.","NO"
"Donati_Cesare-Per_un_gomitolo-1858","Donati Cesare","Per un gomitolo","1858","I giocattoli da fanciulli, per dirlo fra parentesi, hanno sempre avuto il potere di ferire il mio spirito: io li ho sempre riguardati con una vivissima curiosità mista ad un'amorevole compassione, perocchè essi mi sembrano più che altra cosa al mondo, il simbolo di questo nostro umano consorzio, il quale non è altro alla fine che una quantità sterminata di balocchi in balía di pochi fanciulli! Ho detto ciò per ispiegare al lettore la ragione per la quale io mi fermassi a preferenza davanti a codesta bottega, non già per pretenderla a Geremia della travagliata umanità. Stava adunque passandoli in rassegna, tutto assorto nella mia indagine, quando, ad un tratto, sento qualche cosa cadermi perpendicolare sul cocuzzolo del cappello.","NO"
"Donati_Cesare-Per_un_gomitolo-1858","Donati Cesare","Per un gomitolo","1858","4 Alzo gli occhi alle finestre, percorro d'uno sguardo tutti i piani della casa innanzi a cui mi trovava nė mi riesce di scorgere alcuno; - li abbasso per terra, li giro intorno a me per iscoprire la natura del proietto di cui era stato regalato, e vedo a pochi passi di distanza un gomitolo di refe. Lo raccolsi con due dita, e trovandolo di bianchissimo e finissimo filo gentilmente rotondeggiante, mi parve d'inferirne che non potesse appartenere se non ad una ricamatrice, o per lo meno ad una cucitora di bianco di alta levatura. Dopo ciò, d' induzione in induzione me la figurai, in men che non si dice, bella, amabile e dispostissima a lasciarsi legare dietro al mio carro, come Cleopatra, se non si uccideva, avrebbe dovuto dietro a quello d' Augusto.","YES"
"Donati_Cesare-Per_un_gomitolo-1858","Donati Cesare","Per un gomitolo","1858","Io andava facendo tutte queste riflessioni, poco umanitarie ma molto umane, tenendo sempre fra le dita il misterioso gomitolo e contemplandolo con la curiosità d'un antiquario, quando un piccolo romore, che s' assomigliava un cotal poco ad uno scroscio di riso, mi fece alzare di nuovo il capo verso la casa dalla quale doveva essere uscito il gomitolo; ed infatti scorsi la testolina bionda di una fanciulla, che faceva capolino da una finestra del secondo piano, e probabilmente contemplava l'oggetto che io teneva fra le dita con sentimenti assai diversi dai miei. Fatto è che appena s'accorse che io l'aveva veduta, si ritirò tutta rossa come una bragia. Ma inutilmente, perchè io aveva già deliberato di conoscerla più davvicino, prendendo cagione dalla restituzione di ciò che doveva appartenerle, conciossiacchè si vedesse sempre sul davanzale della finestra un pezzo di tela bianca.","NO"
"Donati_Cesare-Per_un_gomitolo-1858","Donati Cesare","Per un gomitolo","1858","Infatti entrai nell'androne per la porticina aperta per metà, e montando gli scalini a tre, a quattro per volta, mi trovai in un baleno sul pianerottolo del secondo piano. Stetti qualche momento ritto dinanzi all'unico usciolino, perchè il cuore mi dava certe botte da non dirsi. Ripensandoci freddamente più tardi, mi avvidi che un simile effetto non poteva essere prodotto se non dalla fretta colla quale aveva montato le scale; ma allora l'immaginazione aveva preso il trotto serrato, e non c'era versi di frenarne il corso, tal che mi pareva fra la fanciulla e me esistere già una simpatica attrazione.","YES"
"Donati_Cesare-Per_un_gomitolo-1858","Donati Cesare","Per un gomitolo","1858","Quetato alquanto per quella breve sosta, e impiegato qualche secondo ad aggiustarmi il nodo della cravatta, a dare una piega più graziosa ai baffi ed ai capelli, afferrai risolutamente la funicella del 4 campanello, e suonai. - Fra il suonare e l'aprire l'uscio passò un istante, ma in quell'istante, io aveva composta la bocca al più grazioso sorriso, e scelta la mossa più favorevole a fare spiccare tutti i pregi fisici della mia persona. Io era certo del fatto mio e mi pareva, appena l'uscio avesse girato sui suoi cardini, di poter ripetere il famoso veni, vidi, vici del dittatore romano.","YES"
"Donati_Cesare-Per_un_gomitolo-1858","Donati Cesare","Per un gomitolo","1858","Ahimė! Quanto fallaci sono i propositi umani, o per dirla in volgare, quanto male si fanno i conti senza l'oste! - L'uscio si apri, girò sui suoi cardini, com' io aveva preveduto, ma invece della vaga biondina, che doveva farmi festa ed accogliermi ospitale sotto la protezione de' suoi penati, che credi, amico lettore, mi si offrisse alla vista?","YES"
"Donati_Cesare-Per_un_gomitolo-1858","Donati Cesare","Per un gomitolo","1858","Nė più nè meno d'un periodo di sessanta anni, personificato in una vecchia adiposa e di alta statura, che col suo corpo chiudeva ermeticamente l'adito anco al più piccolo spiraglio di luce. Per adoprare una similitudine nuova di zecca, dirò che l'ombra di Banquo non isconcertò tanto il convito di Macbeth, come questa inaspettata e sgradita apparizione i miei disegni di conquista. Il sorriso lusinghiero si converti tantosto in una di quelle contorsioni che si fanno dopo aver ingollato un medicamento disgustoso, la parola mi mori sulle labbra, e la mano che racchiudeva il prezioso gomitolo andò a cacciarsi in fondo alla tasca del mio soprabito.","NO"
"Donati_Cesare-Per_un_gomitolo-1858","Donati Cesare","Per un gomitolo","1858","Che desidera? - fu la domanda, del resto naturalissima, che mi fece la mia antipatica interlocutrice, con tale una voce che pareva uscisse da una campana fessa. La domanda peraltro era perentoria ed una risposta indispensabile, ma in quel momento era talmente confuso, che non seppi se non balbettare per due o tre volte « Voleva.... voleva....» precisamente come si racconta di quel pubblico magistrato che, andando a ricevere il suo principe, e dimenticatosi la magnifica orazione preparata un mese avanti, non seppe poi far altro che ripetere « Vengo.... vengo.... >>> e più non disse.","NO"
"Donati_Cesare-Per_un_gomitolo-1858","Donati Cesare","Per un gomitolo","1858","Ma insomma, che vuol'ella? Vedere la casa:- rispond' io, contento di aver trovato un' ancora di salute. Quale casa?","YES"
"Donati_Cesare-Per_un_gomitolo-1858","Donati Cesare","Per un gomitolo","1858","Questa. Le case s' appigionano il maggio e il novembre, ed ora siamo di luglio. E poi questo piano non s' appigiona perchè ho la scritta per tre anni, e pago il fitto puntualmente.","YES"
"Donati_Cesare-Per_un_gomitolo-1858","Donati Cesare","Per un gomitolo","1858","Ma.... - Ho capito: l'arebbe a cercare la luna nel pozzo. Arrivedella. In così dire mi chiuse l' uscio in faccia piuttosto con mal garbo, e mi pianto li su due piedi, arrabbiato più del magro ripiego, che della mala fortuna.","YES"
"Donati_Cesare-Per_un_gomitolo-1858","Donati Cesare","Per un gomitolo","1858","II. Rose e spine. Quando ad Isacco Newton cadde la pera sulla testa, pensò alla luna, e ne trasse la famosa teoria che tutti sanno, e si acquistò una rinomanza che vivrà col mondo.","NO"
"Donati_Cesare-Per_un_gomitolo-1858","Donati Cesare","Per un gomitolo","1858","A me pure piombo qualche cosa sul capo, ma il mio pensiero non si elevò oltre il secondo piano d' una casa, e buscai un rabbuffo da una brutta vecchia ed un' usciata sul viso. Questo prova che cagioni identiche posson produrre effetti differenti secondo gli uomini su cui agiscono: e buon per la scienza che Newton mi abbia preceduto, chè altrimenti aspetterebbe tuttora la face che quel sommo seppe far risplendere a di lei benefizio. - Dopo questo sunto pochissimo necessario del passato capitolo, torniamo a bomba.","NO"
"Donati_Cesare-Per_un_gomitolo-1858","Donati Cesare","Per un gomitolo","1858","Siccome non amo andar per le lunghe, e in questo credo trovarmi d' accordo col poco paziente lettore, rinunzierò alla eroicomica descrizione dello stato in cui rimasi sul pianerottolo del secondo piano, tanto più che ognuno è in libertà di figurarselo come più gli aggrada. Quello che forse non potrebbe immaginarsi si è, come la patita sconfitta, in luogo di farmi abbassare le armi, m' incaponisse più che mai nell' idea di vincere il mio punto; il che poi non ha nulla di strano, ove si consideri che l'uomo corre sempre dietro con maggior calore a quello che più gli vien contrastato, e che milioni d' individui che brulicano sopra la terra, debbono appunto la loro infelicità al malnato desiderio di possedere ció che non hanno. Passerò di volo sui primi conati del mio capriccio amoroso con quella che chiamerò per ora « la fanciulla del gomitolo, » perché, poco più poco meno, cotali faccende le si assomiglian tutte come gocciole d'acqua.","NO"
"Donati_Cesare-Per_un_gomitolo-1858","Donati Cesare","Per un gomitolo","1858","Infatti qual'è quel giovane, che abbia avuto almeno una volta nella vita il suo amoretto, che non sappia da quat parte rifarsi per dar nell' occhio ad una fanciulla? Anch' io dunque, sebbene di cervello alquanto balzano, andai per la via battuta. Feci la ronda sotto le finestre della mia bella, col capo rivolto all' insù come chi studia il tempo, non curando le gravi lesioni che arrecava al bavero del mio soprabito; consumai lastrico e stivali per parecchi giorni; lanciai sguardi di fuoco, appassionati, e n' ebbi in cambio prima occhiatine alla sfuggita, poi prolungate, poi decisamente tenere, che mi facevano provare certi brividi da non dirsi.","NO"
"Donati_Cesare-Per_un_gomitolo-1858","Donati Cesare","Per un gomitolo","1858","E fin qui la bisogna avrebbe proceduto more solito, se due cose non si fossero interposte a darle un carattere di singolarità, che in qualche modo si confaceva più col mio. In primo luogo l'andar io sempre munito, nelle mie escursioni erotiche, del famoso gomitolo che teneva in tasca colla gelosa cura con cui i nostri padri dell'età di mezzo custodivano il talismano scongiuratore delle malie e preservatore dalle ferite; poscia il non riuscirmi mai, per quanto m' adoprassi nel cangiar l'ora rio delle mie passeggiate, di veder la mia bella uscire all'aria aperta. Uno studente, pensava fra me, può starsene rinchiuso in casa per debiti: un letterato (in Italia!)","YES"
"Donati_Cesare-Per_un_gomitolo-1858","Donati Cesare","Per un gomitolo","1858","per aver le scarpe sfondate; una donna oltre i quarant' anni per non mostrare al pubblico i guasti del tempo: ma che ciò avvenisse ad una bella fanciulla, nell' aprile della vita, con una madre accompagnatrice obbligata, in una città come Firenze in cui le abitazioni paion edificate solamente per uso notturno, la mi pareva una cosa insolita anzi che no, e sconfortante nel tempo stesso, perchè non mi sarei sentito davvero di montare per la seconda volta quelle scale. Queste considerazioni che io andava facendo meco stesso di tanto in tanto m'imbarazzavan non poco, e mi mettévan addosso un certo malumore indefinito, perchè mi vedeva troppo lontano dal raggiungere la meta de' miei desiderii. Un tal giorno che io m' era aggirato invano per gli audirivieni che mettevano alla casa della mia tiranna, mi rivolsi per suggir mattana verso il giardin di Boboli.","YES"
"Donati_Cesare-Per_un_gomitolo-1858","Donati Cesare","Per un gomitolo","1858","Era di di festa e in sul tramonto. Il cielo, del più bell' azzurro che fosse mai, non era ingombro dalla più leggera nuvoletta. Una fresca brezzolina scherzava fra le frondi delle vecchie piante ricurve a mo' di padiglioni sui lunghi viali, che parrebber fatti apposta pei furtivi amori, se il concorso dei passanti di tutte le età e di tutti i sessi non facesse temere di veder sbucare nel più bello d'un colloquio, dal lato donde meno s' aspetta, il viso importuno d'un curioso.","NO"
"Donati_Cesare-Per_un_gomitolo-1858","Donati Cesare","Per un gomitolo","1858","Cionondimeno la passeggiata è deliziosa, ed io poi la preferisco ad ogni altra, perchè cammino poco e mi stanco assai. Quel giorno peraltro io non era in istato di far giusta ragione di tutti i pregi che la natura e l'arte accumularono su quel breve spazio di terreno, e pareva mi mancasse qualche cosa per essere contento. Altre volte avrei fatto le carezze ad un brutto bamboccio che mi fosse venuto fra' piedi, per avere un pretesto di dire una parola gentile alla bella servotta, dalla guancia rubiconda e dal tumido seno, alla quale era affidato: oppure avrei prescelto fra cento vuote, la panca di pietra occupata da una graziosa donnina.","NO"
"Donati_Cesare-Per_un_gomitolo-1858","Donati Cesare","Per un gomitolo","1858","Ma quel giorno, tanto è vero che il cuore non fa presentire nulla di quello che deve accadere, io era quasi malcontento di essermi inol DONATI. 2 trato in quel laberinto, e andava errando, tutto dinoccolato, in su e in giù, quando alla svoltata d'un viale mi trovo faccia a faccia, indovinate con chi?... colla legittima proprietaria del gomitolo.","YES"
"Donati_Cesare-Per_un_gomitolo-1858","Donati Cesare","Per un gomitolo","1858","- A quella vista i miei pensieri presero un dirizzone tutto opposto a quello di pria. L'uggia si cangió come per incanto nella gioia più sfrenata, tanto che se la madre non fosse stata al fianco della mia diva, io le sarei caduto ai piedi.... e le avrei offerto il suo gomitolo, candido, intatto, come lo raccolsi sul lastrico della via. Ma la madre era li, a latere, con una fisonomia arcigna come la più brutta delle tre parche dipinte dal Buonarroti, e non feci nulla oltre al ricambiare colla giovanetta uno sguardo che riepilogava in sè stesso tutto il canzoniere di messer Francesco.","YES"
"Donati_Cesare-Per_un_gomitolo-1858","Donati Cesare","Per un gomitolo","1858","La vecchia pare non mi conoscesse, perché non si fece nè in qua nè in là, e mi diede agio cosi di pedinarle a una giusta distanza. Era questa la prima volta che m'avveniva di vedere la fanciulla, dal nastro del cappellino di paglia che le incorniciava graziosamente il viso, alla punta dello stivaletto di raso turco che calzava il piede meglio formato ch'io m' abbia visto giammai, per il che non volli lasciarmi sfuggire un'occasione tanto favorevole per fare un esame accurato de' suoi pregi fisici, che trovai superare ogni immaginazione avessi potuto farne. Ora seguitandola, ora precedendola, e alcuna volta fermandomi col pretesto di osservare una statua, un sasso, un cespuglio, per lasciarla passare, l'accompagnai fino alla sua dimora, ove mi attendeva l'ultima occhiata di congedo.","NO"
"Donati_Cesare-Per_un_gomitolo-1858","Donati Cesare","Per un gomitolo","1858","Oh! amaro disinganno! Proprio sulla porta di casa, ritto come un palo, se ne stava un giovane mingherlino, con due baffettini neri appuntati, il quale sotto l'assisa del lion lasciava trasparire lontano un miglio l'arte sartòria a cui doveva essere addetto.","YES"
"Donati_Cesare-Per_un_gomitolo-1858","Donati Cesare","Per un gomitolo","1858","Io che aveva affrettato il passo per vedere entrare le due donne, giunsi in tempo per ascoltare colle mie proprie orecchie il seguente dialoghetto, che ebbe luogo fra la fanciulla e il giovinotto, mentre la madre faceva girare la chiave nella toppa: È un pezzo che aspetti, Carlino? Più di mezz' ora. - Abbiamo fatto tardi in Boboli, ed io mi struggeva di ritornare a casa perchè m' immaginava che tu saresti stato qui prima di noi.","NO"
"Donati_Cesare-Per_un_gomitolo-1858","Donati Cesare","Per un gomitolo","1858","E in cosi dire la coppia felice entrò, e l'uscio si richiuse dietro la vecchia. - Restai per alcun tempo talmente scombussolato da questa terribile scoperta, che non seppi fare altro che appoggiarmi al muro, vomitando mentalmente mille improperii, prima contro di me, e poi alla perfida che cogli sguardi procaci mi aveva accalappiato, per farmi assistere a quella bella scena. Poi risalendo alla cagion prima ed unica de' miei mali, estrassi rabbiosamente il gomitolo dalla tasca, e stava per gettarlo per sempre lungi da me, quando pensando al filo d' Arianna che aiutò Teseo a svignarsela dal laberinto, lo rimisi al suo posto.... ed entrai al caffè Wital per bevere un punch.","NO"
"Donati_Cesare-Per_un_gomitolo-1858","Donati Cesare","Per un gomitolo","1858","20 III. La pena di Tantalo. Credo vi sarete accorti, come, in fatto d'amore, io non sia un Werther, nè un Iacopo Ortis, talchė non avrete fatte le meraviglie se dopo l'acquistata certezza oculare e auricolare dell' esistenza di un terzo che usucapiva l'oggetto ch'io avrei bramato possedere, io abbia tentato d' affogare la mia rabbia in un beveraggio composto d'acquavite di Francia e di acqua calda, abusivamente chiamato punch.","NO"
"Donati_Cesare-Per_un_gomitolo-1858","Donati Cesare","Per un gomitolo","1858","Però non vi deste a credere che io la prendessi, come suol dirsi, in santa pace, chè la sbagliereste di gran lunga. Troppo era stato crudele il disinganno e troppo impreveduto, per non lasciarmi nel cuore un rammarico che io mal poteva dissimulare a me stesso.Sebbene la mia passione amorosa non fosse che a' suoi inizii e quindi poco intensa, nonostante tra perché la fanciulla mi piaceva forte, tra perchè pareami d'essere stato mandato a spasso come un collegiale, non potei far meno di provare un vero dolore, senza darmi gran pensiero di ciò che il filosofo Epitteto lasciò scritto, che, cioè, gli uomini sono agitati e turbati non dalle cose, ma dalle opinioni che eglino hanno delle cose. - I filosofi son pur la gente curiosa!","YES"
"Donati_Cesare-Per_un_gomitolo-1858","Donati Cesare","Per un gomitolo","1858","Io vorrei chiedere a messer Epitteto, se un povero diavolo affamato come un lupo, e senza un soldo in tasca per procurarsi un po' di pane, sia tormentato dalla cosa ovvero dall'opinione che egli ne ha? Ma lasciando pure che l'uomo affamato si giovi, se buon gli pare, delle massime del filosofo stoico, io so che non poteva in alcun modo acquetarmi al mio mal destino. Per tutta la notte non feci che rivolgermi per il capo le idee più disparate.","YES"
"Donati_Cesare-Per_un_gomitolo-1858","Donati Cesare","Per un gomitolo","1858","Ora mi pareva impossibile che una fanciulla, si giovane e riservata, potesse essere talmente innanzi nell' arte del mal costume da amoreggiare un giovinotto e trattarlo con tanta intimità, nello stesso tempo che teneva a bada un altro con moine e svenevolezze per ogni maniera diverse. Poi rifacendomi da capo e scendendo giú giù sino alla fine, concludeva col restare in forse se veramente ella m' avesse dimostrato predilezione, o se invece il castello incantato ch'io aveva formato per mio uso non fosse che il prodotto della troppo fervida fantasia od anche di troppa stima di me stesso. In mezzo a tutto questo almanaccare ch'io faceva, le pupille mi si aggravarono, ed io sperai col sonno, che è l'oblio de' mali, di obliare eziandio la mia seconda disfatta.","YES"
"Donati_Cesare-Per_un_gomitolo-1858","Donati Cesare","Per un gomitolo","1858","Ma, no signori! Anco questo tenue beneficio mi fu negato, perchè l'animo non bene tranquillo doveva essere funestato da un sogno. E'mi pareva di essere sotto le sue finestre, cantandole la più patetica delle romanze, come un menestrello di Provenza, nella quale io metteva quanto maggior foco mi avessi in corpo.","YES"
"Donati_Cesare-Per_un_gomitolo-1858","Donati Cesare","Per un gomitolo","1858","Ella era li, e pareva si compiacesse della canzone d'amore, e mi sorrideva lusinghiera, e mi guardava con cert' occhi che mi facevano andare in brodo di giuggiole, quando nel piú bello del canto le uscivano da sotto le ascelle due manacce nere, le quali ripiegando poscia gravemente il medio e l'anulare, restavano li dure stecchite, e mi facevano morire la parola sul labbro e chinare lo sguardo per la vergogna. Poi, quando osai di rialzare il capo, che mi pareva pesasse come fosse stato di piombo, la fanciulla era sparita, ed in suo luogo vedeva la vecchia e il felice rivale, che mi guardavano sghignazzando, in un modo cosi indecente, che io, perduto il lume degli occhi, stava per avventarmi contr'essi per punirli dell' aggiungere lo scherno all' offesa. E Dio sa quel che fosse avvenuto, se in quel frattempo io non mi svegliava.","NO"
"Donati_Cesare-Per_un_gomitolo-1858","Donati Cesare","Per un gomitolo","1858","Il sole era già alto, e penetrava co' suoi raggi nella mia cameretta. Mi levai, mi vestii, e ricordandomi di una rivendugliola di frutte e d' erbaggi che teneva bottega proprio di faccia alla casa della fanciulla, pensai di rivolgermi ad essa per prender lingua, ed accertarmi viemeglio del come andasse la cosa. Tanto mi doleva il lasciare in tronco la mia avventura!","YES"
