"filename","nome","titolo","anno","chunk","DIL"
"Guerrazzi_Francesco_Domenico-Pasquale_Paoli-1860","Guerrazzi Francesco Domenico","Pasquale Paoli","1860","Giampaolo rimase ucciso a Furiani, Niccoletto mori al convento di Bozio quando accorse a cavarvi dalle brande del Matra; l'ultimo sono io. Quando babbo mi ha comandato di scrivermi nella compagnia dei volontari ho fatto a dire: pare che la disdetta voglia che i Savelli non abbiano a uscire vivi di battaglia: chiedo perdono, non deve dirsi disdetta, e veramente chi muore per la patria vive alla gloria, e nello amore dei suoi; però meno che sotto questo aspetto, dovete convenire, signor generale, per tutti gli altri o che l'uomo spiri nel campo o nel letto quando è morto è morto. Ora ho fatto a dire, se questo caso mi accade, ecco, lascio qui i miei poveri vecchi soli, abbandonati negli ultimi giorni della loro vita; chi li consolerà?","YES"
"Guerrazzi_Francesco_Domenico-Pasquale_Paoli-1860","Guerrazzi Francesco Domenico","Pasquale Paoli","1860","chi ne piglierà cura? Chi porgerà loro un bicchiere di 1 acqua se cascano infermi ? Però ho fatto udire: io sono promesso a Chilina di Marco Aurelio Brandone, e ci dobbiamo sposare a Pentecoste; dunque sarebbe meglio, che prima me la sposassi, ed una volta che la sapessi incinta, e per parte mia, signor generale, vi prometto che farei presto, venire senza un pensiero al mondo a menare le mani, perchè se campo, tanto di guadagnato; se casco, tagliato il ceppo rimane il pollone, e Chilina resta in casa in luogo di figliuola ai miei poveri vecchi.","YES"
"Guerrazzi_Francesco_Domenico-Pasquale_Paoli-1860","Guerrazzi Francesco Domenico","Pasquale Paoli","1860","- Ora, per Dio santo, domando un po' a voi, se qui ci trovate motivo di saltare su i mazzi, e di tombare un povero figliuolo come un cane? Il vecchio Quirico che a mano a mano il figliuolo ragionava si faceva sereno, alle ultime parole, mentre s'incamminò a depositare lo schioppo in un canto, disse: Come è cosi, la faccenda muta di aspetto: ma no signore; nè anco cosi va bene, perchè vedi, figliuolo mio, tutti i giorni capita morire di punta, di catarro, insomma di uno di quei tanti malanni, che il diavolo ci manda, ma la occasione di morire con una brava palla in testa per la libertà della patria capita di rado, e mentre t'indugi per le nozze, potrebbe scappare; sicchè Vito, fa a modo di tuo padre, non perdere tempo a rassegnarti. - Ecco si potrebbe, soggiunse il Paoli, pigliare due colombi ad una fava; invece di celebrare le nozze per la Pentecoste, o chi para di farle domani?","NO"
"Guerrazzi_Francesco_Domenico-Pasquale_Paoli-1860","Guerrazzi Francesco Domenico","Pasquale Paoli","1860","Vito ha promesso (e così dicendo il Paoli batteva sorridendo la mano su la spalla al giovinotto), che non si farebbe aspettare ad accertarvi la successione, e lo credo; sicchè tra un mese io mi figuro, che potrebbe essere lesto: ora per male che vada, prima del giugno non ci avrebbero ad essere batoste. Gua' per un accomodo ci sto; perchè non è una galanteria ammazzare un figliuolo, ed anco il patriarca Abramo non ci si adattava mica di buona voglia, sebbene glielo avesse ordinato un Angiolo; immaginate, se io, che non aveva ricevuto ordine da persona; però vatti veggendo se Marco Aurelio se ne accontenta, il quale fuma più di un camino, e gli parrebbe rimanere vituperato se i mudracchieri non andassero a prendergli la sposa a casa, e non facessero la travata, con tutti gli altri fastidii di usanza. - Ciò non tenga; ditegli che accompagnerò io stesso la sposa alla parrocchia; e parmi se ne dovrebbe contentare.","NO"
"Guerrazzi_Francesco_Domenico-Pasquale_Paoli-1860","Guerrazzi Francesco Domenico","Pasquale Paoli","1860","Ma ci credo! È onore troppo grande per lui, ed anco per me. - Dunque addio, a domani.","NO"
"Guerrazzi_Francesco_Domenico-Pasquale_Paoli-1860","Guerrazzi Francesco Domenico","Pasquale Paoli","1860","La benedizione di Dio sia su di voi, signor generale, gli augurò la povera madre, che piangeva e rideva. Amen, buona donna, e su voi ancora; e tutta la comitiva rimontò in sella. Il generale entrando in palazzo rinvenne l'anticamera ingombra di gente più che non soleva, ci vibrò sopra uno sguardo, e gli parve vedere facce nuove, ma studioso di praticare verso il cavaliere francese ogni termine di convenienza, non si trattenne a indagare.","NO"
"Guerrazzi_Francesco_Domenico-Pasquale_Paoli-1860","Guerrazzi Francesco Domenico","Pasquale Paoli","1860","Licenziato su la soglia la compagnia entrò nel gabibinetto coll' oratore ed un frate. Il signor Giacomo, il quale comecchè si fosse riconciliato in [parte co'frati dopo l'incontro del padre Casacconi, pure si sgomentava a trovarsegli sempre fra i piedi, domandò ad Altobello: - e chi è quel frate che si chiude in conclave col generale è coll'ambasciatore francese? - Costui si chiama Buonfigliolo Guelfucci; appartiene all'ordine dei servi di Maria, o vogliamo dire ser vita; lo dicono uomo di molta dottrina, e di prudenza grande; detta con molta eleganza di lingua, sicchè in Toscana lo chiamarono a parte dell'Accademia della Crusca, custode, come saprete, della purezza del par.","NO"
"Guerrazzi_Francesco_Domenico-Pasquale_Paoli-1860","Guerrazzi Francesco Domenico","Pasquale Paoli","1860","lar Toscano; il signor generale se lo tiene da molti anni per segretario, ed ha da lodarsene; ma ecco che esce dal gabinetto. Di vero fra Guelfuccio comparso nella sala fece intendere con urbanissime parole rincrescere al generale non potere sul subito accogliere le persone ivi presenti; confortarle a non aspettare; tornassero dopo la calata del sole, che avrebbe provveduto in modo da trovarsi libero. Taluni si partirono dicendo si sarebbero fatti rivedere il giorno appresso ; altri risolverono aspettare; solo una donna di bello aspetto e giovane ancora non si tenne contenta, ed incominciò a strillare: Ho furia io, mi sono partita innanzi giorno da Castirla, e non posso ritornare; si veramente è la via dell'Orto da Castirla a Corte; e poi ho furia io; bisogna che parli subito al generale, e gli voglio parlare.","YES"
"Guerrazzi_Francesco_Domenico-Pasquale_Paoli-1860","Guerrazzi Francesco Domenico","Pasquale Paoli","1860","Ma capite bene, buona donna, la veniva ammonendo il servita, che il generale adesso sta in faccende per lo Stato. E se il generale fa le sue faccende, io non posso mandare a male le mie; ho furia vi dico, ho furia, bisogna che inforni il pane, dia da mangiare ai maiali, annacqui i fagioli; insomma ho furia. Tanto e tale mandava schiamazzo costei, che il generale importunato, dopo chiestane licenza al Valcroissant, levatosi da sedere, si affacciò alla porta con volto torbo interrogando: Che bordello è questo?","YES"
"Guerrazzi_Francesco_Domenico-Pasquale_Paoli-1860","Guerrazzi Francesco Domenico","Pasquale Paoli","1860","Perchè non cacciate via il temerario? Non sarebbe un temerario, bensì una temeraria; ma se merito questo nome, giudicherete poi; intanto bisogna che vi parli, ed ho furia. - Dunque sbrigatevi.","YES"
"Guerrazzi_Francesco_Domenico-Pasquale_Paoli-1860","Guerrazzi Francesco Domenico","Pasquale Paoli","1860","Vien qua, Giacinto; vedete eh! che pezzo di figliuolo? Sentiamo, quanto gli sate?","NO"
"Guerrazzi_Francesco_Domenico-Pasquale_Paoli-1860","Guerrazzi Francesco Domenico","Pasquale Paoli","1860","Ma või non lo indovinereste di qui a mezza notte, però ve lo dirò addirittura io, perchè ho furia; egli è entrato in sedici anni la festa di san Giacomo e Filippo apostoli.... Sbrigatevi vi dico. Lasciatene il pensiero a me, che ho da tornare a casa a infornare il pane. Io per lo addietro non rifiniva mai rinfacciare a questo povero figliuolo di mangiarsi il pane a tradimento; perchè come si trattava recarsi in mano una zappa sudava peggio di un cavallo bolso; sempre li con lo schioppo in mano, sempre erpicato pei comignoli delle rupi, o sempre inabissato per le fratte delle valli.","YES"
"Guerrazzi_Francesco_Domenico-Pasquale_Paoli-1860","Guerrazzi Francesco Domenico","Pasquale Paoli","1860","- Donna, pel vostro meglio vi consiglio andarvene... Ma no; ma no; coll'interrompermi mi fate perdere tempo, ed io ho furia; jeri dunque mírando che il mio zitello ammaniva lo schioppo per uscire di casa, gli ho detto: scioperataccio che sei, almeno, dacchè da quella rocca in fuori non vuoi toccare altro, tu la sapessi maneggiare come ogni fedele cristiano; gioco un seino, che non ti basta l'animo di ammazzarmi quel falco, che fa la ruota costasù. Giacinto si ripose in tasca il misurino dei pallini che stava per arrovesciare dentro lo schioppo, e cavata dalla carchiera una palla la cacció nella canna, é mi rispose: adesso è troppo alto.","YES"
"Guerrazzi_Francesco_Domenico-Pasquale_Paoli-1860","Guerrazzi Francesco Domenico","Pasquale Paoli","1860","Intanto il falco calò, e Giacinto: mamma preparate il seino! Il falco giù come cencio bagnato. Allora detti spesa al mio cervello e parlai: figliuolo, mi sembra che ci stia sopra le spalle un tempo in cui si deve sparare l'archibugio contro qualche cosa di meglio che un falco; dimani verrai meco a Corte: questo domani è oggi, ed io ve l'ho menáto, perchè se vi abbisognasse albergare a trecento passi una palla di oncia dentro la testa di qualche prepotente Francese, egli è il fatto vostro.","NO"
"Guerrazzi_Francesco_Domenico-Pasquale_Paoli-1860","Guerrazzi Francesco Domenico","Pasquale Paoli","1860","Certo il vostro bando chiama alle armi gli uomini da diciotto anni in su; ma ciò non tenga, gliene darò due dei miei, o, se non erro, non vi farà disturbo, generale, dargliene anco due dei vostri. Devota, poichè mi pare che siate Devota Pieragia di Castirla.... Si certo, giusto, voleva dire che voi non mi aveste riconosciuta ! Il vostro zitello non avrà mestieri di questo brutto regalo, se come corpo gagliardo gli deste cuore disposto adoperare virtuosamente in pro' del suo paese.","NO"
"Guerrazzi_Francesco_Domenico-Pasquale_Paoli-1860","Guerrazzi Francesco Domenico","Pasquale Paoli","1860","Ma sicuro che gliel' ho dato; fatti qua oltre.... o dove sei ito? Presto, che ho furia. Il giovanetto si era rimpiattato dietro le spalle alla madre; ella lo spinse dinanzi a sè tutto vergognoso con gli occhi bassi.","YES"
"Guerrazzi_Francesco_Domenico-Pasquale_Paoli-1860","Guerrazzi Francesco Domenico","Pasquale Paoli","1860","Il generale gli pose la destra sul capo, e gli disse: - GUARDATEMI IN VISO. Ed egli lo guardò; allora il generale si volse alla madre, e soggiunse : Non occorre altro, Devota, questo giovane farà dire di sè, o non mi chiamo più Paoli; lo metto nella mia compagnia col fiore dei giovani del paese. E adesso vado a infornare il pane: mio Colombo addio; un bacio e addio.... un altro, e un altro.","NO"
"Guerrazzi_Francesco_Domenico-Pasquale_Paoli-1860","Guerrazzi Francesco Domenico","Pasquale Paoli","1860","Signor generale, non ha da costarvi nulla.... capite.... grazie a Dio ho da fargli le spese, e ad un altro ancora se occorrerà: gli manderò, o gli porterò la provvista settimana per settimana: ve lo raccomando perchè l'ho solo, ma all' occorrenza non lo risparmiate ve'! Giacinto mio, obbedisci il signor generale come obbedivi a tuo padre, che vuol dire un zinzino più che a tua madre, e ora anche un bacio... e addio, chè ho furia. E via di corsa: il generale stava per richiamarla, senonchè Minuto Grosso gli diede su la voce notando: Lasciatela andare, Eccellenza, che la buona femmina pare che abbia furia di andare a infornarvi il pane, e un altro figliuolo.","NO"
"Guerrazzi_Francesco_Domenico-Pasquale_Paoli-1860","Guerrazzi Francesco Domenico","Pasquale Paoli","1860","Minuto! dubito che la stagione dei tuoi motti sia passata: per me penso che se la nostra causa sostenuta dal sangue più puro delle viscere del popolo avesse a soccombere, sarebbe segno che Dio ha ritirato le sue sante mani da questo mondo. Rientrò il Paoli nella stanza, e chiusane diligentemente la porta si volse al cavaliere Valcroissant dicendo: - Signor colonnello, se vi piacerà espormi il fine lella vostra ambasciata, sono disposto ad ascoltarvi.","NO"
"Guerrazzi_Francesco_Domenico-Pasquale_Paoli-1860","Guerrazzi Francesco Domenico","Pasquale Paoli","1860","Il cavaliere attendeva ricevere lo invito di assettarsi; visto però che il Paoli prese a camminare su e giù per la stanza, non fu tardo ad imitarlo: intantochè essi si movevano su due linee parallele, il cane Nasone messosi in terzo si era cacciato nel mezzo regolando i suoi moti con quelli dei nostri personaggi. Il cavaliere ch'era uomo dotto non potè astenersi, a cagione dell' accompagnatura, di paragonare il Paoli con gli eroi dei tempi a mezzo barbari, come Evandro, Patroclo, Telemaco e Siface, che Virgilio, Omero e Tito Livio ci rappresentano inseparabili dai propri cani, e per la irrequietudine sua a Catilina il quale, giusta quanto avverte Sallustio, nè vegliando nè dormendo poteva star fermo un momento, tuttavolta con felice disinvoltura incominciò: Innanzi tratto permettetemi, signore, che io mi congratuli con voi, che col senno e la fermezza, che tutta Europa onorano, avete saputo ridurre i Côrsi dallo stato, in cui vivevano, a quello in cui oggi li vediamo.... E li conoscevate voi questi Côrsi?","NO"
"Guerrazzi_Francesco_Domenico-Pasquale_Paoli-1860","Guerrazzi Francesco Domenico","Pasquale Paoli","1860","I Francesi, che con la distanza di parecchi secoli visitarono l'isola, ci lasciarono ragguagli cosi copiosi come veridici. E adesso li conoscete voi questi Côrsi? Spero dimostrarvelo, signore.","YES"
"Guerrazzi_Francesco_Domenico-Pasquale_Paoli-1860","Guerrazzi Francesco Domenico","Pasquale Paoli","1860","Il mio padrone e signore.... Il Paoli gli vibrò un'occhiata di traverso. Sua maestà il re di Francia voi sapete che va degnamente insignito di due titoli del pari gloriosi; uno lo possiede comune co' suoi antenati; l'altro glielo deferivano i popoli riconoscenti: desideroso sempre più meritarsi i nomi di cristianissimo e di bene amato, prese in matura considerazione la guerra secolare, che lacera due illustri popoli, il Côrso e il Genovese, e poichè per esperienza propria ed altrui conobbe ormai disperato che tra loro potesse cadere termine alcuno di concordia, deliberò affrancare la Corsica dall'odiato governo della repubblica genovese.","NO"
"Guerrazzi_Francesco_Domenico-Pasquale_Paoli-1860","Guerrazzi Francesco Domenico","Pasquale Paoli","1860","Se la Provvidenza non avesse riposte nelle sue auguste mani le forze della prima nazione del mondo, forse avrebbe comandato ai Genovesi sgombrassero da una contrada che non avevano o voluto o saputo nel corso di tanti secoli felicitare; e trovatili contumaci a obbedire sarebbe ricorso all'ultima ragione dei re; la potenza sua unita in bello accordo con la magnanimità gli persuase partiti più blandi, volle risparmiare sangue cristiano, e la Provvidenza secondò il pio desiderio. La Francia, ricca abbastanza per pagare la sua gloria, con molto denaro acquistava il diritto di beneficare la Corsica; e cosi operando era mossa dal desiderio di appagare i voti secolari di questi popoli generosi, dacchè con grato animo essa rammenta che un giorno vennero ascritti alla famiglia dei sudditi di S. M., che sotto le bandiere francesi militarono, e per ultimo, che anche nei tempi recentissimi manifestarono per mezzo di oratori e di istanze, non una volta ma molte, il fermo proposito di essere chiamati a parte della naturalità francese. La Francia pertanto oggi senza ostacolo vi apre le braccia, e voi potete commettervici con effusione di cuore.","NO"
"Guerrazzi_Francesco_Domenico-Pasquale_Paoli-1860","Guerrazzi Francesco Domenico","Pasquale Paoli","1860","Uniti alla Francia, di deboli diventate ad un tratto potenti; invece di temere le minacce dei nemici, sta adesso ai nemici a imparare la paura delle vostre; la Francia conosce le vostre piaghe, e vuole, e può ripararle: nuove strade si apriranno, saranno asciugati paduli, ponti eretti, l'agricoltura ricondotta in fiore, i commerci promossi; questa fortunata isola sta per diventare in mano alla Francia scala dei suoi traffici per tutto levante, arsenale per le sue armate, più acconcio dello stesso Tolone; per la copia dei suoi legnami cantiere privilegiato, per la moltitudine dei porti fidatissima stazione navale; i vasti golfi le accertano la scuola di marina quasi esclusiva: qui ufficiali si civili che militari, qui prelati, e con essi le belle case, le splendide masserizie, l'urbanità, le arti del lusso, le feste. Stupendo a dirsi! Quello che la Francia con la fatica di molti secoli conseguì, voi altri Corsi in un giorno, anzi in un'ora, acquistate; nè questo è tutto; S. M. cristianissima intende ancora sopra i suoi antichi sudditi felicitarvi; non mica, che in lei ch'è fonte di tutta giustizia possa allignare parzialità, bensi perchè qui vede urgente riparare le ingiurie della dominazione altrui: a questo scopo divisa affrancare i Côrsi per trent'anni dal pagamento di qualunque imposizione o gravezza.","NO"
"Guerrazzi_Francesco_Domenico-Pasquale_Paoli-1860","Guerrazzi Francesco Domenico","Pasquale Paoli","1860","E voi, illustre signore, che per l'egregie opere vostre meritaste che un principe barbaro mediante onorevole ambasciata vi palesasse l'alto concetto nel quale vi teneva, non maraviglierete certo se il re cristianissimo, ch'è quanta gentilezza vive nel mondo, per mia bocca vi partecipa la sua ammirazione, e il desiderio di vedere con la presenza vostra onorata la corte con ufficio degno, come sarebbe quello di tenente generale degli eserciti del re, o se meglio vi aggradisce vita più tranquilla, rimette in voi ła scelta della provincia di terraferma dove vorreste andare governatore. Finchè il Paoli conobbe che questo discorso era per durare un pezzo stette quieto, o parve: mano a mano però, che volgeva alla fine il suo passo si fece più accelerato; gli s'infiammò la faccia, tremava; tuttavolta si contenne, e socchiuse gli occhi per nascondere le faville dell'ira, che quinci prorompevano. Tacque fin tanto gli fu possibile senza offendere l'urbanità; costretto per ultimo a parlare, con voce tremula incominciò: - Signor colonnello, i miei complimenti per la vostra facondia: perdonerete le mie disadorne parole; rettorica non ci so mettere, e sapendo non ci metterei; studierò all'opposto di mostrarmi più schietto, che per avventura la mia condizione non comporta.","NO"
"Guerrazzi_Francesco_Domenico-Pasquale_Paoli-1860","Guerrazzi Francesco Domenico","Pasquale Paoli","1860","Orsù, il vostro discorso contiene due parti; la prima concerne la patria; la seconda me. Quanto alla patria mi fate sapere che il vostro padrone ci ha comprato interi, terra e anima, come si acquistano poderi con le stime vive e morte; ovvero, che mentre la Europa incomincia a vergognarsi per la tratta dei negri, S. M. cristianissima non prova ribrezzo alla compra dei bianchi: un'altra cosa vedo nei vostri discorsi ed è che il vostro padrone, ottimo padre di famiglia, vi manda a pigliare possesso del podere acquistato, con facoltà di levare di mezzo imbarazzi col migliore mercato possibile.... - Signore, voi fate ingiuria..... - Colonnello, io non vi ho interrotto, adesso non GUERRAZZI, Pasquale Paoli. Vol.","NO"
"Guerrazzi_Francesco_Domenico-Pasquale_Paoli-1860","Guerrazzi Francesco Domenico","Pasquale Paoli","1860","I. 19 interrompete me, e ricordatevi che il vostro signore e padrone non è il mio, anzi ponete addirittura, che nessuno, intendete bene, nessuno, sarà padrone del Paoli eccetto Dio. - Or via, supposto che siffatti traffici non sieno infami, che cosa ha potuto comprarsi da una parte, che vendersi dall' altra?","NO"
"Guerrazzi_Francesco_Domenico-Pasquale_Paoli-1860","Guerrazzi Francesco Domenico","Pasquale Paoli","1860","I Genovesi mentiscono quando vantano avere conquistato la Corsica, e di questo vi chiarirà il libro di Don Gregorio Salvini, che feci stampare in Oletta, e l'altro più breve di mole, e forse di argomento più notabile, di monsignor Natali vescovo di Tivoli 1. Quale non dirò pudore, ma conformità in voi? Ci aiutaste prima col sangue, con la pecunia, con armi a rompere il giogo aborrito della repubblica genovese, anzi ci mandaste, per conforto a perseverare, le bandiere col motto pugna pro patria; più tardi vi siete uniti con la repubblica genovese, e non risparmiaste nulla, nè anche delitti, per ribadirci al collo le catene di Genova; ora vi augurate esercitare la tirannide, auspice Genova, ma per conto proprio.","NO"
"Guerrazzi_Francesco_Domenico-Pasquale_Paoli-1860","Guerrazzi Francesco Domenico","Pasquale Paoli","1860","Dio eterno, ma che credete voi, che i popoli sieno la cavalla morta legata al piede di Orlando matto? Voi dite che ci volete felici, e cominciate intanto col rendere i Côrsi schiavi, me traditore. Certo non vo' negarlo, costretti dalla necessità, e mossi ancora dalla gratitudine, che nei nostri cuori facili a commoversi esageriamo del pari che l'odio, ci proferimmo a voi e voi ci accettaste, e prometteste tenerci perpetuamente a parte del vostro reame; ma questo accadde, vi piaccia rammentarvelo, quando le forze di 1 Giustificazione della Rivoluzione di Corsica, con la ferma risoluzione presa dai Côrsi di non sottomettersi mai più al dominio di Genova.","YES"
"Guerrazzi_Francesco_Domenico-Pasquale_Paoli-1860","Guerrazzi Francesco Domenico","Pasquale Paoli","1860","Oletta 1758. Nella stamperia della Unità. Con l'approvazione di tutti i savi.","NO"
"Guerrazzi_Francesco_Domenico-Pasquale_Paoli-1860","Guerrazzi Francesco Domenico","Pasquale Paoli","1860","- Disinganno intorno alla guerra di Corsica scoperto da Curzio Tulliano corso ad un suo amico dimorante nell' Isola. Colonia, 20 novembre 1736. Carlo V, il più potente degl'imperatori dopo i Romani, mosse di Germania, di Spagna e d'Italia, minacciavano inondarci; comunque sia noi ci diemmo, voi ci accettaste, come ci teneste?","NO"
"Guerrazzi_Francesco_Domenico-Pasquale_Paoli-1860","Guerrazzi Francesco Domenico","Pasquale Paoli","1860","Voltabili nella fortuna contraria, non fermi nella buona, appena credeste aggiustare i fatti vostri con vantaggio, ci gettaste via a modo... a modo di donna, che butta là un ventaglio sgualcito. Un' altra volta ci proferimmo a voi, lo confesso, e fu quando intromessi pacieri tra Genova e noi, con gravità non so se più stupida o feroce, ci andavate avvisando: tendete prima il collo al rasoio, e poi aggiusteremo le cose! nè a noi giovava punto rispondere: Dio ve ne renda merito, morti una volta non vale medicina, che imperturbati voi nella medesima proposta insistevate; allora vi si proffersero i Côrsi nella guisa, che il condannato, al cui arbitrio si lasci morire di laccio o di mannaia, sceglie la scure sperando patire meno, e tuttavolta voi non ci accettaste.","YES"
"Guerrazzi_Francesco_Domenico-Pasquale_Paoli-1860","Guerrazzi Francesco Domenico","Pasquale Paoli","1860","Adesso voi volete dare ad intendere a voi stessi ed a noi, che di questa razza uffici a voi conferiscano diritti, a noi obblighi? Senza ridere voi vi vantate benefattori, e noi sul serio ci confesseremo beneficati. Ah!","NO"
"Guerrazzi_Francesco_Domenico-Pasquale_Paoli-1860","Guerrazzi Francesco Domenico","Pasquale Paoli","1860","colonnello, forti siete perchè venti e più milioni legati ad un medesimo giogo tirano un monte, e non importa se trattisi di bestie o di uomini; ma quanto a ingegno, che nella solitudine può salire fino alla divinità, non presumete vincere le menti latine. Il vostro re ha sentito (voi lo accertate) pietoso ribrezzo di spargere sangue cristiano per costringere i Genovesi a vendere i Côrsi, ma pare non proverà scrupolo a versarlo a bigonce, caso mai i Còrsi repugnassero a confessarsi comprati. - Voi volete rendere i Côrsi felici; lo siete voi, signor colonnello, in casa vostra ?","NO"
"Guerrazzi_Francesco_Domenico-Pasquale_Paoli-1860","Guerrazzi Francesco Domenico","Pasquale Paoli","1860","Ah! voi pretendete guarirci mettendoci a parte dell'olio santo che già vi ha amministrato il prete? - Signore, noi siamo potenti.","NO"
"Guerrazzi_Francesco_Domenico-Pasquale_Paoli-1860","Guerrazzi Francesco Domenico","Pasquale Paoli","1860","Potenti? Sia, ma oltrechè la felicità di rado nasce dalla potenza, io talora credo che la potenza sia la fortuna in maschera: ad ogni modo se fortuna e potenza sono due enti diversi, io gli ho veduti spesso seduti al medesimo tavoliere passarsi alternativamente nelle mani il bussolotto co' dadi. Presumereste forse di avere preso a pigione la fortuna voi altri, frammento minimo della rovina romana?","YES"
"Guerrazzi_Francesco_Domenico-Pasquale_Paoli-1860","Guerrazzi Francesco Domenico","Pasquale Paoli","1860","Colonnello, io non ho in fede mia, intenzione di oltraggiare la Francia, pure non crediate che noi ignoriamo quali rovesci condussero le paci di Utrecht e di Rastdat sotto Luigi XIV, che scambiò una candela col sole, e prima di morire la vide condotta al verde: avendo comandato troppo in casa altrui, fini col comandare appena in casa propria, quantunque affermasse l'opposto. Ditemi, la pace di Aquisgrana vi venne persuasa dalle vostre vittorie? Per la Francia non si bisbiglia che il vostro bene amato re si nabissi nello stravizio e nelle lascivie, meno per talento naturale che per sottrarsi al senso dei mali che il suo stato patisce?","NO"
