"filename","nome","titolo","anno","chunk","DIL"
"Guerrazzi_Francesco_Domenico-Pasquale_Paoli-1860","Guerrazzi Francesco Domenico","Pasquale Paoli","1860","Colle bordeggiate ho finito; questa ultima è stata la più lunga; pensava mi conducesse fino a Bastia; adesso ho stretto il vento, e come vedete vado di burina ch'è un incanto: non vi par ella la mia galera cosi chinata un gabbiano che radendo il mare vi tuffa un'ala? Grazie alla Immacolata siamo fuori di pericolo cosi degli uomini come del mare. I Corsi tornarono sotto cheti cheti; il Boswell non si parti più dal fianco del capitano, finchè questi non gli disse: Ci siamo: adesso faccio calare il caicco, che ci rimorchi fino alla spiaggia col piombino alla mano per iscandagliare il fondo.","YES"
"Guerrazzi_Francesco_Domenico-Pasquale_Paoli-1860","Guerrazzi Francesco Domenico","Pasquale Paoli","1860","Ed ora in quanti passi di acqua giudicate voi che peschiamo? Giudico venti. Il Boswell fattosi allora al boccaporto, vi si affacciava gridando: - Su, su che siamo a casa.","NO"
"Guerrazzi_Francesco_Domenico-Pasquale_Paoli-1860","Guerrazzi Francesco Domenico","Pasquale Paoli","1860","Salirono; la notte già scura non dava luogo a contemplare la faccia della gente, ma si sentivano gli aneliti, i gemiti e per fino i brividi: segni tutti del tremendo affetto che gli agitava. Dalla parte di terra non comparivano distinte le cose; solo i contorni di monti neri dipinti in cielo meno fosco, e le masse dei fabbricati; però di su, di giù sopra la spiaggia andavano e venivano persone con ischiappe di pino accese nelle mani, rammentando le miriadi delle lucciole sfavillanti pei bui sereni delle notti estive. Il frate Casacconi andò difilato a prua, e colà, sporte le braccia dal parapetto della nave, con voce di pianto esclamava: O madre!","NO"
"Guerrazzi_Francesco_Domenico-Pasquale_Paoli-1860","Guerrazzi Francesco Domenico","Pasquale Paoli","1860","o madre mia! E il Boswell, che gli veniva dietro rispose: Bene, bene; mi rallegro con voi, signor frate, che abbiate la madre viva: deve avere a quest'ora una bella età. Ma il frate non lo badando continuava: Tu mi stendi le braccia... e ohimè!","YES"
"Guerrazzi_Francesco_Domenico-Pasquale_Paoli-1860","Guerrazzi Francesco Domenico","Pasquale Paoli","1860","a te vengo. Il Boswell dietro: Non sarebbero mica i vostri occhi di natura di gatto, che vi vedono di notte? Mentre così il signor Giacomo favella, il frate spicca un salto di sopra al buonpresso, e giù di tonfo nel mare.","NO"
"Guerrazzi_Francesco_Domenico-Pasquale_Paoli-1860","Guerrazzi Francesco Domenico","Pasquale Paoli","1860","Misericordia! grida il signor Giacomo spendolandosi fuori della galera - affoga... il signor frate si affoga - pare... tengo opinione... salvo suo onore... che sia ammattito. E sopraggiunsero Giocante e Altobello, i quali, chinandosi a loro posta, videro il frate in mezzo alle onde, che sotto i suoi colpi vigorosi smagliavano fosforo, notare malgrado la sua tonaca come un tonno: parve non avesse a traversare gran tratto per mettere i piedi sul sodo, dacchè fu visto sorgere ritto e rompere le acque, che gli gorgogliavano intorno alle gambe, con passi veloci, mentre anch' egli alla sua volta gridava: Tocco la madre mia: lasciatemi con la mia mattana, e voi, signor inglese, restatevi con la vostra sapienza, che buon pro' vi faccia.","YES"
"Guerrazzi_Francesco_Domenico-Pasquale_Paoli-1860","Guerrazzi Francesco Domenico","Pasquale Paoli","1860","Grande è l'amore di patria, diceva in questa Altobello, in ispecie se riposino nel suo seno i nostri parenti, imperciocchè allora ci appaia come l' erede del loro affetto per noi. Bene: siamo d'accordo: ma non vedo ragione di bagnarsi senza bisogno fino all'osso, e mettersi al cimento di troncarci il collo per voler bene alla patria. - Certo, rispose Altobello, non cascava nel quarto ad aspettare tanto da scendere a modo e a verso... oh!","YES"
"Guerrazzi_Francesco_Domenico-Pasquale_Paoli-1860","Guerrazzi Francesco Domenico","Pasquale Paoli","1860","sentite? sentite?.... Che cosa ho da sentire?","YES"
"Guerrazzi_Francesco_Domenico-Pasquale_Paoli-1860","Guerrazzi Francesco Domenico","Pasquale Paoli","1860","Non vi pare che una voce, chiami: Altobello! Altobello! Ditemi, signor Giacomo, non la sentite voi?","NO"
"Guerrazzi_Francesco_Domenico-Pasquale_Paoli-1860","Guerrazzi Francesco Domenico","Pasquale Paoli","1860","Io non-sento nulla. Si, che la sento io.... È mia madre... mamma! mamma!","NO"
"Guerrazzi_Francesco_Domenico-Pasquale_Paoli-1860","Guerrazzi Francesco Domenico","Pasquale Paoli","1860","Eh! dico, signor Altobello, non vi venisse mica la tentazione d'imitare il frate.... per amore di Dio non fate..... fermatevi. E visto Altobello in procinto di gittarsi giù capovolto in mare, lo afferrò per le falde; invano però, che il vestito cesse, e il signor Giacomo si trovò come la moglie di Putifarre quando dette l'assalto a Giuseppe ebreo: cosi almeno racconta la Genesi al capitolo trentanove.","NO"
"Guerrazzi_Francesco_Domenico-Pasquale_Paoli-1860","Guerrazzi Francesco Domenico","Pasquale Paoli","1860","Allora il signor Giacomo si volse agli altri, che gli facevano calca d'intorno, e con voce alta predicò: Il soverchio, signori miei, rompe il coperchio; cotesti due gentiluomini, il signor frate e il signor Altobello non hanno a mio parere fatto mostra di buon giudizio.... e non andò oltre che lo interruppe un tonfo, poi due, poi tre: insomma la smania di buttarsi in mare, per giungere un tantino prima a baciare la sacra terra della patria, invase tutti i passeggeri a mo' di contagio, - e nonostante che il signor Boswell si aggirasse dintorno infuriato, come non fu mai prima nè poi in tutta la sua vita, urlando: Siete diventati i montoni di Panurgo, o Dio mi perdoni, vi è entrato il diavolo in corpo... badate... vi romperete le gambe.... le braccia... il collo, - fiato perduto; vide però con piacere, che i marinari e le ciurme restavano a bordo; e perchè questo facessero bastò una parola sola; è vero che la parola sonava cosi: il primo ch' esce dal bordo senza permesso sarà impiccato; ma infine gli dava sempre argomento di maraviglia considerare come il capitano con una parola sola era riuscito farsi obbedire, mentre a lui che ne aveva dette tante nessuno aveva dato retta; ond'è che accostatosi al capitano così gli disse: Voi avrete letto di certo, signor capitano, che nei tempi antichi il popolo di Abdera durò matto tre giorni: questa molti reputano favola, ed io era fra loro; oggi poi avrei incominciato a crederla, se non eravate voi, che con savio e prudente contegno avete fatto eccezione tra i vostri compaesani. Per amore di Dio tenetevi in tasca il vostro elogio, perchè io non so chi mi tenga che non mi butti giù dalla galera per correre dietro a quegli altri. O tempo, o danari buttati via!","NO"
"Guerrazzi_Francesco_Domenico-Pasquale_Paoli-1860","Guerrazzi Francesco Domenico","Pasquale Paoli","1860","Se partito da Londra e venuto in Corsica io non ci doveva vedere altro che pazzi era meglio che me ne stessi a casa sfogandomi a visitare Bedlam tutti i giorni..., e con mio comodo. Poichè fu ormeggiata la galera ed acconigliarono i remi con le debite cautele, il capitano Angiolo invitò il signor Giacomo a recarsi con esso lui nel medesimo schifo a terra, dove in breve ora giunti ambedue, il capitano si diede subito in cerca di padre Bernardino; non gli fu arduo rinvenirlo, che lo vide girare e rigirare come un arcolaio, dispensando e ricevendo all'intorno un diluvio di baci. Il capitano riconobbe il frate per la pratica grande che ne aveva, imperciocchè diversamente non lo avrebbe trovato in capo a un mese; di lui come dello spettro di Ettore avrebbe detto Virgilio: ehu quantum mutatus ab illo; in effetto egli aveva spogliato la tonaca, ché inzuppata di acqua gli era divenuta pesa come se fosse stata di piombo, ed alle consuete vesti ne aveva sostituite altre tumultuariamente senza badare se convenissero o no; le gambe mostrava ignude, dal ginocchio alla cintura andava coperto di un paio di mutande bianche, poi vestiva una camiciola di lana rossa da marinaro, su le spalle portava un mantello da pastore e un cappello a tre corni da prete sopra la testa; la barba sua così candida, e il viso, presentavano più tinte della tavolozza dei pittori, primeggiando però fra esse il nero, il verde e il giallo, e questo in virtù delle centinaia di labbra colorite di erba côrsa, che lo avevano baciato.","YES"
"Guerrazzi_Francesco_Domenico-Pasquale_Paoli-1860","Guerrazzi Francesco Domenico","Pasquale Paoli","1860","Il capitano Angiolo gli pose ardito una mano su la spalla dicendo: di voi appunto cercava. Di me? rispose il frate con voce mal sicura temendo chi sa qual rabbuffo pei suoi mal sortiti sospetti; e l'altro Di voi.","NO"
"Guerrazzi_Francesco_Domenico-Pasquale_Paoli-1860","Guerrazzi Francesco Domenico","Pasquale Paoli","1860","Vi paiono azioni da gente bene allevata disertarmi il bordo come se aveste paura ch'io volessi menarvi schiavi in Algeri? - Figliuole, abbiate pazienza.... - Pazienza! Questa non tutti la intendono a un modo: per voi altri frati è un vestito; io non ve lo posso perdonare, massime che mi faceva bisogno dei vostri frati e di voi... A questo punto Giocante si accostò ai due che parlavano, ma il capitano finse di non lo vedere, e continuò: - aveva proprio bisogno dei vostri frati e di voi perchè mi aiutaste a scaricare il bastimento.","NO"
"Guerrazzi_Francesco_Domenico-Pasquale_Paoli-1860","Guerrazzi Francesco Domenico","Pasquale Paoli","1860","O che ci avete preso per camalli? Io vi ho preso per buoni patrioti capaci a mettere in terra presto e bene un carico che preme molto al generale e alla patria. Com'è così, torna onorata ogni cosa.","YES"
"Guerrazzi_Francesco_Domenico-Pasquale_Paoli-1860","Guerrazzi Francesco Domenico","Pasquale Paoli","1860","- Ma non basta; è necessario, date retta, è necessario che ve ne andiate in chiesa, e la sgombriate fino all'altare maggiore; se trovate accesa unicamente la lampada del Santissimo Sacramento lasciatela stare; fuori questa, le altre spegnete; le casse mettete da un lato, i barili dall'altro, il ferro e le cuoia a rinfuso nel mezzo; intorno alla chiesa piantate in sentinella quattro religiosi perchè con parole ortatorie persuadano la gente a non si accostare; ma siccome potrebbe accadere, che delle parole non facessero caso, cosi per cautela, ho recato certi moschettoni, i quali distribuirete ai predetti quattro religiosi con raccomandazione, che occorrendo il caso non gli lascino dormire; con altri frati, che potrete darmi, valendomi ancora di parte della ciurma, ordinate la catena per mezzo della quale uno passando all'altro il barlozzo o la cassa, in breve ora avremo sgombrato la galera. Ma non si potrebbe fare con maggior comodo e meglio queste cose domani? - Eccoci qui da capo sul perfidiare, e parrebbe che non foste stato mai frate: e si che avreste a sapere, che il primo obbligo del frate, e (qui si volse di un tratto a Giocante) del soldato, consiste nell' obbedire.","NO"
"Guerrazzi_Francesco_Domenico-Pasquale_Paoli-1860","Guerrazzi Francesco Domenico","Pasquale Paoli","1860","O signor Giocante, mi perdonerete se prima di aggiustare i conti con voi, io penso a mettere in sicuro il carico.... non lo farei se non appartenesse al governo. - Capitano Angiolo, di grazia non vogliate rammentare le parole dette sul mare; il vento se l'è portate via. Non così; ogni mancanza merita punizione.","NO"
"Guerrazzi_Francesco_Domenico-Pasquale_Paoli-1860","Guerrazzi Francesco Domenico","Pasquale Paoli","1860","- Quanto a punirmi poi.... - Tacete; la vostra punizione sarà vigilare in terra a che il discarico succeda con massima puntualità: vorreste ricusare questo servigio alla patria? - Quanto a questo eccomi pronto con tutto il cuore. Vedete?","NO"
"Guerrazzi_Francesco_Domenico-Pasquale_Paoli-1860","Guerrazzi Francesco Domenico","Pasquale Paoli","1860","Voi v' inalberate di nulla. Prima vi tiravate addietro arruffato, adesso che mi avete udito, veruno riuscirebbe a farvi metter giù questo carico. Crescete il peso dall'altra parte perchè la vostra bilancia possa andar giusta.","NO"
"Guerrazzi_Francesco_Domenico-Pasquale_Paoli-1860","Guerrazzi Francesco Domenico","Pasquale Paoli","1860","L'orologio della parrocchia batteva le due dopo la mezzanotte, e la gente rifinita dalla stanchezza camminava come ebbra con le palpebre socchiuse, quando il capitano Angiolo volto al padre Bernardino e a Giocante domandò loro: dov'è andato il signor Altobello? In verità non lo so, rispose il frate: appena sceso in terra una donna lo ha arroncigliato con una furia di amore materno.... Dite piuttosto con la ferocia del gatto salvatico.... Sicuro, voi dite bene, Giocante, ci era anco del gatto, e se lo portò Dio sa dove.... Andiamo a cercarlo perché lo vo' salutare.... O non sarebbe meglio andarcene a dormire?","NO"
"Guerrazzi_Francesco_Domenico-Pasquale_Paoli-1860","Guerrazzi Francesco Domenico","Pasquale Paoli","1860","Ouf! padre Bernardino, vi dico, che ho bisogno di salutarlo. E domandando seppero il luogo dove Alando si era riparato con la madre sua: apersero pianamente l' uscio, un lume ardeva sul lastrico, sicchè poterono vedere di colta una donna di sembianze severe assettata sopra un letto di paglia con le spalle al muro, in grembo della quale dormiva Alando; ella non faceva altro che, guardato il figlio, levare gli occhi al cielo; guardato il cielo, declinare gli occhi sul figliuolo, come se volesse condurre Dio in terra a pigliare sotto la sua speciale protezione il figliuolo, o deporre l'anima di questo nel grembo di Dio come adesso ne riposava il corpo sopra il suo grembo.","YES"
"Guerrazzi_Francesco_Domenico-Pasquale_Paoli-1860","Guerrazzi Francesco Domenico","Pasquale Paoli","1860","Anche le mani teneva giunte insieme, ma tratto in tratto le spaiava o per asciugargli il sudore, e per iscacciarne qualche insetto pertinace a recargli fastidio. Michelangiolo, ma Michelangiolo solo, se a caso si fosse imbattuto costà, avria saputo cavarne modello a significare in marmo lo abisso della gioia materna da mettere a riscontro della Pietà, abisso di dolore di madre da cotesto Divino confidato alla pietra. Padre Bernardino, che la riconobbe, senza appunto avvertire lo strano arnese nel quale in quel momento si trovava, le si accostò alla domestica dicendo: Siete qui, donna Francesca Domenica?","NO"
"Guerrazzi_Francesco_Domenico-Pasquale_Paoli-1860","Guerrazzi Francesco Domenico","Pasquale Paoli","1860","Oh! che miracoli sono questi? La madre interrotta nelle soavi cure gli sbarrò in viso certi occhi truci da mettere i brividi adosso ad ogni fedele cristiano; ma l'altro senza scomporsi: Oh!","NO"
"Guerrazzi_Francesco_Domenico-Pasquale_Paoli-1860","Guerrazzi Francesco Domenico","Pasquale Paoli","1860","che vi ribolle, ne'! Francesca Domenica, che mi fate gli occhiacci? - Qual siete voi?","NO"
"Guerrazzi_Francesco_Domenico-Pasquale_Paoli-1860","Guerrazzi Francesco Domenico","Pasquale Paoli","1860","andate via! - Questa la è nuova di zecca! dopo dieci anni arrivo adesso, e voi mi volete mandar via?","NO"
"Guerrazzi_Francesco_Domenico-Pasquale_Paoli-1860","Guerrazzi Francesco Domenico","Pasquale Paoli","1860","Intanto Altobello destatosi si era ritto in piedi, e vergognoso di avere piantato in asso la compagnia stava per farne le scuse, quando il capitano Angiolo lo prevenne parlando. - Signore Altobello, vi domando perdono se sono venuto a svegliarvi, ed a voi pure, signora, domando umilmente perdono se vi levo per un minuto il figliuolo dal seno: mi pareva non potere partire col cuore contento se non avessi detto addio a voi come agli altri nostri compagni di viaggio. Addio dunque, datemi tutti, e pigliatevi un bacio: desidero, e spero che ci rivedremo quaggiù; ma se a Dio piacesse altrimenti, ci rivedremo ad ogni modo, perchè il nostro padre Bernardino ci ha fatto toccare con mano col suo libro, che chi muore per la patria va in paradiso senza passare pel purgatorio, e, padre, scusate, il mio cuore me lo aveva detto prima di voi 1.","NO"
"Guerrazzi_Francesco_Domenico-Pasquale_Paoli-1860","Guerrazzi Francesco Domenico","Pasquale Paoli","1860","Come! volete partire subito? Non piglierete un'ora di riposo?","NO"
"Guerrazzi_Francesco_Domenico-Pasquale_Paoli-1860","Guerrazzi Francesco Domenico","Pasquale Paoli","1860","Che prescia è questa? Si udiva domandargli dintorno; ed egli: Mi tarda di andare a rendere la bandiera di Francia allo sciabecco che me la imprestò, e vedere se mi riuscisse fargli inalberare la corsa. Signor Giacomo, voi mi avete promesso, che al nostro generale raccontereste quanto avreste veduto.","NO"
"Guerrazzi_Francesco_Domenico-Pasquale_Paoli-1860","Guerrazzi Francesco Domenico","Pasquale Paoli","1860","Di grazia accostatevi. Cosi parlando raccatta di terra il lume a mano, e messolo sopra una botte, che li si trovava a caso si cavò dal seno uno astuccio di foglia di argento; da questo aperto trasse fuori una lettera, che spiegò con tremito religioso, e lesse con voce strozzata: Al signor Angiolo Franceschi. Casinca 4 ottobre 1768.","NO"
"Guerrazzi_Francesco_Domenico-Pasquale_Paoli-1860","Guerrazzi Francesco Domenico","Pasquale Paoli","1860","Il vostro zelo ed onoratezza hanno riscosso gli applausi di tutta la nazione, dalla quale sarete con 4 Questo libro veramente non fuscritto da frate Bernardino Casacconi, bensì da frate Lionardo da Campoloro, e porta il seguente titolo: Discorso sacro civile col quale s'insegna che i morti per la patria sono martiri. tradistinto: ed io vi farò conoscere quanto vi sono particolarmente tenuto. Se vi faranno proposizioni indegne del vostro coraggio, dite per unica risposta: viva la libertà!","NO"
"Guerrazzi_Francesco_Domenico-Pasquale_Paoli-1860","Guerrazzi Francesco Domenico","Pasquale Paoli","1860","Cordialmente vi saluto. Il generale Paoli 1. Dopo averla ripiegata, chiusa nello astuccio, e bene assicurata sul petto riprese: - voi gli direte, che il capitano Angiolo ha sentito farsi proposizioni infami, e non le ha respinte, anzi le ha accettate; ditegli, che egli prese in prestito una bandiera francese, ammainò la côrsa, ed in sua vece inalberò la nemica.... però aggiungetegli tosto che il capitano Angiolo lo ha fatto per salvare cento e più patriotti come questi (e qui toccò le mani a padre Bernardino, ad Altobello e a Giocante), ed un amico, come siete voi, alla patria: e questo è già molto; e l'ha fatto eziandio per condurgli sano e salvo un carico di armi e di polvere, dal quale può dipendere la salute della patria stante le angustie in cui ella si versa; di qui il mio abborrimento a combattere, e di qui l'odio per la vostra pipa, signor Giocante: per ultimo ditegli che, depositate in terra anime e beni, egli senza porre tempo fra mezzo si è partito per andare a vincere o morire onoratamente combattendo i nemici.","NO"
"Guerrazzi_Francesco_Domenico-Pasquale_Paoli-1860","Guerrazzi Francesco Domenico","Pasquale Paoli","1860","Altobello gettò le braccia al collo di sua madre, e singhiozzando disse: O mamma mia, quando avrete un figliuolo che rassomigli il capitano Angiolo? Padre Bernardino, dopo essersi sentito mareggiare il terreno sotto più che non aveva provato la galera in mare, casco di stianto ginocchioni, e presa la mano del prode uomo la baciava è la ribaciava; intanto Giocante levatesi le pistole di tasca le porgeva al capitano con queste parole: Questa lettera, in parte che non rileva, alquanto varia, è stampata nella Raccolta delle Lettere del Paoli a p. 164. - Capitano, io vi supplico di accettare queste pistole, perchè ogni volta vi capiterà gettarvi gli occhi sopra vi rammentiate di un folle, che voleva spararvele nel capo per traditore.","NO"
"Guerrazzi_Francesco_Domenico-Pasquale_Paoli-1860","Guerrazzi Francesco Domenico","Pasquale Paoli","1860","- No, tenetele per voi, che vi faranno bisogno più spesso che a me; e il paese soffre penuria di armi: d'altronde quando mai potessi dimenticare Giocante Canale, io vado persuaso che i vostri gesti mi riporteranno il suo nome più spesso che io saprei desiderare. Il signor Giacomo, anche prima che Giocante avesse offerto le pistole, aveva pensato lasciare al capitano qualche pegno che a lui lo ricordasse, e da prima si fermò su la tabacchiera, ma subito dopo conoscendo quanto necessario arnese gli fosse, torse lo sguardo altrove e lo posò sopra un anello che aveva in dito, ma questo era ricordo della sua madre defunta: allora la sua volontà cominciò dentro a ondeggiargli dalla scatola all' anello come la cima di un cipresso al rovaio: quella, bisogno frequente del naso; questo, bisogno perpetuo dell'animo; si rinnovava la battaglia antica tra lo spirito e la materia, e il signor Giacomo usci da cotesto parapiglia da galantuomo par suo, imperciochè sporgendo la scatola: - Quanto a questa spero non ricorreranno i motivi delle pistole per escluderla, però quando ci andrete a cercare una presa di tabacco.... - Io non piglio tabacco, signor Giacomo, e levare a voi la tabacchiera sarebbe proprio come rubarla di su l'altare. Mio buono e generoso inglese, se in qualche parte vi piacqui, se in alcuna cosa vi parve io meritassi di voi, vi supplico a mani giunte di un guiderdone, e questo sia avere a cuore il generale Paoli e la mia patria.","YES"
"Guerrazzi_Francesco_Domenico-Pasquale_Paoli-1860","Guerrazzi Francesco Domenico","Pasquale Paoli","1860","Mio degno amico, si, quello come padre, questa come madre. 1 Il gallo chiama Francesca Domenica alle opere diurne; deposto soavemente il capo del figliuolo, ella lo ricopre col pilone affinchè la brezza mattutina non lo raffreddi, poi si fa ad esaminare il fornimento dell'ospite e del figliuolo. Egli era negozio serio quello del signor Giacomo: due valigie, e come pese!","YES"
"Guerrazzi_Francesco_Domenico-Pasquale_Paoli-1860","Guerrazzi Francesco Domenico","Pasquale Paoli","1860","una sacca, una cassetta e un mazzo fra ombrello, canna e spada: a considerare tante robe la donna alza le mani quasi per dire: manco male, che colui non si porta dietro la casa; allora va e soppesa anche la valigia del figliuolo, e la trovando, fuori di ogni presagio, grave, si stringe nelle spalle; intanto si accosta ai labbri uno dopo l'altro il pollice, l'indice e il medio, e mormora: tre di certo, ma ce ne bisogneranno quattro; e via fuori dell'uscio. Attinse una mezzina di acqua, e la portò nella stalla ad abbeverarne il ciuco; tratte da una sacchetta tre manciate di castagne gliele mise per profenda davanti; ma subito dopo pensando che quel giorno avrebbe fatto cammino sforzato gliene crebbe due altre: uscita all'aperto, mentre andava in fretta verso una casa vide una capra che scioltasi durante la notte brucava le cime dei polloni agli ulivi, ond'ella presto presto la ridusse al laccio e prosegui: in questa una donna al bruzzo la prega: mi fareste la carità a darmi una mano a mettermi questo fascio sul capo? e Francesca Domenica, preso il fascio di legne da un lato, le rende il servizio; dopo le chiede: mi sapreste indicare dove potrei trovare bestie da prendere a nolo?","YES"
"Guerrazzi_Francesco_Domenico-Pasquale_Paoli-1860","Guerrazzi Francesco Domenico","Pasquale Paoli","1860","- Ho il fatto vostro, voi non avete a far altro che andare a cotesta casa lassù, e chiedere dello Zembo vetturale. Buon giorno e buon anno, disse Francesca Domenica dando una spinta all'uscio dubitando che a cotesta ora dormissero in casa tuttavia, ma rimase delusa, che si trovò a petto di un'altra donna non meno sollecita di lei, che avendo già acceso il fuoco, e scaldato il latte, adesso ci buttava giù la farina di castagna rimuginando sempre per impedire li zolli, e preparare una scodella di brilloli superlativi; costei levò il capo di su la pignatta e rispose: - Buon giorno. Qual siete?","NO"
"Guerrazzi_Francesco_Domenico-Pasquale_Paoli-1860","Guerrazzi Francesco Domenico","Pasquale Paoli","1860","E che volete? Vorrei pigliare a nolo quattro muli o cavalli per tre o quattro giorni. Gli avete?","NO"
"Guerrazzi_Francesco_Domenico-Pasquale_Paoli-1860","Guerrazzi Francesco Domenico","Pasquale Paoli","1860","Volete darli? Quanto pretendete per giorno? Noi non gli abbiamo tutti; possiamo cercare quelli che mancano; ma dove hanno a ire?","NO"
"Guerrazzi_Francesco_Domenico-Pasquale_Paoli-1860","Guerrazzi Francesco Domenico","Pasquale Paoli","1860","A Corte. Viaggio lungo. - Lungo.","NO"
"Guerrazzi_Francesco_Domenico-Pasquale_Paoli-1860","Guerrazzi Francesco Domenico","Pasquale Paoli","1860","E pericoloso; il mozzo ha da venire con voi? Si. - Strade dove spesso la bestia capitombola; nemici nel paese alla busca, e se si perdono, chi me gli rimette?","YES"
"Guerrazzi_Francesco_Domenico-Pasquale_Paoli-1860","Guerrazzi Francesco Domenico","Pasquale Paoli","1860","I muli non sono mica fatti per istare in convento; coteste strade hanno pure a correre e a ricorrere, e non sarà da oggi che le passeggeranno; quanto a'nemici, è un altro paio di maniche: se vi saranno ritenuti ve ne manderemo altrettanti, e meglio dei vostri. Bo! Spaccata pomontinea 1, e tacque.","YES"
"Guerrazzi_Francesco_Domenico-Pasquale_Paoli-1860","Guerrazzi Francesco Domenico","Pasquale Paoli","1860","Insomma li volete dare o non li volete dare? Assicuratemi prima che me gli rimetterete sani e salvi, poi parleremo del resto. E come volete che io vi assicuri?","YES"
"Guerrazzi_Francesco_Domenico-Pasquale_Paoli-1860","Guerrazzi Francesco Domenico","Pasquale Paoli","1860","Datemi un pegno. Un pegno? Vi darò questa croce di oro?","NO"
