"filename","nome","titolo","anno","chunk","DIL"
"Guerrazzi_Francesco_Domenico-Pasquale_Paoli-1860","Guerrazzi Francesco Domenico","Pasquale Paoli","1860","Piacque il partito, e si spartirono l'isola. Intanto che Arriguccio patteggiava così co' Genovesi, persuadeva ai baroni côrsi non si movessero, aspettassero il destro di coglierli alla spicciolata: nè la occasione si lasciò attendere un pezzo, conciossiachè, stipulato il convegno dei Maonesi, chi andò di qua, chi di là: rimasero insieme due di loro con poca gente, e questi improvvidi assalirono, uno ammazzarono, l'altro fatto prigione ebbe a riscattarsi con seimila fiorini di taglia. I superstiti dei Maonesi, stroppi tra per questi tra per altri casi che si tacciono, un bel giorno, mandata la Corsica dove più tardi Luigi XI mandò Genova, voglio dire al diavolo, grulli grulli se ne tornarono a casa.","NO"
"Guerrazzi_Francesco_Domenico-Pasquale_Paoli-1860","Guerrazzi Francesco Domenico","Pasquale Paoli","1860","Ma quel dovere lasciare la Corsica era per Genova una gran spina al cuore; per la qual cosa la signoria trovandosi meglio fornita di danaro, ripigliata la concessione, ci manda governatore lo Zoaglio, che venuto alle mani con Arriguccio lo sconfisse. Costui, ch'era della razza di Anteo, il quale picchiato un tonfo in terra si rizzava più rompicollo che mai, tornò in Aragona, dove ottenuto qualche sussidio dal re Giovanni, si fa vivo da capo su per le rupi dell'isola: indi a breve la grande computista dei conti umani tirò di frego alla sua vita facendo la somma: mori senza figli, ad eccezione di Francesco bastardo. Accorsero i parenti a stormo urlando: All'albero caduto accetta, accetta!","NO"
"Guerrazzi_Francesco_Domenico-Pasquale_Paoli-1860","Guerrazzi Francesco Domenico","Pasquale Paoli","1860","Chi tira un brandello del suo retaggio, chi l'altro; sicché Francesco, disperato, se non volle rima L nere ignudo, ebbe a vendere al comune di Genova il castello di Cinarca per mille scudi di oro e le ragioni tali quali si trovava a possedere egli sopra la Corsica pomontana 4. Per questo modo tornata in mano della signoria di Genova la stanga del torchio si mise a strizzare a suo bell'aggio il paese, finchè Vincentello d'Istria parente di Arriguccio, non si reputando vincolato dalla vendita di Francesco, tentò più volte ripigliare il suo con armi proprie. Provata la fortuna contraria, si volge secondo l'antico costume al re di Aragona, il quale per questa volta intende usufruttare per sè le pontificie munificenze: sceso armato nell'isola, di leggeri occupa i luoghi aperti, espugna Calvi, mette l'assedio a Bonifazio.","NO"
"Guerrazzi_Francesco_Domenico-Pasquale_Paoli-1860","Guerrazzi Francesco Domenico","Pasquale Paoli","1860","I benestanti, come suole, più studiosi della roba che della libertà, accordano rendersi, dove la città non venga soccorsa dentro certo termine prefisso. La vigilia della scadenza il popolo tumultua e cassa il convenuto; mandansi messi per notificarlo al re Alfonso allegando per causa il soccorso nella notte antecedente entrato in città. Alfonso nega possa essersi intromesso il soccorso e li rinfaccia di fede tradita: i Bonifazini a purgarsi del rimprovero, e in testimonio di verità esibiscono due caci freschi, i quali avevano fatto di latte di donna; di che Alfonso rimase confuso; nondimanco ordinò l'assalto: ma quantunque egli e i suoi ci si adoperassero attorno, con tutti i nervi, rimasero ributtati valorosamente.","NO"
"Guerrazzi_Francesco_Domenico-Pasquale_Paoli-1860","Guerrazzi Francesco Domenico","Pasquale Paoli","1860","Egregie opere in vero sono queste, però con troppo sangue acquistate e per di più per causa non sua. Oh quanto meglio vivere liberi in pace all'ombra della vite e del fico proprii! Se togli Bonifazio, la intera Corsica venne in potestà di Alfonso; ond'ei un bel giorno, buttata giù buffa, impose una taglia di 1 Nel linguaggio côrso equivale oltremontano, e mi pare da adottarsi.. arbitrio.","YES"
"Guerrazzi_Francesco_Domenico-Pasquale_Paoli-1860","Guerrazzi Francesco Domenico","Pasquale Paoli","1860","Il popolo comincia a bollire: allora Vincentello gli dice: «Da pignatta che bolle si allontana la gatta; leva la tassa. » E il re: « Oh bella! e se non posso.","NO"
"Guerrazzi_Francesco_Domenico-Pasquale_Paoli-1860","Guerrazzi Francesco Domenico","Pasquale Paoli","1860","mettere taglie come e quanto mi piace, a che sarei venuto a fare il re? E Vincentello: «Qui tra noi non costuma imporre tasse senza il consenso dei popoli. Il ré, guardatolo fosco, conchiuse: « Questa è mala sudditanza, e se non la sanno i Côrsi, gliela insegneremo noi.","YES"
"Guerrazzi_Francesco_Domenico-Pasquale_Paoli-1860","Guerrazzi Francesco Domenico","Pasquale Paoli","1860","La provvidenza volle che, invece di farla a noi, noi facessimo la lezione a lui, e di che tinta! La più parte dei Catalani lasciò le ossa in Campoloro; al punto stesso Calvi per ardimento di Pietro Baglioni si rivendica in libertà, e quasi presago che il cognome antico sarebbe un giorno infamato dal più grande traditore comparso al mondo dopo Giuda, smesso quello di Baglioni, Pietro assunse meritamente l'altro di libertà. La famiglia Libertà partori di ogni ragione uomini illustri: trapassata in Francia tenne cariche supreme; uno de' suoi difese Marsiglia contro gl' imperiali; e in cotesto paese si estinse.","NO"
"Guerrazzi_Francesco_Domenico-Pasquale_Paoli-1860","Guerrazzi Francesco Domenico","Pasquale Paoli","1860","E' pare destino che, nome o cosa, la libertà, nata e cresciuta in altre terre o in Francia o per cagione di Francia, deva morire! Alfonso, conosciuto che aveva preso a menare l'orso a Modena, maledicendo le fatiche durate e i quattrini rimessi, si parte lasciando l'isola a cui se la vuol pigliare. I Genovesi, arrabattati a strapparsi di mano la patria, adesso non badano a noi, e i baroni riarsi dalla superbia antica si legano insieme per ricuperare la perduta dominazione: il popolo, non sapendo che pesci pigliare, consulta i vescovi, e, come se avesse la virtù della bettonica, questi propongono Roma: chi ce la vuole, e chi non ce la vuole: chi ce la vuole manda gente ad offrire l'isola alla Chiesa..","YES"
"Guerrazzi_Francesco_Domenico-Pasquale_Paoli-1860","Guerrazzi Francesco Domenico","Pasquale Paoli","1860","Eugenio IV con fronte romana bandisce accettarla perchè la commette alla sua fede il consenso univer sale dei popoli; e intanto manda parecchie migliaia di armati a dare sul capo a cui contradicesse. Da quello che pare, a Roma avevano dimenticato la storia côrsa; gliela rinfrescarono alla memoria i Corsi mettendo in pezzi i papalini e Monaldo Paradisi che li capitanava. Allora il papa Nicolò V conobbe più sicuro attenersi alle pratiche de' suoi antecessori, e vendè cotesta manata di spine a Ludovico Campofregoso.","NO"
"Guerrazzi_Francesco_Domenico-Pasquale_Paoli-1860","Guerrazzi Francesco Domenico","Pasquale Paoli","1860","Ora, sebbene con cessino qui i guai cagionati da Roma alla mia povera patria, domando a voi se da persone che rappresentano sopra questa terra il nostro Signore Gesù Cristo potevamo aspettarci più e peggio. Che vi dirò io, signor frate? - rispose il Boswell.","NO"
"Guerrazzi_Francesco_Domenico-Pasquale_Paoli-1860","Guerrazzi Francesco Domenico","Pasquale Paoli","1860","Da per tutto Roma suona la stessa musica. Quel vostro Gregorio VII trasferiva dai Sassoni nei Romani l'Inghilterra, perchè eglino si fossero mostrati poco premurosi di osservare la legge di Canuto circa al pagamento del tributo annuale da farsi a Roma. Offa, dopo ammazzato a tradimento Edelberto, domanda I assoluzione al papa: concedegliela a patto che l'Inghilterra gli paghi ogni anno il danaro di san Pietro, il quale era tassa di un danaro per casa.","NO"
"Guerrazzi_Francesco_Domenico-Pasquale_Paoli-1860","Guerrazzi Francesco Domenico","Pasquale Paoli","1860","L' Inghilterra scontava a contanti il delitto regio! Indi a breve passando il prete improntissimo i modi più avari, instituisce decime sopra i salari, le mercanzie, le paghe ai soldati, che più? fino sul turpe guadagno delle meretrici, indegnissima cosa e non però la più rea: nel vero voi troverete come Gregorio II, inviando il frate Agostino nella Britannia, per convertirne gli abitanti, gli desse per precetto di provvedere cauto, avanzarsi bel bello, chiudere un occhio, se trovasse duro non si opponesse ai sagrifizi delle vittime; quanto sopra la religione cattolica po-.","NO"
"Guerrazzi_Francesco_Domenico-Pasquale_Paoli-1860","Guerrazzi Francesco Domenico","Pasquale Paoli","1860","tesse innestarsi di pagano accettasse, allo scopo che la gente rozza, senza che se ne accorgesse, all'antica religione trovasse sostituita la nuova: cosi, rinnegata la tradizione di Cristo dentro e fuori, la chiesa cattolica è pagana. Tira, tira, un bel giorno la corda si stiantò, e l'Inghilterra si divise per sempre da Roma. - E FACE MALE.","NO"
"Guerrazzi_Francesco_Domenico-Pasquale_Paoli-1860","Guerrazzi Francesco Domenico","Pasquale Paoli","1860","- Come male? Anzi, dopo quanto vi ho inteso ragionare, io non concepisco come voi la duriate monaco. Sareste di quelli, salvo vostro onore, che parlano bene e razzolano male?","NO"
"Guerrazzi_Francesco_Domenico-Pasquale_Paoli-1860","Guerrazzi Francesco Domenico","Pasquale Paoli","1860","- Adagio ai ma' passi, signor Inglese. Io sento e parlo in modo unico. Nè io solo, ma quanti ecclesiastici viviamo in Corsica, conoscendo le rovine originate alla Chiesa dai peccati dei supremi correttori, massime dall' appetito disordinato dei beni terreni, senza rispetto ne riprendiamo gli abusi.","NO"
"Guerrazzi_Francesco_Domenico-Pasquale_Paoli-1860","Guerrazzi Francesco Domenico","Pasquale Paoli","1860","Affermano i curiali di Roma il potere temporale necessario allo splendore della Chiesa. Santa fede! Oh quale altro splendore può pareggiare quello che le viene dalla faccia di Dio?","YES"
"Guerrazzi_Francesco_Domenico-Pasquale_Paoli-1860","Guerrazzi Francesco Domenico","Pasquale Paoli","1860","Ma, conoscendo tuttavia e deplorando le abominazioni della Chiesa, e di quelle con tutto lo spirito supplicando dal Signore riparo, noi non la crediamo meno santa; ammiriamo la vastità del concetto, la efficacia degli ordini secolari, e ci affatichiamo, per quanto è dato a noi oscurissimi figliuoli suoi, a mantenerne incolume la stupenda unità. Ditemi che avete fatto voi altri Inglesi, e con esso voi i luterani, i calvinisti, i zuingliani e soci vostri? Avete preso il male per medicina: invece di rammendare la veste di Cristo, l'avete strappata peggio di prima: non operarono lo stesso i soldati della sua crocifissione?","NO"
"Guerrazzi_Francesco_Domenico-Pasquale_Paoli-1860","Guerrazzi Francesco Domenico","Pasquale Paoli","1860","- Signor frate, - rispose imperturbato il Boswell, - questi argomenti desiderano discussione positiva, GUERRAZZI. Pasquale Paoli. Vol.","NO"
"Guerrazzi_Francesco_Domenico-Pasquale_Paoli-1860","Guerrazzi Francesco Domenico","Pasquale Paoli","1860","I. 9 messi da parte tropi, metafore e figuré rettoriche di ogni maniera. Voi altri siete i soldati della riscossa, e levate i pezzi della disciplina per salvare il dogma.","NO"
"Guerrazzi_Francesco_Domenico-Pasquale_Paoli-1860","Guerrazzi Francesco Domenico","Pasquale Paoli","1860","Ora voi sapete come il cattolicesimo arrivasse a mettere i suoi dogmi in custodia di Dio nel cielo, e degli sbirri in terra: inondando la barbarie, preti rozzi stettero al governo spirituale e sovente al temporale di popoli più rozzi: costoro fecero a gara a cui guastava di più, ma le sconcezze nel buio non apparivano. Più tardi, anzi troppo tardi, alcuni prelati romani, dotti quanto pii, conobbero dove stringeva la scarpa, ma che farci? Ormai la natta tanto era ingrossata che tagliandola correvano risico di ammazzare l'infermo; e la sbagliarono, perchè i medici pietosi sono proprio i babbi del canchero: di fatti gl'increduli trassero pro dagli errori per dissuadere da ogni fede, gli empi per mandare tutto a rifascio sotto il flagello dello scherno.","NO"
"Guerrazzi_Francesco_Domenico-Pasquale_Paoli-1860","Guerrazzi Francesco Domenico","Pasquale Paoli","1860","Dio è la regola, il Vangelo la chiosa; chiosa su chiosa è mestiere da mozzorecchi. Il cristianesimo, che taglia dalla pazza, può accomodare ottimamente di vesti la umanità mano a mano che cresce: i preți cattolici vollero stringere troppo e per sempre, quindi la cintura stiantò in più parti e tornerà a stiantarsi da capo: avendo eglino preteso non solo il concetto, bensi ancora le parole infallibili, adesso discredono l'uno e le altre. Che abbiamo fatto noi, domandate?","YES"
"Guerrazzi_Francesco_Domenico-Pasquale_Paoli-1860","Guerrazzi Francesco Domenico","Pasquale Paoli","1860","Noi abbiamo rotto i cancelli alla libera indagine, la quale come le altre libertà sorelle deve appuntare in Dio padre misericordioso di tutte. - Zucche! Voi avete rinnovata Babele.","NO"
"Guerrazzi_Francesco_Domenico-Pasquale_Paoli-1860","Guerrazzi Francesco Domenico","Pasquale Paoli","1860","Tot capita, tot sententiæ. Fortunato quegli che sa distinguere con voi da che parte tira la tramontana e da quale altra mezzodi! Per me quello starsi fermo come torre che fa la Chiesa per bene diciotto secoli contro le persecuzioni dei suoi nemici, e più ancora contro le prevaricazioni dei suoi indegni pastori, emmi non dubbia prova dello aiuto divino.","NO"
"Guerrazzi_Francesco_Domenico-Pasquale_Paoli-1860","Guerrazzi Francesco Domenico","Pasquale Paoli","1860","Se Dio non la governasse con le sue sante mani, ormai pei papi la Chiesa avrebbe dato in secco chi sa da quanti secoli! Cotesto vostro è l'argomento di Abramo giudeo quando, dopo essere stato in corte di Roma, volle il Battesimo; lo racconta il Boccaccio nelle Novelle... Io l'ho letto dentro il commento della Divina Commedia scritto da Benvenuto da Imola, - rispose fra Bernardino con voce alterata.","YES"
"Guerrazzi_Francesco_Domenico-Pasquale_Paoli-1860","Guerrazzi Francesco Domenico","Pasquale Paoli","1860","- Bene; egli è tutto uno, chè la botte non fa il vino. Ma diamo un taglio a questi discorsi, chè io non venni in Corsica a disputare di teologia: torniamo sul tasto dei forestieri. La Corsica adesso è capitata nelle branche a san Giorgio, voglio dire della Banca di san Giorgio.","NO"
"Guerrazzi_Francesco_Domenico-Pasquale_Paoli-1860","Guerrazzi Francesco Domenico","Pasquale Paoli","1860","Questa compagnia è un banco che ha leggi e governatori a parte, prestava e presta al governo, il quale gli commise in appalto bestie, cristiani, gabeile, rendite, città, castelli e provincie quando il governo ne aveva: San Giorgio arrolò eserciti, allesti armate, sottomise paesi, dettò codici, institui tribunali, fece giustizia; insomma fu ed è Stato dentro lo Stato: non manca gente che lo ammiri; gusti da donne gravide. Quanto a me lo giudico censura solennissima della repubblica ligure; imperciocchè, badate a me, aut, aut: o sperimentano buona cotesta amministrazione in preferenza del governo ordinario, e allora quella si tengano, questo mandino allo scorticatoio; o la faccenda va all' opposto, ed allora io non capisco come un reggimento bene ordinato patisca quel calcio in gola., Soprattutto io poi lo considero prova manifesta ed incentivo ad un punto del disamore che i Genovesi hanno per la patria. Per lui si chiarisce come una parte di Genovesi, messi in salvo gli averi, si dieno senza pietà a ruinare la patria: per lui l'altra parte, sicura di non perdere i danari, lascia nabissare ogni cosa; mentre se, sprofondata la patria, vedessero andarle dietro le fortune private, se non per benevolenza, almanco per avarizia i Genovesi si rimarrebbero da mal fare.","YES"
"Guerrazzi_Francesco_Domenico-Pasquale_Paoli-1860","Guerrazzi Francesco Domenico","Pasquale Paoli","1860","Il Banco, solito a volere i negozi spicci, conobbe che il nodo stava nello abbattere con gli aiuti della Terra del Comune i baroni pomontani; nè riputò disperato lo assunto, conciossiachè, quantunque costoro fossero parecchi, pure, nel modo che gli universi fiumi della Corsica mettono foce nel Golo e nel Tavignano, si riunivano tutti sotto le due case della Rocca e da Leca. Pel Banco di san Giorgio ogni partito buono, ma sopra gli altri gli piacquero il fuoco, il tradimento, il coltello. Antonio Calvo governatore fece una ghiacciata di ventiquattro baroni ad un tratto; gli altri fuggirono via atterriti riparando a Napoli.","NO"
"Guerrazzi_Francesco_Domenico-Pasquale_Paoli-1860","Guerrazzi Francesco Domenico","Pasquale Paoli","1860","Beati loro se la volontà o gli anni li persuadevano a starsi in esiglio! E' vollero perfidiare nel cimento delle armi; e su le prime andò bene, chè Vincenzo da Leca, sorpreso Ambrogio Marabotto in quella che stava per entrare in Cinarca, lo tagliò a pezzi con tutti i suoi. Se non che Antonio Spinola governatore, considerando come a mantenere viva la nuova guerra contribuivano massimamente gli aiuti che cotesti signori cavavano dal contado del Niolo divotissimo a loro, trovò partito più certo essere quello di sterminarlo e così fece: la desolazione e la morte percossero tutto il tratto di paese che giace tra Soana e Calvi: il passeggero che attraversa quel deserto, il quale nel suo silenzo maledice la straniera dominazione più che non potrebbero fare cento predicatori, sente venirsi addosso il ribrezzo della febbre.","YES"
"Guerrazzi_Francesco_Domenico-Pasquale_Paoli-1860","Guerrazzi Francesco Domenico","Pasquale Paoli","1860","Ciò fatto, per mezzo di con giunti da bene fa sapere ai da Leca che, ove si disponessero venire alla obbedienza, li perdonerebbe ; chiesto di confermare la promessa con giuramento, giura. Fidasi Vincenzo, ma non si fida Giocante, che la scapola, conservandosi a tempo men reo. Lo Spinola, avuti nelle mani Vincenzo, Mannone suo padre di ottant'anni vecchio e due bastardi di Renuccio da Leca, senza misericordia macellò; ai quali aggiunse contro la religione dei patti quattro baroni di casa Rôcca, Antonio e il figlio, Arrigo e il figliuolo del conte Polo.","NO"
"Guerrazzi_Francesco_Domenico-Pasquale_Paoli-1860","Guerrazzi Francesco Domenico","Pasquale Paoli","1860","Cotesto Spinola indi a poco moriva di un trabocco di sangue; ed era ragione, ne aveva bevuto tanto che non bastava a capirlo. In questa, Genova sciolto un nodo ne lega un altro: dopo avere sperimentato tanti signori paesani, pare che voglia rifarsi la bocca tastando la straniera serviti: cacciati pertanto i Fregosi, si dà in balía di Francesco Sforza e noi gli porge pecore da tosare di seconda mano. Ecco in Corsica gente insolita, consueti supplizii: il Cotta vice-duca, per conto di non so quale tumulto, manda di punto in bianco su le forche una brigata di vassalli di baroni; e poichè cane non morse mai Côrso ch' ei non volesse del suo pelo, i popoli di Terra di Comune presero le armi e si elessero a capitano un secondo Sambucuccio di Alando, che fece ritirare le mani a cotesto sollecito Cotta.","YES"
"Guerrazzi_Francesco_Domenico-Pasquale_Paoli-1860","Guerrazzi Francesco Domenico","Pasquale Paoli","1860","Anco i duchi di Milano passarono; Francesco Sforza morì; Galeazzo Maria suo figliuolo rimase spento della morte dei tiranni senza che ne approdasse la libertà. Ora San Giorgio ripiglia l'isola, disfà la lega di Tommaso Fregoso e Giampaolo da Leca, cacciando l'uno in prigione, l'altro in esilio. Sorge vendicatore Renuccio da Leca.","NO"
"Guerrazzi_Francesco_Domenico-Pasquale_Paoli-1860","Guerrazzi Francesco Domenico","Pasquale Paoli","1860","Potevano i Genovesi vincerlo in guerra, ma parve caro, e gli proferirono uno spediente di molto risparmio. Capitato a sorte un figliuolo di Renuccio a Genova, lo acciuffano, poi, pensando cavarne partito migliore, lo rimandano in Corsica in compagnia di Filippino Fiesco amico vecchio di casa. Qui giunti il Fiesco fa sapere a Renuccio che, se ha caro il riscatto del figliuolo, vada per esso.","NO"
"Guerrazzi_Francesco_Domenico-Pasquale_Paoli-1860","Guerrazzi Francesco Domenico","Pasquale Paoli","1860","Renuccio, che accivettato uomo era, non si fida e continua a starsi chiuso nel castello di Zirlina: allora Fiesco va a trovarlo e negozia con lui la restituzione del figliuolo e l'accordo con Genova. Renuccio, vergognoso di mostrare diffidenza o paura, si consiglia visitare l'amico; il diavolo lo tira: preso e incatenato, dopo breve spazio di tempo muore nelle prigioni di Genova; gli storici genovesi scrivono di malattia e non hanno torto, perchè anco un capestro al collo è infermità e di che tinta! In questo modo finiva la potentissima casata dei baroni da Leca; rimaneva adesso l'altra della Rocca, sbattuta è vero, tuttavia sempre tale da mettere in soggezione.","NO"
"Guerrazzi_Francesco_Domenico-Pasquale_Paoli-1860","Guerrazzi Francesco Domenico","Pasquale Paoli","1860","I Genovesi prima di venire in essa a mezza spada spedirono governatore nell'isola Ambrogio di Negri personaggio rotto alle più sottili arti di governare i popoli. Costui s'ingegnò staccare i Côrsi dall' affezione dei loro signor eccitando la vanità del popolo, blandendo la superbia dei caporali e principalmente saziando la cupidità di tutti: così seminato il terreno da Ambrogio di Negri, il Banco di san Giorgio mandò la falce tagliente a mietere, e la falce fu Nicolò Doria. I Doria stettero un giorno e credo tuttavia durino emuli degli Spinola; e poichè si era poco prima acquistato Nicolò Spinola bella fama tra i suoi per avere menato sterminio del paese tra Calvie Soana, Nicolò Doria, dopo avere vinto Renuccio della Rocca, a fine di precidere i nervi ai baroni, delibera condurre all'ultima rovina il Niolo, sul quale essi per ordinario facevano fondamento.","NO"
"Guerrazzi_Francesco_Domenico-Pasquale_Paoli-1860","Guerrazzi Francesco Domenico","Pasquale Paoli","1860","Essendosi pertanto il nuovo governatore introdotto nella terra, assai forte su le armi, chiese per pegno di fedeltà sessanta ostaggi delle principali famiglie promettendo averne buona cura: avutili nelle mani, bandisce tutto il popolo esca dalla isola non badati sesso nè età. Un popolo intero ebbe ad esúlare disperdendosi per le terre d'Italia; e fu sentenza dove uomo durava fatica a distinguere se la empietà superasse la mattia, perchè i villani stessi ingrassano l'agnello per ammazzarlo a pasqua, e nol cacciano via dal presepio. Peggio accadde a Talavo, se pure peggio può dirsi la morte in paragone della vita sofferta lontano dalla patria.","NO"
"Guerrazzi_Francesco_Domenico-Pasquale_Paoli-1860","Guerrazzi Francesco Domenico","Pasquale Paoli","1860","Il prode uomo manda a sangue tutto il popolo di cotesto paese alla rinfusa, tranne una donna chiamata Lucrezia delle Vie, la quale ebbe ad ammazzarsi da sè per fuggire vergogna. Grande cosa ella è questa, che il nome di Lucrezia comparisca fatale in Italia; imperciocchè tre Lucrezie ci si ammazzarono per istudio di pudicizia e di carità patria, Lucrezia Mazzanti a Firenze, Lucrezia delle Vie in Corsica e la più antica Lucrezia a Roma. Le prime due, forse le più innocenti, perirono invano; fortunata l'ultima.","NO"
"Guerrazzi_Francesco_Domenico-Pasquale_Paoli-1860","Guerrazzi Francesco Domenico","Pasquale Paoli","1860","Di tre, una giovò, e se, come di quelli delle donne, andasse pei sacrifizi degli uomini, avventurosi noi! Quando Renuccio udi coteste nuove, dubitò tutto il mondo gli cascasse addosso: come poteva starsi in Genova tranquillo mentre menavano siffatto scempio dei popoli devoti alla sua casa? La sua quiete non sarebbe stata argomento ch' egli avesse venduto il suo sangue a oncia a oncia?","YES"
"Guerrazzi_Francesco_Domenico-Pasquale_Paoli-1860","Guerrazzi Francesco Domenico","Pasquale Paoli","1860","Se lo appellassero Giuda, non gli sarebbe parso che gli dessero il suo avere. Racimola quello che può di genti e di armi, e ricomparisce su i campi. Le arti del Di Negri cosi partorirono pessimi effetti, che i Genovesi poterono opporre a Renuccio cavalli côrsi capitanati da un Cacciaguerra corso.","NO"
"Guerrazzi_Francesco_Domenico-Pasquale_Paoli-1860","Guerrazzi Francesco Domenico","Pasquale Paoli","1860","Incontra 1 ronsi in campagna, e non appena si videro (chè di ogni odio più bestiale è il fraterno), l'uno si avventò contro l'altro, si annodarono, nè si sciolsero prima che Cacciaguerra cadesse in terra sbranato. Poichè i Côrsi per mutue ferite si fecero scemi di sangue, Nicolò cauto con molta brigata si presenta a disperdere Renuccio della Rocca stremo di forze: impresa copiosa di sicurezza, vuota di gloria; ma che importava al Genovese la gloria? Qui fu che apparve intera la virtù di Renuccio; imperciocchè, essendogli morto sotto il cavallo, e trovandosi travolto nella fuga, appena potè districarsi dai suoi, egli tornò addietro solo per tagliare la cinghia della sella, la quale postasi sul capo in mezzo a un turbine di archibugiate nemiche riparò incolume fra i suoi gridando: < Di me Genova non vanti trofeol, La guerra tirava in lungo, e ormai questo Côrso diventava un cattivo affare nelle mani dei mercanti Genovesi: si posero a vedere se ci era verso di finirla a buon mercato, ed anco per questa volta lo trovarono.","NO"
