"filename","nome","titolo","anno","chunk","DIL"
"Leopardi_Giacomo-Operette_morali-1834","Leopardi Giacomo","Operette morali","1834","Come quello di là? Venditore. Più più, illustrissimo.","YES"
"Leopardi_Giacomo-Operette_morali-1834","Leopardi Giacomo","Operette morali","1834","Passegere. Ma come qual altro? Non vi piacerebb'egli che l'anno nuovo fosse come qualcuno di questi anni ultimi?","YES"
"Leopardi_Giacomo-Operette_morali-1834","Leopardi Giacomo","Operette morali","1834","Venditore. Signor no, non mi piacerebbe. Passegere.","NO"
"Leopardi_Giacomo-Operette_morali-1834","Leopardi Giacomo","Operette morali","1834","Quanti anni nuovi sono passati da che voi vendete almanacchi? Venditore. Saranno vent'anni, illustrissimo.","NO"
"Leopardi_Giacomo-Operette_morali-1834","Leopardi Giacomo","Operette morali","1834","Passegere. A quale di cotesti vent'anni vorreste che somigliasse l'anno venturo? Venditore.","NO"
"Leopardi_Giacomo-Operette_morali-1834","Leopardi Giacomo","Operette morali","1834","Io? non saprei. Passegere.","NO"
"Leopardi_Giacomo-Operette_morali-1834","Leopardi Giacomo","Operette morali","1834","Non vi ricordate di nessun anno in particolare, che vi paresse felice? Venditore. No in verità, illustrissimo.","NO"
"Leopardi_Giacomo-Operette_morali-1834","Leopardi Giacomo","Operette morali","1834","Passegere.E pure la vita è una cosa bella. Non è vero? Venditore.","NO"
"Leopardi_Giacomo-Operette_morali-1834","Leopardi Giacomo","Operette morali","1834","Cotesto si sa. Passegere. Non tornereste voi a vivere cotesti vent'anni, e anche tutto il tempo passato, cominciando da che nasceste?","YES"
"Leopardi_Giacomo-Operette_morali-1834","Leopardi Giacomo","Operette morali","1834","Venditore. Eh, caro signore, piacesse a Dio che si potesse. Passegere.Ma se aveste a rifare la vita che avete fatta né più né meno, con tutti i piaceri e i dispiaceri che avete passati?","NO"
"Leopardi_Giacomo-Operette_morali-1834","Leopardi Giacomo","Operette morali","1834","Venditore. Cotesto non vorrei. Passegere.Oh che altra vita vorreste rifare?","NO"
"Leopardi_Giacomo-Operette_morali-1834","Leopardi Giacomo","Operette morali","1834","la vita ch'ho fatta io, o quella del principe, o di chi altro? O non credete che io, e che il principe, e che chiunque altro, risponderebbe come voi per l'appunto; e che avendo a rifare la stessa vita che avesse fatta, nessuno vorrebbe tornare indietro? Venditore.","YES"
"Leopardi_Giacomo-Operette_morali-1834","Leopardi Giacomo","Operette morali","1834","Lo credo cotesto. Passegere. Né anche voi tornereste indietro con questo patto, non potendo in altro modo?","YES"
"Leopardi_Giacomo-Operette_morali-1834","Leopardi Giacomo","Operette morali","1834","Venditore. Signor no davvero, non tornerei. Passegere.","NO"
"Leopardi_Giacomo-Operette_morali-1834","Leopardi Giacomo","Operette morali","1834","Oh che vita vorreste voi dunque? Venditore. Vorrei una vita così, come Dio me la mandasse, senz'altri patti.","NO"
"Leopardi_Giacomo-Operette_morali-1834","Leopardi Giacomo","Operette morali","1834","Passegere. Una vita a caso, e non saperne altro avanti, come non si sa dell'anno nuovo? Venditore.","NO"
"Leopardi_Giacomo-Operette_morali-1834","Leopardi Giacomo","Operette morali","1834","Appunto. Passegere. Così vorrei ancor io se avessi a rivivere, e così tutti.","YES"
"Leopardi_Giacomo-Operette_morali-1834","Leopardi Giacomo","Operette morali","1834","Ma questo è segno che il caso, fino a tutto quest'anno, ha trattato tutti male. E si vede chiaro che ciascuno è d'opinione che sia stato più o di più peso il male che gli è toccato, che il bene; se a patto di riavere la vita di prima, con tutto il suo bene e il suo male, nessuno vorrebbe rinascere. Quella vita ch'è una cosa bella, non è la vita che si conosce, ma quella che non si conosce; non la vita passata, ma la futura.","NO"
"Leopardi_Giacomo-Operette_morali-1834","Leopardi Giacomo","Operette morali","1834","Coll'anno nuovo, il caso incomincerà a trattar bene voi e me e tutti gli altri, e si principierà la vita felice. Non è vero? Venditore.Speriamo.","NO"
"Leopardi_Giacomo-Operette_morali-1834","Leopardi Giacomo","Operette morali","1834","Passegere. Dunque mostratemi l'almanacco più bello che avete. Venditore.","NO"
"Leopardi_Giacomo-Operette_morali-1834","Leopardi Giacomo","Operette morali","1834","Ecco, illustrissimo. Cotesto vale trenta soldi. Passegere.","NO"
"Leopardi_Giacomo-Operette_morali-1834","Leopardi Giacomo","Operette morali","1834","Ecco trenta soldi. Venditore. Grazie, illustrissimo: a rivederla.","NO"
"Leopardi_Giacomo-Operette_morali-1834","Leopardi Giacomo","Operette morali","1834","Almanacchi, almanacchi nuovi; lunari nuovi. DIALOGO DI TRISTANO E DI UN AMICO Amico.","NO"
"Leopardi_Giacomo-Operette_morali-1834","Leopardi Giacomo","Operette morali","1834","Ho letto il vostro libro. Malinconico al vostro solito. Tristano.Sì, al mio solito.","NO"
"Leopardi_Giacomo-Operette_morali-1834","Leopardi Giacomo","Operette morali","1834","Amico. Malinconico, sconsolato, disperato; si vede che questa vita vi pare una gran brutta cosa. Tristano.Che v'ho a dire?","NO"
"Leopardi_Giacomo-Operette_morali-1834","Leopardi Giacomo","Operette morali","1834","io aveva fitta in capo questa pazzia, che la vita umana fosse infelice. Amico. Infelice sì forse.","NO"
"Leopardi_Giacomo-Operette_morali-1834","Leopardi Giacomo","Operette morali","1834","Ma pure alla fine. Tristano.No no, anzi felicissima. Ora ho cambiata opinione.","YES"
"Leopardi_Giacomo-Operette_morali-1834","Leopardi Giacomo","Operette morali","1834","Ma quando scrissi cotesto libro, io aveva quella pazzia in capo, come vi dico. E n'era tanto persuaso, che tutt'altro mi sarei aspettato, fuorché sentirmi volgere in dubbio le osservazioni ch'io faceva in quel proposito, parendomi che la coscienza d'ogni lettore dovesse rendere prontissima testimonianza a ciascuna di esse. Solo immaginai che nascesse disputa dell'utilità o del danno di tali osservazioni, ma non mai della verità: anzi mi credetti che le mie voci lamentevoli, per essere i mali comuni, sarebbero ripetute in cuore da ognuno che le ascoltasse.","YES"
"Leopardi_Giacomo-Operette_morali-1834","Leopardi Giacomo","Operette morali","1834","E sentendo poi negarmi, non qualche proposizione particolare, ma il tutto, e dire che la vita non è infelice, e che se a me pareva tale, doveva essere effetto d'infermità, o d'altra miseria mia particolare, da prima rimasi attonito, sbalordito, immobile come un sasso, e per più giorni credetti di trovarmi in un altro mondo; poi, tornato in me stesso, mi sdegnai un poco; poi risi, e dissi: gli uomini sono in generale come i mariti. I mariti, se vogliono viver tranquilli, è necessario che credano le mogli fedeli, ciascuno la sua; e così fanno; anche quando la metà del mondo sa che il vero è tutt'altro. Chi vuole o dee vivere in un paese, conviene che lo creda uno dei migliori della terra abitabile; e lo crede tale.","YES"
"Leopardi_Giacomo-Operette_morali-1834","Leopardi Giacomo","Operette morali","1834","Gli uomini universalmente, volendo vivere, conviene che credano la vita bella e pregevole; e tale la credono; e si adirano contro chi pensa altrimenti. Perché in sostanza il genere umano crede sempre, non il vero, ma quello che è, o pare che sia, più a proposito suo. Il genere umano, che ha creduto e crederà tante scempiataggini, non crederà mai né di non saper nulla, né di non essere nulla, né di non aver nulla a sperare.","NO"
"Leopardi_Giacomo-Operette_morali-1834","Leopardi Giacomo","Operette morali","1834","Nessun filosofo che insegnasse l'una di queste tre cose, avrebbe fortuna né farebbe setta, specialmente nel popolo: perché, oltre che tutte tre sono poco a proposito di chi vuol vivere, le due prime offendono la superbia degli uomini, la terza, anzi ancora le altre due, vogliono coraggio e fortezza d'animo a essere credute. E gli uomini sono codardi, deboli, d'animo ignobile e angusto; docili sempre a sperar bene, perché sempre dediti a variare le opinioni del bene secondo che la necessità governa la loro vita; prontissimi a render l'arme, come dice il Petrarca,(1)alla loro fortuna, prontissimi e risolutissimi a consolarsi di qualunque sventura, ad accettare qualunque compenso in cambio di ciò che loro è negato o di ciò che hanno perduto, ad accomodarsi con qualunque condizione a qualunque sorte più iniqua e più barbara, e quando sieno privati d'ogni cosa desiderabile, vivere di credenze false, così gagliarde e ferme, come se fossero le più vere o le più fondate del mondo. Io per me, come l'Europa meridionale ride dei mariti innamorati delle mogli infedeli, così rido del genere umano innamorato della vita; e giudico assai poco virile il voler lasciarsi ingannare e deludere come sciocchi, ed oltre ai mali che si soffrono, essere quasi lo scherno della natura e del destino.","NO"
"Leopardi_Giacomo-Operette_morali-1834","Leopardi Giacomo","Operette morali","1834","Parlo sempre degl'inganni non dell'immaginazione, ma dell'intelletto. Se questi miei sentimenti nascano da malattia, non so: so che, malato o sano, calpesto la vigliaccheria degli uomini, rifiuto ogni consolazione e ogn'inganno puerile, ed ho il coraggio di sostenere la privazione di ogni speranza, mirare intrepidamente il deserto della vita, non dissimularmi nessuna parte dell'infelicità umana, ed accettare tutte le conseguenze di una filosofia dolorosa, ma vera. La quale se non è utile ad altro, procura agli uomini forti la fiera compiacenza di vedere strappato ogni manto alla coperta e misteriosa crudeltà del destino umano.","NO"
"Leopardi_Giacomo-Operette_morali-1834","Leopardi Giacomo","Operette morali","1834","Io diceva queste cose fra me, quasi come se quella filosofia dolorosa fosse d'invenzione mia; vedendola così rifiutata da tutti, come si rifiutano le cose nuove e non più sentite. Ma poi, ripensando, mi ricordai ch'ella era tanto nuova, quanto Salomone e quanto Omero, e i poeti e i filosofi più antichi che si conoscano; i quali tutti sono pieni pienissimi di figure, di favole, di sentenze significanti l'estrema infelicità umana; e chi di loro dice che l'uomo è il più miserabile degli animali; chi dice che il meglio è non nascere, e per chi è nato, morire in cuna; altri, che uno che sia caro agli Dei, muore in giovanezza, ed altri altre cose infinite su questo andare. (2)E anche mi ricordai che da quei tempi insino a ieri o all'altr'ieri, tutti i poeti e tutti i filosofi e gli scrittori grandi e piccoli, in un modo o in un altro, avevano ripetute o confermate le stesse dottrine.","NO"
"Leopardi_Giacomo-Operette_morali-1834","Leopardi Giacomo","Operette morali","1834","Sicché tornai di nuovo a maravigliarmi: e così tra la maraviglia e lo sdegno e il riso passai molto tempo: finché studiando più profondamente questa materia, conobbi che l'infelicità dell'uomo era uno degli errori inveterati dell'intelletto, e che la falsità di questa opinione, e la felicità della vita, era una delle grandi scoperte del secolo decimonono. Allora m'acquetai, e confesso ch'io aveva il torto a credere quello ch'io credeva. Amico.","NO"
"Leopardi_Giacomo-Operette_morali-1834","Leopardi Giacomo","Operette morali","1834","E avete cambiata opinione? Tristano. Sicuro.","NO"
"Leopardi_Giacomo-Operette_morali-1834","Leopardi Giacomo","Operette morali","1834","Volete voi ch'io contrasti alle verità scoperte dal secolo decimonono? Amico.E credete voi tutto quello che crede il secolo? Tristano.Certamente.","NO"
"Leopardi_Giacomo-Operette_morali-1834","Leopardi Giacomo","Operette morali","1834","Oh che maraviglia? Amico.Credete dunque alla perfettibilità indefinita dell'uomo? Tristano.Senza dubbio.","NO"
"Leopardi_Giacomo-Operette_morali-1834","Leopardi Giacomo","Operette morali","1834","Amico. Credete che in fatti la specie umana vada ogni giorno migliorando?. Tristano.","NO"
"Leopardi_Giacomo-Operette_morali-1834","Leopardi Giacomo","Operette morali","1834","Sì certo. È ben vero che alcune volte penso che gli antichi valevano, delle forze del corpo, ciascuno per quattro di noi. E il corpo è l'uomo; perché (lasciando tutto il resto) la magnanimità, il coraggio, le passioni, la potenza di fare, la potenza di godere, tutto ciò che fa nobile e viva la vita, dipende dal vigore del corpo, e senza quello non ha luogo.","NO"
"Leopardi_Giacomo-Operette_morali-1834","Leopardi Giacomo","Operette morali","1834","Uno che sia debole di corpo, non è uomo, ma bambino; anzi peggio; perché la sua sorte è di stare a vedere gli altri che vivono, ed esso al più chiacchierare, ma la vita non è per lui. E però anticamente la debolezza del corpo fu ignominiosa, anche nei secoli più civili. Ma tra noi già da lunghissimo tempo l'educazione non si degna di pensare al corpo, cosa troppo bassa e abbietta: pensa allo spirito; e appunto volendo coltivare lo spirito, rovina il corpo; senza avvedersi che rovinando questo, rovina a vicenda anche lo spirito.","NO"
"Leopardi_Giacomo-Operette_morali-1834","Leopardi Giacomo","Operette morali","1834","E dato che si potesse rimediare in ciò all'educazione, non si potrebbe mai senza mutare radicalmente lo stato moderno della società, trovare rimedio che valesse in ordine alle altre parti della vita privata e pubblica, che tutte, di proprietà loro, cospirarono anticamente a perfezionare o a conservare il corpo, e oggi cospirano a depravarlo. L'effetto è che a paragone degli antichi noi siamo poco più che bambini, e che gli antichi a confronto nostro si può dire più che mai che furono uomini. Parlo così degl'individui paragonati agl'individui, come delle masse (per usare questa leggiadrissima parola moderna) paragonate alle masse.","NO"
"Leopardi_Giacomo-Operette_morali-1834","Leopardi Giacomo","Operette morali","1834","Ed aggiungo che gli antichi furono incomparabilmente più virili di noi anche ne' sistemi di morale e di metafisica. A ogni modo io non mi lascio muovere da tali piccole obbiezioni, credo costantemente che la specie umana vada sempre acquistando. Amico.","NO"
"Leopardi_Giacomo-Operette_morali-1834","Leopardi Giacomo","Operette morali","1834","Credete ancora, già s'intende, che il sapere, o, come si dice, i lumi, crescano continuamente. Tristano. Certissimo.","NO"
"Leopardi_Giacomo-Operette_morali-1834","Leopardi Giacomo","Operette morali","1834","Sebbene vedo che quanto cresce la volontà d'imparare, tanto scema quella di studiare. Ed è cosa che fa maraviglia a contare il numero dei dotti, ma veri dotti, che vivevano contemporaneamente cencinquant'anni addietro, e anche più tardi, e vedere quanto fosse smisuratamente maggiore di quello dell'età presente. Né mi dicano che i dotti sono pochi perché in generale le cognizioni non sono più accumulate in alcuni individui, ma divise fra molti; e che la copia di questi compensa la rarità di quelli.","NO"
"Leopardi_Giacomo-Operette_morali-1834","Leopardi Giacomo","Operette morali","1834","Le cognizioni non sono come le ricchezze, che si dividono e si adunano, e sempre fanno la stessa somma. Dove tutti sanno poco, e' si sa poco; perché la scienza va dietro alla scienza, e non si sparpaglia. L'istruzione superficiale può essere, non propriamente divisa fra molti, ma comune a molti non dotti.","NO"
"Leopardi_Giacomo-Operette_morali-1834","Leopardi Giacomo","Operette morali","1834","Il resto del sapere non appartiene se non a chi sia dotto, e gran parte di quello a chi sia dottissimo. E, levati i casi fortuiti, solo chi sia dottissimo, e fornito esso individualmente di un immenso capitale di cognizioni, è atto ad accrescere solidamente e condurre innanzi il sapere umano. Ora, eccetto forse in Germania, donde la dottrina non è stata ancora potuta snidare, non vi par egli che il veder sorgere di questi uomini dottissimi divenga ogni giorno meno possibile?","NO"
"Leopardi_Giacomo-Operette_morali-1834","Leopardi Giacomo","Operette morali","1834","Io fo queste riflessioni così per discorrere, e per filosofare un poco, o forse sofisticare; non ch'io non sia persuaso di ciò che voi dite. Anzi quando anche vedessi il mondo tutto pieno d'ignoranti impostori da un lato, e d'ignoranti presuntuosi dall'altro, nondimeno crederei, come credo, che il sapere e i lumi crescano di continuo. Amico.","NO"
"Leopardi_Giacomo-Operette_morali-1834","Leopardi Giacomo","Operette morali","1834","In conseguenza, credete che questo secolo sia superiore a tutti i passati. Tristano. Sicuro.","NO"
"Leopardi_Giacomo-Operette_morali-1834","Leopardi Giacomo","Operette morali","1834","Così hanno creduto di se tutti i secoli, anche i più barbari; e così crede il mio secolo, ed io con lui. Se poi mi dimandaste in che sia egli superiore agli altri secoli, se in ciò che appartiene al corpo o in ciò che appartiene allo spirito, mi rimetterei alle cose dette dianzi. Amico.In somma, per ridurre il tutto in due parole, pensate voi circa la natura e i destini degli uomini e delle cose (poiché ora non parliamo di letteratura né di politica) quello che ne pensano i giornali?","NO"
"Leopardi_Giacomo-Operette_morali-1834","Leopardi Giacomo","Operette morali","1834","Tristano. Appunto. Credo ed abbraccio la profonda filosofia de' giornali, i quali uccidendo ogni altra letteratura e ogni altro studio, massimamente grave e spiacevole, sono maestri e luce dell'età presente.","NO"
"Leopardi_Giacomo-Operette_morali-1834","Leopardi Giacomo","Operette morali","1834","Non è vero? Amico. Verissimo.","NO"
"Leopardi_Giacomo-Operette_morali-1834","Leopardi Giacomo","Operette morali","1834","Se cotesto che dite, è detto da vero e non da burla, voi siete diventato de' nostri. Tristano.Sì certamente, de' vostri. Amico.Oh dunque, che farete del vostro libro?","NO"
"Leopardi_Giacomo-Operette_morali-1834","Leopardi Giacomo","Operette morali","1834","Volete che vada ai posteri con quei sentimenti così contrari alle opinioni che ora avete? Tristano.Ai posteri? Io rido, perché voi scherzate; e se fosse possibile che non ischerzaste, più riderei.","NO"
"Leopardi_Giacomo-Operette_morali-1834","Leopardi Giacomo","Operette morali","1834","Non dirò a riguardo mio, ma a riguardo d'individui o di cose individuali del secolo decimonono, intendete bene che non v'è timore di posteri, i quali ne sapranno tanto, quanto ne seppero gli antenati. Gl'individui sono spariti dinanzi alle masse, dicono elegantemente i pensatori moderni. Il che vuol dire ch'è inutile che l'individuo si prenda nessun incomodo, poiché, per qualunque suo merito, né anche quel misero premio della gloria gli resta più da sperare né in vigilia né in sogno.","NO"
"Leopardi_Giacomo-Operette_morali-1834","Leopardi Giacomo","Operette morali","1834","Lasci fare alle masse; le quali che cosa sieno per fare senza individui, essendo composte d'individui, desidero e spero che me lo spieghino gl'intendenti d'individui e di masse, che oggi illuminano il mondo. Ma per tornare al proposito del libro e de' posteri, i libri specialmente, che ora per lo più si scrivono in minor tempo che non ne bisogna a leggerli, vedete bene che, siccome costano quel che vagliono, così durano a proporzione di quel che costano. Io per me credo che il secolo venturo farà un bellissimo frego sopra l'immensa bibliografia del secolo decimonono; ovvero dirà: io ho biblioteche intere di libri che sono costati quali venti, quali trenta anni di fatiche, e quali meno, ma tutti grandissimo lavoro.","NO"
"Leopardi_Giacomo-Operette_morali-1834","Leopardi Giacomo","Operette morali","1834","Leggiamo questi prima, perché la verisimiglianza è che da loro si cavi maggior costrutto; e quando di questa sorta non avrò più che leggere, allora metterò mano ai libri improvvisati. Amico mio, questo secolo è un secolo di ragazzi, e i pochissimi uomini che rimangono, si debbono andare a nascondere per vergogna, come quello che camminava diritto in paese di zoppi. E questi buoni ragazzi vogliono fare in ogni cosa quello che negli altri tempi hanno fatto gli uomini, e farlo appunto da ragazzi, così a un tratto, senza altre fatiche preparatorie.","YES"
"Leopardi_Giacomo-Operette_morali-1834","Leopardi Giacomo","Operette morali","1834","Anzi vogliono che il grado al quale è pervenuta la civiltà, e che l'indole del tempo presente e futuro, assolvano essi e loro successori in perpetuo da ogni necessità di sudori e fatiche lunghe per divenire atti alle cose. Mi diceva, pochi giorni sono, un mio amico, uomo di maneggi e di faccende, che anche la mediocrità è divenuta rarissima: quasi tutti sono inetti, quasi tutti insufficienti a quegli uffici o a quegli esercizi a cui necessità o fortuna o elezione gli ha destinati. In ciò mi pare che consista in parte la differenza ch'è da questo agli altri secoli.","NO"
"Leopardi_Giacomo-Operette_morali-1834","Leopardi Giacomo","Operette morali","1834","In tutti gli altri, come in questo, il grande è stato rarissimo; ma negli altri la mediocrità ha tenuto il campo, in questo la nullità. Onde è tale il romore e la confusione, volendo tutti esser tutto, che non si fa nessuna attenzione ai pochi grandi che pure credo che vi sieno; ai quali, nell'immensa moltitudine de' concorrenti, non è più possibile di aprirsi una via. E così, mentre tutti gl'infimi si credono illustri, l'oscurità e la nullità dell'esito diviene il fato comune e degl'infimi e de' sommi.","NO"
"Leopardi_Giacomo-Operette_morali-1834","Leopardi Giacomo","Operette morali","1834","Ma viva la statistica! vivano le scienze economiche, morali e politiche, le enciclopedie portatili, i manuali, e le tante belle creazioni del nostro secolo! e viva sempre il secolo decimonono!","YES"
"Leopardi_Giacomo-Operette_morali-1834","Leopardi Giacomo","Operette morali","1834","forse povero di cose, ma ricchissimo e larghissimo di parole: che sempre fu segno ottimo, come sapete. E consoliamoci, che per altri sessantasei anni, questo secolo sarà il solo che parli, e dica le sue ragioni. Amico.Voi parlate, a quanto pare, un poco ironico.","NO"
"Leopardi_Giacomo-Operette_morali-1834","Leopardi Giacomo","Operette morali","1834","Ma dovreste almeno all'ultimo ricordarvi che questo è un secolo di transizione. Tristano. Oh che conchiudete voi da cotesto?","NO"
"Leopardi_Giacomo-Operette_morali-1834","Leopardi Giacomo","Operette morali","1834","Tutti i secoli, più o meno, sono stati e saranno di transizione, perché la società umana non istà mai ferma, né mai verrà secolo nel quale ella abbia stato che sia per durare. Sicché cotesta bellissima parola o non iscusa punto il secolo decimonono, o tale scusa gli è comune con tutti i secoli. Resta a cercare, andando la società per la via che oggi si tiene, a che si debba riuscire, cioè se la transizione che ora si fa, sia dal bene al meglio o dal male al peggio.","NO"
"Leopardi_Giacomo-Operette_morali-1834","Leopardi Giacomo","Operette morali","1834","Forse volete dirmi che la presente è transizione per eccellenza, cioè un passaggio rapido da uno stato della civiltà ad un altro diversissimo dal precedente. In tal caso chiedo licenza di ridere di cotesto passaggio rapido, e rispondo che tutte le transizioni conviene che sieno fatte adagio; perché se si fanno a un tratto, di là a brevissimo tempo si torna indietro, per poi rifarle a grado a grado. Così è accaduto sempre.","NO"
"Leopardi_Giacomo-Operette_morali-1834","Leopardi Giacomo","Operette morali","1834","La ragione è, che la natura non va a salti, e che forzando la natura, non si fanno effetti che durino. Ovvero, per dir meglio, quelle tali transizioni precipitose sono transizioni apparenti, ma non reali. Amico.","NO"
"Leopardi_Giacomo-Operette_morali-1834","Leopardi Giacomo","Operette morali","1834","Vi prego, non fate di cotesti discorsi con troppe persone, perché vi acquisterete molti nemici. Tristano. Poco importa.","NO"
"Leopardi_Giacomo-Operette_morali-1834","Leopardi Giacomo","Operette morali","1834","Oramai né nimici né amici mi faranno gran male. Amico. O più probabilmente sarete disprezzato, come poco intendente della filosofia moderna, e poco curante del progresso della civiltà e dei lumi.","YES"
"Leopardi_Giacomo-Operette_morali-1834","Leopardi Giacomo","Operette morali","1834","Tristano. Mi dispiace molto, ma che s'ha a fare? se mi disprezzeranno, cercherò di consolarmene.","NO"
"Leopardi_Giacomo-Operette_morali-1834","Leopardi Giacomo","Operette morali","1834","Amico.Ma in fine avete voi mutato opinioni o no? e che s'ha egli a fare di questo libro? Tristano.","NO"
"Leopardi_Giacomo-Operette_morali-1834","Leopardi Giacomo","Operette morali","1834","Bruciarlo è il meglio. Non lo volendo bruciare, serbarlo come un libro di sogni poetici, d'invenzioni e di capricci malinconici, ovvero come un'espressione dell'infelicità dell'autore: perché in confidenza, mio caro amico, io credo felice voi e felici tutti gli altri; ma io quanto a me, con licenza vostra e del secolo, sono infelicissimo; e tale mi credo; e tutti i giornali de' due mondi non mi persuaderanno il contrario. Amico.","YES"
"Leopardi_Giacomo-Operette_morali-1834","Leopardi Giacomo","Operette morali","1834","Io non conosco le cagioni di cotesta infelicità che dite. Ma se uno sia felice o infelice individualmente, nessuno è giudice se non la persona stessa, e il giudizio di questa non può fallare. Tristano.","NO"
