"filename","nome","titolo","anno","chunk","DIL"
"Leopardi_Giacomo-Operette_morali-1834","Leopardi Giacomo","Operette morali","1834","Usava di farsi leggere quando un libro quando un altro, per lo più di scrittore antico; e interponeva alla lettura qualche suo detto, e quasi annotazioncella a voce, sopra questo o quel passo, di mano in mano. Udendo leggere nelle Vite dei filosofi scritte da Diogene Laerzio,(3)che interrogato Chilone in che differiscano gli addottrinati dagl'indotti, rispose che nelle buone speranze; disse: oggi è tutto l'opposto; perché gl'ignoranti sperano, e i conoscenti non isperano cosa alcuna. Similmente, leggendosi nelle dette Vite(4)come Socrate affermava essere al mondo un solo bene, e questo essere la scienza; e un solo male, e questo essere l'ignoranza; disse: della scienza e dell'ignoranza antica non so; ma oggi io volgerei questo detto al contrario.","NO"
"Leopardi_Giacomo-Operette_morali-1834","Leopardi Giacomo","Operette morali","1834","Nello stesso libro(5)riportandosi questo dogma della setta degli Egesiaci: il sapiente, che che egli si faccia, farà ogni cosa a suo beneficio proprio; disse: se tutti quelli che procedono in questo modo sono filosofi, oramai venga Platone, e riduca ad atto la sua repubblica in tutto il mondo civile. Commendava molto una sentenza di Bione boristenite, posta dal medesimo Laerzio,(6)che i più travagliati di tutti, sono quelli che cercano le maggiori felicità. E soggiungeva che, all'incontro, i più beati sono quelli che più si possono e sogliono pascere delle minime, e anco da poi che sono passate, rivolgerle e assaporarle a bell'agio colla memoria.","NO"
"Leopardi_Giacomo-Operette_morali-1834","Leopardi Giacomo","Operette morali","1834","Recava alle varie età delle nazioni civili quel verso greco che suona: i giovani fanno, i mezzani consultano, i vecchi desiderano; dicendo che in vero non rimane all'età presente altro che desiderio. A un passo di Plutarco,(7)che è trasportato da Marcello Adriani giovane in queste parole: molto meno arieno ancora gli Spartani patito l'insolenza e buffonerie di Stratocle: il quale avendo persuaso il popolo (ciò furono gli Ateniesi) a sacrificare come vincitore; che poi, sentito il vero della rotta, si sdegnava; disse: qual ingiuria riceveste da me, che seppi tenervi in festa ed in gioia per ispazio di tre giorni? soggiunse l'Ottonieri: il simile si potrebbe rispondere molto convenientemente a quelli che si dolgono della natura, gravandosi che ella, per quanto è in se, tenga celato a ciascuno il vero, e coperto con molte apparenze vane, ma belle e dilettevoli: che ingiuria vi fa ella a tenervi lieti per tre o quattro giorni?","NO"
"Leopardi_Giacomo-Operette_morali-1834","Leopardi Giacomo","Operette morali","1834","E in altra occasione disse, potersi appropriare alla nostra specie universalmente, avendo rispetto agli errori naturali dell'uomo, quello che del fanciullo ridotto ingannevolmente a prendere la medicina, dice il Tasso: e da l'inganno suo vita riceve. Nei Paradossi di Cicerone(8)essendogli letto un luogo, che in volgare si ridurrebbe come segue: forse le voluttà fanno la persona migliore o più lodevole? e hacci per avventura alcuno che del goderle si magnifichi o pavoneggi?","NO"
"Leopardi_Giacomo-Operette_morali-1834","Leopardi Giacomo","Operette morali","1834","disse: caro Cicerone, che i moderni divengano per la voluttà o migliori o più lodevoli, non ardisco dire; ma più lodati, sì bene. Anzi hai da sapere che oggi questo solo cammino di lode si propongono e seguono quasi tutti i giovani; cioè quello che mena per le voluttà. Delle quali non pure si vantano, ottenendole, e ne fanno infinite novelle cogli amici e cogli strani, con chi vuole e con chi non vorrebbe udire; ma oltre di ciò, moltissime ne appetiscono e ne procacciano, non come voluttà, ma come cagione di lode e di fama, e come materia da gloriarsi; moltissime eziandio se ne attribuiscono o non ottenute, o anco pure non cercate, o finte del tutto.","NO"
"Leopardi_Giacomo-Operette_morali-1834","Leopardi Giacomo","Operette morali","1834","Notava nell'istoria che scrisse Arriano delle imprese di Alessandro Magno,(9)che alla giornata dell'Isso, Dario collocò i soldati mercenari greci nella fronte dell'esercito, e Alessandro i suoi mercenari pur greci alle spalle; e stimava che da questa circostanza sola senza più, si fosse potuto antivedere il successo della battaglia. Non riprendeva, anzi lodava ed amava, che gli scrittori ragionassero molto di se medesimi: perché diceva che in questo, sono quasi sempre e quasi tutti eloquenti, e hanno per l'ordinario lo stile buono e convenevole, eziandio contro il consueto o del tempo, o della nazione, o proprio loro. E ciò non essere maraviglia; poiché quelli che scrivono delle cose proprie, hanno l'animo fortemente preso e occupato dalla materia; non mancano mai né di pensieri né di affetti nati da essa materia e nell'animo loro stesso, non trasportati di altri luoghi, né bevuti da altre fonti, né comuni e triti, e con facilità si astengono dagli ornamenti frivoli in se, o che non fanno a proposito, dalle grazie e dalle bellezze false, o che hanno più apparenza che di sostanza, dall'affettazione, e da tutto quello che è fuori del naturale.","NO"
"Leopardi_Giacomo-Operette_morali-1834","Leopardi Giacomo","Operette morali","1834","Ed essere falsissimo che i lettori ordinariamente si curino poco di quello che gli scrittori dicono di se medesimi: prima, perché tutto quello che veramente è pensato e sentito dallo scrittore stesso, e detto con modo naturale e acconcio, genera attenzione, e fa effetto, poi, perché in nessun modo si rappresentano o discorrono con maggior verità ed efficacia le cose altrui, che favellando delle proprie: atteso che tutti gli uomini si rassomigliano tra loro, sì nelle qualità naturali, e sì negli accidenti, in quel che dipende dalla sorte; e che le cose umane, a considerarle in se stesse, si veggono molto meglio e con maggior sentimento che negli altri. In confermazione dei quali pensieri adduceva, tra le altre cose, l'aringa di Demostene per la Corona, dove l'oratore parlando di se continuamente, vince se medesimo di eloquenza: e Cicerone, al quale, il più delle volte, dove tocca le cose proprie, vien fatto altrettanto: il che si vede in particolare nella Miloniana, tutta maravigliosa, ma nel fine maravigliosissima, dove l'oratore introduce se stesso. Come similmente bellissimo ed eloquentissimo nelle orazioni del Bossuet sopra tutti gli altri luoghi, è quello dove chiudendo le lodi del Principe di Condé, il dicitore fa menzione della sua propria vecchiezza e vicina morte.","NO"
"Leopardi_Giacomo-Operette_morali-1834","Leopardi Giacomo","Operette morali","1834","Degli scritti di Giuliano imperatore, che in tutti gli altri è sofista, e spesso non tollerabile, il più giudizioso e più lodevole è la diceria che s'intitola Misopogone, cioè contro alla barba; dove risponde ai motti e alle maldicenze di quelli di Antiochia contro di lui. Nella quale operetta, lasciando degli altri pregi, egli non è molto inferiore a Luciano né di grazia comica, né di copia, acutezza e vivacità di sali, laddove in quella dei Cesari, pure imitativa di Luciano, è sgraziato, povero di facezie, ed oltre alla povertà, debole e quasi insulso. Tra gl'Italiani, che per altro sono quasi privi di scritture eloquenti, l'apologia che Lorenzino dei Medici scrisse per giustificazione propria, è un esempio di eloquenza grande e perfetta da ogni parte; e Torquato Tasso ancora è non di rado eloquente nelle altre prose, dove parla molto di se stesso, e quasi sempre eloquentissimo nelle lettere, dove non ragiona, si può dire, se non de' suoi propri casi.","NO"
"Leopardi_Giacomo-Operette_morali-1834","Leopardi Giacomo","Operette morali","1834","CAPITOLO SETTIMO Si ricordano anche parecchi suoi motti e risposte argute: come fu quella ch'ei diede a un giovanetto, molto studioso delle lettere, ma poco esperto del mondo; il quale diceva, che dell'arte del governarsi nella vita sociale, e della cognizione pratica degli uomini, s'imparano cento fogli il dì. Rispose l'Ottonieri: ma il libro fa cinque milioni di fogli.","NO"
"Leopardi_Giacomo-Operette_morali-1834","Leopardi Giacomo","Operette morali","1834","A un altro giovane inconsiderato e temerario, il quale per ischermirsi da quelli che gli rimproveravano le male riuscite che faceva giornalmente, e gli scorni che riportava, era usato rispondere, che della vita non è da fare più stima che di una commedia; disse una volta l'Ottonieri: anche nella commedia è meglio riportare applausi che fischiate; e il commediante male instrutto nell'arte sua, o mal destro in esercitarla, all'ultimo si muore di fame. Preso dai sergenti della corte un ribaldo omicida, il quale per essere zoppo, commesso il misfatto, non era potuto fuggire; disse: vedete, amici, che la giustizia, se bene si dice che sia zoppa, raggiunge però il malfattore, se egli è zoppo. Viaggiando per l'Italia, essendogli detto, non so dove, da un cortigiano che lo voleva mordere: io ti parlerò schiettamente, se tu me ne dai licenza; rispose: anzi avrò caro assai di ascoltarti; perché viaggiando si cercano le cose rare.","NO"
"Leopardi_Giacomo-Operette_morali-1834","Leopardi Giacomo","Operette morali","1834","Costretto da non so quale necessità una volta, a chiedere danari in prestanza a uno, il quale scusandosi di non potergliene dare, concluse affermando, che se fosse stato ricco, non avrebbe avuto maggior pensiero che delle occorrenze degli amici; esso replicò: mi rincrescerebbe assai che tu stessi in pensiero per causa nostra. Prego Dio che non ti faccia mai ricco. Da giovane, avendo composto alcuni versi, e adoperatovi certe voci antiche; dicendogli una signora attempata, alla quale, richiesto da essa, li recitava, non li sapere intendere, perché quelle voci al tempo suo non correvano; rispose: anzi mi credeva che corressero; perché sono molto antiche.","NO"
"Leopardi_Giacomo-Operette_morali-1834","Leopardi Giacomo","Operette morali","1834","Di un avaro ricchissimo, al quale era stato fatto un furto di pochi danari, disse, che si era portato avaramente ancora coi ladri. Di un calcolatore, che sopra qualunque cosa gli veniva udita o veduta, si metteva a computare, disse: gli altri fanno le cose, e costui le conta. Ad alcuni antiquari che disputavano insieme dintorno a una figurina antica di Giove, formata di terra cotta; richiesto del suo parere; non vedete voi, disse, che questo è un Giove in Creta?","NO"
"Leopardi_Giacomo-Operette_morali-1834","Leopardi Giacomo","Operette morali","1834","Di uno sciocco il quale presumeva saper molto bene raziocinare, e ne' suoi discorsi, a ogni due parole, ricordava la logica; disse: questi è propriamente l'uomo definito alla greca; cioè un animale logico. Vicino a morte, compose esso medesimo questa inscrizione, che poi gli fu scolpita sopra la sepoltura. OSSA DI FILIPPO OTTONIERI NATO ALLE OPERE VIRTUOSE E ALLA GLORIA VISSUTO OZIOSO E DISUTILE E MORTO SENZA FAMA NON IGNARO DELLA NATURA NÉ DELLA FORTUNA SUA","NO"
"Leopardi_Giacomo-Operette_morali-1834","Leopardi Giacomo","Operette morali","1834","DIALOGO DI CRISTOFORO COLOMBO E DI PIETRO GUTIERREZ Colombo.Bella notte, amico. Gutierrez.Bella in verità: e credo che a vederla da terra, sarebbe più bella.","NO"
"Leopardi_Giacomo-Operette_morali-1834","Leopardi Giacomo","Operette morali","1834","Colombo.Benissimo: anche tu sei stanco del navigare. Gutierrez.Non del navigare in ogni modo; ma questa navigazione mi riesce più lunga che io non aveva creduto e mi dà un poco di noia. Contuttociò non hai da pensare che io mi dolga di te, come fanno gli altri.","NO"
"Leopardi_Giacomo-Operette_morali-1834","Leopardi Giacomo","Operette morali","1834","Anzi tieni per certo che qualunque deliberazione tu sia per fare intorno a questo viaggio, sempre ti seconderò, come per l'addietro, con ogni mio potere. Ma, così per via di discorso, vorrei che tu mi dichiarassi precisamente, con tutta sincerità, se ancora hai così per sicuro come a principio, di avere a trovar paese in questa parte del mondo; o se, dopo tanto tempo e tanta esperienza in contrario, cominci niente a dubitare. Colombo.Parlando schiettamente, e come si può con persona amica e segreta, confesso che sono entrato un poco in forse: tanto più che nel viaggio parecchi segni che mi avevano dato speranza grande, mi sono riusciti vani; come fu quel degli uccelli che ci passarono sopra, venendo da ponente, pochi dì poi che fummo partiti da Gomera, e che io stimai fossero indizio di terra poco lontana.","NO"
"Leopardi_Giacomo-Operette_morali-1834","Leopardi Giacomo","Operette morali","1834","Similmente, ho veduto di giorno in giorno che l'effetto non ha corrisposto a più di una congettura e più di un pronostico fatto da me innanzi che ci ponessimo in mare, circa a diverse cose che ci sarebbero occorse, credeva io, nel viaggio. Però vengo discorrendo, che come questi pronostici mi hanno ingannato, con tutto che mi paressero quasi certi; così potrebbe essere che mi riuscisse anche vana la congettura principale, cioè dell'avere a trovar terra di là dall'Oceano. Bene è vero che ella ha fondamenti tali, che se pure è falsa, mi parrebbe da un canto che non si potesse aver fede a nessun giudizio umano, eccetto che esso non consista del tutto in cose che si veggano presentemente e si tocchino.","NO"
"Leopardi_Giacomo-Operette_morali-1834","Leopardi Giacomo","Operette morali","1834","Ma da altro canto, considero che la pratica si discorda spesso, anzi il più delle volte, dalla speculazione: e anche dico fra me: che puoi tu sapere che ciascuna parte del mondo si rassomigli alle altre in modo, che essendo l'emisfero d'oriente occupato parte dalla terra e parte dall'acqua, seguiti che anche l'occidentale debba essere diviso tra questa e quella? che puoi sapere che non sia tutto occupato da un mare unico e immenso? o che invece di terra, o anco di terra e d'acqua, non contenga qualche altro elemento?","YES"
"Leopardi_Giacomo-Operette_morali-1834","Leopardi Giacomo","Operette morali","1834","Dato che abbia terre e mari come l'altro, non potrebbe essere che fosse inabitato? anzi inabitabile? Facciamo che non sia meno abitato del nostro: che certezza hai tu che vi abbia creature razionali, come in questo?","YES"
"Leopardi_Giacomo-Operette_morali-1834","Leopardi Giacomo","Operette morali","1834","e quando pure ve ne abbia, come ti assicuri che sieno uomini, e non qualche altro genere di animali intellettivi? ed essendo uomini; che non sieno differentissimi da quelli che tu conosci? ponghiamo caso, molto maggiori di corpo, più gagliardi, più destri; dotati naturalmente di molto maggiore ingegno e spirito; anche, assai meglio inciviliti, e ricchi di molta più scienza ed arte?","YES"
"Leopardi_Giacomo-Operette_morali-1834","Leopardi Giacomo","Operette morali","1834","Queste cose vengo pensando fra me stesso. E per verità, la natura si vede essere fornita di tanta potenza, e gli effetti di quella essere così vari e moltiplici, che non solamente non si può fare giudizio certo di quel che ella abbia operato ed operi in parti lontanissime e del tutto incognite al mondo nostro, ma possiamo anche dubitare che uno s'inganni di gran lunga argomentando da questo a quelle, e non sarebbe contrario alla verisimilitudine l'immaginare che le cose del mondo ignoto, o tutte o in parte, fossero maravigliose e strane a rispetto nostro. Ecco che noi veggiamo cogli occhi propri che l'ago in questi mari declina dalla stella per non piccolo spazio verso ponente: cosa novissima, e insino adesso inaudita a tutti i navigatori; della quale, per molto fantasticarne, io non so pensare una ragione che mi contenti.","NO"
"Leopardi_Giacomo-Operette_morali-1834","Leopardi Giacomo","Operette morali","1834","Non dico per tutto questo, che si abbia a prestare orecchio alle favole degli antichi circa alle maraviglie del mondo sconosciuto, e di questo Oceano; come, per esempio, alla favola dei paesi narrati da Annone,(1)che la notte erano pieni di fiamme, e dei torrenti di fuoco che di là sboccavano nel mare: anzi veggiamo quanto sieno stati vani fin qui tutti i timori di miracoli e di novità spaventevoli, avuti dalla nostra gente in questo viaggio; come quando, al vedere quella quantità di alghe, che pareva facessero della marina quasi un prato, e c'impedivano alquanto l'andare innanzi, pensarono essere in sugli ultimi confini del mar navigabile. Ma voglio solamente inferire, rispondendo alla tua richiesta, che quantunque la mia congettura sia fondata in argomenti probabilissimi, non solo a giudizio mio, ma di molti geografi, astronomi e navigatori eccellenti, coi quali ne ho conferito, come sai, nella Spagna, nell'Italia e nel Portogallo; nondimeno potrebbe succedere che fallasse: perché, torno a dire, veggiamo che molte conclusioni cavate con ottimi discorsi, non reggono all'esperienza; e questo interviene più che mai, quando elle appartengano a cose intorno alle quali si ha pochissimo lume. Gutierrez.Di modo che tu, in sostanza, hai posto la tua vita, e quella de' tuoi compagni, in sul fondamento di una semplice opinione speculativa.","NO"
"Leopardi_Giacomo-Operette_morali-1834","Leopardi Giacomo","Operette morali","1834","Colombo.Così è: non posso negare. Ma, lasciando da parte che gli uomini tutto giorno si mettono a pericolo della vita con fondamenti più deboli di gran lunga, e per cose di piccolissimo conto, o anche senza pensarlo; considera un poco. Se al presente tu, ed io, e tutti i nostri compagni, non fossimo in su queste navi, in mezzo di questo mare, in questa solitudine incognita, in istato incerto e rischioso quanto si voglia; in quale altra condizione di vita ci troveremmo essere?","NO"
"Leopardi_Giacomo-Operette_morali-1834","Leopardi Giacomo","Operette morali","1834","in che saremmo occupati? in che modo passeremmo questi giorni? Forse più lietamente?","YES"
"Leopardi_Giacomo-Operette_morali-1834","Leopardi Giacomo","Operette morali","1834","o non saremmo anzi in qualche maggior travaglio o sollecitudine, ovvero pieni di noia? Che vuol dire uno stato libero da incertezza e pericolo? se contento e felice, quello è da preferire a qualunque altro; se tedioso e misero, non veggo a quale altro stato non sia da posporre.","NO"
"Leopardi_Giacomo-Operette_morali-1834","Leopardi Giacomo","Operette morali","1834","Io non voglio ricordare la gloria e l'utilità che riporteremo, succedendo l'impresa in modo conforme alla speranza. Quando altro frutto non ci venga da questa navigazione, a me pare che ella ci sia profittevolissima in quanto che per un tempo essa ci tiene liberi dalla noia, ci fa cara la vita, ci fa pregevoli molte cose che altrimenti non avremmo in considerazione. Scrivono gli antichi, come avrai letto o udito, che gli amanti infelici, gittandosi dal sasso di Santa Maura (che allora si diceva di Leucade) giù nella marina, e scampandone; restavano, per grazia di Apollo, liberi dalla passione amorosa.","NO"
"Leopardi_Giacomo-Operette_morali-1834","Leopardi Giacomo","Operette morali","1834","Io non so se egli si debba credere che ottenessero questo effetto; ma so bene che, usciti di quel pericolo, avranno per un poco di tempo, anco senza favore di Apollo, avuta cara la vita, che prima avevano in odio; o pure avuta più cara e più pregiata che innanzi. Ciascuna navigazione è, per giudizio mio, quasi un salto dalla rupe di Leucade, producendo le medesime utilità, ma più durevoli che quello non produrrebbe; al quale, per questo conto, ella è superiore assai. Credesi comunemente che gli uomini di mare e di guerra, essendo a ogni poco in pericolo di morire, facciano meno stima della vita propria, che non fanno gli altri della loro.","NO"
"Leopardi_Giacomo-Operette_morali-1834","Leopardi Giacomo","Operette morali","1834","Io per lo stesso rispetto giudico che la vita si abbia da molto poche persone in tanto amore e pregio come da' navigatori e soldati. Quanti beni che, avendoli, non si curano, anzi quante cose che non hanno pur nome di beni, paiono carissime e preziosissime ai naviganti, solo per esserne privi! Chi pose mai nel numero dei beni umani l'avere un poco di terra che ti sostenga?","NO"
"Leopardi_Giacomo-Operette_morali-1834","Leopardi Giacomo","Operette morali","1834","Niuno, eccetto i navigatori, e massimamente noi, che per la molta incertezza del successo di questo viaggio, non abbiamo maggior desiderio che della vista di un cantuccio di terra; questo è il primo pensiero che ci si fa innanzi allo svegliarci, con questo ci addormentiamo; e se pure una volta ci verrà scoperta da lontano la cima di un monte o di una foresta, o cosa tale, non capiremo in noi stessi dalla contentezza; e presa terra, solamente a pensare di ritrovarci in sullo stabile, e di potere andare qua e là camminando a nostro talento, ci parrà per più giorni essere beati. Gutierrez.Tutto cotesto è verissimo: tanto che se quella tua congettura speculativa riuscirà così vera come è la giustificazione dell'averla seguita, non potremo mancar di godere questa beatitudine un giorno o l'altro. Colombo.Io per me, se bene non mi ardisco più di promettermelo sicuramente, contuttociò spererei che fossimo per goderla presto.","NO"
"Leopardi_Giacomo-Operette_morali-1834","Leopardi Giacomo","Operette morali","1834","Da certi giorni in qua, lo scandaglio, come sai, tocca fondo; e la qualità di quella materia che gli vien dietro, mi pare indizio buono. Verso sera, le nuvole intorno al sole, mi si dimostrano d'altra forma e di altro colore da quelle dei giorni innanzi. L'aria, come puoi sentire, è fatta un poco più dolce e più tepida di prima.","NO"
"Leopardi_Giacomo-Operette_morali-1834","Leopardi Giacomo","Operette morali","1834","Il vento non corre più, come per l'addietro, così pieno, né così diritto, né costante; ma piuttosto incerto, e vario, e come fosse interrotto da qualche intoppo. Aggiungi quella canna che andava in sul mare a galla, e mostra essere tagliata di poco; e quel ramicello di albero con quelle coccole rosse e fresche. Anche gli stormi degli uccelli, benché mi hanno ingannato altra volta, nondimeno ora sono tanti che passano, e così grandi; e moltiplicano talmente di giorno in giorno; che penso vi si possa fare qualche fondamento; massime che vi si veggono intramischiati alcuni uccelli che, alla forma, non mi paiono dei marittimi.","YES"
"Leopardi_Giacomo-Operette_morali-1834","Leopardi Giacomo","Operette morali","1834","In somma tutti questi segni raccolti insieme, per molto che io voglia essere diffidente, mi tengono pure in aspettativa grande e buona. Gutierrez. Voglia Dio questa volta, ch'ella si verifichi.","YES"
"Leopardi_Giacomo-Operette_morali-1834","Leopardi Giacomo","Operette morali","1834","ELOGIO DEGLI UCCELLI Amelio filosofo solitario, stando una mattina di primavera, co' suoi libri, seduto all'ombra di una sua casa in villa, e leggendo; scosso dal cantare degli uccelli per la campagna, a poco a poco datosi ad ascoltare e pensare, e lasciato il leggere; all'ultimo pose mano alla penna, e in quel medesimo luogo scrisse le cose che seguono. Sono gli uccelli naturalmente le più liete creature del mondo.","NO"
"Leopardi_Giacomo-Operette_morali-1834","Leopardi Giacomo","Operette morali","1834","Non dico ciò in quanto se tu li vedi o gli odi, sempre ti rallegrano; ma intendo di essi medesimi in se, volendo dire che sentono giocondità e letizia più che alcuno altro animale. Si veggono gli altri animali comunemente seri e gravi; e molti di loro anche paiono malinconici: rade volte fanno segni di gioia, e questi piccoli e brevi; nella più parte dei loro godimenti e diletti, non fanno festa, né significazione alcuna di allegrezza; delle campagne verdi, delle vedute aperte e leggiadre, dei soli splendidi, delle arie cristalline e dolci, se anco sono dilettati, non ne sogliono dare indizio di fuori: eccetto che delle lepri si dice che la notte, ai tempi della luna, e massime della luna piena, saltano e giuocano insieme, compiacendosi di quel chiaro, secondo che scrive Senofonte. (1)Gli uccelli per lo più si dimostrano nei moti e nell'aspetto lietissimi; e non da altro procede quella virtù che hanno di rallegrarci colla vista, se non che le loro forme e i loro atti, universalmente, sono tali, che per natura dinotano abilità e disposizione speciale a provare godimento e gioia: la quale apparenza non è da riputare vana e ingannevole.","NO"
"Leopardi_Giacomo-Operette_morali-1834","Leopardi Giacomo","Operette morali","1834","Per ogni diletto e ogni contentezza che hanno, cantano; e quanto è maggiore il diletto o la contentezza, tanto più lena e più studio pongono nel cantare. E cantando buona parte del tempo, s'inferisce che ordinariamente stanno di buona voglia e godono. E se bene è notato che mentre sono in amore, cantano meglio, e più spesso, e più lungamente che mai; non è da credere però, che a cantare non li muovano altri diletti e altre contentezze fuori di queste dell'amore.","NO"
"Leopardi_Giacomo-Operette_morali-1834","Leopardi Giacomo","Operette morali","1834","Imperocché si vede palesemente che al dì sereno e placido cantano più che all'oscuro e inquieto: e nella tempesta si tacciono, come anche fanno in ciascuno altro timore che provano; e passata quella, tornano fuori cantando e giocolando gli uni cogli altri. Similmente si vede che usano di cantare in sulla mattina allo svegliarsi; a che sono mossi parte dalla letizia che prendono del giorno nuovo, parte da quel piacere che è generalmente a ogni animale sentirsi ristorati dal sonno e rifatti. Anche si rallegrano sommamente delle verzure liete, delle vallette fertili, delle acque pure e lucenti, del paese bello.","NO"
