"filename","nome","titolo","anno","chunk","DIL"
"Lopez_Savi_Maria-Leggende_del_mare-1890","Lopez Savi Maria","Leggende del mare","1890","Nel Medioevo, quando par che si vadano moltiplicando in mezzo alle genti, appassionate per i racconti meravigliosi, le reminiscenze di tanti miti lontanissimi, come per affermare la fratellanza antica dei vinti coi vincitori, delle genti nuove coi figli delle gloriose civiltà antiche, troviamo innumerevoli draghi custodi di tesori, e ancora adesso si parla in certe regioni delle Alpi delle Vouivres, draghi colle corone d'oro, mentre nei canti popolari dei Bulgari si dice dei draghi che passano sulle foreste nei carri d'oro. In Islanda, dove si ricorda da ogni classe di cittadini l'epica poesia dell'Edda e specialmente la vittoria di Sigurd sul drago, custode del famoso tesoro, che doveva più tardi appartenere ai principi Nibelunghi, abbiamo anche altre chiarissime reminiscenze di miti indiani, in alcune leggende raccolte recentemente, nelle quali dicesi di certi draghi che dimorano sulla terra in mezzo all'oro, o di serpenti acquatici che hanno dell'oro intorno al corpo. Fra queste parmi che abbia maggiore importanza la leggenda del verme o serpente del Lagarfljot, che può in qualche modo collegarsi con un racconto indiano, nel quale si trovano ricordi storici del diluvio confusi con mitiche favole.","NO"
"Lopez_Savi_Maria-Leggende_del_mare-1890","Lopez Savi Maria","Leggende del mare","1890","Dicesi in questo racconto che il dio Vishnù comincia coll'essere un piccolissimo pesce, il quale prega il penitente Manus di toglierlo dal Gange, dove teme di essere divorato dai mostri acquatici. Manus riceve il pesciolino nel vaso di acqua, che gli serve per le sue abluzioni. In una notte il pesce cresce tanto che non può rimanere nel vaso.","NO"
"Lopez_Savi_Maria-Leggende_del_mare-1890","Lopez Savi Maria","Leggende del mare","1890","Manus lo porta in uno stagno, poi nel Gange; ma il pesce continua a crescere in modo meraviglioso, e Manus, riconoscendo in esso un dio, gli dà intera libertà nel mare. Il pesce per dimostrargli la sua gratitudine, gli annunzia che fra sette giorni le acque inonderanno il mondo e che tutte le creature periranno; poi gli comanda di costruire una nave e gli dice: «Starai dentro di essa con sette savii, con una coppia di ogni specie di animali e coi semi di tutte le piante. Aspetterai nella nave la fine della notte di Brama, e quando il bastimento sarà agitato dalle onde, lo legherai con un grosso serpente al corno di un pesce enorme, che verrà presso di te, per guidarti fra le onde nell'abisso».","NO"
"Lopez_Savi_Maria-Leggende_del_mare-1890","Lopez Savi Maria","Leggende del mare","1890","Nel giorno indicato da Vishnù le acque del mare invasero la superficie della terra, ed il pesce apparve per guidare la nave, salvando Manus ed i suoi compagni. Nella leggenda islandese del verme o serpe del Lagarfljot, si dice che sulla sponda di questo fiume viveva in una casetta una donna che aveva una figlia giovinetta, alla quale ella diede in dono un anello. La fanciulla chiese alla madre in qual modo avrebbe potuto trarre molto profitto di quell'oro; la madre le rispose di metterlo intorno al corpo di un verme delle brughiere.","NO"
"Lopez_Savi_Maria-Leggende_del_mare-1890","Lopez Savi Maria","Leggende del mare","1890","La fanciulla seguì il consiglio ricevuto, sperando che l'anello ingrossasse col verme, e ripose l'uno e l'altro nella cassa dove conservava la sua biancheria. Un giorno ella volle vedere se il verme era cresciuto ed aprì la cassa; il verme era già divenuto un rettile tanto grosso, che non poteva più essere contenuto nella cassa, spaccatasi in diverse parti; e la fanciulla fu così spaventata che gittò nel Lagarfljot la cassa e quanto trovavasi dentro di essa. Dopo qualche tempo il rettile, divenuto enorme, divorava gli uomini e le donne, che passavano in barca sul fiume, o veniva sulla sponda, gittando in aria tale quantità di veleno, che una pestilenza terribile fece strage fra gli abitanti di quella regione dell'Islanda, i quali non trovavano nessun mezzo per ucciderlo.","NO"
"Lopez_Savi_Maria-Leggende_del_mare-1890","Lopez Savi Maria","Leggende del mare","1890","Basta leggere i canti epici dei Finni per sapere che questi si ritengono molto esperti nelle arti della magia; e bisogna credere che la loro fama di stregoni si fosse anche estesa nell'Islanda, poiché dicesi che due Finni vennero incaricati di uccidere il serpente del Lagarfljot; e di prendere l'oro che aveva intorno al corpo. Essi si affaticarono assai prima di vincere il mostro; finalmente riuscirono a legarlo con due catene, e liberarono gl'Islandesi, che tanto avevano sofferto a cagione della sua malvagità. Un altro drago o serpente enorme aveva un letto d'oro ad oriente dell'isola Papey.","NO"
"Lopez_Savi_Maria-Leggende_del_mare-1890","Lopez Savi Maria","Leggende del mare","1890","Un olandese chiamato Kumper sparò contro di esso con un archibugio, per discacciarlo dal suo letto ed impossessarsi dell'oro. Egli riuscì a farlo fuggire, ma non si seppe mai quanto oro raccolse nel suo letto. Il drago si gittò nelle acque del golfo vicino, e sparì nuotando; dopo quel tempo si credette che avesse la sua dimora in quel golfo, dove i pescatori, per tema di essere divorati, non andarono più colle barche; e ora dicesi ancora che mostrasi agli uomini quando deve accadere qualche fatto di grande importanza.","NO"
"Lopez_Savi_Maria-Leggende_del_mare-1890","Lopez Savi Maria","Leggende del mare","1890","In una leggenda scandinava troviamo il racconto di un'epica lotta col grande serpente del mare. Il dio Thor naviga col gigante Hymer, ed ha seco una grossa testa di toro, che deve servirgli per adescare il serpente. Thor rema a poppa con due remi, e Hymer vede con molto stupore che la barca avanza rapidamente.","NO"
"Lopez_Savi_Maria-Leggende_del_mare-1890","Lopez Savi Maria","Leggende del mare","1890","Hymer che rema a prora nota pure che sono già arrivati nel luogo dove hanno il costume di pescare; ma Thor gli assicura che possono andare molto più lontano. Continuano a remare finché Hymer grida che se non si fermeranno subito verrà a minacciarli Midgard, il grande serpente del mare. Thor non si cura di ciò che dice il gigante e rema ancora; quando si fermano, Hymer prende due balene.","NO"
"Lopez_Savi_Maria-Leggende_del_mare-1890","Lopez Savi Maria","Leggende del mare","1890","Thor gitta a mare un amo meraviglioso, attaccato insieme colla testa di toro ad una lenza fortissima. La testa vien subito divorata dal serpente, e l'amo gli resta conficcato in gola; Thor tira con tanta forza la lenza, che i suoi piedi sfondano la nave, e scendono nel fondo del mare, mentre egli tira il serpente verso la nave. In quel momento ha luogo una lotta terribile, fra Thor che assale il serpente, e questo che alza la testa dalle onde, e gitta sul suo nemico torrenti di veleno.","NO"
"Lopez_Savi_Maria-Leggende_del_mare-1890","Lopez Savi Maria","Leggende del mare","1890","Allora Hymer atterrito taglia la lenza, ed il serpente piomba nel fondo del mare. Il Kraken è un altro mostro enorme del mare, famoso nelle tradizioni della Norvegia al pari del serpente di cui già tenni parola, e che dimorava, secondo le leggende, nelle vicinanze di Bergen. Quando i pescatori notavano che il mare non era profondo nel luogo dove andavano a pescare, questo caso li rallegrava, essendo certi di prendere molti pesci, i quali erano come sollevati dall'enorme Kraken, che si trovava certamente in quel sito nascosto dall'acqua.","NO"
"Lopez_Savi_Maria-Leggende_del_mare-1890","Lopez Savi Maria","Leggende del mare","1890","Essi dovevano tuttavia stare molto attenti per vedere se diminuisse ancora la profondità dell'acqua, ed in questo caso era necessario che si allontanassero rapidamente, verso un luogo dove l'acqua fosse di nuovo profonda, e dal quale potessero guardare senza pericolo il mostro, che si alzava fino alla superficie del mare. Dice ancora Pontoppidan: «La circonferenza di quel mostro è di circa un miglio; esso pare una piccola isola circondata da qualche cosa che somiglia all'erba di mare. Par che abbia certe braccia enormi che crescono in grossezza a misura che escono dall'acqua, e sembrano alberi di una nave di mediocre grandezza.","NO"
"Lopez_Savi_Maria-Leggende_del_mare-1890","Lopez Savi Maria","Leggende del mare","1890","La forza di quelle braccia è tale che se afferrassero il più grande vascello da guerra lo trascinerebbero facilmente nell'abisso. «Dopo essere rimasto per qualche tempo sulla superficie del mare il Kraken sparisce, ed il momento in cui immergesi nell'acqua è terribile per le navi che si trovano a poca distanza, poiché spostasi un volume d'acqua così grande che si forma un vortice simile a quello del Maelstrom». Gli enormi tentacoli del Kraken gli servivano per afferrare la preda, e si diceva che durante alcuni mesi dell'anno mangiava continuamente.","NO"
"Lopez_Savi_Maria-Leggende_del_mare-1890","Lopez Savi Maria","Leggende del mare","1890","Si narrò pure che certi pescatori, credendo di approdare in un'isola, discesero invece sopra un Kraken, e vi rimasero in pace, finché, avendo acceso il fuoco, il mostro che sentì il calore s'immerse interamente nell'oceano, e trascinò seco i poveri pescatori atterriti. In un'altra leggenda si dice che un santo della Norvegia, il quale stava di domenica sopra una nave, dolevasi di non poter celebrare la Messa sulla terra ferma. Subito emerse dall'acqua un'isola, sulla quale il santo discese con tutta la ciurma, ed essendo stato eretto un altare disse la Messa secondo il suo desiderio.","NO"
"Lopez_Savi_Maria-Leggende_del_mare-1890","Lopez Savi Maria","Leggende del mare","1890","Appena risalì sulla nave coi suoi compagni l'isola scomparve, perché era formata dal dorso di un Kraken. San Brandano incontrò nel suo viaggio un pesce enorme detto Gascomus, sul quale discese coi suoi compagni, ma tutti fuggirono appena il pesce, sentendo il calore del fuoco acceso sul suo dorso, si mosse. Un'altra volta un cete smisurato l'inseguì e certamente avrebbe inghiottita la sua nave, se un altro mostro marino colla bocca che gittava fiamme non lo avesse assalito ed ucciso.","NO"
"Lopez_Savi_Maria-Leggende_del_mare-1890","Lopez Savi Maria","Leggende del mare","1890","Il Kraken fu detto immortale, e si parlò con frequenza degli uomini infelici uccisi nel volgere dei secoli dalle sue braccia poderose. Forse è stato, più di tutti gli altri mostri del mare ricordati nelle leggende, cagione ai marinai d'infinito spavento; ma non senza qualche buona ragione la fantasia popolare andò immaginando intorno ad esso tanti strani racconti, poiché si può trovare una certa somiglianza fra il suo aspetto leggendario e quello di certe seppie gigantesche, che trovansi anche nei mari del Nord, e delle quali già feci cenno. Da qualche tempo è pure stato tolto ogni dubbio intorno all'esistenza di certi mostri reali del mare, più strani ancora di queste seppie.","NO"
"Lopez_Savi_Maria-Leggende_del_mare-1890","Lopez Savi Maria","Leggende del mare","1890","Essi hanno intorno alla bocca un gran numero di piedi o tentacoli e vengono chiamati dagli Americani: «Seadevils» (diavoli del mare). Qualche volta i loro tentacoli hanno più di trenta piedi di lunghezza, e si afferrano con rabbia indicibile alle barche, o prendono gl'infelici pescatori, che non fuggono in tempo, e li trascinano nell'abisso. Sono tuttavia ben lungi dall'avere le dimensioni di un favoloso Kraken, sul dorso del quale, a quanto si dice, poté fare gli esercizii un reggimento intero di soldati!","NO"
"Lopez_Savi_Maria-Leggende_del_mare-1890","Lopez Savi Maria","Leggende del mare","1890","Secondo altre leggende, che si trovano non solo in Europa, ma anche presso gl'indigeni americani, il dorso di qualche testuggine venne creduto un'isola dagli uomini. Il vortice spaventevole del Maelstrom, nel quale tante povere navi andarono perdute nelle notti burrascose o di giorno, fra la triste nebbia del Nord, fu anche detto in certe leggende un vorace mostro del mare, e forse è il solo che possa uguagliare nella forza e nella ferocia l'antico mostro Scilla, che Dodici ha piedi, anterïori tutti, Sei lunghissimi colli, e su ciascuno Spaventosa una testa… Nel Medioevo si credette pure nell'esistenza del mostro Leviathan, nel quale credo che dobbiamo trovare un ricordo del mitico serpente antichissimo (l'Oceano) che cingeva la terra. Il Leviathan abbracciava fra le sue spire i continenti, e cagionava le maree quando assorbiva le acque dei mari e degli oceani e le rigettava.","NO"
"Lopez_Savi_Maria-Leggende_del_mare-1890","Lopez Savi Maria","Leggende del mare","1890","Recentemente gli abitanti delle isole Shetland credevano ancora nell'esistenza di un gran mostro, il quale abitava nella profondità del mare e col suo respiro cagionava la marea. Si disse pure che, quando si cominciò a costruire Alessandria d'Egitto, certi mostri marini venivano tutte le notti a distruggere le fondamenta della nuova città. Alessandro fece fare una cassa di vetro, nella quale discese nel fondo del mare, per disegnare il ritratto di quei mostri.","NO"
"Lopez_Savi_Maria-Leggende_del_mare-1890","Lopez Savi Maria","Leggende del mare","1890","Quando tornò dal suo pericoloso viaggio fece eseguire certe statue somiglianti ai suoi disegni, e le fece collocare sulla spiaggia, presso la città nascente. Nella notte, quando i mostri marini uscirono dalle onde per compiere la solita opera di distruzione, videro le proprie immagini orribili, e spaventati fuggirono per sempre. Nella sua storia della Groenlandia Thormoder dice di un mostro marino così grosso che sembra un paese.","NO"
"Lopez_Savi_Maria-Leggende_del_mare-1890","Lopez Savi Maria","Leggende del mare","1890","Quando ha fame spande sull'acqua una saliva profumata, che piace molto ai pesci, i quali entrano nella bocca della bestia gigantesca, finché essa la chiuda, essendo satolla. Questo mostro impiega un anno per digerire la preda; vuolsi che abbia parecchie miglia di lunghezza, e che si lasci veder solo quando il mare è calmo; ha diverse teste, e certe grosse zampe colle quali afferra gli uomini e le navi. Si può trovare una certa somiglianza fra questa bestia ed il Kraken leggendario della Norvegia.","NO"
"Lopez_Savi_Maria-Leggende_del_mare-1890","Lopez Savi Maria","Leggende del mare","1890","In una specie di ballata che vien ripetuta qualche volta dai marinai degli Stati Uniti, si dice di un'isola che fu vista per lungo tempo sul mare. Era coperta di rocce e di avvallamenti del terreno, e non aveva vegetazione; la sua circonferenza era di sei miglia. Certi marinai si avvicinarono ad essa, e videro che una parte della spiaggia si era alquanto sollevata, formando verso il mare una specie di caverna immensa, nella quale entrarono.","NO"
"Lopez_Savi_Maria-Leggende_del_mare-1890","Lopez Savi Maria","Leggende del mare","1890","L'isola non era altro che un'ostrica enorme. Gli antichi Arii paragonarono il sole che attraversa il cielo ad un cavallo di battaglia, poi esso divenne l'auriga che guidava cavalli divini. Le onde del mare colle creste bianche di schiuma divennero i cavalli di Poseidone, che nella gara con Minerva crea il cavallo, e troviamo in mitologie diverse certi spiriti del mare che si mutano in cavalli; per questo motivo il cavallo marino ha anche grande importanza leggendaria.","NO"
"Lopez_Savi_Maria-Leggende_del_mare-1890","Lopez Savi Maria","Leggende del mare","1890","In Islanda il fantastico cavallo marino delle leggende chiamasi Hnickur; credesi che sia grigio, e se d'inverno odesi una specie di crepitio nel ghiaccio è segno che si avvicina. Spesso induce gli uomini e specialmente le fanciulle a montargli in groppa, indi balza nel mare e li porta seco nella sua dimora incantata. Nelle isole Orcadi si dice che lo spirito del mare è un bel cavallino coperto di alighe.","NO"
"Lopez_Savi_Maria-Leggende_del_mare-1890","Lopez Savi Maria","Leggende del mare","1890","Il cavallo marino leggendario ha nomi vani e strani presso diversi popoli; dicesi che gli uomini ch'esso ha trascinati nel mare possono salvarsi soltanto se riescono ad ucciderlo. Nelle isole Shetland chiamasi «Shoopiltree», in Irlanda «Phookie», nella Germania del Nord «Sagow». Un Kelpie, specie di folletto scozzese, prendeva aspetto di cavallo, e traeva in inganno chi lo montava.","NO"
"Lopez_Savi_Maria-Leggende_del_mare-1890","Lopez Savi Maria","Leggende del mare","1890","Nella Scozia anche ogni lago, secondo certe credenze popolari, ha il suo fantastico cavallo. Nei racconti popolari dell'Illiria dicesi che le Nixi, le quali dimorano le onde, hanno bellezza meravigliosa; se un giovane s'innamora di uno di questi spiriti, esso trasformasi in cavallo, lo prende in groppa, e lo trasporta nella dimora di cristallo che ha sotto le onde. Nella leggenda di Corigliano calabro, della quale già tenni parola, in cui il diavolo appare ad una fanciulla, egli monta un cavallo bianco.","NO"
"Lopez_Savi_Maria-Leggende_del_mare-1890","Lopez Savi Maria","Leggende del mare","1890","In un'altra leggenda anche calabrese si parla di un certo Marecavallo, ma costui non ha aspetto di cavallo; è invece un bellissimo giovane, figlio della regina del mare. Egli salvò una giovinetta che era stata buttata in mare e s'invaghì di lei; la sposò, ma fu costretto a tenerla nascosta in una cameretta del suo splendido palazzo, perché sapeva bene che se ella fosse stata veduta da sua madre, sarebbe stata divorata da lei. Dall'alto di una torre la regina filava, e la giovinetta chiamata Teresa, che stava nel fondo del mare, ungeva il filo con miele, quando scendeva il fuso.","NO"
"Lopez_Savi_Maria-Leggende_del_mare-1890","Lopez Savi Maria","Leggende del mare","1890","La vecchia accostava spesso alle labbra le dita che avevano toccato il filo ed esclamava: «Come è dolce questo filo! se sapessi chi mi usa tanta cortesia gli darei un bel compenso; se fosse un giovine lo amerei come figlio, se fosse una fanciulla la darei per moglie a Marecavallo». La fanciulla non rispondeva, e continuava ad ungere il filo.","NO"
"Lopez_Savi_Maria-Leggende_del_mare-1890","Lopez Savi Maria","Leggende del mare","1890","Un giorno la vecchia disse: «Tu che mi dai tanto piacere, perché non vieni sopra accanto a me? Sali, se vuoi ch'io ti doni un palazzo incantato e tutte le bellezze del mare, tutte le ricchezze dell'oceano». La fanciulla taceva sempre, finalmente la vecchia disse: «Sali, se ami Marecavallo!».","NO"
"Lopez_Savi_Maria-Leggende_del_mare-1890","Lopez Savi Maria","Leggende del mare","1890","Teresa salì subito, e la regina del mare l'accolse con gioia, ma più tardi prese a odiarla, e le comandò di far bollire certi ceci al sole. Il cielo era oscuro, ma il sole fu chiamato da Marecavallo e mandò tanto calore sui ceci da farli cuocere subito. La vecchia domandò a Teresa un materasso di piume; Marecavallo fischiò, ed in un attimo certi stormi di uccelli discesero intorno alla fanciulla, che poté raccogliere le loro penne e contentare la sua nemica.","NO"
"Lopez_Savi_Maria-Leggende_del_mare-1890","Lopez Savi Maria","Leggende del mare","1890","Questa le ordinò ancora di andare in Inghilterra, per visitare una zia di Marecavallo, e la fanciulla ubbidì coraggiosamente, ricordando tutti i consigli che le aveva dato lo sposo. Ella giunse in luogo dove le acque del mare erano limacciose e disse: «Che bell'acqua limpida! è un piacere vederla».","NO"
"Lopez_Savi_Maria-Leggende_del_mare-1890","Lopez Savi Maria","Leggende del mare","1890","L'acqua lusingata dalle parole cortesi divenne limpida, ed ella poté andare innanzi colla sua barchetta, finché trovò due isole galleggianti, che cozzavano con forza l'una contro l'altra. Ella disse: «Poverette! come sarei felice se potessi aiutarvi».","NO"
"Lopez_Savi_Maria-Leggende_del_mare-1890","Lopez Savi Maria","Leggende del mare","1890","Le isole rimasero subito immobili, lasciandola passare. Incontrò ancora molte balene e certi pescicani che si dilaniavano a vicenda, ed ella disse: «O buona gente, lasciate che vi aiuti!». Le balene ed i pescicani stettero fermi ed ella poté andare per la sua via; finché giunse vicino alla zia, regina dei mari d'Inghilterra, che prese a volerle bene, e dopo qualche tempo la rimandò a Marecavallo, col quale essa visse felicemente.","NO"
"Lopez_Savi_Maria-Leggende_del_mare-1890","Lopez Savi Maria","Leggende del mare","1890","Il capitano Seymour e la ciurma della sua nave affermarono di aver veduto a quaranta o cinquanta miglia da Panama un mostro, il quale mise fuori dalle onde una testa simile a quella di un bellissimo cavallo, con due corna. Il suo corpo aveva circa venti piedi di lunghezza, quattro gambe e larghe natatoie; la sua coda era divisa in due parti. Altri marinai ed ufficiali di piroscafi appartenenti alla compagnia marittima del Pacifico, videro nello stesso luogo mostri simili a questo.","NO"
"Lopez_Savi_Maria-Leggende_del_mare-1890","Lopez Savi Maria","Leggende del mare","1890","Nel poemetto russo che ha per titolo Kaniok Garbunok, un cavallo bianco porta Ivano nel mezzo del mare presso una balena che ha ingoiato una flotta. Questo Ivano, il quale deve cercare per il sultano un anello chiuso in una cassetta caduta nel mare, ha una certa affinità con Niccolò Pesce di cui dirò in altro capitolo. Spesso fra le onde dell'Oceano glaciale e dell'Atlantico passano sui massi galleggianti di ghiaccio foche ed orsi bianchi, i quali hanno aspetto quasi soprannaturale fra lo splendore delle aurore boreali, o nei lunghi tramonti dell'estate, ed avviene con frequenza che i marinai dicano intorno ad essi strane leggende.","NO"
"Lopez_Savi_Maria-Leggende_del_mare-1890","Lopez Savi Maria","Leggende del mare","1890","Forse quelle che trovansi in maggior numero fanno cenno delle trasformazioni meravigliose di pescatori, e specialmente di stregoni islandesi ed eschimesi in foche ed in orsi bianchi; altre volte gli spiriti del mare prendono anch'essi l'aspetto di questi animali per trarre gli uomini a rovina o per aiutarli, come già notai nella leggenda eschimese di Stiliarnat. Anche le balene hanno molta importanza fra le leggende marinaresche, e si dice che in Groenlandia due giovinette si trastullavano con alcune ossa sopra una spiaggia; una di esse aveva in mano ossa di aquile, l'altra ossa di balene. Un'aquila passò su di esse ed una delle ragazze disse: «Avrò un'aquila per marito»; l'altra esclamò: «Invece avrò per marito una balena!» ed in quel momento apparve sulle onde una balena.","NO"
"Lopez_Savi_Maria-Leggende_del_mare-1890","Lopez Savi Maria","Leggende del mare","1890","L'aquila rapì una delle fanciulle, la balena prese l'altra e la portò nel fondo del mare, avendole prima reso gli occhi e le orecchie impenetrabili, affinché non vi entrasse l'acqua. L'aquila portò la fanciulla scelta per sua sposa in cima ad una rupe, e le dava diverse specie di uccelletti per nutrirsi. Ella conservava con molta cura i loro nervi, e intrecciandoli insieme fece con essi una fune.","NO"
"Lopez_Savi_Maria-Leggende_del_mare-1890","Lopez Savi Maria","Leggende del mare","1890","Un giorno, mentre l'aquila era assente, ella misurò la lunghezza della fune, e vide che giungeva a livello del mare. Un altro giorno scorse un pescatore sulla spiaggia, e quando egli giunse presso la rupe lo chiamò, pregandolo di mandare una barca per salvarla. Appena questa arrivò, la giovane discese, avvalendosi della fune di nervi, e tornò presso i suoi genitori che uccisero l'aquila.","NO"
"Lopez_Savi_Maria-Leggende_del_mare-1890","Lopez Savi Maria","Leggende del mare","1890","La fanciulla rubata dalla balena fu legata con una fune al fondo del mare. Ella aveva due fratelli, che dimoravano a poca distanza, ed entrambi costruirono una barca leggerissima, colla quale speravano di liberarla. Più tardi distrussero questa barca, perché non avea sul mare rapidità pari a quella di un uccello.","NO"
"Lopez_Savi_Maria-Leggende_del_mare-1890","Lopez Savi Maria","Leggende del mare","1890","Ne fecero un'altra veloce come un uccello e la ruppero pure; finalmente ne costruirono una più veloce di un uccello, e partirono per liberare la sorella. Costei, sapendo che si avvicinavano, sciolse la fune che la legava, salì nella barca e fuggì con essi. Quando la balena tornò, e si avvide che la fanciulla era fuggita, le corse dietro.","NO"
"Lopez_Savi_Maria-Leggende_del_mare-1890","Lopez Savi Maria","Leggende del mare","1890","Ella, vedendo che si avvicinava alla barca, gittò nel mare il suo corpetto; la balena si fermò per raccoglierlo, poi, lasciandolo, corse di nuovo dietro alla barca. La fanciulla gittò nell'acqua altra parte dei suoi abiti, e la balena si fermò ancora; poi riprese la sua corsa; la fanciulla le gittò anche la sua sottana, e prima che la balena l'afferrasse scese a terra e fu salva. Dicesi che quando la balena giunse sulla spiaggia si trasformò in un osso di balena.","NO"
"Lopez_Savi_Maria-Leggende_del_mare-1890","Lopez Savi Maria","Leggende del mare","1890","In altre leggende anche le balene, come il Kraken e le testuggini, sono credute isole dai marinai, e siccome sul dorso delle balene si trovano conchiglie ed alighe, si disse che quelle isole erano verdeggianti. Il ricordo di certi mostri del mare nominati nelle leggende che possiamo dire classiche durò a lungo, mentre anche molte persone colte non vedevano in essi soltanto miti creati dalla fantasia del popolo, o immagini vagheggiate dai poeti, ma esseri reali; in maniera che in tempi non lontanissimi da noi si narrarono ancora strane apparizioni di Tritoni e di Sirene. Il Poggio racconta seriamente che apparve sulle coste della Dalmazia un tritone colla fronte ornata di piccole corna, aveva anche la barba, e poteva esser tenuto come una specie di satiro del mare, poiché rubava sulle spiagge le donne.","NO"
