"filename","nome","titolo","anno","chunk","DIL"
"Lopez_Savi_Maria-Tramonto_regale-1901","Lopez Savi Maria","Tramonto regale","1901","Fin da quando era quasi una bambina ancora, non aveva mai potuto andare d'accordo col cugino Filippo su quest'argomento, essendo egli tanto diverso da lei nelle convinzioni, nei desiderii. Ciò non aveva impedito più tardi all'amore di unire i loro cuori appassionati e buoni, ed era così dolce per essi dimenticare spesso la politica per discorrere invece dell'avvenire; per dirsi che si amavano con tutta l'anima. Pur qualche volta discutevano insieme, senza che Assuna potesse mutare l'animo di lui.","NO"
"Lopez_Savi_Maria-Tramonto_regale-1901","Lopez Savi Maria","Tramonto regale","1901","Quando ebbe detto ogni particolare della triste visita a Filippo, lo guardò, lasciando la mano immobile sul telaio, e chiese: – Come è possibile che tu non voglia mai, mai, unirti con noi. Non vedi che infamie si compiono? Il volto di Filippo si fece scuro.","NO"
"Lopez_Savi_Maria-Tramonto_regale-1901","Lopez Savi Maria","Tramonto regale","1901","Con molta dolcezza egli rispose: – Perchè torni sempre su quest'argomento così penoso per noi? Lo sai che non posso! – Perchè no?","NO"
"Lopez_Savi_Maria-Tramonto_regale-1901","Lopez Savi Maria","Tramonto regale","1901","– chiese Assunta, che aveva lo sguardo sfavillante. – Non cospirano forse Antonio, Severino e tanti altri, mettendo a rischio la vita, per rompere queste catene intollerabili? Dovresti imitarli, tu; dovresti unirti con essi, per amor mio; per amore della giustizia.","NO"
"Lopez_Savi_Maria-Tramonto_regale-1901","Lopez Savi Maria","Tramonto regale","1901","Verrà pure il giorno della lotta: non è possibile che un popolo non si ribelli a questa tirannia; e verrà anche il giorno del trionfo. È così bello per un uomo, in un paese dove si trovano tanti oppressi, abbandonare per questi gli oppressori! Filippo era impallidito; egli temeva sempre di perdere qualche cosa dell'amore di Assunta, quando discuteva in quel modo con lei.","YES"
"Lopez_Savi_Maria-Tramonto_regale-1901","Lopez Savi Maria","Tramonto regale","1901","Ma neppure l'amore aveva la forza di mutare le sue convinzioni, e di indurlo a cosa che ripugnava alla sua coscienza. Egli disse con tristezza: – Sai che non posso! Debbo ripeterti sempre che per tradizione, per gratitudine si serve da tanto tempo fedelmente il re dalla mia famiglia?","NO"
"Lopez_Savi_Maria-Tramonto_regale-1901","Lopez Savi Maria","Tramonto regale","1901","La prosperità che si gode in casa mia la dobbiamo a lui, a suo padre; non posso io divenire un traditore, e dare un mortale dispiacere ai miei genitori. Vorrei che il governo seguisse la via della giustizia; che non vi fossero nè oppressi nè oppressori; ma non posso unirmi con Severino ed Antonio. Se m'ami non dirmelo più.","YES"
"Lopez_Savi_Maria-Tramonto_regale-1901","Lopez Savi Maria","Tramonto regale","1901","– Ah! lo sai, se t'amo, – disse lei sottovoce, chinando il capo verso il lavoro. Il volto di Filippo divenne raggiante.","NO"
"Lopez_Savi_Maria-Tramonto_regale-1901","Lopez Savi Maria","Tramonto regale","1901","– E sono sempre lo stesso per te, anche non facendo ciò che desideri, e che mi pare contrario al mio dovere? – Sì, – rispose lei, vinta da quella voce che amava. – Lo sai, – soggiunse Filippo, – che tutta l'anima mia è cogli oppressi; ma non posso, non voglio combattere contro gli oppressori.","NO"
"Lopez_Savi_Maria-Tramonto_regale-1901","Lopez Savi Maria","Tramonto regale","1901","– Ah! se tu volessi, – esclamò lei sospirando. – Non è possibile.","NO"
"Lopez_Savi_Maria-Tramonto_regale-1901","Lopez Savi Maria","Tramonto regale","1901","– Ti muterai un giorno o l'altro, ne sono certa. – Non posso mutarmi, intendi? t'amerò sempre.","NO"
"Lopez_Savi_Maria-Tramonto_regale-1901","Lopez Savi Maria","Tramonto regale","1901","– Veramente? – chiese Assunta, che sorrise. Sempre, – rispose Filippo, ed accostò alle labbra con amore, con riverenza, la piccola mano, che teneva un filo di seta azzurra.","NO"
"Lopez_Savi_Maria-Tramonto_regale-1901","Lopez Savi Maria","Tramonto regale","1901","Teresa, che aveva continuato a stirare in fretta, sperando di finire prima che la madre si svegliasse, li guardò entrambi con affetto e sorrise. Sapeva che finivano sempre in quel modo le loro discussioni, alle quali non voleva, mai prendere parte; per tema di cagionare un dispiacere non lieve ad Assunta, mostrando apertamente che dava ragione a Filippo. Ciccillo «'o stuorto» sensale di stanze mobigliate, di «quarti e quartini» onorato dalla fiducia di molti abitanti del quartiere Stella, dalla strada Fonseca, fino a Materdei ed a San Raffaele, accompagnò il tenente Schwarz per fargli vedere il quartierino mobiliato che don Lorenzo, vicino di donna Amalia, aveva lasciato da una settimana.","YES"
"Lopez_Savi_Maria-Tramonto_regale-1901","Lopez Savi Maria","Tramonto regale","1901","La bella persona del tenente faceva sembrare più brutta quella di Ciccillo. Egli era forte e alto, roseo come una fanciulla, piacente nell'aspetto, benchè non avesse la fine eleganza del gentiluomo. Il povero Ciccillo piccolo e giallo, contraffatto, con una grossa gobba fra le spalle, stentava a camminare con passo adeguato al suo, e pensava che avrebbe lasciato ad altri, molto volentieri, la cura di trovargli un alloggio.","YES"
"Lopez_Savi_Maria-Tramonto_regale-1901","Lopez Savi Maria","Tramonto regale","1901","Ma come avrebbe osato lui così povero, umile, debole, ricusare, l'opera sua, quando colui l'aveva chiamato con modi arroganti, per farlo andare presto con lui? Il tenente parlava male l'italiano, e con spiacente pronunzia. Ciccillo non lo capiva, e spesso, non sapendo che cosa rispondergli, benchè la paura tenesse desta la sua intelligenza, faceva inchini profondi; balbettava in dialetto parole appena intelligibili e tremava, non osando guardare il compagno; al quale i passanti, amici della quiete, facevano subito largo, mentre i monelli, impauriti anch'essi, cessavano di fare il chiasso, vedendolo.","YES"
"Lopez_Savi_Maria-Tramonto_regale-1901","Lopez Savi Maria","Tramonto regale","1901","Il tenente, al quale Gennaro il portinaio fece un saluto così profondo, che la punta acuminata del berretto sfiorò le lastre grigie del cortile, si dolse, nel salire le scale, che il quartierino fosse alquanto discosto dalla caserma di San Potito, dove si trovava il suo reggimento, e molto lungi dal centro della città. Ma quando vide che le finestre si aprivano verso i giardini, dai quali saliva un profumo inebriante di magnolie e di rose, e avevano dinanzi lo spazio, limitato solo in lontananza della collina di Capodimonte, stabilì di venirvi ad abitare. Per questa ragione Ciccillo non perdette la passeggiata, avendo fatto affittare il «quartino» e il tenente Schwarz, libero cittadino della libera Elvezia, e mercenario di re Ferdinando nella città di Napoli, divenne vicino di donna Amalia e della famiglia Riva, Vedendo il tenente non si poteva imaginare che rimpiangesse le sue montagne, e fosse malato di nostalgia, come spesso avveniva a certi suoi compagni.","YES"
"Lopez_Savi_Maria-Tramonto_regale-1901","Lopez Savi Maria","Tramonto regale","1901","La vita era per lui in Napoli facile e piacevole, e nessun rimorso veniva a turbare la pace dell'animo suo. Povero ed avvezzo a dura vita nel suo paese, seguiva una consuetudine secolare, in quel tempo, della sua gente, vendendo a prezzo l'anima ed il sangue; pronto sempre ad ubbidire agli ordini dei suoi superiori; anche se gl'imponessero di uccidere gente che non aveva offesa e minacciata la sua terra, insultata la sua bandiera. Lieto di essere pagato largamente, gli piaceva molto di bere, di passare la vita nell'allegria; e avendo un'intelligenza ristretta, non si avvedeva dell'indifferenza glaciale che lo circondava, o del ribrezzo, della paura che destava la sua presenza, in mezzo a certe famiglie napoletane, nelle quali era riuscito a farsi presentare.","NO"
"Lopez_Savi_Maria-Tramonto_regale-1901","Lopez Savi Maria","Tramonto regale","1901","Schwarz mandò il bagaglio modesto nel quartierino, al numero ventisei del vicolo Calce, contento di lasciare le stanze non rallegrate mai dal sole, che occupava da qualche tempo nella strada San Potito, di fronte ad un muro alto e triste, presso la porta piccola della chiesa. Egli metteva la chiave nella toppa della serratura, per entrare nella nuova casa, quando sentì sulla scala il passo leggero di donna Amalia, che tornava dall'aver portato a certi negozianti gli ultimi ricami eseguiti da lei e dalle fanciulle Riva. Il tenente volse con molta lentezza la chiave, per avere il tempo di vedere la persona che saliva, ed era forse qualche sua bella vicina; una di quelle napoletane brune, con i grandi occhi neri ed espressivi, con i folti capelli, che gli piacevano.","YES"
"Lopez_Savi_Maria-Tramonto_regale-1901","Lopez Savi Maria","Tramonto regale","1901","Scorse invece dopo un momento donna Amalia, che si fermò presso l'ultimo gradino, per prendere fiato, benchè si trovasse solo al primo piatto. Ella portava un grosso involto di biancheria, che faceva parte del corredo di una sposa, e non era più elegante come la sera della visita al povero dottore. Invece della paglia bianca, ornata di piume e di papaveri, portava un vecchio cappello di merletto nero, che faceva sembrare più giallo il suo viso.","NO"
"Lopez_Savi_Maria-Tramonto_regale-1901","Lopez Savi Maria","Tramonto regale","1901","Uno scialle molto più vecchio del cappello, con certi ricami turchi di una tinta sbiadita, sul fondo di un nero divenuto rossastro, copriva le sue spalle quadrate, stringendole. E pareva che la sua povera veste grigia, senza la crinolina, che donna Amalia non si era piegata ad usare, coprisse un sottile bastone. Il tenente provò un certo dispetto, scorgendo quella povera creatura gialla, ossuta, mal vestita, invece della specie di Venere bruna da lui sognata.","NO"
"Lopez_Savi_Maria-Tramonto_regale-1901","Lopez Savi Maria","Tramonto regale","1901","Ella si era confusa molto nel vederlo e anche sgomentata, perchè, al pari della maggior parte dei Napoletani, aveva gran paura degli Svizzeri. Schwarz aveva aperta la metà dell'uscio, ed al suo dispetto era seguita una certa curiosità di sapere se lei abitasse proprio accanto a lui. Intanto donna Amalia era indispettita nel vedere che lo Svizzero la guardava.","YES"
"Lopez_Savi_Maria-Tramonto_regale-1901","Lopez Savi Maria","Tramonto regale","1901","Le spiaceva di fermarsi vicino a lui, per aprire la sua porta; e per un istante divisò di salire ancora e di andare in casa Riva. Ma non poteva, era troppo stanca, avendo percorso alcuni chilometri col peso dell'involto, dalla strada di Chiaia fino al vicolo Calce; ed era anche discesa a piedi laggiù! E poi a quell'ora si pranzava in casa Riva e donna Amalia non voleva andarvi.","YES"
"Lopez_Savi_Maria-Tramonto_regale-1901","Lopez Savi Maria","Tramonto regale","1901","Ella passò innanzi al tenente, e mise la chiave nella toppa, affrettandosi. Schwarz appoggiato allo stipite dell'uscio la guardava, mentre si lisciava i baffi e sorrideva. Donna Amalia era molto perplessa, non usando chiudere l'uscio di casa sua, che aveva aperto, senza salutarlo.","NO"
"Lopez_Savi_Maria-Tramonto_regale-1901","Lopez Savi Maria","Tramonto regale","1901","Non credendo di poter fare diversamente si decise al saluto, volse lo sguardo verso di lui, e con molta timidezza disse: – Permettete! Nel suo linguaggio troppo spiacente per essere ripetuto fra queste pagine, Schwarz le chiese subito, prima che ella avesse il tempo di chiudere: – Abitate qui? – Sì, signor tenente.","NO"
"Lopez_Savi_Maria-Tramonto_regale-1901","Lopez Savi Maria","Tramonto regale","1901","– Sola? – Sissignore. – Non ci sono belle ragazze, in questa casa?","NO"
"Lopez_Savi_Maria-Tramonto_regale-1901","Lopez Savi Maria","Tramonto regale","1901","– domandò Schwarz, che sorrideva ancora. Donna Amalia era sempre più agitata, perplessa; non voleva mentire, dicendo che non ve n'erano, e non voleva neppure far cenno a colui delle fanciulle Riva. Schwarz già seccato di non avere una pronta risposta, disse con impazienza: – Vi manca, la lingua per rispondere?","NO"
"Lopez_Savi_Maria-Tramonto_regale-1901","Lopez Savi Maria","Tramonto regale","1901","– Ecco, – disse lei costretta, – vi sono due ragazze. – Belle? – domandò ancora il tenente.","NO"
"Lopez_Savi_Maria-Tramonto_regale-1901","Lopez Savi Maria","Tramonto regale","1901","Per donna Amalia le figlie del dottore Riva erano le più belle fanciulle di Napoli; ma non voleva dire il suo parere allo svizzero, e rispose: – così, – poi soggiunse subito, per troncare il discorso e chiudersi in casa: – permettete. – Le conoscete voi quelle ragazze? – Permettete, – disse di nuovo donna Amalia.","NO"
"Lopez_Savi_Maria-Tramonto_regale-1901","Lopez Savi Maria","Tramonto regale","1901","– Voglio sapere se sono bionde o brune. – Una è bionda, e l'altra è bruna. – Ah!","NO"
"Lopez_Savi_Maria-Tramonto_regale-1901","Lopez Savi Maria","Tramonto regale","1901","– Permettete, – ripetè lei che ebbe il coraggio di chiudere l'uscio. Poi entrò nella sua camera, annoiata molto di quell'interrogatorio subìto, e mentre ripiegava con grande cura il vecchio scialle, e spolverava il cappello rossastro diceva sottovoce: – Che seccatura! che cosa deve importargli di sapere se ci sono ragazze nel palazzo.","NO"
"Lopez_Savi_Maria-Tramonto_regale-1901","Lopez Savi Maria","Tramonto regale","1901","Se l'avessero sentito Filippo o Severino! che disgrazia è questa di averlo qui vicino! Più tardi mentre Schwarz, il quale aveva fatto la mattina una lunga marcia sulla strada di Caserta, dormiva, stanco nella nuova casa, e sognava la vicina bionda e quella bruna, Squitti pallidissimo si alzò, e tenendo colla mano che tremava lievemente il cappello a cilindro stette per un istante immobile vicino a Salvetti, nel suo studio.","YES"
"Lopez_Savi_Maria-Tramonto_regale-1901","Lopez Savi Maria","Tramonto regale","1901","Questi aveva chinato il volto pacifico verso una lettera aperta, sulla scrivania, che doveva fare la rovina di una famiglia napoletana, e pareva intento a leggerla, senza darsi pensiero di Squitti. Costui aveva lo sguardo acceso d'ira, ma riuscì a dominare l'interna ribellione, e quasi umilmente, pregando disse: – Non mi lasciate andar via, stasera, senza una buona parola, senza una speranza. Salvetti alzò il capo, e con una voce quasi dolce, che non pareva quella di un uomo avvezzo a far tremare la gente anche se questa non era nemica palese del governo, domandò: – Ma che importa a voi di Michele Riva?","NO"
"Lopez_Savi_Maria-Tramonto_regale-1901","Lopez Savi Maria","Tramonto regale","1901","– Nulla, cavaliere, nulla, – rispose Squitti in fretta, come se gli premesse di convincere subito Salvetti, che non era stretto da nessun vincolo di amicizia o d'interesse al prigioniero; poi soggiunse: – Ma parlo per la giustizia. – Ah! vi preoccupate anche della giustizia, voi?","NO"
"Lopez_Savi_Maria-Tramonto_regale-1901","Lopez Savi Maria","Tramonto regale","1901","– chiese ridendo Salvetti; e quel riso beffardo, e lo sguardo cattivo mutarono in un attimo l'aspetto del suo volto, il quale parve minaccioso. Il senso amaro della domanda, non fece nessuna impressione sull'animo di Squitti: non era avvezzo a preoccuparsi d'inezie di quel genere. Rispose: – Vi ho pregato, vi prego, perchè si tratta d'un innocente.","NO"
"Lopez_Savi_Maria-Tramonto_regale-1901","Lopez Savi Maria","Tramonto regale","1901","Michele Riva non cospirava quando venne accusato. Lo zelo eccessivo fu cagione di un grave errore. Salvetti pareva molto annoiato; alzò le spalle, e riprese il largo foglio che portava i segni delle piegature, ed aveva un'ostia giallastra sul margine superiore.","NO"
"Lopez_Savi_Maria-Tramonto_regale-1901","Lopez Savi Maria","Tramonto regale","1901","Egli disse: – Se non cospirava allora ha cospirato prima; è giusto che paghi. Squitti l'avrebbe annientato, se fosse stato possibile; pregò invece di nuovo, Salvetti gli rispose con grande impazienza: – Ma non sapete che ho molto da fare; e non voglio perdere il tempo per sentire le vostre inutili querimonie? Addio, tornerete appena vi sarà riuscito di raccogliere qualche notizia importante, e se vi è possibile guardate di mettere le mani sopra quegli audaci cospiratori, dei quali, come sapete, s'indovina l'esistenza, ma non si conosce ancora il nome.","NO"
"Lopez_Savi_Maria-Tramonto_regale-1901","Lopez Savi Maria","Tramonto regale","1901","I tempi sono tristi, pare che nell'aria vi siano delle minacce vicine; sempre a cagione di quel maledetto Piemonte e di questi maledettissimi liberali napoletani. Non è il momento, per i fedeli servitori del re, di fare delle ciance inutili per gente nemica o sospetta. Invece bisogna spiegare tutte le forze dell'intelletto e tutti i suggerimenti dell'astuzia per mettere dei bastoni fra le ruote di certi carri, i quali minacciano di schiacciarci.","YES"
"Lopez_Savi_Maria-Tramonto_regale-1901","Lopez Savi Maria","Tramonto regale","1901","Avete capito? Cercate piuttosto quei nomi. Addio.","NO"
"Lopez_Savi_Maria-Tramonto_regale-1901","Lopez Savi Maria","Tramonto regale","1901","Squitti li conosceva già quei nomi, ma non voleva, non poteva dirli. Per consuetudine fece un inchino profondo innanzi a Salvetti, che aveva ripreso a leggere, e quasi barcollando uscì dallo studio. Quando fu sulla scala discesa un giorno da Concetta Marulla, mentre le stringeva il cuore un'infinita angoscia, egli terse il sudore che gli copriva la fronte.","YES"
"Lopez_Savi_Maria-Tramonto_regale-1901","Lopez Savi Maria","Tramonto regale","1901","Non pensava che si era quasi compromesso innanzi a Salvetti, per ottenere la liberazione di Riva; ma si doleva acerbamente di non essere, neppure quella volta, riuscito nel suo intento. Quando uscì dalla casa, la mezzanotte sonava, ed egli si avviò verso il Largo di San Ferdinando, in mezzo a poca gente, non essendo ancora incominciato il gran movimento di persone e di carrozze, che seguiva la chiusura dei teatri. Egli non pensò a fermarsi nel caffè di Europa, come avrebbe fatto, se la condizione dell'animo suo fosse stata diversa.","NO"
"Lopez_Savi_Maria-Tramonto_regale-1901","Lopez Savi Maria","Tramonto regale","1901","Era tanto agitato, soffriva in modo così acerbo, e non aveva nessuna voglia di discorrere. Presso la chiesa di San Ferdinando salì in una carrozzella, per tornare in casa presso la piazzetta di Materdei; e mentre il cocchiere sferzava con rabbia il cavallo, perchè era costretto a percorrere una via tanto lunga, la quale finiva, con una ripida salita, Squitti continuava ad essere furente in cuor suo contro Salvetti, e certi altri ai quali aveva dato, prima, il nome di amici. Non gli sembrava possibile che non gli riuscisse di liberare Michele Riva!","YES"
"Lopez_Savi_Maria-Tramonto_regale-1901","Lopez Savi Maria","Tramonto regale","1901","Era questi un uomo quasi oscuro; si poteva immaginare che da gran tempo non era pericoloso per il governo. Perchè dunque si ostinavano a negargli quella liberazione implorata? Si sarebbe detto che volessero fargli dispetto; e che Salvetti e gli altri lo guardassero con ironia, quando non si lasciavano persuadere dalle sue parole.","YES"
"Lopez_Savi_Maria-Tramonto_regale-1901","Lopez Savi Maria","Tramonto regale","1901","Eppure dovevano crederlo, quando proprio lui affermava che Riva, dopo le pazzie fatte nel venti e nel quarantotto, non aveva cospirato più, e solo certi falsi indizii avevano dato argomento all'accusa, contro di lui. Ah! donna Francesca poteva essere certa ch'egli non mentiva, affermandole che si adoperava per ottenere la liberazione del marito.","YES"
"Lopez_Savi_Maria-Tramonto_regale-1901","Lopez Savi Maria","Tramonto regale","1901","Ella, forse, lo credeva, ma gli altri, ma Teresa, che pensavano di lui? Circa tre mesi dopo l'arresto di Riva, sembrandogli troppo imprudente di farlo prima, aveva incominciato a lavorare per lui, timidamente; poi, trovando l'ostacolo impreveduto, si era mostrato quasi audace nell'affermare che era innocente; piegandosi a tollerare le ripulse, le osservazioni, battendo a nuove porte; ma sempre inutilmente, perchè il rigore cresceva contro i liberali, ed il governo non era disposto a lasciare in libertà qualcuno degl'infelici che teneva stipati nelle prigioni del Regno. Squitti si andava dunque persuadendo che, in certi casi, la sua voce non aveva nessuna autorità, presso le persone che pur si servivano di lui come di un istrumento prezioso.","YES"
"Lopez_Savi_Maria-Tramonto_regale-1901","Lopez Savi Maria","Tramonto regale","1901","E con grande amarezza pensava che a nulla gli servivano gli anni passati segretamente agli ordini di Salvetti e di altri, se chiedeva ad essi un favore speciale. Lo pagavano, ma poi tutto era finito; e non era quella una gente che si lasciasse commuovere da preghiere o convincere da sottili ragionamenti. Eppure tra le persone assai numerose che vivevano facendo le spie vicino al prossimo, poche sapevano come lui essere abili e scaltre, trarre il discorso con semplicità sopra argomenti pericolosi, leggere nei cuori e negli sguardi, seguire in certe aspirazioni audaci il pensiero, che si manifestava appena.","YES"
"Lopez_Savi_Maria-Tramonto_regale-1901","Lopez Savi Maria","Tramonto regale","1901","Dalla liberazione di Riva; desiderata da Squitti con tanto ardore, questi credeva che dipendesse per lui la felicità suprema, il solo bene che desiderasse da gran tempo, fin da quando si era acceso di un infinito amore per Teresa; e disperando di vincere il suo cuore in altro modo, bramava di legarla alla sua vita con un vincolo d'immensa gratitudine. Che giorno sarebbe stato quello, in cui gli fosse riuscito di accompagnare il dottore, liberato da lui, in mezzo alla sua famiglia! Già quando illuso da una fallace speranza, avea sognato quel giorno, gli era parso di vedere come cosa reale la scena che sarebbe avvenuta nella povera casa di Riva nel momento del ritorno inatteso.","YES"
"Lopez_Savi_Maria-Tramonto_regale-1901","Lopez Savi Maria","Tramonto regale","1901","Donna Francesca non si sarebbe curata di lui, subito, invasa da una pazza gioia nel rivedere il marito; ma gli altri l'avrebbero udito se egli avesse detto con orgoglio: – Eccolo, sono io che ve lo rendo! – ma Teresa l'avrebbe ascoltato senza respingerlo, commossa per l'infinita gratitudine, se egli, audace per la prima volta accanto a lei, le avesse detto, stringendo la sua cara mano: – L'ho salvato per voi. Per voi mi sono esposto a grave pericolo.","YES"
"Lopez_Savi_Maria-Tramonto_regale-1901","Lopez Savi Maria","Tramonto regale","1901","L'ho salvato perchè non posso vivere senza il vostro amore! – Ma la dolce visione era sparita, ed egli non potrebbe mai ricondurre il dottore alla sua famiglia! Squitti era fatto in modo che le sue opere tenebrose non destavano mai rimorso in lui.","YES"
"Lopez_Savi_Maria-Tramonto_regale-1901","Lopez Savi Maria","Tramonto regale","1901","Non essendo possibile che riuscisse col solo stipendio vivere come bramava, si era servito senza il minimo scrupolo di certe speciali attitudini della sua mente: che doveva importare a lui se a cagione delle insidie, dei tradimenti, delle denunzie, vi fosse gente rovinata, che soffrisse acerbamente, purchè gli riuscisse di avere la sedia a San Carlo ed ai Fiorentini; di servirsi da uno dei sarti di Napoli più schiettamente inglese nel taglio degli abiti, e da farsi notare per la grande eleganza? Anzi qualche volta aveva finito col persuadersi che compiva un'opera meritevole verso lo Stato, cercando colle armi delle quali poteva disporre di allontanare da esso le insidie, di rompere i fili delle cospirazioni, e contribuire a mantenere l'ordine nella città e nel Regno. Viveva dunque in pace, senza chiedere altro alla vita.","YES"
"Lopez_Savi_Maria-Tramonto_regale-1901","Lopez Savi Maria","Tramonto regale","1901","Poi, un giorno, era avvenuto nel suo cuore, nella sua mente una specie di rivoluzione, senza che avesse un mezzo qualsiasi d'impedirla, quando si era incontrato con Teresa in casa della Marulla, conosciuta da lui per mezzo di Peppina Salvetti. Egli che era avvezzo a compiacersi in facili e volgari amori, si era stupito nel sentire la forza del sentimento nuovo che l'attraeva con forza irresistibile verso la fanciulla. Allora aveva incominciato a visitare con frequenza la famiglia Riva, a guardare con occhio geloso Antonio e Filippo, benchè avesse finito coll'essere certo che non amavano Teresa.","NO"
"Lopez_Savi_Maria-Tramonto_regale-1901","Lopez Savi Maria","Tramonto regale","1901","Più tardi aveva accolto la disperazione nell'animo, acquistando la certezza che un abisso insuperabile lo separava dalla fanciulla. Egli conosceva il passato di Riva, e si era subito accorto che erano tutti in quella famiglia avversi al governo; capiva, pure che si diffidava di lui, a dispetto della cortesia apparente. E quella diffidenza indovinata da lui, che pur non si era preoccupato mai della diffidenza destata in altre persone, era divenuta per il suo spirito, un tormento perenne, intollerabile.","YES"
"Lopez_Savi_Maria-Tramonto_regale-1901","Lopez Savi Maria","Tramonto regale","1901","Riva, ne era certo, non gli avrebbe mai concesso la mano di Teresa; e questa, sospettando come gli altri, aveva forse in cuore una profonda avversione per lui. In qual modo avrebbe potuto far dileguare quei sospetti, acquistare la stima e l'affetto della famiglia Riva? Certamente l'amore aveva cambiato in qualche modo Squitti, ma non per questo l'aveva messo sulla via di redimersi.","YES"
