"filename","nome","titolo","anno","chunk","DIL"
"Lopez_Savi_Maria-Tramonto_regale-1901","Lopez Savi Maria","Tramonto regale","1901","Non era la prima volta che nelle visite notturne trovavano nelle carceri un morente. Uno di essi scosse forte Riva, afferrandogli con modo quasi brutale la spalla e lo chiamò; l'altro aveva già avvicinato la lanterna al viso del dottore, e dopo averlo guardato fece un passo indietro, dicendo: – Costui muore! – È vero, – balbettò l'altro carceriere, avvezzo a vedere scene spaventevoli, ma che non sapeva mai vincere un senso di raccapriccio innanzi alla morte.","NO"
"Lopez_Savi_Maria-Tramonto_regale-1901","Lopez Savi Maria","Tramonto regale","1901","L'uomo che aveva scosso Riva cercò di sollevarlo. Questi riaprì gli occhi: aveva ancora coscienza di quanto lo circondava, e fece uno sforzo violento per parlare a coloro che assistevano alla sua agonia. Quanti pensieri si affollavano nella sua mente!","YES"
"Lopez_Savi_Maria-Tramonto_regale-1901","Lopez Savi Maria","Tramonto regale","1901","Quante parole d'amore per la famiglia egli voleva dire, di perdono per quelli che l'uccidevano, di fede e di speranza! Intanto il carceriere che l'aveva sollevato alquanto, vinto da un sentimento insolito di pietà disse all'altro, che teneva sempre la lanterna: – Non è possibile che si lasci morire un cristiano in questo modo. Corri a chiamare gente, ad avvertire il cappellano.","YES"
"Lopez_Savi_Maria-Tramonto_regale-1901","Lopez Savi Maria","Tramonto regale","1901","L'uomo lasciò la lanterna sulla vecchia sedia, dove il tarlo taceva ancora, ed uscì in fretta, lasciando spalancata la porta. Il suo compagno rimasto solo con Riva, che tremava, vinto dal freddo della morte, adagiò lentamente il suo capo sul piccolo guanciale, e la pietà cresceva in lui. Ah!","YES"
"Lopez_Savi_Maria-Tramonto_regale-1901","Lopez Savi Maria","Tramonto regale","1901","non era colui che moriva uno dei soliti ladri, dei camorristi feriti mortalmente nelle sanguinose risse frequenti nei cameroni della Vicaria, e che spiravano coll'ira in cuore, la bestemmia sulle labbra, anelando alla vendetta. Il dottore invece, sul volto già coperto dalle ombre della morte, aveva qualche cosa della serenità dei santi e dei martiri. Il carceriere prese un mantello gittato a piè del lettuccio, lo spiegò e lo distese sul dottore; poi di nuovo sollevò il suo capo con grande gentilezza, dicendogli di sperare ancora, di confortarsi.","NO"
"Lopez_Savi_Maria-Tramonto_regale-1901","Lopez Savi Maria","Tramonto regale","1901","Fra poco tornerebbe il compagno, avrebbe qualche soccorso. Poi egli esitò. Non era permesso ancora di parlare ai prigionieri della vicina amnistia; ma quell'uomo era morente, e si poteva fare per lui una eccezione.","YES"
"Lopez_Savi_Maria-Tramonto_regale-1901","Lopez Savi Maria","Tramonto regale","1901","Se capiva ancora, non era possibile che una grande commozione, una gioia intensa richiamassero in lui la vita che fuggiva? Il carceriere si chinò verso Riva e gli disse: – Guardate di vivere, di stare bene. Si dice che il re... Parve che il dottore interrogasse collo sguardo che si spegneva il carceriere.","YES"
"Lopez_Savi_Maria-Tramonto_regale-1901","Lopez Savi Maria","Tramonto regale","1901","Questi, che aveva esitato un istante non sapendo se le sue parole fossero intese, soggiunse, vedendosi guardato dal morente: – Si dice, ed è certo, che il re farà presto la grazia ai prigionieri politici. Saranno forse settecento i liberati. Ci sarete anche voi, sperate!","NO"
"Lopez_Savi_Maria-Tramonto_regale-1901","Lopez Savi Maria","Tramonto regale","1901","Riva udì, ebbe la forza di sollevare il capo, e per un istante sentì un rimpianto amaro della vita che fuggiva. Poi rassegnato, rapidamente, sollevò di nuovo a Dio il pensiero e la speranza. Il respiro cessò, gli occhi rimasero fissi, senza sguardo.","NO"
"Lopez_Savi_Maria-Tramonto_regale-1901","Lopez Savi Maria","Tramonto regale","1901","Era morto! Squitti aveva dormito in pace nella sua camera, ed erano vicine le otto, quando per respirare una boccata d'aria fresca, spalancò il balcone, che si apriva sulla piazzetta di Materdei, al primo piano della grande casa, di fronte alla chiesa. Vi era già sulla piazzetta una folla di donnicciuole e di venditori ambulanti, i quali gridavano forte, chiamando gli avventori intorno alla loro merce; e le grandi ceste colme di fichi, in mezzo ai quali spiccavano colla tinta rosea gli oleandri coperti ancora di rugiada, attraevano in modo speciale la gente.","NO"
"Lopez_Savi_Maria-Tramonto_regale-1901","Lopez Savi Maria","Tramonto regale","1901","Da gran tempo Squitti non era stato così soddisfatto. E con animo commosso, con ardente speranza, ripensava al contegno di Teresa, la sera innanzi, vicino a lui, quando gli aveva data la lettera per il padre, ed insieme avevano stabilito diverse cose per la visita alla Vicaria. Ella si era mostrata così riconoscente, l'aveva con tanto calore ringraziato di quanto faceva per il padre; e se, guardandolo, aveva indovinato il suo amore, non si era mostrata disposta a respingerlo.","YES"
"Lopez_Savi_Maria-Tramonto_regale-1901","Lopez Savi Maria","Tramonto regale","1901","Come era giunta a proposito per lui la lieta notizia della prossima amnistia, e con quanto desiderio aspettava il giorno nel quale andrebbero a visitare il dottore! Gli sarebbe così facile allora di stare a lungo accanto a Teresa e si mostrerebbe così affettuoso e commosso vedendolo, ch'ella sentirebbe crescere in sè la fiducia verso di lui e la gratitudine. Non era forse vicino il giorno in cui potrebbe senza temere una ripulsa disdegnosa, dire alla fanciulla tutto l'amor suo?","YES"
"Lopez_Savi_Maria-Tramonto_regale-1901","Lopez Savi Maria","Tramonto regale","1901","Mentre Squitti colla fantasia accesa vedeva già Teresa, che ascoltava commossa le sue ardenti parole, tre donne, vedendo dalla strada Materdei, entrarono nella piazzetta, fra molte persone discese da San Raffaele o salite dalle Fontanelle, mentre la campana di Materdei chiamava i fedeli alla Messa delle otto. Era giorno di festa, e le fanciulle Riva andavano anch'esse con donna Amalia nella piccola chiesa. Esse videro Squitti, passando innanzi al balcone, e con un lieve cenno del capo, con un sorriso, risposero al suo saluto.","NO"
"Lopez_Savi_Maria-Tramonto_regale-1901","Lopez Savi Maria","Tramonto regale","1901","Donna Amalia chinò per lui, con una certa solennità, la cima dei papaveri rossi, che ondeggiavano all'aura mattutina sul suo cappello di paglia. Che cosa avvenne nel cuore di Squitti, quando ebbe il saluto di Teresa e vide il suo sorriso? Gli parve allora più vicino il giorno del suo trionfo ed il principio di una felicità infinita.","YES"
"Lopez_Savi_Maria-Tramonto_regale-1901","Lopez Savi Maria","Tramonto regale","1901","La fanciulla aveva già salito colle sue compagne i tre gradini di pietra grigia, per entrare in chiesa, quando giunse con passo affrettato sulla piazzetta il servo di Salvetti, tenendo in mano una lettera, e si diresse verso la casa di Squitti, che si fece scuro in volto appena lo vide. Che cosa voleva da lui Salvetti, contro il quale, dopo le costanti ripulse per la liberazione di Michele Riva, sentiva un odio profondo? Il servo era già entrato nella casa, e Squitti, il quale si era seduto presso il balcone, aspettando che le fanciulle Riva uscissero da Materdei, ebbe dopo alcuni minuti la lettera, che aprì con molta noia, quasi con dispetto, benchè fosse sempre il servo di Salvetti.","YES"
"Lopez_Savi_Maria-Tramonto_regale-1901","Lopez Savi Maria","Tramonto regale","1901","Sul largo foglio spiegato lesse «Caro Squitti, «Il dottore Michele Riva è morto stanotte alla Vicaria. V'incarico di far conoscere questa notizia alla famiglia. Vi saluto.","NO"
"Lopez_Savi_Maria-Tramonto_regale-1901","Lopez Savi Maria","Tramonto regale","1901","Salvetti». Squitti lasciò cadere il foglio dalle mani tremanti, ed il suo volto divenne livido. Riva era morto!","YES"
"Lopez_Savi_Maria-Tramonto_regale-1901","Lopez Savi Maria","Tramonto regale","1901","per alcuni minuti egli non seppe fare altro che ripetere quelle terribili parole, dimenticando Teresa, il suo amore; ed aveva solo dinanzi l'immagine dell'ucciso. Poi, riavutosi alquanto, volle persuadersi che sognava, Riva non era morto e Salvetti non aveva scritto. Ma la lettera era aperta innanzi ai suoi piedi: egli non sognava!","YES"
"Lopez_Savi_Maria-Tramonto_regale-1901","Lopez Savi Maria","Tramonto regale","1901","Squitti cercò di vincere lo spavento che l'invadeva, mentre uno spasimo atroce di rimorso gli lacerava il cuore. Come poteva essersi mutato in quel modo? Non erano morti altri in carcere, vittime delle sue accuse?","YES"
"Lopez_Savi_Maria-Tramonto_regale-1901","Lopez Savi Maria","Tramonto regale","1901","Non ve n'erano altri che trascinavano all'ergastolo, per cagion sua, la catena, colpevoli solo di avergli lasciato indovinare l'amore ardente per la patria, e di avere detto innanzi a lui qualche imprudente parola? Perchè dunque l'atterriva in quel modo la morte del dottore, e lo faceva piombare nel dolore e nella disperazione? Ma Riva era il padre di Teresa, e a dispetto della corruzione profonda, egli sentiva che un abisso spaventevole si era aperto per dividerlo dalla fanciulla amata.","YES"
"Lopez_Savi_Maria-Tramonto_regale-1901","Lopez Savi Maria","Tramonto regale","1901","Come era possibile che la figlia della vittima fosse unita un giorno all'assassino? Per ha prima volta, e per breve tempo, Squitti misurò tutta l'abbiezione della sua vita d'insidie, di tradimenti, poi si fece animo. Essendo maestro nell'arte di simulare, che cosa poteva temere?","YES"
"Lopez_Savi_Maria-Tramonto_regale-1901","Lopez Savi Maria","Tramonto regale","1901","Chi avrebbe mai rivelato a Teresa il terribile segreto? E poi egli non aveva voluto la morte di Riva. Un giorno, quasi acciecato dalla passione che ardeva in ogni fibra dell'animo suo, aveva imaginato un mezzo, il solo, a parer suo, che potesse legare a lui l'anima di Teresa.","YES"
"Lopez_Savi_Maria-Tramonto_regale-1901","Lopez Savi Maria","Tramonto regale","1901","Allora aveva denunziato Riva, affermando che cospirava contro il re, ma era certo di poterlo liberare fra brevissimo tempo, perchè nessuna accusa poteva reggere allora contro di lui. Invece non aveva accusato il vero colpevole, che vi era in casa Riva, perchè non gli sarebbe più riuscito di salvarlo! Egli aveva sognato allora di essere accolto dal dottore, dopo un breve periodo di affanno per la sua famiglia, come un liberatore ed un figliuolo!","YES"
"Lopez_Savi_Maria-Tramonto_regale-1901","Lopez Savi Maria","Tramonto regale","1901","Invece la Vicaria non gli aveva reso vivente l'infelice. Riva era morto! Essendo alquanto più calmo, Squitti riprese la lettera, la rilesse, e badò all'ultima parte, della quale non aveva tenuto conto prima: Salvetti lo incaricava dunque di annunziare il triste caso alla famiglia Riva!","YES"
"Lopez_Savi_Maria-Tramonto_regale-1901","Lopez Savi Maria","Tramonto regale","1901","Come era possibile che lui, proprio lui portasse quella notizia! Il cuore gli sarebbe bastato per darla a donna Francesca, a Severino, ad Assunta, ma non poteva, non osava dire a Teresa che suo padre era morto, non voleva essere per lei un nunzio di sventura. Da circa mezz'ora Squitti aveva letto la lettera di Salvetti, e nell'affanno che lo travagliava, nella confusione turbinosa dei suoi pensieri non si era accorto che il tempo passava.","YES"
"Lopez_Savi_Maria-Tramonto_regale-1901","Lopez Savi Maria","Tramonto regale","1901","Intanto la gente ricominciò ad uscire dalla chiesa, ed egli teneva lo sguardo fisso sulla facciata bianca, o sulla porta spalancata senza vedere nulla. Poi Teresa apparve sulla soglia, precedendo di alcuni passi Assunta e donna Amalia. Appena Squitti vide la sua persona snella, che non perdeva nulla della sua grazia colla veste semplice, quasi povera, egli si alzò, pallido, tremante, e tornò in fretta nella camera.","NO"
"Lopez_Savi_Maria-Tramonto_regale-1901","Lopez Savi Maria","Tramonto regale","1901","Non voleva che le fanciulle, passando, gli sorridessero di nuovo, come ad un amico, mentre il padre era morto alla Vicaria! Le fanciulle e donna Amalia attraversarono la piazzetta; il balcone di Squitti era vuoto. Sonavano le nove e mezzo, quando Peppina Salvetti pallidissima, ansante, perchè aveva salito in fretta le scale, giunse in casa di Concetta Marulla.","YES"
"Lopez_Savi_Maria-Tramonto_regale-1901","Lopez Savi Maria","Tramonto regale","1901","Filomena che le aprì la porta, la guardò spaventata, vedendola col viso stravolto. Ella chiese: – C'è la Signora? – Sì, eccellenza, ma che cosa avete?","NO"
"Lopez_Savi_Maria-Tramonto_regale-1901","Lopez Savi Maria","Tramonto regale","1901","vi sentite... La Salvetti l'interruppe, dicendo: – Avverti subito Concetta che sono qui. Peppina andò innanzi, attraversando alcune stanze, e si fermò in un salotto che precedeva la camera della Marulla.","NO"
"Lopez_Savi_Maria-Tramonto_regale-1901","Lopez Savi Maria","Tramonto regale","1901","Filomena corse a chiamare la padrona, che era andata a fare, come spesso usava, una specie d'ispezione in cucina. Quando la Marulla seppe che la Salvetti era venuta a chiedere di lei, ed era così pallida, smarrita, che faceva pietà, si affrettò a raggiungerla nel salotto. Alcune lagrime scorrevano sulle guance di Peppina, che disse vedendola: – Che disgrazia, Concetta, che disgrazia!","NO"
"Lopez_Savi_Maria-Tramonto_regale-1901","Lopez Savi Maria","Tramonto regale","1901","– Che cosa è accaduto? – chiese la Marulla che impallidì. Filippo ed il marito erano usciti da circa un quarto d'ora e l'assalì una paura irragionevole, temendo che Peppina fosse venuta ad annunziarle qualche sventura toccata all'uno o all'altro.","NO"
"Lopez_Savi_Maria-Tramonto_regale-1901","Lopez Savi Maria","Tramonto regale","1901","– Il dottore, tuo cognato! – esclamò Peppina, che non potè continuare. Il volto di Concetta si rischiarò.","NO"
"Lopez_Savi_Maria-Tramonto_regale-1901","Lopez Savi Maria","Tramonto regale","1901","Poichè non si trattava del marito e di Filippo, ma solo del cognato, il caso non era tanto grave per lei. Ella chiese: – Ebbene? – Se tu sapessi.","YES"
"Lopez_Savi_Maria-Tramonto_regale-1901","Lopez Savi Maria","Tramonto regale","1901","Proprio adesso che il re gli voleva concedere la grazia! – Ha fatto qualche altra pazzia? Si è rovinato di nuovo?","YES"
"Lopez_Savi_Maria-Tramonto_regale-1901","Lopez Savi Maria","Tramonto regale","1901","Ha voluto fuggire? – No! La Marulla guardò tacendo Peppina.","NO"
"Lopez_Savi_Maria-Tramonto_regale-1901","Lopez Savi Maria","Tramonto regale","1901","Che cosa aveva dunque fatto il cognato? – Non puoi imaginare! soggiunse la Salvetti, che non trovava in sè il coraggio di dirle la verità.","NO"
"Lopez_Savi_Maria-Tramonto_regale-1901","Lopez Savi Maria","Tramonto regale","1901","– Che cosa ha fatto? La Salvetti non rispose. – Insomma puoi parlare.","NO"
"Lopez_Savi_Maria-Tramonto_regale-1901","Lopez Savi Maria","Tramonto regale","1901","Sai bene che mi aspetto sempre nuovi dispiaceri da colui. Che cosa ha fatto? Certamente ha offeso di nuovo Sua Maestà.","NO"
"Lopez_Savi_Maria-Tramonto_regale-1901","Lopez Savi Maria","Tramonto regale","1901","– No! – Ebbene? – È morto La Marulla divenne più pallida e tacque.","NO"
"Lopez_Savi_Maria-Tramonto_regale-1901","Lopez Savi Maria","Tramonto regale","1901","L'odiava tanto quel cognato, ma era pure terribile la notizia della sua morte; non perchè le premesse di lui, ma solo perchè imaginò che non vi fosse più speranza di pace e di salute per l'unica sorella che amava. Le parve di vederla più bianca e disfatta, vicina a morire per colui, che aveva rovinata la sua casa, i figliuoli, ed una grande angoscia le strinse il cuore. Peppina le aveva cinto con un braccio il collo e la baciava piangendo, sdegnata contro di sè, sembrandole di non essere stata prudente come si conveniva, e di aver dato in modo quasi brutale quella notizia all'amica.","YES"
"Lopez_Savi_Maria-Tramonto_regale-1901","Lopez Savi Maria","Tramonto regale","1901","La prese per mano, la trasse con dolcezza presso un seggiolone, la fece sedere, poi corse a tirare il cordone di un campanello e tornò vicino a lei, che non poteva parlare, dicendole: – Perdonami, Concetta, non dovevo dirtelo così; ma non credevo che t'importasse tanto di lui! La Marulla fece un lieve gesto d'impazienza, nel sentire queste parole. Le spiaceva che l'amica la credesse tanto addolorata, per quella morte.","YES"
"Lopez_Savi_Maria-Tramonto_regale-1901","Lopez Savi Maria","Tramonto regale","1901","Disse: – Hai avuto ragione; non m'importa nulla di lui. Mi dolgo solo per Francesca. Ora morirà anche lei, non è possibile che sopravviva al marito!","NO"
"Lopez_Savi_Maria-Tramonto_regale-1901","Lopez Savi Maria","Tramonto regale","1901","Filomena venne in fretta, e si spaventò vedendo la padrona così bianca. La Salvetti le disse: – Porta subito un bicchiere d'acqua e qualche liquore. La Marulla, che si era alquanto riavuta, chiese: – Quando è morto?","NO"
"Lopez_Savi_Maria-Tramonto_regale-1901","Lopez Savi Maria","Tramonto regale","1901","– Verso l'alba, stamane. – Chi è morto? – dimandò Filomena, che non si era mossa ancora per andar a prendere l'acqua, accesa da grande curiosità.","NO"
"Lopez_Savi_Maria-Tramonto_regale-1901","Lopez Savi Maria","Tramonto regale","1901","– Il dottore, Michele, – rispose la Marulla. – Il dottore! nella Vicaria?","NO"
"Lopez_Savi_Maria-Tramonto_regale-1901","Lopez Savi Maria","Tramonto regale","1901","– Sì! Filomena congiunse insieme le mani e tacque. Avrebbe voluto dire che il dottore meritava di fare quella morte, in prigione, solo come un cane, lungi dalla famiglia, che aveva rovinata colle sue pazzie; ma non osò, perchè la padrona non tollerava che facesse inutili discorsi quando vi era qualcuno con lei.","YES"
"Lopez_Savi_Maria-Tramonto_regale-1901","Lopez Savi Maria","Tramonto regale","1901","Ella si volse per andare a prendere l'acqua. Concetta domandò ancora a Peppina: – Sai se hanno già fatto conoscere la notizia in casa sua? – Mio marito ha scritto molto presto a Squitti stamane e l'ha incaricato di comunicarla alla famiglia.","NO"
"Lopez_Savi_Maria-Tramonto_regale-1901","Lopez Savi Maria","Tramonto regale","1901","– Dunque, – esclamò la Marulla, – a quest'ora Francesca ed i suoi figli sanno che è morto. Povera Francesca, poveri ragazzi! Filomena tornò col bicchiere d'acqua sul vassoio, dove erano anche due bicchierini, ed una bottiglia col liquore di caffè, fatto con grande perfezione dalla padrona, alla quale disse, mentre versava il liquore nei bicchieri di cristallo coi fregi d'oro: – È venuto adesso don Pasquale Squitti.","NO"
"Lopez_Savi_Maria-Tramonto_regale-1901","Lopez Savi Maria","Tramonto regale","1901","Totonno l'ha fatto entrare nel salotto giallo. Vuole parlare subito con voi. – Vado, – disse la Marulla che si alzò dopo che ebbe bevuto in fretta il liquore, – vieni anche tu, Peppina?","NO"
"Lopez_Savi_Maria-Tramonto_regale-1901","Lopez Savi Maria","Tramonto regale","1901","– No, ti aspetto qui. Sai che non posso soffrire Squitti: ha la faccia di un iettatore. – Torno subito con te, – disse Marulla lasciando sola Peppina, che provava sempre un senso di ribrezzo vicino a certi individui, i quali frequentavano la sua casa, ed erano peraltro servi devoti di suo marito.","NO"
"Lopez_Savi_Maria-Tramonto_regale-1901","Lopez Savi Maria","Tramonto regale","1901","La Marulla era giunta nel salotto giallo. Squitti l'aspettava in piedi; vedendola sconvolta in viso domandò: – Avete saputo, è vero? – Sì.","NO"
"Lopez_Savi_Maria-Tramonto_regale-1901","Lopez Savi Maria","Tramonto regale","1901","Avete già veduto Francesca? – Non ancora. – Eppure so che Salvetti ha dato a voi l'incarico di... – Sì.","NO"
"Lopez_Savi_Maria-Tramonto_regale-1901","Lopez Savi Maria","Tramonto regale","1901","ma non ho avuto il coraggio di parlare con donna Francesca e colle signorine. Ho cercato di vedere Severino, e non è stato possibile; era già uscito. E poi sapete bene che in certi momenti non basta l'affetto degli amici per consolare chi è oppresso da grande sventura.","YES"
"Lopez_Savi_Maria-Tramonto_regale-1901","Lopez Savi Maria","Tramonto regale","1901","Più efficace può essere la parola di parenti affettuosi. Nessuno potrà meglio di voi far sapere con garbo la notizia... – Io! – Ma sì!","NO"
"Lopez_Savi_Maria-Tramonto_regale-1901","Lopez Savi Maria","Tramonto regale","1901","Pensate alla condizione di vostra sorella, e delle vostre nipoti, ora che sapranno la notizia. Dovete andare voi in casa Riva, e parlare alle ragazze prima di vedere donna Francesca. Io guarderò di trovare Severino.","NO"
"Lopez_Savi_Maria-Tramonto_regale-1901","Lopez Savi Maria","Tramonto regale","1901","Forse verrà alla Vicaria, per domandare se hanno consegnato quella lettera al padre. Sapete che doveva averla stamane! Intanto bisogna che io pensi subito a tante cose, altrimenti il... il cadavere del dottore sarà fra breve portato via sul carro dei poveri.","YES"
"Lopez_Savi_Maria-Tramonto_regale-1901","Lopez Savi Maria","Tramonto regale","1901","Ora mi occuperò io, affinchè Severino ottenga di vedere il padre, e di provvedere come meglio crederà alla sua sepoltura. Andrò più tardi in casa Riva. Adesso è necessario che ci andiate voi.","NO"
"Lopez_Savi_Maria-Tramonto_regale-1901","Lopez Savi Maria","Tramonto regale","1901","– Avete ragione, debbo andare. Ecco quello che si guadagna a fare il rompicollo, il liberale. Si muore in carcere, e poi toccano agli altri tanti guai e tante seccature.","NO"
"Lopez_Savi_Maria-Tramonto_regale-1901","Lopez Savi Maria","Tramonto regale","1901","– Vado dunque a fare le pratiche necessarie. Non posso lasciare che la salma del dottore sia trasportata al camposanto senza riguardi, come quella di un assassino, di un ladro. Squitti salutò la Marulla, ed era già sulla soglia del salotto, quando si voltò e disse ancora: – Direte in casa Riva che penso io a tutto.","NO"
"Lopez_Savi_Maria-Tramonto_regale-1901","Lopez Savi Maria","Tramonto regale","1901","Che non li abbandono. Andrò più tardi. La Marulla non rispose: pensava il doloroso incarico assunto; quando ritornò presso la Salvetti, questa chiese: – Che cosa voleva Squitti?","YES"
"Lopez_Savi_Maria-Tramonto_regale-1901","Lopez Savi Maria","Tramonto regale","1901","– Dice che deve pensare a tante cose per l'esequie di Michele. Non ha avvertito la famiglia: Severino era uscito, e non ha voluto parlare a Francesca ed alle ragazze. – Ah!","NO"
"Lopez_Savi_Maria-Tramonto_regale-1901","Lopez Savi Maria","Tramonto regale","1901","capisco; gli manca il cuore di portare la notizia! Come è diventato sensibile quell'uomo! E tu, vai?","YES"
"Lopez_Savi_Maria-Tramonto_regale-1901","Lopez Savi Maria","Tramonto regale","1901","La Marulla non badò al senso amaro delle parole di Peppina, e rispose: – Subito. Non posso abbandonare in questo momento Francesca e le ragazze. – Aspetto che tu sia pronta, scenderemo insieme.","NO"
"Lopez_Savi_Maria-Tramonto_regale-1901","Lopez Savi Maria","Tramonto regale","1901","La Marulla non pensò a vestirsi coi solito lusso. Mise in fretta una mantiglia di merletto nero sulla veste scura, che aveva indosso, e chiamata Filomena questa le appuntò sui folti capelli, pettinati con molta cura, un cappellino elegantissimo bianco e rosso, non avendone ella un altro che fosse meno vistoso. La Marulla discese affrettandosi nel cortile con Peppina Salvetti, che era sempre dolente pel dispiacere toccato all'amica, e la lasciò soltanto quando fu salita nella carrozzella chiamata dal portinaio.","NO"
"Lopez_Savi_Maria-Tramonto_regale-1901","Lopez Savi Maria","Tramonto regale","1901","La Marulla pensava con terrore al momento nel quale vedrebbe la sorella, e intanto aveva premura di giungere in casa sua, temendo che il fatale annunzio le pervenisse in altro modo, senza ch'ella si trovasse vicino a lei per confortarla come meglio saprebbe. Passavano di rado le carrozzelle nel vicolo Calce, e quando una di esse vi giungeva con una certa fatica, in mezzo alla biancheria distesa al sole ed a certi sciami di monelli irrequieti, molte faccie di persone curiose apparivano alle finestre. Appena quella della Marulla arrivò innanzi alla casa di donna Francesca, Assunta si affacciò per vedere chi vi fosse dentro.","NO"
"Lopez_Savi_Maria-Tramonto_regale-1901","Lopez Savi Maria","Tramonto regale","1901","Avendo vista la zia corse ad annunziare la sua venuta alla mamma ed a Teresa, che stavano in un'altra stanza, e furono meravigliate di quella insolita visita mattutina. La Marulla entrata nel piccolo cortile saliva già il primo braccio delle scale, lentamente, affannando. Non era mai facile per lei salire una scala; ma in quel momento l'impresa era molto più ardua, perchè tremava ed il cuore le batteva con insolita violenza.","NO"
"Lopez_Savi_Maria-Tramonto_regale-1901","Lopez Savi Maria","Tramonto regale","1901","Intanto pensava che se Michele fosse stato un galantuomo, come suo marito, ella non avrebbe dovuto subire quella terribile prova. Giunta sul primo pianerottolo, ella si fermò per riprendere lena; donna Amalia, che scendeva, svoltando si trovò di fronte a lei. Per fortuna non aveva sofferto per la gran paura, chè le avevano fatta quei diavoli ubbriachi, che non sapeva chiamare con altro nome, ed era così lieta quella mattina, poichè aveva lasciato esultanti le ragazze e donna Francesca.","YES"
