"filename","nome","titolo","anno","chunk","DIL"
"Lopez_Savi_Maria-Leggende_del_mare-1890","Lopez Savi Maria","Leggende del mare","1890","I tre uomini che stavano col pescatore fecero verso la nave diabolica il segno della Croce, costringendola così ad andarsene e salvarono la città. Essi erano San Nicolò, San Giorgio e San Marco. Questi disse al pescatore: «Va al Senato, narra quello che hai veduto e fatti pagare, perché hai contribuito alla salute di Venezia.","NO"
"Lopez_Savi_Maria-Leggende_del_mare-1890","Lopez Savi Maria","Leggende del mare","1890","Et in segno della verità prendi questo anello e di' che guardino nel Santuario, che non ve lo troveranno». «Laonde la mattina il prefatto barcaiuolo andò dal doge e dissegli quanto la notte aveva veduto. E mostrogli l'anello per segnale.","NO"
"Lopez_Savi_Maria-Leggende_del_mare-1890","Lopez Savi Maria","Leggende del mare","1890","E fu mandato pe' Procuratori, e guardato dove stava il detto anello no 'l trovarono. Et il detto anello fu dato a ser Marco Loredano et a ser Andrea Dandolo procuratori, che lo allogassero nel Santuario, e data provvigione perpetua al vecchio barcaiuolo sopradetto». Si dice che il barcaiuolo chiese «anche il privilegio di poter vendere, solo con la di lui famiglia, sabione, senza perturbazione alcuna» e che il Consiglio accordò la presa della rena dal lido di Sant'Erasmo.","NO"
"Lopez_Savi_Maria-Leggende_del_mare-1890","Lopez Savi Maria","Leggende del mare","1890","Da questo fatto, ricordato anche in un prezioso codice del Museo Correr di Venezia, trae la sua origine la corporazione dei Sabbioneri (renaiuoli) di Grado. Il grande pittore Giorgione dipinse la tempesta sedata dai tre santi. Un'altra leggenda marinaresca italiana accenna in qualche modo ad uno strano Vascello fantasma.","NO"
"Lopez_Savi_Maria-Leggende_del_mare-1890","Lopez Savi Maria","Leggende del mare","1890","I marinai di parecchie città al sud della Sicilia hanno per costume di portare nei loro viaggi della bambagia benedetta, che serve, secondo una loro credenza, a calmare le tempeste, o fa sì che le barche possano entrare in qualche porto per mettersi in salvo. Per dare tanta virtù alla bambagia si usa, l'undici gennaio di ogni anno, di passarla sulla fronte e sulle tempie del Crocifisso, e credesi di tergere così il sudore benedetto. Quest'uso ebbe, a quanto dicesi, origine dalla seguente leggenda: In tempi lontani lontani, una tempesta violenta si scatenò a terrore dei marinai sulle coste della Sicilia; le onde furenti rompevansi contro gli scogli, ed una fitta nebbia impediva che si potesse guardare lontano verso l'orizzonte; quando da levante apparve una barca bianca, colla vela spiegata, che volava sui marosi.","NO"
"Lopez_Savi_Maria-Leggende_del_mare-1890","Lopez Savi Maria","Leggende del mare","1890","Tutti i marinai raccolti sulle spiagge la guardavano stupiti, e non sapevano intendere come potesse reggere in mezzo a quella tempesta, e correre con tanta velocità contro il vento impetuoso, che soffiava da ponente. La barca filando tranquillamente passò a poca distanza dalla riva; nessuno la guidava, ed essa andava per la sua via, come se una forza soprannaturale, più possente dell'aria e del mare, la governasse a suo talento. La tempesta durò nella sua furia per tre giorni e tre notti, e la candida barca, che parea fatta di neve o di bambagia, ripassò anche per tre giorni e tre notti, lasciandosi dietro una striscia luminosa; e si disse che era formata dalle anime di tutti coloro che eran morti in naufragio, nelle vicinanze di queste coste.","NO"
"Lopez_Savi_Maria-Leggende_del_mare-1890","Lopez Savi Maria","Leggende del mare","1890","La calma tornò sul mare, ed i pescatori ripresero a pescare, ma non potevano dimenticare l'apparizione della candida barca, e furono assai meravigliati trovando in un seno di mare, ove essa era passata, della bambagia. La raccolsero con molta cura, e quando il mare era tempestoso, bastava che ne gittassero alcuni fiocchi sull'acqua, per calmarla, ed essere in condizione di ripararsi in un porto. La bambagia della barca bianca durò poco, e fu sostituita da quella benedetta che non finisce mai, e che, secondo la credenza dei marinai, calma sempre le tempeste.","NO"
"Lopez_Savi_Maria-Leggende_del_mare-1890","Lopez Savi Maria","Leggende del mare","1890","Forse in questa pia credenza si potrebbe trovare una reminiscenza del costume antichissimo pagano, che dura ancora in certe regioni, di far doni al mare per placarne l'ira, siccome già notai. I marinai cinesi hanno invece molta fede nell'efficacia della cenere che tolgono dalle lampade per l'incenso, che ardono innanzi all'idolo grottesco di Chua, possente divinità del mare, che ha molti templi; fra i quali va notato per la sua grandezza quello di Ningpo. Dicesi che questa dea era figlia di un marinaio, ed avendo sognato che suo padre era in pericolo sul mare si adoperò per salvarlo.","NO"
"Lopez_Savi_Maria-Leggende_del_mare-1890","Lopez Savi Maria","Leggende del mare","1890","La cenere tolta dai suoi altari viene messa dai marinai in certe borse rosse che sospendono alle navi nell'ora del pericolo. Se questo non basta per calmare le tempeste, vanno ad inginocchiarsi a poppa, parte sacra della nave, e bruciano incenso innanzi all'immagine di Chua. Possiamo riannodare le leggende dei vascelli fantasmi con quelle medioevali intorno all'Ebreo errante.","NO"
"Lopez_Savi_Maria-Leggende_del_mare-1890","Lopez Savi Maria","Leggende del mare","1890","L'Olandese maledetto, il Cavaliere di Falkenberg, Vanderdecken, sono gli ebrei erranti del mare. Ma parmi che le origini di tutte queste leggende si debbano cercare in tempi molto più lontani di quelli in cui i racconti intorno all'Ebreo errante divennero popolari in Europa, poiché troviamo che in parecchi inni vedici, Indra e Savitar, nel loro aspetto di mitici personaggi, hanno per destino di viaggiare sempre senza tregua, essendo respinti da coloro ai quali domandano l'ospitalità. Quasi simile è il destino di Wuotan Wigtam nella mitologia teutonica, ed anche Perseo, Bellerofonte, Edipo, Ulisse, Bacco e Sigurd sono fino ad un certo punto costretti ad errare.","NO"
"Lopez_Savi_Maria-Leggende_del_mare-1890","Lopez Savi Maria","Leggende del mare","1890","Molti incidenti della vita di questi eroi si trovano pure in quella dello scandinavo Grettîr, nel quale possiamo anche vedere, congiunti insieme strettamente, il mito e l'eroe, e che pur si avvicina in qualche modo all'Ebreo errante ed all'Olandese dannato. Nella Saga di questo eroe Grettîr, intorno alla quale molto si discusse, essendovi chi voleva dare ad essa una grande importanza storica, mentre altri vi trovava semplicemente una nuova trasformazione di racconti mitologici, Grettîr si mostra ora malvagio, ora benefico, e può ridar la vita ad un certo Glam, il quale era morto da lungo tempo. Finalmente il diavolo gli dice: «Finora hai acquistato fama colle tue imprese, ma da ora in poi la sventura cadrà su di te, ciò che farai ti riuscirà dannoso, sarai un bandito e dovrai sempre errare in terre straniere».","NO"
"Lopez_Savi_Maria-Leggende_del_mare-1890","Lopez Savi Maria","Leggende del mare","1890","Da quel tempo Grettîr viaggia di continuo ed è respinto da tutti. Anche Giuda sarebbe, secondo certe credenze popolari, costretto a vagare sul mare. San Brandano, in quel suo viaggio del quale parlerò in altro capitolo, lo vide sopra uno scoglio.","NO"
"Lopez_Savi_Maria-Leggende_del_mare-1890","Lopez Savi Maria","Leggende del mare","1890","Nel Medioevo sono numerose le leggende che dicono di altre navi misteriose. Fausto, il gran mago germanico, costruisce una nave di vetro, e non può navigare senza l'aiuto di un Nix, specie di folletto o spirito famigliare. Fra le navi più strane va ricordata quella della dea Freya, chiamata Skidbladnir, abbastanza grande per contenere tutti gli dei.","NO"
"Lopez_Savi_Maria-Leggende_del_mare-1890","Lopez Savi Maria","Leggende del mare","1890","I nani o trolli l'avevano costruita e donata a Freya; essa era sempre sospinta da un vento favorevole, nel luogo dove, per desiderio degli dei, doveva approdare. Quando costoro non viaggiavano per mare, potevano piegarla e ridurla a tale da tenerla in mano. Più grande ancora di questa nave era la Naglfar, formata colle unghie dei morti.","NO"
"Lopez_Savi_Maria-Leggende_del_mare-1890","Lopez Savi Maria","Leggende del mare","1890","Nell'Edda, Gangleri domanda se non sia la Skidbladnir la nave migliore e più artistica; gli si rispose che è migliore e più ornata di tutte le altre, ma che la Naglfar è più grande; si discute ancora sulla bontà di queste due navi, e più lungi parlasi della spaventevole apparizione della Naglfar che avverrà sull'Oceano, quando la vecchia terra sarà distrutta. Questa nave non è finita ancora, e le credenze strane intorno ad essa diedero origine a molte superstizioni, che riguardano il taglio delle unghie. Le saghe dicono che se una persona muore senza avere le unghie tagliate, deve aiutare per forza coloro che lavorano alla costruzione della Naglfar.","NO"
"Lopez_Savi_Maria-Leggende_del_mare-1890","Lopez Savi Maria","Leggende del mare","1890","Bisogna dunque evitare di avere le unghie lunghe morendo; anche perché esse potrebbero servire ad aumentare il materiale usato nel costruire la nave fatale che, per interesse degli dei e degli uomini, deve essere finita il più tardi possibile. Ora nell'Islanda si ricorda ancora qualche cosa delle antiche credenze intorno a questa nave, poiché dicesi che bisogna fare in diversi pezzi le unghie quando vengono tagliate, affinché Satana non se ne serva per la costruzione di una nave diabolica. Invece certi popoli slavi credettero che i morti dovessero salire sopra un erto colle di ferro o di ghiaccio, per andare in Paradiso, aiutandosi colle mani; e per questo motivo si usò, e ancora adesso si usa fra i contadini russi, di mettere ritagli d'unghie nella tomba di un cadavere che le avesse corte.","NO"
"Lopez_Savi_Maria-Leggende_del_mare-1890","Lopez Savi Maria","Leggende del mare","1890","I Russi non conformisti, fra i quali durano molti ricordi della loro antica religione, hanno il costume di portare in certi anelli o amuleti unghie di falchi, o ritagli delle proprie, dovendo dopo la morte servirsi di esse nell'arrampicarsi sull'alta ripa che mena in Paradiso. I Lituani bruciavano le unghie di certe bestie selvagge e sui roghi, insieme coi morti. Parmi inutile di discorrere a lungo fra queste pagine delle favole tanto note che possono dirsi classiche e narrano del soggiorno dei morti dove approdò Ulisse, oltre il gran fiume Oceano, il quale forse per Omero non fu altro che il Mediterraneo centrale, e non è neppure opportuno che io ripeta le ragioni addotte da coloro che vorrebbero indurci a credere che l'Odissea abbia per argomento principale il mito del viaggio delle anime; dirò invece che fin dalla più remota antichità parlasi del viaggio misterioso delle anime che lasciano i miseri corpi umani, come se l'uomo, anche fra le tenebre dell'errore e dell'ignoranza, non potesse dimenticare il suo eterno destino ed affermasse l'immortalità dello spirito.","NO"
"Lopez_Savi_Maria-Leggende_del_mare-1890","Lopez Savi Maria","Leggende del mare","1890","Le antiche leggende che ci restano ancora su questo argomento sono molte, e possiamo dire innumerevoli quelle che vengono ripetute dai popoli di ogni razza nelle regioni della terra dove non si estende ancora la civiltà cristiana. Di queste ultime tratterò a lungo in altro lavoro, ora noterò che anche presso le genti arie sono numerose le leggende intorno al viaggio che deve compiere lo spirito dopo che la morte lo ha diviso inesorabilmente dal corpo. Pare che fin dai tempi più antichi le anime dovettero, secondo la credenza popolare, attraversare un fiume reale o immaginario per andare nel regno delle ombre, e solo più tardi invalse presso certe genti l'idea che si dovesse compiere il viaggio sul mare reale o sul gran mare atmosferico.","NO"
"Lopez_Savi_Maria-Leggende_del_mare-1890","Lopez Savi Maria","Leggende del mare","1890","La credenza nell'Oceano atmosferico si ritrova in antichissime tradizioni, specialmente fra quelle degli Arii primitivi, che confondono spesso, al pari dei loro discendenti, questo mare superiore col vero Oceano; e per questa ragione molte loro divinità celesti si trasformano in divinità del mare o governano il cielo e la terra. Anche la scienza moderna si compiace nel chiamare Oceano aereo l'atmosfera, ma tornando al passato dirò che i Celti credettero che vi fosse il mare delle nubi, stimando possibile andarvi dalla terra. I contadini della Vandea credettero pure in questo mare misterioso, e pensarono che gli uccelli attraversandolo andassero in Paradiso.","NO"
"Lopez_Savi_Maria-Leggende_del_mare-1890","Lopez Savi Maria","Leggende del mare","1890","Il tramontare del sole parve nel vecchio e nel nuovo mondo una immagine del dipartirsi dell'anima dalla terra, e poiché verso l'Occidente il sole scendeva nel mare ed il mistero univasi al mistero, si credette che le anime lo seguissero nel suo diurno viaggio verso i mari occidentali, quando non salivano nell'Oceano superiore. Per questo motivo l'Atlantico divenne per molti popoli arii il gran mare misterioso dove si trovava la regione delle anime, ed il Pacifico fu certamente guardato con paura dagli antichi Americani. Certi popoli arii credettero pure che il Mar Nero ed il Caspio fossero popolati dalle anime che andavano nel tenebroso mondo inferiore.","NO"
"Lopez_Savi_Maria-Leggende_del_mare-1890","Lopez Savi Maria","Leggende del mare","1890","Molti Slavi credettero, al pari di altre genti arie, in questi viaggi delle anime, e stimando che i morti dovessero attraversare un immenso mare, mettevano vicino ai cadaveri certe monete che dovevano servire per pagare il passaggio dello spirito a qualche misterioso Caronte o alle schiere di spiriti malvagi che avrebbero incontrate per via. Quest'uso si conserva ancora in certi paesi slavi, e anche molte tribù selvagge hanno il costume di mettere presso i cadaveri i doni che debbono dare agli spiriti possenti. La convinzione che il gran viaggio si dovesse compiere per mare diede origine al costume che ebbero popoli diversi di bruciare o di seppellire i morti in barche o in bare fatte a foggia di barche, o ancora di metterli in certe barche le quali erano lasciate in balia del mare.","NO"
"Lopez_Savi_Maria-Leggende_del_mare-1890","Lopez Savi Maria","Leggende del mare","1890","I Vikings lavavano accuratamente, dopo le battaglie, i volti dei loro morti, li vestivano coi loro abiti più belli, poi ciascuno di essi era disteso sul proprio scudo, colle armi allato per essere in perfetta tenuta di guerra innanzi al forte Odino. Il parente più stretto del morto gli metteva la «forte calzatura dell'inferno» utilissima nella faticosa discesa che doveva fare per giungere presso l'infernale Hela, fino alla profondità di nove mondi, ove la dea tratteneva gli schiavi ed i vigliacchi, lasciando che gli altri andassero presso Odino. Ma non sempre i cadaveri dei fortissimi Normanni furono chiusi sotto i tumuli e nelle camere sepolcrali, che trovansi con tanta frequenza nei paesi al Nord di Europa.","NO"
"Lopez_Savi_Maria-Leggende_del_mare-1890","Lopez Savi Maria","Leggende del mare","1890","Molte notizie che si possono raccogliere nella poesia epica medioevale ed in certe vecchie prose ci provano che gli Scandinavi, i Danesi, e specialmente fra essi i pirati, ebbero anche il costume di chiudere i loro morti in una barca e di affidarli al mare, affinché potessero giungere nella regione dei morti. Troviamo nell'Edda che dopo la morte del grande eroe Baldur il suo cadavere fu portato nella sua nave, più grande di tutte le altre; gli dei vollero lanciarla in mare, ma non vi riuscirono; dovette invece spingerla nell'acqua una strega, la quale usò tanta forza che uscirono fiamme dalla chiglia, quando questa si mosse. Il Yarl Magnus fu insieme colla sua vedova messo in una nave che se n'andò verso il regno dei morti.","NO"
"Lopez_Savi_Maria-Leggende_del_mare-1890","Lopez Savi Maria","Leggende del mare","1890","Beowulf dice che l'eroe Scyld fu sepolto nella nave dei nobili, che stava presso la spiaggia pronta per il viaggio pauroso dal quale non sarebbe tornata più. I guerrieri, dopo aver dato l'ultimo addio all'amato principe, legarono un'insegna d'oro sull'albero maestro e fecero scendere la nave nel mare. Un altro eroe fu messo, a quanto narra Guglielmo di Malmesbury, in un battello e lasciato in balìa del mare.","NO"
"Lopez_Savi_Maria-Leggende_del_mare-1890","Lopez Savi Maria","Leggende del mare","1890","Qualche volta gli antichi re del Nord, sentendosi vicini a morte, si facevano portare sopra una nave nella quale era già acceso il fuoco che doveva consumare il loro cadavere. Il re Hake, essendo gravemente ferito, capì che la sua morte era vicina, ma non si sgomentò, e, mentre era ancora vivente, volle cominciare il viaggio verso l'eterna dimora dei forti guerrieri. Fece deporre sopra una nave da guerra i cadaveri dei guerrieri morti nella battaglia, poi comandò che fosse alzato sul ponte un rogo per lui.","NO"
"Lopez_Savi_Maria-Leggende_del_mare-1890","Lopez Savi Maria","Leggende del mare","1890","Era vicino a morte quando si fece mettere su di esso e volle che vi si appiccasse il fuoco. Il vento che soffiava con violenza spinse dopo breve tempo la nave avvolta dalle fiamme lontano, verso l'Oceano. Forse alle leggende intorno alle barche dei morti, vaganti sui mari, si riannoda la novellina italiana in cui si dice di una damigella morta d'amore per il bel cavaliere Lancialotto de Lac.","NO"
"Lopez_Savi_Maria-Leggende_del_mare-1890","Lopez Savi Maria","Leggende del mare","1890","Ella dispose che «quando sua anima fosse partita dal corpo, fosse arredata una ricca navicella, coperta d'uno vermiglio sciancito, con un ricco letto ivi entro, con ricche e nobili coverture di seta, ornato di ricche pietre preziose. E fosse il suo corpo messo in questo letto, vestito di suoi più nobili vestimenti, e con bella corona in capo ricca cintura e borsa. Et in quella borsa aveva una lettera che era dello infrascritto tenore.","NO"
"Lopez_Savi_Maria-Leggende_del_mare-1890","Lopez Savi Maria","Leggende del mare","1890","Ma imprima diciamo di ciò che va innanzi la lettera. La damigella morì di mal d'amore, e fu fatto di lei ciò che disse, la navicella senza vela fu messa in mare con la donna. Il mare la guidò a Camalot e ristette alla riva».","NO"
"Lopez_Savi_Maria-Leggende_del_mare-1890","Lopez Savi Maria","Leggende del mare","1890","E questa volta ancora la leggenda, la novellina ha allettato la fantasia di un grande artista, e Domenico Morelli ha dipinto la navicella della morta fanciulla, che approda, guidata verso l'uomo amato da una misteriosa forza, pari a quella che guidava le navi dei morti verso le misteriose dimore delle anime eterne. Non era però generale la credenza che per giungere nella regione dei morti si dovesse proprio navigare, poiché, al pari di altre genti, certi Slavi credettero che l'arcobaleno fosse il ponte fra la terra dei viventi e quella dei morti; altri stimarono che fosse la Via Lattea. Ancora adesso nel governo di Novgorod la misteriosa strada è detta Via dei topi; essendo il topo un'immagine dell'anima; a Perm si chiama la Via di Gerusalemme; i contadini di Tambof dicono che passa intorno alle colline di ferro in cui sono chiusi i Tartari invasori, i quali nelle leggende medioevali si trasformarono in cattivi spiriti.","NO"
"Lopez_Savi_Maria-Leggende_del_mare-1890","Lopez Savi Maria","Leggende del mare","1890","Nel governo di Jaroslaf si dice invece che vi è una sacra città nascosta nelle acque profonde, e che ad essa conduce la Via dei morti. Gli Slavi, i quali credettero invece nella necessità del viaggio delle anime sul mare, non furono sempre in condizione di affidare ad esso i loro morti, quando nelle emigrazioni si trovavano lungi dalle spiagge; ma è certo che in ogni regione dove posero la loro dimora mostrarono nella solennità dei riti per i funerali molta riverenza verso i morti, ed usarono quasi generalmente le bare in forma di barche. Parmi che in questo costume si debba anche trovare un ricordo del loro dio Perum, il quale, prima della sua confusione medioevale col profeta Elia, dovette compiere misteriosi viaggi, poiché si dice in certi antichi racconti che egli muore qualche volta, come l'Osiride egiziano ed altri miti solari, e che il suo frale galleggia sull'acqua in una bara.","NO"
"Lopez_Savi_Maria-Leggende_del_mare-1890","Lopez Savi Maria","Leggende del mare","1890","In ogni modo sia che popoli diversi abbiano avuto il costume di affidare tutti i loro morti al mare nelle barche, sia che tal cosa sia stata in uso in certi casi speciali, quando si rendevano gli ultimi onori ai capi slavi e normanni, è certo che vi furono tempi in cui galleggiarono sui mari del Nord, e forse sul Caspio e sul Mar Nero, le navi dei morti, che i marinai, i pirati, i commercianti dovettero guardare con terrore, essendo così estese ed antiche le credenze intorno ai fantasmi dei morti ed alla loro malefica potenza. Ma non solo queste barche dei morti restarono sui mari e sull'Atlantico in balìa delle onde. Certe pietose leggende e molte canzoni popolari, che si trovano presso popoli diversi, dicono la tristissima storia di poveri marinai, che sono morenti per fame in mezzo al mare.","NO"
"Lopez_Savi_Maria-Leggende_del_mare-1890","Lopez Savi Maria","Leggende del mare","1890","Si tira a sorte per sapere quale di essi sarà ucciso e mangiato dai compagni. Qualche volta, prima che si compia il sacrifizio dell'infelice, scende dal cielo una colomba che trae la nave e la ciurma da ogni pericolo. In una canzone danese del XVII secolo si dice che un vecchio marinaio vuole sacrificare la vita per i compagni e domanda che l'uccidano.","NO"
"Lopez_Savi_Maria-Leggende_del_mare-1890","Lopez Savi Maria","Leggende del mare","1890","Essi, come impazziti per la fame, compiono il delitto, poi non hanno il coraggio di divorare l'ucciso; preferiscono morir di fame e sono salvati da un angelo. Una variante provenzale delle canzoni popolari su quest'argomento dice che vi sono a Marsiglia tre vascelli che partono per il Portogallo. Essi rimangono per sette anni sull'acqua senza poter approdare, e tutto manca a bordo.","NO"
"Lopez_Savi_Maria-Leggende_del_mare-1890","Lopez Savi Maria","Leggende del mare","1890","I marinai tirano a sorte, per sapere a chi toccherà di essere ucciso prima degli altri; il padrone divide la paglia ed a lui tocca il filo più corto. Egli domanda se fra i mozzi vi sia un valoroso che voglia salvarlo; gli darà per mercede una delle proprie figlie ed un vascello dorato. Un mozzo esclama: «Io vi salverò!».","NO"
"Lopez_Savi_Maria-Leggende_del_mare-1890","Lopez Savi Maria","Leggende del mare","1890","«Sali», grida il capitano, «Sali, valoroso mozzo, sulla punta dell'albero maestro, e guarda se si scorge il porto». Il mozzo sale: quando giunge verso la metà dell'albero maestro, il capitano trepidamente domanda se vede il porto. Il mozzo sale ancora; quando arriva sulla cima dell'albero canta e grida: «Veggo Tolone, Marsiglia e tre fanciulle che passeggiano sulla spiaggia».","NO"
"Lopez_Savi_Maria-Leggende_del_mare-1890","Lopez Savi Maria","Leggende del mare","1890","«Se così è», dice il capitano, «canta pure, valoroso mozzo: hai guadagnato una sposa ed un vascello d'oro». Ma non tutti i marinai ebbero fortuna pari a quella del capitano, ed avvenne che si trovarono anche sul mare certe navi o barche, le quali, portavano cadaveri di uomini morti per fame o per pestilenza, ed intorno ad esse i marinai spaventati dissero strane cose. In maniera che adesso molti credono ancora che passino sui mari e sugli oceani le lugubri navi dei morti.","NO"
"Lopez_Savi_Maria-Leggende_del_mare-1890","Lopez Savi Maria","Leggende del mare","1890","Secondo certe leggende questi morti sono santi, ma con maggior frequenza si afferma che sono dannati, o povere anime che vadano espiando sul mare le proprie colpe. Sopra alcune spiagge del Morbihan si parla spesso di certe navi enormi sulle quali stanno uomini e cani giganteschi; gli uomini sono dannati, i cani sono demoni che debbono custodirli. I vascelli maledetti vanno dall'Atlantico al Mare del Nord, senza entrare in qualche porto, senza mai gittar l'àncora, ed il loro viaggio avrà fine soltanto quando non vi sarà più il mare.","NO"
"Lopez_Savi_Maria-Leggende_del_mare-1890","Lopez Savi Maria","Leggende del mare","1890","Un altro vascello dei morti, chiamato Libera nos, è spaventevole: coperto con drappi neri porta una bandiera nera circondata di teschi, sulla quale si vede scritto: «Libera nos». Gli uomini della ciurma, comandati dal Capitano Requiem, aspettano che passi qualche equipaggio cristiano, al quale possano chiedere che si facciano celebrare Messe per il riposo delle anime loro. Il Longfellow, imitando una leggenda popolare, ci dice coll'armonia del verso che il Carmilhan è un vascello dei morti, il quale ha una ciurma di fantasmi ed appare prima e dopo le tempeste.","NO"
"Lopez_Savi_Maria-Leggende_del_mare-1890","Lopez Savi Maria","Leggende del mare","1890","Naviga senza vele e senza pilota: grave sventura piomba inevitabilmente sulla nave che l'incontra, poiché il mare balza sul suo ponte, ed essa deve piombare nell'abisso. In una leggenda tedesca si dice di un povero capitano ammalato che sta sul ponte della sua nave, e chiede al pilota donde venga il suono di una campana che ode distintamente. Il pilota gli risponde che non sentesi nessuna campana, invece l'orologio ha sonato un quarto prima della mezzanotte; il vento che soffia dal nord è freddo, sarà meglio che egli torni nella sua cabina.","NO"
