"filename","nome","titolo","anno","chunk","DIL"
"Lopez_Savi_Maria-Tramonto_regale-1901","Lopez Savi Maria","Tramonto regale","1901","Dopo alcuni minuti fu sonato il campanello e tutti, in casa Riva, provarono un senso di noia, pensando che veniva Schwarz. Infatti egli entrò seguendo Severino che gli aveva aperto l'uscio, ed aveva gli occhi accesi, il volto infiammato. Un puzzo di vino, di liquori si spandeva intorno a lui, e tutti lo guardavano con ribrezzo.","NO"
"Lopez_Savi_Maria-Tramonto_regale-1901","Lopez Savi Maria","Tramonto regale","1901","Per qualche tempo, dopo la morte di Michele Riva, Schwarz aveva fatto solo rare visite alla sua famiglia, benchè sognasse spesso il bel volto di Teresa; ma sentiva un'oppressione intollerabile in mezzo a quella gente desolata. Poi, quando una calma dolorosa era seguita alla prima violenza del dolore, egli aveva ripreso con una certa frequenza a passare la sera in casa Riva, senza che riuscisse coll'allegria del carattere e l'apparente gentilezza a vincere l'antipatia che destava la sua persona. Non era per altro avvenuto mai che si presentasse in casa Riva in quello stato, poichè, quando sentiva al cervello i fumi del vino nel tornare a casa, andava subito a dormire; e allora donna Amalia lo sentiva russare più forte del solito!","NO"
"Lopez_Savi_Maria-Tramonto_regale-1901","Lopez Savi Maria","Tramonto regale","1901","Severino fremeva in cuor suo, e sentiva una voglia matta d'imporre allo Svizzero d'andarsene. Questi, intanto, aveva ancora una certa padronanza sopra di sè, e prese a discorrere in fretta, con Don Gaetano, il quale non vedeva più le carte che aveva in mano. Schwarz teneva un mazzetto di mammole e di giunchiglie; sembrava molto allegro, odorava spesso i fiori, mentre discorreva, e ben presto qualche frase incoerente incominciò ad uscirgli dalle labbra.","NO"
"Lopez_Savi_Maria-Tramonto_regale-1901","Lopez Savi Maria","Tramonto regale","1901","Severino fece un segno alle sorelle perchè lasciassero la stanza; esse ripiegarono subito il lavoro, e si erano alzate appena, quando Schwarz, il quale aveva già gli occhi sonnolenti, e non distingueva più quale fosse la bruna e quale la bionda, si alzò con atto pronto avvicinandosi ad Assunta, che era pur vicina a lui, e le accostò ridendo e in modo quasi brutale il mazzetto al volto perchè l'odorasse. La mano di Filippo scese pronta sui fiori, prima che toccassero il volto di Assunta, e li strappò a Schwarz, al quale disse con ira: – Nel mio paese, signore, non si usano questi modi colle fanciulle per bene! I fiori gittati da Filippo con rabbia caddero sulla tavola, in mezzo alle carte sparse.","NO"
"Lopez_Savi_Maria-Tramonto_regale-1901","Lopez Savi Maria","Tramonto regale","1901","Assunta aveva fatto un passo indietro, quando Filippo si era messo fra lei e Schwarz. Antonio e Severino accesi d'ira erano balzati vicino a Filippo. Schwarz furente nel vedersi strappare i fiori bestemmiava nel dialetto del suo villaggio, e cercava di trarre dal fodero la spada, ma la mano mal ferma non vi riusciva.","NO"
"Lopez_Savi_Maria-Tramonto_regale-1901","Lopez Savi Maria","Tramonto regale","1901","Filippo aveva afferrato una sedia e la brandiva contro lo Svizzero per difendersi. I tre giovani erano inermi, ma non occorrevano armi contro Schwarz! La sua mano lasciò subito l'elsa della spada; egli si appoggiò alla tavola per non cadere, vacillò, non vide più nessuno, e bestemmiando sempre cadde come una massa inerte.","NO"
"Lopez_Savi_Maria-Tramonto_regale-1901","Lopez Savi Maria","Tramonto regale","1901","Donna Amalia respirò, lasciando il braccio di don Gaetano al quale si era attaccata, durante la rapidissima scena. Don Gaetano tremava come lei, ma, non temendo più nulla dallo Svizzero, guardava con rammarico le carte sparse vicino al mazzetto fatale e al tabacco leccese, che aveva lasciato cadere colla tabacchiera. Se non fosse venuto lo Svizzero avrebbe vinta la partita, perchè Antonio aveva un punto solo ed egli, invece, sette!","YES"
"Lopez_Savi_Maria-Tramonto_regale-1901","Lopez Savi Maria","Tramonto regale","1901","Si sentì la voce spaventata di donna Francesca destata dalle voci e dal rumore, che chiamava i figli. Teresa corse vicino a lei, mentre Assunta, che non si reggeva più, appoggiata alla spalla di Filippo cercava di frenare i singhiozzi convulsi che le spezzavano il petto. – Mamma, – disse Teresa, che ebbe il coraggio di ridere, – non temere; se sapessi!","NO"
"Lopez_Savi_Maria-Tramonto_regale-1901","Lopez Savi Maria","Tramonto regale","1901","Schwarz è ubbriaco ed è caduto presso la tavola. – Ho sentito certe grida!.. che paura; ma è vero quello che dici?","NO"
"Lopez_Savi_Maria-Tramonto_regale-1901","Lopez Savi Maria","Tramonto regale","1901","– Sì, mamma, – affermò Teresa che la baciava. – Ed ora che cosa farete? – Credo che Severino e gli altri lo porteranno fuori.","NO"
"Lopez_Savi_Maria-Tramonto_regale-1901","Lopez Savi Maria","Tramonto regale","1901","Non temere se lo senti bestemmiare ancora. Non è neppur capace di alzare un dito. Ella, rideva di nuovo, e l'ira dei giovani si era spenta innanzi a quell'uomo ubbriaco, o sentivano un gran disgusto, una specie di nausea guardandolo.","YES"
"Lopez_Savi_Maria-Tramonto_regale-1901","Lopez Savi Maria","Tramonto regale","1901","– Ed ora, – disse Filippo, – che cosa faremo? – Dobbiamo trasportarlo fuori sulla scala, – rispose Severino. Schwarz disteso a terra russava già.","NO"
"Lopez_Savi_Maria-Tramonto_regale-1901","Lopez Savi Maria","Tramonto regale","1901","– Aiutatemi, – disse Severino. Si sentì allora la voce di donna Francesca che chiamava forte: – Assunta, Severino! – non era rassicurata dalle parole di Teresa e voleva vederli.","NO"
"Lopez_Savi_Maria-Tramonto_regale-1901","Lopez Savi Maria","Tramonto regale","1901","– Eccoci, mamma, – rispose subito Severino. – Andate pure, – disse Filippo, – noi bastiamo per portarlo via. Voi, donna Amalia, aprite l'uscio e tenete il lume, per cortesia.","NO"
"Lopez_Savi_Maria-Tramonto_regale-1901","Lopez Savi Maria","Tramonto regale","1901","Io lo prendo per le spalle, ecco; tu, Antonio prendilo per i piedi, don Gaetano, tocca a voi di reggere la spada; farebbe troppo rumore battendo sui gradini. Don Gaetano non ebbe il coraggio di ricusare, e si accostò allo Svizzero inerte. Con grande timore prese la punta della spada, che restava attaccata alla cintura stretta intorno al corpo di Schwarz.","NO"
"Lopez_Savi_Maria-Tramonto_regale-1901","Lopez Savi Maria","Tramonto regale","1901","I due giovani l'avevano già sollevato; Donna Amalia col lume in mano li precedeva, mentre essi, col grave peso, andavano innanzi lentamente, verso la scala. Donna Amalia spalancò l'uscio; tutti erano silenziosi, fatta eccezione di Schwarz che balbettava ancora parole incoerenti. Presero a scendere le scale.","NO"
"Lopez_Savi_Maria-Tramonto_regale-1901","Lopez Savi Maria","Tramonto regale","1901","Don Gaetano si trovava in gran disagio, costretto sempre a tenere la punta della spada. Ah! se la sorella l'avesse visto in quel momento!","YES"
"Lopez_Savi_Maria-Tramonto_regale-1901","Lopez Savi Maria","Tramonto regale","1901","Giunti sul pianerottolo, presso la porta dello Svizzero, i giovani lo lasciarono disteso sulle lastre grigie. Donna Francesca abbracciava i figli, che non osavano lasciarla. Si era spaventata tanto, nel sentire la voce irata di Schwarz!","NO"
"Lopez_Savi_Maria-Tramonto_regale-1901","Lopez Savi Maria","Tramonto regale","1901","Era sonata da un pezzo la mezzanotte, quando don Carlo Alvisi attraversò lentamente la strada dell'Infrascata; e prima di salire sull'erta rampa che mena ai vicoli di San Raffaele e di Materdei, si guardò intorno con sospetto. Anche sui larghi gradini, dove incontrò alcuni popolani che scendevano verso l'Infrascata, continuò a camminare senza affrettarsi, come se gl'importasse poco di star solo a quell'ora nelle strade quasi deserte e mal rischiarate. Ma quando giunse finalmente negli stretti vicoli di San Raffaele, non incontrando più nessuno, affrettò il passo e trasse un sospiro di soddisfazione.","NO"
"Lopez_Savi_Maria-Tramonto_regale-1901","Lopez Savi Maria","Tramonto regale","1901","Nelle stradicciuole si sentivano solo i sibili del vento che soffiava con violenza, scotendo gli alberi nei giardini. Alvisi prese a camminare rasentando i muri, dove era più fitta l'oscurità, fuori della luce di alcuni fanali rimasti ancora accesi, delle piccole lampade che splendevano innanzi alle cappelle o sui muri dei giardini e delle case. Egli affannava e la sua fronte era coperta di sudore quando giunse presso la chiesa di San Raffaele, ed esitò un istante prima di passare innanzi alla grande Croce di legno, eretta nell'angolo, fra le mura basse dei giardini.","NO"
"Lopez_Savi_Maria-Tramonto_regale-1901","Lopez Savi Maria","Tramonto regale","1901","Se avesse trovato, scendendo verso Materdei, qualcuno che volesse sbarrargli la via, non avrebbe potuto fuggire non essendovi strade laterali. Poi si fece animo. Non era esagerato e quasi puerile il suo timore?","YES"
"Lopez_Savi_Maria-Tramonto_regale-1901","Lopez Savi Maria","Tramonto regale","1901","Chi poteva sapere che avesse presa quella via? Certamente nessuno l'aspettava al varco presso la piazzetta di Materdei! Andò innanzi, e la grossa lampada accesa a piè del Redentore, il quale alzava in quella solitudine, nella fosca notte senza stelle, la fronte dolorosa, dominando da una parte la collina verso le Fontanelle, illuminò il viso pallido di quell'uomo che fuggiva.","YES"
"Lopez_Savi_Maria-Tramonto_regale-1901","Lopez Savi Maria","Tramonto regale","1901","Un fanale era acceso presso la chiesa, di fronte alla strada Materdei. Alvisi giunto a pochi passi da questa rallentò il passo. Due uomini erano fermi a breve distanza dal fanale.","NO"
"Lopez_Savi_Maria-Tramonto_regale-1901","Lopez Savi Maria","Tramonto regale","1901","Certamente erano due guardie, ed egli avrebbe dovuto passare innanzi ad esse per entrare poi nel vicolo Melofioccolo. Deliberò subito di scendere alle Fontanelle, svoltando presso la chiesa, per risalire di là nel vicolo Calce. Con passo leggiero, per non essere sentito dagli uomini involti nei larghi mantelli, che gli volgevano le spalle, passò sotto la luce del fanale, e voltò sulla discesa.","NO"
"Lopez_Savi_Maria-Tramonto_regale-1901","Lopez Savi Maria","Tramonto regale","1901","Questa era immersa in una grande oscurità. Neppure un fanale era rimasto acceso e si vedeva solo, come in un baratro profondo a piè dell'erto pendìo, una fiammella rossastra, che doveva trovarsi nel fondo della valle. Non era possibile che Alvisi scendesse in fretta sulla strada senza selciato, orribile, dove le pietre che si movevano sotto i suoi piedi, i buchi frequenti, la terra ineguale, in mezzo a quell'oscurità, lo facevano inciampare ad ogni passo.","NO"
"Lopez_Savi_Maria-Tramonto_regale-1901","Lopez Savi Maria","Tramonto regale","1901","Alla sua destra il silenzio era profondo nelle povere case, e solo il latrare di qualche cane si udiva, come una nota lugubre, alla sua sinistra, nell'aperta campagna. Finalmente egli giunse a pie' della scala che volge al vicolo Calce, non ancora divenuta allora, come è adesso, impraticabile al pari di certe pericolose salite delle Alpi. In alto, dove finisce la scala, ardeva la solita piccola lampada innanzi alla cappelletta.","NO"
"Lopez_Savi_Maria-Tramonto_regale-1901","Lopez Savi Maria","Tramonto regale","1901","Egli si confortò salendo e, quando vide che non vi era anima viva nel vicolo, battè leggermente al portone della casa dove abitava la famiglia Riva. Troppo gravi erano le cure di Severino, i pericoli che affrontava, i sospetti che lo circondavano perchè potesse avere la calma dello spirito, ed il suo sonno era leggiero. I colpi battuti da Alvisi lo destarono subito.","NO"
"Lopez_Savi_Maria-Tramonto_regale-1901","Lopez Savi Maria","Tramonto regale","1901","Chi poteva essere a quell'ora, verso le due dopo la mezzanotte? I fratelli Mazzarella, venuti da circa due settimane da Catanzaro, si erano ritirati alle undici e Schwarz non bussava mai, avendo la chiave della porta. Un sospetto terribile balenò nella mente di Severino.","YES"
"Lopez_Savi_Maria-Tramonto_regale-1901","Lopez Savi Maria","Tramonto regale","1901","Venivano ad arrestarlo, quella notte, in casa sua? Egli tremò non per sè, ma per la madre e le sorelle. Era dunque stata inutile tutta la sua prudenza per evitare un mortale dolore a quelle povere donne!","YES"
"Lopez_Savi_Maria-Tramonto_regale-1901","Lopez Savi Maria","Tramonto regale","1901","In ogni modo si vestì in fretta, prima d'aprire la finestra per vedere chi fosse. Donna Francesca era desta, quando Alvisi aveva bussato. Esterrefatta sedette sul letto, non essendo ancora ben sicura che i colpi venissero battuti alla porta della sua casa.","NO"
"Lopez_Savi_Maria-Tramonto_regale-1901","Lopez Savi Maria","Tramonto regale","1901","Intanto l'attesa era terribile per Alvisi: gli pareva che solo dietro quella porta chiusa potrebbe riprender lena ed avere un po' di pace, nella notte angosciosa, ma essa non si apriva! Ripetè i colpi più forti, colla mano che tremava sempre, e donna Francesca, ebbe la certezza di non ingannarsi. Bussavano alla sua porta!","YES"
"Lopez_Savi_Maria-Tramonto_regale-1901","Lopez Savi Maria","Tramonto regale","1901","allora pensò rapidamente, come Severino, che i fratelli Mazzarella erano in casa, e che Schwarz aveva la chiave. Sospettò come lui che una nuova sventura minacciasse la sua casa. Ella continuava a non avere il più lieve sospetto di ciò che faceva Severino, ma era stata per tanto tempo avvezza a tremare per cento ragioni, quando viveva il marito; e dopo la sua morte le vecchie paure, spesso puerili ed irragionevoli, si ridestavano in lei anche per Severino.","NO"
"Lopez_Savi_Maria-Tramonto_regale-1901","Lopez Savi Maria","Tramonto regale","1901","Ella chiamò Teresa. La fanciulla erasi già destata, e con maggior ragione, poichè sapeva, tremava per il fratello. La lieve speranza avuta che la madre non sentisse svanì in lei quando fu chiamata.","NO"
"Lopez_Savi_Maria-Tramonto_regale-1901","Lopez Savi Maria","Tramonto regale","1901","Rispose subito: – Mamma, non temere! Forse Schwarz si trova in casa e vengono a chiamarlo per qualche cosa avvenuta in quartiere. Anche Assunta si era destata nel sentire le voci della mamma e della sorella, e le due fanciulle, atterrite dallo stesso sospetto, presero a vestirsi in fretta.","NO"
"Lopez_Savi_Maria-Tramonto_regale-1901","Lopez Savi Maria","Tramonto regale","1901","Severino aveva già aperta la finestra, e alla luce della piccola lampada scorse un uomo solo. Si rassicurò, poichè non venivano ad arrestarlo e chiese: – Chi volete? – Apri, Severino, apri!","NO"
"Lopez_Savi_Maria-Tramonto_regale-1901","Lopez Savi Maria","Tramonto regale","1901","– rispose alquanto sommessamente una voce che il giovane riconobbe. – Scendo subito. – rispose lui, indovinando che Alvisi veniva a cercare un rifugio in casa sua, e si stupì, perchè non era quella una casa sicura; e poi gli pareva una cosa quasi impossibile che si potesse perseguitare un uomo tanto innocuo e pacifico.","NO"
"Lopez_Savi_Maria-Tramonto_regale-1901","Lopez Savi Maria","Tramonto regale","1901","Egli si affrettò per andare ad aprire, e nell'anticamera incontrò Teresa alla quale disse, prima che potesse interrogarlo: – È Alvisi, – poi discese in fretta le scale. – È don Carlo Alvisi, – disse Teresa alla madre e ad Assunta, e non aggiunse altro, già dolente di aver pronunziato innanzi alla madre il nome di quel poveretto. Solo un caso grave poteva indurlo a andare in casa loro di notte, e il dolore di quel vecchio amico di Michele Riva avrebbe anche cagionato molto dispiacere all'inferma.","YES"
"Lopez_Savi_Maria-Tramonto_regale-1901","Lopez Savi Maria","Tramonto regale","1901","– Che cosa può volere a quest'ora? – esclamò donna Francesca che sentì un pungente ricordo di altri tempi. Spesso gli amici, i clienti di suo marito erano venuti a chiamarlo di notte, ma sempre per assistere qualche infermo, e Michele, senza lamentarsi mai del disagio, si era affrettato per andare a compiere con amore l'opera sua benefica; ma ora che Michele Riva era per sempre lungi dalla sua casa perchè era venuto Alvisi?","YES"
"Lopez_Savi_Maria-Tramonto_regale-1901","Lopez Savi Maria","Tramonto regale","1901","Severino era già arrivato nel cortile. Egli aprì, Alvisi entrò subito, richiuse la porta e strinse la mano al giovane. – Ebbene?","NO"
"Lopez_Savi_Maria-Tramonto_regale-1901","Lopez Savi Maria","Tramonto regale","1901","– disse questi sottovoce. – Mi cercano per arrestarmi! Sono stato un giorno nascosto in una casa ai Ventaglieri, ma non potevo restarci più a lungo.","NO"
"Lopez_Savi_Maria-Tramonto_regale-1901","Lopez Savi Maria","Tramonto regale","1901","Ora vengo da te, Severino! – Coraggio, – gli disse il giovane, anche sottovoce, ma con calore, – venite, questa è casa vostra, lo sapete! – Grazie, – disse lui, e salirono insieme le scale.","NO"
"Lopez_Savi_Maria-Tramonto_regale-1901","Lopez Savi Maria","Tramonto regale","1901","Quando furono nella piccola anticamera, Severino chiuse l'uscio, Alvisi si sentiva venir meno per la paura e la stanchezza e sedette sopra una sedia. Teresa, che l'aveva accolto con calore, al pari del fratello, gli tolse di mano il cappello e cercò di confortarlo con amorevoli parole, poichè si vedeva che soffriva acerbamente. – Vai subito a preparargli una tazza di caffè, – disse Severino alla sorella.","NO"
"Lopez_Savi_Maria-Tramonto_regale-1901","Lopez Savi Maria","Tramonto regale","1901","– Ah! – esclamò Alvisi, – ero certo che mi avreste accolto come un fratello, benchè la mia presenza qui sia un pericolo così grave per voi! – Ma perchè vi cercano?","NO"
"Lopez_Savi_Maria-Tramonto_regale-1901","Lopez Savi Maria","Tramonto regale","1901","– chiese Severino. – Chi può saperlo! È stata qualche vendetta, ma non so chi abbia potuto denunziarmi!","NO"
"Lopez_Savi_Maria-Tramonto_regale-1901","Lopez Savi Maria","Tramonto regale","1901","Tardai ieri sera, per un affare, a ritirarmi, e mentre tornavo in fretta a casa, perchè i miei dovevano essere inquieti, ecco che incontro Salvatore, il figlio del mio portinaio, che mi viene innanzi pallido e col viso stravolto per la paura, dicendo: – don Carlo, non tornate a casa vostra, ci sta la polizia che vi cerca! – Non lo volevo credere in sul principio, ma quando egli, che è un ottimo giovine, mi ha supplicato di fuggire, perchè diceva la verità, ho perduto la testa e sono corso da un mio compare alla strada Ventaglieri. Prima che Teresa fosse tornata col caffè, Assunta, che era rimasta vicino alla madre, venne nell'anticamera e disse al fuggitivo: – Don Carlo venite, la mamma vuole vedervi.","NO"
"Lopez_Savi_Maria-Tramonto_regale-1901","Lopez Savi Maria","Tramonto regale","1901","Alvisi provò un acuto rimorso, per la prima volta, dopo che era entrato in casa Riva. Erano già tanto bersagliati quei poveretti dall'avversa fortuna, ed egli veniva a portare in casa loro nuove cagioni d'inquietudine e grave pericolo! Eppure la casa di donna Francesca così lungi dal centro e vicinissima all'aperta campagna, gli era sembrata il solo rifugio che gli convenisse quella notte, e non aveva neppur pensato che facilmente potrebbero cercarlo in quel luogo, conoscendo la sua amicizia colla famiglia Riva.","YES"
"Lopez_Savi_Maria-Tramonto_regale-1901","Lopez Savi Maria","Tramonto regale","1901","Egli aveva riacquistata un po' di calma quando giunse presso donna Francesca con Assunta e Severino. – Anche voi, don Carlo! – esclamò donna Francesca vedendolo.","NO"
"Lopez_Savi_Maria-Tramonto_regale-1901","Lopez Savi Maria","Tramonto regale","1901","– Sì, – rispose lui, che sentì ridestarsi nel cuore il dispiacere per la morte dell'amico, – anch'io, e adesso Luisa ed i figli miei piangono come avete pianto voi. – Che il Signore vi aiuti, don Carlo, – disse donna Francesca, la quale aveva già misurato il rischio che si correva ospitando il fuggitivo. Se fossero venuti a cercarlo in casa sua, le avrebbero preso anche Severino.","YES"
"Lopez_Savi_Maria-Tramonto_regale-1901","Lopez Savi Maria","Tramonto regale","1901","Ma nel suo animo generoso non era neppur balenato il pensiero di negargli l'ospitalità implorata. Ella soggiunse: – Voi resterete qui finchè sarà necessario, e dovete essere sicuro che noi, per amore verso di voi e verso la memoria di Michele, siamo felici di vedervi in casa nostra. – Grazie, – esclamò don Carlo, e siate benedetti!","NO"
"Lopez_Savi_Maria-Tramonto_regale-1901","Lopez Savi Maria","Tramonto regale","1901","Ma che cosa faranno adesso mia moglie ed i figli miei? – Confortatevi, – disse ancora donna Francesca. – Speriamo che non riusciranno a trovarvi.","NO"
"Lopez_Savi_Maria-Tramonto_regale-1901","Lopez Savi Maria","Tramonto regale","1901","Chi verrebbe a cercarvi quassù, in casa nostra! Troveremo domani un mezzo affinchè donna Luisa abbia vostre notizie. Ed ora dovete pensare a riposarvi.","YES"
"Lopez_Savi_Maria-Tramonto_regale-1901","Lopez Savi Maria","Tramonto regale","1901","Severino vi darà la sua camera. Andate, don Carlo. Ah!","NO"
"Lopez_Savi_Maria-Tramonto_regale-1901","Lopez Savi Maria","Tramonto regale","1901","se anche Michele avesse avuto il tempo di fuggire. Alvisi era troppo agitato perchè gli riuscisse di riposare, e passò il resto della notte sopra un seggiolone nella camera di Severino, senza che l'animo suo avesse un momento di pace; e se qualche passo si sentiva nel vicolo, un sudore freddo gli bagnava la fronte. Finalmente la voce monotona del caffettiere ambulante, che annunziava in quella stagione l'avvicinarsi dell'alba, risonò nel vicolo ancora deserto; e alcune porte dei bassi vennero aperte dagli operai che andavano al lavoro, e dalle donnicciuole che porgevamo le tazze piccole e rozze al caffettiere.","NO"
"Lopez_Savi_Maria-Tramonto_regale-1901","Lopez Savi Maria","Tramonto regale","1901","Col venir del giorno cresceva il pericolo per Alvisi e si faceva più vicino; ma in ogni modo vi era un certo conforto per lui nel ritorno della luce, che incominciò presto a entrare nella camera tra le fessure delle imposte chiuse. E intanto egli ragionava con Severino sul miglior modo da tenere per cercare d'imbarcarsi sopra qualche nave straniera ancorata nel porto, e la cosa non pareva impossibile al giovine, che si sarebbe valso per aiutarlo di tutta la sua occulta potenza. Verso le dieci giunse Antonio, che Severino aveva fatto chiamare, non volendo lasciar la casa finchè vi restasse don Carlo, e i due giovani avevano già stabilito quello che si dovrebbe fare la sera per favorire la sua fuga, quando si sentì il rumore di alcune carrozze, le quali venivano in fretta dal vicolo Melofioccolo e si fermarono innanzi alla casa.","NO"
"Lopez_Savi_Maria-Tramonto_regale-1901","Lopez Savi Maria","Tramonto regale","1901","Assunta e Teresa si erano affacciate per vedere e si ritrassero subito atterrite dalla finestra. Assunta disse piano ad Alvisi ed a giovani che l'interrogavano ansiosi collo sguardo: – Un signore e cinque uomini sono entrati nel palazzo! – Sono perduto!","NO"
"Lopez_Savi_Maria-Tramonto_regale-1901","Lopez Savi Maria","Tramonto regale","1901","– balbettò Alvisi, pallido come un morto, non reggendosi più in piedi. I due giovani erano impalliditi e si guardarono per un istante, dicendosi mille cose con quello sguardo eloquente; ma ben diverso era l'animo loro da quello di Alvisi! Severino si accostò prontamente all'infelice e con infinita bontà innanzi a quella grande debolezza, gli disse: – Animo, don Carlo.","NO"
"Lopez_Savi_Maria-Tramonto_regale-1901","Lopez Savi Maria","Tramonto regale","1901","Non tremate così! Teresa, prendi subito il suo cappello. Ecco, seguitemi, don Carlo.","NO"
"Lopez_Savi_Maria-Tramonto_regale-1901","Lopez Savi Maria","Tramonto regale","1901","Sapete che la mamma è inferma; ella si è aggravata stamane improvvisamente. Voi siete il dottor Savelli, venuto a visitarla.. Somigliate un poco a Savelli, voi: animo don Carlo!","YES"
"Lopez_Savi_Maria-Tramonto_regale-1901","Lopez Savi Maria","Tramonto regale","1901","Alvisi non aveva più speranza alcuna di salute, eppure macchinalmente, non sapendo quello che faceva, prese il cappello e sorretto da Severino entrò con lui nella camera di donna Francesca. La poveretta stanca dopo la grande commozione provata nella notte non era stata ancora in grado di alzarsi. Ella aveva sentito le carrozze, ed un grave sospetto si era destato in lei.","NO"
"Lopez_Savi_Maria-Tramonto_regale-1901","Lopez Savi Maria","Tramonto regale","1901","Forse venivano a cercare Alvisi in casa sua, ed ella si sentì male pensando a Severino, ed all'infelice che forse morirebbe nel carcere come era morto Michele. – Mamma, – le disse in fretta Severino, che fece sedere Alvisi vicino al suo letto, – don Carlo si chiama adesso il dottor Savelli: ti senti male, è venuto a visitarti, intendi? – Sì.","YES"
"Lopez_Savi_Maria-Tramonto_regale-1901","Lopez Savi Maria","Tramonto regale","1901","– disse lei con una calma apparente ammirevole. – Ed ora, se occorre, sappiate fare la vostra parte, don Carlo! Assunta, appoggiata all'uscio chiuso, udiva i passi degli uomini che salivano lentamente, parlando.","NO"
