"filename","nome","titolo","anno","chunk","DIL"
"Majocchi_Platis_Maria-Suor_Immacolata-1904","Majocchi Platis Maria","Suor Immacolata","1904","— Il mio dovere.... — mormorò con voce soffocata la grassa signora. — Anzi dovrei inginocchiarmi davanti a lei.... Dovrei dirle tanto.... ma non posso.... Troppe cose oggi sono accadute, troppe cose.... — Sì sì, poveretta lo comprendo.... — rispose l'altra con la sua soavissima voce. — Noi ci siamo comprese: basta, Dio la rimeriti per questo atto di bontà il cui ricordo non mi lascierà mai più.... Donna Ester si premeva sulle labbra e contro le narici il piccolo fazzoletto trinato, odoroso.","NO"
"Majocchi_Platis_Maria-Suor_Immacolata-1904","Majocchi Platis Maria","Suor Immacolata","1904","Suor Immacolata continuò: — Se in questi mesi di soggiorno in casa sua, avessi mancato.... se l'avessi offesa.... se qualche cosa in me le fosse dispiaciuto.... le domando scusa. La signora fece un gesto come per dire: ""Non parliamo di questo"" poi prese da un portagioie sulla toletta un ricco orologio d'oro e lo presentò alla monaca: — Suor Immacolata.... io e Jole la preghiamo di accettare questo piccolo ricordo in segno della nostra riconoscenza per le sue amorevoli cure.... un ben meschino segno.... Nel suo abito rosso, nella corpulenta persona, nell'atto, donna Ester era teatralissima. Ma il suo volto esprimeva un sentimento sincero, la voce un'affabilità non artificiosa.","NO"
"Majocchi_Platis_Maria-Suor_Immacolata-1904","Majocchi Platis Maria","Suor Immacolata","1904","E la suora se ne sentì intenerire: — Quanta bontà, signora! Ma io non posso accettare. Noi non possiamo accettare oggetti personali di valore.","NO"
"Majocchi_Platis_Maria-Suor_Immacolata-1904","Majocchi Platis Maria","Suor Immacolata","1904","Abbiamo voto di povertà. — Oh!... — ella disse delusa: — che peccato.... Sarei stata così contenta di dimostrarle in qualche modo….","NO"
"Majocchi_Platis_Maria-Suor_Immacolata-1904","Majocchi Platis Maria","Suor Immacolata","1904","— Possiamo fare un'offerta alla chiesa, mamma — suggerì Jole che s'era tenuta in disparte, immobile, ma profondamente tocca da quella scena. — Sì.... sì.... brava.... faremo un'offerta.... Che cosa? Una lampada?","NO"
"Majocchi_Platis_Maria-Suor_Immacolata-1904","Majocchi Platis Maria","Suor Immacolata","1904","Un ornamento da altare? — Ci penseremo insieme, mamma.... Ed ora andiamo, suor Immacolata, perchè si fa davvero tardi.","NO"
"Majocchi_Platis_Maria-Suor_Immacolata-1904","Majocchi Platis Maria","Suor Immacolata","1904","Donna Ester mandò la cameriera a prendere una carrozza. Con la sua albagia pareva caduto quel mattino anche il suo rancore. Sul volto in cui permanevano, malgrado gli artifizi della toelette, le traccie d'una recente emozione dolorosa e della notte insonne, suor Immacolata non ritrovava più che il sentimento materno, gagliardo, dominatore.","NO"
"Majocchi_Platis_Maria-Suor_Immacolata-1904","Majocchi Platis Maria","Suor Immacolata","1904","Così il loro saluto fu espansivo e commosso. Perfino donna Ester, chiese se avrebbe potuto recarsi al convento a vederla di tanto in tanto.... — Ah, suora, suora mia.... — diceva quando furono sole nella carrozza chiusa, Jole, comprimendosi il piccolo cuore con le mani inguantate, piccine come quelle d'una bimba — che giornata, che memorabile giornata.... Mi par di sognare.","YES"
"Majocchi_Platis_Maria-Suor_Immacolata-1904","Majocchi Platis Maria","Suor Immacolata","1904","Chi avrebbe detto solo pochi giorni fa, che tutto sarebbe andato così bene? Sa che cosa mi viene in mente? Che Lei sia un angelo vero, mandato dal Signore per far dei miracoli, e che quando saremo in chiesa io le vedrò le ali, due grandi ali luminose.... e Lei mi sparirà.... — No, non dubiti.... — sorrise la suora.","YES"
"Majocchi_Platis_Maria-Suor_Immacolata-1904","Majocchi Platis Maria","Suor Immacolata","1904","— Noi ci separeremo, ma non così.... Tacquero. Il grande mazzo di fiori candidi odorava acutamente sul sedile dirimpetto: Jole con le mani intrecciate, seminascosta dal suo ampio velo, a occhi bassi, rimase in silenzio.","NO"
"Majocchi_Platis_Maria-Suor_Immacolata-1904","Majocchi Platis Maria","Suor Immacolata","1904","Suor Immacolata rispettò quel raccoglimento. Una grande tristezza l'aveva invasa all'improvviso mentre la carrozza correva verso il monastero dove aveva l'obbligo di recarsi un momento prima di accompagnare la giovinetta all'altare. Una tristezza cupa, opprimente, come non aveva provato mai e che la sorprendeva in quell'ora in cui finiva d'adempiersi la sacra missione a lei affidata da Dio.","YES"
"Majocchi_Platis_Maria-Suor_Immacolata-1904","Majocchi Platis Maria","Suor Immacolata","1904","Ella aveva ottenuto oltre le sue speranze, e tornava ai piedi della croce vittoriosa. Che desiderare di più? Una pura anima assunta alla luce della fede chiamata all'esercizio del bene e della virtù: un'altra arrestata sull'orlo dell'abisso: il seme della religione, l'idea della Divinità onnipotente che annienta e compie i miracoli, che minaccia e assolve, paga dell'avvertimento dato a chi può intenderlo, gettati in quella casa e non forse in un terreno sterile; in quella casa dov'era entrata invisa, accolta con diffidenza, con ostilità, con umiliante alterigia, e donde usciva benedetta, riverita, onorata come una sovrana.","YES"
"Majocchi_Platis_Maria-Suor_Immacolata-1904","Majocchi Platis Maria","Suor Immacolata","1904","Che desiderare, che sperare di più? E come mai ella non inneggiava al Signore? Quando le apparvero a poca distanza le alte vecchie muraglie del monastero, la sua pena si addensò.","YES"
"Majocchi_Platis_Maria-Suor_Immacolata-1904","Majocchi Platis Maria","Suor Immacolata","1904","Il suo spirito libero e mondo, docile e sensibilissimo alle voci soprannaturali, la avvertì che una prova, forse aspra come non ne aveva subite mai, la aspettava oltre quella soglia.... E così lucido fu l'avvertimento ch'ella scese di carrozza con la sicurezza d'una sventura, in un'ansia mortale. Jole parve destarsi da un soave sogno.","YES"
"Majocchi_Platis_Maria-Suor_Immacolata-1904","Majocchi Platis Maria","Suor Immacolata","1904","Col suo fragrante mazzo immacolato che sembrava formare un tutto di poesia e di gentilezza con lei, entrò per l'altra porta austera dietro alla suora. Alcune sorelle si fecero loro incontro. Portavano tutte l'abito bianco dell'Ordine di San Domenico e il nero scapolare, come suor Immacolata; ma la figura slanciata, l'aria signorile, l'angelico volto di lei, la facevano apparire tutta diversa e superiore.","NO"
"Majocchi_Platis_Maria-Suor_Immacolata-1904","Majocchi Platis Maria","Suor Immacolata","1904","Le suore si congratularono con la comunicanda, diedero il benvenuto alla compagna, ma la medesima espressione di mestizia mal celata era nei loro volti fasciati dalle bende. Suor Immacolata dopo uno sguardo dei suoi azzurri occhi usi a contemplare il dolore, pregò con calma austera e dolce: — Ditemi dunque quello che mi è accaduto. Le monache si guardarono a vicenda con alta sorpresa.","NO"
"Majocchi_Platis_Maria-Suor_Immacolata-1904","Majocchi Platis Maria","Suor Immacolata","1904","L'una d'esse, una giovane, mormorò: — Lo sa? — Ecco la superiora.... — bisbigliarono poi facendo largo alla matronale figura della vecchia monaca che giungeva con altre dal fondo dell'atrio, ove tra colonne verdeggiava un giardino. Suor Immacolata le mosse incontro, le si inginocchiò innanzi, e così prostrata, in un'agonia dell'anima, attese la sua sentenza.","NO"
"Majocchi_Platis_Maria-Suor_Immacolata-1904","Majocchi Platis Maria","Suor Immacolata","1904","La superiora le posò una mano sul capo, le disse con la voce triste e tremula: — Benvenuta, figliuola. Si alzi.... La prostrata obbedì.","NO"
"Majocchi_Platis_Maria-Suor_Immacolata-1904","Majocchi Platis Maria","Suor Immacolata","1904","Vide allora che la vecchia monaca teneva tra le dita un telegramma. — Si faccia coraggio — quella proseguì. — Il Signore vuol provare la sua rassegnazione.... Sua madre.... — È morta?","NO"
"Majocchi_Platis_Maria-Suor_Immacolata-1904","Majocchi Platis Maria","Suor Immacolata","1904","— È morente..., Suor Immacolata lesse nel dispaccio, con le pupille offuscate: ""Nostra madre aggravatissima accesso cardiaco. Vieni. Arrigo"".","NO"
"Majocchi_Platis_Maria-Suor_Immacolata-1904","Majocchi Platis Maria","Suor Immacolata","1904","Il velo agli occhi si fece più denso, un gran rumore le riempì gli orecchi, un sudore gelato le agghiacciò il viso.... La natura fragile vinse, e la monaca svenne. Il lungo viaggio da Genova a Bologna fu un martirio per suor Immacolata.","NO"
"Majocchi_Platis_Maria-Suor_Immacolata-1904","Majocchi Platis Maria","Suor Immacolata","1904","Accompagnata da una vecchia monaca che doveva recarsi in Romagna in quei giorni, nel vagone di seconda classe riservato alle signore dove si trovavano altre due viaggiatrici, una delle quali con un bimbo malato e inquieto, ella doveva fare gran forza a sé stessa per non prorompere in singhiozzi disperati ogni volta che la dolce imagine materna le si presentava più viva al pensiero. L'ultimo loro incontro era avvenuto cinque mesi addietro, e sebbene di salute sempre malferma specialmente dopo la perdita del marito, della quale la contessa Farigliano aveva vivamente sofferto, nulla dava a dubitare ch'ella dovesse seguirlo così in breve. Anche gli accessi cardiaci a cui andava soggetta, non erano a dire del medico, pericolosi, date le cure sollecite e continue delle quali i suoi figlioli la circondavano.","NO"
"Majocchi_Platis_Maria-Suor_Immacolata-1904","Majocchi Platis Maria","Suor Immacolata","1904","Per questo suor Immacolata non aveva inquietudini. Ella conosceva bene la bontà, la delicatezza, l'abnegazione di sua cognata, la moglie d'Arrigo, che era cara alla suocera come una figliuola, mentre costei la venerava come una madre. Se il male aveva potuto aggravarsi fino a quel punto non era certo stato per mancanza di riguardi e di cure.","YES"
"Majocchi_Platis_Maria-Suor_Immacolata-1904","Majocchi Platis Maria","Suor Immacolata","1904","Le tornarono in mente le parole della superiora quando si era congedata: ""Coraggio, figliuola: l'ora della morte è fissata da Dio; conviene rassegnarsi alla Sua volontà. Pregheremo per sua madre...."" Eppure ella non poteva rassegnarsi! La morte di suo padre le aveva fatto provare un gran dolore; ma all'idea di perdere sua madre, si sentiva invasa da una specie di disperazione ribelle....","YES"
"Majocchi_Platis_Maria-Suor_Immacolata-1904","Majocchi Platis Maria","Suor Immacolata","1904","Erano lontane, è vero: rinunziando al mondo aveva dovuto pure rinunziare alla sua casa piena di memorie, alla sua famiglia piena di dolcezze: ma ai suoi affetti puri e santi aveva potuto non rinunziare senza offendere quel Dio a cui si consacrava interamente. Anzi nella via superiore a quelle terrestri, nella via piena di luce, fiorita degli asfodeli della Grazia, suor Immacolata aveva la convinzione d'esser più efficace verso i suoi cari che non rimanendo con essi, Ella pregava per la pace e la purezza dei loro spiriti e il benessere della loro esistenza materiale: essa li guidava, li sorreggeva, li ammoniva, li confortava, li consigliava di lontano, nelle lunghe lettere in cui versava tutti i tesori della sua anima immacolata come la sua veste e il suo nome. Era la vigile lampada del santuario, che si consuma solitaria, ma dà luce di amore e di fede: era la mistica colomba di pace che fa sereno il tetto su cui si posa, a cui ritorna, non fosse che per un istante.","YES"
"Majocchi_Platis_Maria-Suor_Immacolata-1904","Majocchi Platis Maria","Suor Immacolata","1904","Ella si sentiva quindi avvinta alla famiglia, alla madre lontana, con vincoli ai quali il lume ideale sovrapposto, non aveva fatto che accrescere la forza e l'intensità. L'attempata monaca che l'accompagnava, suor Caterina, tentava in tutti i modi di rianimarla, ora infondendole qualche speranza, ora esortandola alla rassegnazione e al sacrifizio, ora invitandola a pregare con lei. E suor Immacolata si prestava docile, ma il pallore del suo delicato volto e l'offuscamento doloroso dei suoi occhi azzurri che ogni momento si colmavano di lacrime, rivelavano che il sentimento lottava in lei con la volontà.","NO"
"Majocchi_Platis_Maria-Suor_Immacolata-1904","Majocchi Platis Maria","Suor Immacolata","1904","Si era anche occupata del suo piccolo compagno di viaggio malato, per distogliersi alla propria angoscia, interrogando la madre e suggerendole qualche rimedio: aveva recitato un intero rosario e letto nel suo Manuale di pietà molte preghiere; eppure il tempo non passava mai, e quel viaggio le pareva non dovesse mai aver fine. — Vedrà, vedrà.... — mormorava alla sua compagna, — che non arriverò in tempo a vederla viva.... — Speri nel Signore misericordioso.... — rispondeva la pia sorella. — Egli non le negherà forse questa grazia.","YES"
"Majocchi_Platis_Maria-Suor_Immacolata-1904","Majocchi Platis Maria","Suor Immacolata","1904","Suor Immacolata taceva, stringendo convulsamente il rosario fra le dita sottili. E guardando distratta il verde paesaggio della monotona campagna emiliana che sembrava fuggire dal lato opposto a quello dove inoltrava il treno, si consumava nei suoi occulti pensieri, di dolore e di rimorso.... Sì, anche di rimorso. In quell'ora grave, nella quale sua madre stava per lasciarla, la sua coscienza sensibilissima le rivolgeva una interrogazione severa: se non avesse lei, per avventura, contribuito, seguendo la via del suo alto destino, a logorare per un patema d'animo segreto la salute di quella sua cara.","YES"
"Majocchi_Platis_Maria-Suor_Immacolata-1904","Majocchi Platis Maria","Suor Immacolata","1904","La tenerezza di sua madre per lei, specie dopo la morte della prima figliuola, Luisa, recava tutti i caratteri d'una passione. Quante volte l'aveva veduta trepidare, inquietarsi, affliggersi anche di cose di poco conto, ma che riguardavano lei, la figlia prediletta! E con quale gelosa cura l'aveva allevata, fisicamente e moralmente, se l'era sempre tenuta vicina, sino ai vent'anni, fino al giorno in cui apprendeva la sua grande risoluzione di ritirarsi dal mondo per offrirsi a Dio.","YES"
"Majocchi_Platis_Maria-Suor_Immacolata-1904","Majocchi Platis Maria","Suor Immacolata","1904","Il distacco era stato crudelissimo, e la contessa Farigliano non vi si era rassegnata che facendo violenza al suo sentimento egoistico. Ma ne aveva sofferto, ma poteva averne sofferto più di quanto nella sua virtù ne avesse lasciato trapelare.... E suor Immacolata pensava che se sua madre fosse partita dal mondo prima di risolvere quel dubbio doloroso, non avrebbe avuto più pace, nemmeno nel chiostro.","YES"
"Majocchi_Platis_Maria-Suor_Immacolata-1904","Majocchi Platis Maria","Suor Immacolata","1904","Una parola, un atto, uno sguardo della moribonda basterebbero.... ed implorava Dio con tutte le sue forze che la lasciasse giungere in tempo per raccoglierli. — Suor Caterina.... e se la mia vista le desse una emozione troppo forte? Se il suo cuore malato al vedermi si spezzasse?","YES"
"Majocchi_Platis_Maria-Suor_Immacolata-1904","Majocchi Platis Maria","Suor Immacolata","1904","Sarei io che.... Il pianto le fece nodo alla gola e suor Immacolata tacque chiudendo gli occhi nello spasimo di quel nuovo sgomento. — No, si dia coraggio: i suoi parenti l'avranno preparata.... poi chissà se il male è così grave come essi temono?","YES"
"Majocchi_Platis_Maria-Suor_Immacolata-1904","Majocchi Platis Maria","Suor Immacolata","1904","Può essere una crisi come le altre.... forse la supererà.... La suora addolorata rialzò le palpebre a questo alito di nuova speranza. Ah se il Signore le facesse questa grazia immensa!","YES"
"Majocchi_Platis_Maria-Suor_Immacolata-1904","Majocchi Platis Maria","Suor Immacolata","1904","Ma il presentimento lugubre opprimeva tanto la sua anima che nessun sollievo la penetrò. Il treno correva fra Piacenza e Parma nel pomeriggio afoso, livido, senza sole. Due ore ancora la separavano dall'arrivo.","YES"
"Majocchi_Platis_Maria-Suor_Immacolata-1904","Majocchi Platis Maria","Suor Immacolata","1904","Qualcuno sarebbe certo alla stazione, poiché essa aveva avvisato della sua immediata partenza da Genova. Troverebbe Corrado? Oh almeno fossero tutti intorno a quel letto.... almeno vi trovasse anche monsignor Altabella, il prelato venerando, l'antico amico della sua casa, lui che aveva ricevuto fra i primi la rivelazione della sua vocazione e che si era assunto la difficile missione di persuadere i suoi genitori a non impedirle di rispondere all'appello del Signore.","YES"
"Majocchi_Platis_Maria-Suor_Immacolata-1904","Majocchi Platis Maria","Suor Immacolata","1904","La Stazione di Parma col suo piccolo parco verde lieto, dopo pochi minuti di fermata, passò come una visione. Mano mano che lo spazio diminuiva, la sua ansia invece di calmarsi si faceva più acerba; ed ella offriva quel tormento al suo Dio perchè le concedesse la suprema, triste dolcezza di raccogliere l'estremo sospiro di lei che le aveva dato la vita. Pregava mentalmente; e la preghiera le si spezzava in una invocazione, disperata, monotona, ardente, nell'intimo del cuore, sotto il suo aspetto dignitoso e tranquillo.","NO"
"Majocchi_Platis_Maria-Suor_Immacolata-1904","Majocchi Platis Maria","Suor Immacolata","1904","— Ecco Modena. Presto siamo a Bologna.... — osservò Suor Caterina per consolarla. Bologna!","YES"
"Majocchi_Platis_Maria-Suor_Immacolata-1904","Majocchi Platis Maria","Suor Immacolata","1904","Quel nome la percosse, la trasse per qualche momento dalla sua agitazione. Non era più stata a Bologna dacché era suor Immacolata. Sua madre, i suoi parenti, si recavano essi a vederla qua e là, dove la portava il suo ministero, o nel suo convento, a Padova.","YES"
"Majocchi_Platis_Maria-Suor_Immacolata-1904","Majocchi Platis Maria","Suor Immacolata","1904","Suo padre era morto nella loro villa di Rivarola, ella vi era accorsa, era passata anche molte volte dalla stazione della più centrale fra le città emiliane, ma non era più rientrata nel palazzo avito di via San Stefano dove era nata, dove aveva trascorso la sua prima giovinezza, dove si era infranto il luminoso sogno del suo cuore. Ed ora dopo dieci anni, sotto altro nome, ella vi rimetterebbe il piede; ella rivedrebbe quelle pareti, quei mobili, quegli oggetti, certi immutati, e con che strazio nell'anima! e in qual luttuoso giorno!","YES"
"Majocchi_Platis_Maria-Suor_Immacolata-1904","Majocchi Platis Maria","Suor Immacolata","1904","Ancora pregò: ""Gesù, che sapesti l'amarezza suprema nell'orto degli Olivi, fa che il mio cuore non si schianti nel varcare quella soglia! Cingimi della tua fortezza sovrumana: fa ch'io mi dimentichi di me medesima, ch'io porti anche nella casa che fu mia il raggio della tua fede, il conforto e la speranza e la pace che scendono da Te...."" L'ardente preghiera fu spezzata dal fischio acuto e prolungato della macchina che avvertiva l'arrivo imminente. Le altre viaggiatrici si levarono.","NO"
"Majocchi_Platis_Maria-Suor_Immacolata-1904","Majocchi Platis Maria","Suor Immacolata","1904","Suor Caterina tolse dalla rete le due umili valigie di tela; rivolse alla compagna altre parole di consolazione e di incoraggiamento che ella udì come in sogno. Il treno entrò sotto la tettoia affollata, rallentò e si fermò con fragore. Suor Immacolata udì il nome della sua città gridato con una specie d'orgoglio da molte voci.... udì il dialetto che le era famigliare.... ma si sentiva incapace d'un movimento, d'un atto di volontà, come sotto un incubo penoso.","NO"
"Majocchi_Platis_Maria-Suor_Immacolata-1904","Majocchi Platis Maria","Suor Immacolata","1904","Fu suor Caterina che la prese delicatamente per il braccio, la forzò a levarsi, l'aiutò a scendere. Mentre rimaneva incerta sul marciapiede stordita dal chiasso, dall'emozione, dalla propria debolezza fisica, un nome, il suo nome, il nome della sua vita morta, pronunciato da una voce cara la riscosse, la rianimò: — Maria.... Era Corrado, il suo fratello prediletto, in divisa di capitano, lì accanto a lei.","NO"
"Majocchi_Platis_Maria-Suor_Immacolata-1904","Majocchi Platis Maria","Suor Immacolata","1904","— Ah! — ella gridò dominando a fatica l'impulso di gettarsi sul suo petto fido, come usava un tempo. E tosto: — È viva?...","NO"
"Majocchi_Platis_Maria-Suor_Immacolata-1904","Majocchi Platis Maria","Suor Immacolata","1904","— Sì.... Vieni subito: c'è la carrozza.... Hai del bagaglio? Nel rivolgersi a prendere la piccola valigia di tela, rivide suor Caterina e si congedò commossa in fretta, per seguire il fratello che già si avviava.","NO"
"Majocchi_Platis_Maria-Suor_Immacolata-1904","Majocchi Platis Maria","Suor Immacolata","1904","Uno strano effetto le fece il salire in un coupè stemmato al cui sportello il servo attendeva in attitudine rispettosa, ella, l'umile figliuola della Carità, che volontariamente aveva eletto l'ultimo posto nelle gerarchie del mondo. E quella carrozza e quei servi venivano dalla sua casa: erano stati un tempo i suoi. Quando la carrozza si avviò sotto una pioggerella fine che mutava quel vespro di giugno in un vespro autunnale, suor Immacolata chiese con ansia al fratello dei dettagli sullo stato della diletta ammalata.","YES"
"Majocchi_Platis_Maria-Suor_Immacolata-1904","Majocchi Platis Maria","Suor Immacolata","1904","Era gravissimo.... Aveva ricevuto i sacramenti. Pure si mostrava tranquilla, in una lucidità di mente perfetta. Era stata lei a desiderare che si telegrafasse ai figliuoli lontani per averli intorno nel momento estremo....","YES"
"Majocchi_Platis_Maria-Suor_Immacolata-1904","Majocchi Platis Maria","Suor Immacolata","1904","Corrado era arrivato al mattino da Livorno: non si era troppo commossa vedendolo.... aveva dimostrato solamente la sua intima dolcezza.... Ora aspettava lei.... La suora, tutta bianca, nell'abito, nelle bende, nel volto, dall'ombra della carrozza ascoltava il diletto fratello parlare, contemplando su quel maschio e nobile viso la sua stessa emozione dolorosa a cui se ne aggiungeva un'altra, più tenera e sottile.","YES"
"Majocchi_Platis_Maria-Suor_Immacolata-1904","Majocchi Platis Maria","Suor Immacolata","1904","La voce di Corrado, i lineamenti famigliari, alterati dagli anni e dal dolore, lo sguardo acuto e grave degli occhi azzurri che somigliavano ai suoi, la divisa d'ufficiale di marina, la riportavano nel suo passato, negli anni prima dolci, poi tristi della sua giovinezza. E una schiera di fantasmi aleggiava intorno, alcuni soavemente grati alla memoria fedele, altri temibili, ma che non era più capace di scacciare. Maria Bertolese.... l'amica capricciosa e infida, ch'era stata la devastatrice dei loro due cuori, di quello del fratello per l'amore che vi aveva fatto nascere; raro tesoro sdegnato e disconosciuto; di quello di lei a cui aveva invocato l'unico sogno che le faceva parer lieta e desiderabile la vita.","YES"
"Majocchi_Platis_Maria-Suor_Immacolata-1904","Majocchi Platis Maria","Suor Immacolata","1904","Dove si trovava colei? Le risovvenne del loro ultimo incontro, già lontano, causale, in un ospizio d'orfane d'una città di Romagna, nel vespro dell'ultimo giorno dell'anno, mentre lei, suor Immacolata, si trovava in giardino con le fanciulle affidate alle sue cure.... Rivide la scena.... rivide il lampo freddo di quegli occhi color delle lame d'acciaio.... rivide la bimba che la signora teneva per mano, la loro figlia, ch'ella aveva poi condotto seco con un turbamento ineffabile.... Riudì la vocina infantile, ne rammentava il nome: Mimma.... Che era mai adesso di quella creatura, adolescente ormai?","YES"
"Majocchi_Platis_Maria-Suor_Immacolata-1904","Majocchi Platis Maria","Suor Immacolata","1904","Non osò chiederne al fratello. Chissà se aveva dimenticato? Chissà se il mare lo aveva guarito?","YES"
"Majocchi_Platis_Maria-Suor_Immacolata-1904","Majocchi Platis Maria","Suor Immacolata","1904","Se in fondo alla sua anima forte e invitta l'antica ferita era rimarginata completamente? Povero fratello! In quel momento che un comune e così vivo e santo dolore li riuniva, suor Immacolata sentì più per lui che per sé acerbo il rimprovero per l'usurpatrice.","YES"
"Majocchi_Platis_Maria-Suor_Immacolata-1904","Majocchi Platis Maria","Suor Immacolata","1904","Lei oramai, era al sicuro.... La carrozza si fermò. La viaggiatrice riconobbe con un sussulto i gradini e l'arco del portico di via S. Stefano: il portone di casa sua.","YES"
"Majocchi_Platis_Maria-Suor_Immacolata-1904","Majocchi Platis Maria","Suor Immacolata","1904","Con un appello supremo alla protezione divina, raccolse le sue forze, scese dopo il fratello. Pioveva tranquillamente, con un lieve e fresco rumore come in autunno. Corrado le porse amorevolmente il braccio.","NO"
"Majocchi_Platis_Maria-Suor_Immacolata-1904","Majocchi Platis Maria","Suor Immacolata","1904","Solo quel braccio forte e fido potè darle l'eroismo d'oltrepassare quella vecchia soglia senza svenire. L'altro fratello, Arrigo, un bel giovine bruno, un po' tarchiato, attendeva a' piedi della scala. Alcuni servi andavano e venivano, inchinandosi intorno a lei ossequiosamente; ma suor Immacolata viveva in quel momento come in sogno.","NO"
