"filename","nome","titolo","anno","chunk","DIL"
"Novelli_Enrico-Ciuffettino-1902","Novelli Enrico","Ciuffettino","1902","uh! — Quando morì Ciuffettino XXXIV, senza eredi – proseguiva il primo pappagallo – il gran Mago dei Pappagalli dichiarò che l’isola doveva restare senza Imperatore finchè l’anima di Ciuffettino Primo, detto il Vittorioso per le sue guerre contro i macacchi invasori, finchè la sua anima grande, dico, non ritornasse in terra nelle spoglie di un essere umano... Tu sei l’Eletto!","NO"
"Novelli_Enrico-Ciuffettino-1902","Novelli Enrico","Ciuffettino","1902","Tu sei l’Atteso! Tu sei il nostro nuovo Imperatore! Da dieci anni, ogni mattina noi volavamo su questa spiaggia sperando di vederti arrivare.","NO"
"Novelli_Enrico-Ciuffettino-1902","Novelli Enrico","Ciuffettino","1902","— Ma voi altri, chi siete? – chiese Ciuffettino, il quale in tutto quel discorso non aveva capito che una cosa: che lo volevano creare Imperatore dei Pappagalli. — Noi siamo i più alti dignitari dell’impero.","NO"
"Novelli_Enrico-Ciuffettino-1902","Novelli Enrico","Ciuffettino","1902","Io sono il principe Beccolungo... — E io sono il duca Beccocorto... — Mi dispiace tanto di non aver un becco anch’io! – esclamò il ragazzo, un po’ mortificato: ma poi, riprendendo coraggio: — Me ne metterò uno di cartone. Sicchè voi altri mi assicurate che io sono proprio il vostro nuovo Imperatore?","NO"
"Novelli_Enrico-Ciuffettino-1902","Novelli Enrico","Ciuffettino","1902","— Gloria a te, Ciuffettino! - gridò Beccolungo, facendo due rivoltoloni. — Gloria te, Ciuffettino – ripetè l’altro, facendone quattro.","NO"
"Novelli_Enrico-Ciuffettino-1902","Novelli Enrico","Ciuffettino","1902","In quella un raggio di sole ruppe il velo di nubi, e sfolgorò sul capo augusto di Ciuffettino XXXV! Dove Ciuffettino è obbligato a dimostrare la propria sagacia e la propria tattica nella guerra contro le scimmie predone. Beccolungo e Beccocorto conficcarono le loro unghie negli abiti di Ciuffettino, e spiccarono il volo.","NO"
"Novelli_Enrico-Ciuffettino-1902","Novelli Enrico","Ciuffettino","1902","Il ragazzo, in un attimo, si trovò ad una altezza vertiginosa, ed ebbe una gran paura di fare un capitombolo. — Tenetemi forte, almeno! – balbettò, diventando bianco come un cencio lavato.","NO"
"Novelli_Enrico-Ciuffettino-1902","Novelli Enrico","Ciuffettino","1902","I pappagalli risposero con una risatina rispettosa, ma sardonica. — Vostra Maestà non dubiti!... – disse Beccolungo.","NO"
"Novelli_Enrico-Ciuffettino-1902","Novelli Enrico","Ciuffettino","1902","— ...non dubiti! – ripetè Beccocorto. Il tragitto aereo si compì in pochi minuti.","NO"
"Novelli_Enrico-Ciuffettino-1902","Novelli Enrico","Ciuffettino","1902","Ecco Ciuffettino seduto in un bel nido fatto di rami intrecciati maestevolmente e imbottito di superbe piume azzurre, rosse, gialle, verdi e color dell’oro. E quel nido maraviglioso era piantato su la biforcatura di un alto albero, nel bel mezzo della foresta. Intorno a Ciuffettino, su i rami degli alberi stavano appollaiati, a gruppi di due, di tre, di quattro, dei graziosi perrocchetti, dei maestosi kakatoa, dei superbi pappagalli cinerini, verdi e rossi, delle are colossali, dai colori mirabili.","NO"
"Novelli_Enrico-Ciuffettino-1902","Novelli Enrico","Ciuffettino","1902","Alcuni di quei pappagalli, forse per la vecchiaia, portavano gli occhiali; altri tenevano sotto l’ala dei grossi scartafacci; altri, ancora, erano decrepiti e malconci, però si coprivano le membra spennacchiate, con delle piume di altri uccelli, attaccate a furia di gomma e di colla di pesce. Il più vecchio dell’assemblea – un decrepito kakatoa che aveva perduto la cresta rossa, e portava piume finte e gli occhiali – dopo aver confabulato a lungo con Beccolungo e Beccocorto, esclamò, rivolto al nostro eroe: Il banchetto dei macacchi.","NO"
"Novelli_Enrico-Ciuffettino-1902","Novelli Enrico","Ciuffettino","1902","— Tu sei il successore di Ciuffettino XXXIV, il nostro grande imperatore morto per aver mangiato del prezzemolo con le patate. Tu sei colui che attendevamo. Ricordati però, che se tu sei l’Imperatore, io sono il tuo primo ministro, e sono anche perciò presidente del Consiglio.","NO"
"Novelli_Enrico-Ciuffettino-1902","Novelli Enrico","Ciuffettino","1902","Tu avrai nelle tue mani le nostre ricchezze e le nostre sostanze. Però non potrai disporne in nessuna maniera, senza il nostro consenso, che non ti accorderemo mai. Ti serviremo tutti fedelmente; ora tu devi giurare di sottometterti alle leggi che regolano il nostro impero... — Mi sottometto!","NO"
"Novelli_Enrico-Ciuffettino-1902","Novelli Enrico","Ciuffettino","1902","giuro! – proruppe Ciuffettino. In un momento presso il ragazzo si affollarono pappagalli di tutte le dimensioni, di tutte le forme e di tutte le specie, i quali, fra il verde delle piante, alla bella luce dorata del sole che metteva fiamme e scintillii nelle loro piume multicolori, formavano un quadro degno di ispirare anche quel famoso pittore di pappagalli che si chiamava... oh!","NO"
"Novelli_Enrico-Ciuffettino-1902","Novelli Enrico","Ciuffettino","1902","il nome lasciamolo lì. Il vecchio pappagallo con gli occhiali, arrampicandosi a fatica su di un ramo posto al disopra di Ciuffettino, mostrò agli adunati la corona imperiale e la lasciò cadere proprio su la zucca del fanciullo. Allora tutti i pappagalli, ad un tempo solo, intonarono l’inno dei Rampicanti, inno scritto dall’imperatore Ciuffettino XIV.","NO"
"Novelli_Enrico-Ciuffettino-1902","Novelli Enrico","Ciuffettino","1902","Le stonature di quei cantori non potete figurarvele; basti dirvi che Ciuffettino, il quale, in fondo, non conosceva che la musica suonata dall’unico organetto sfiatato di Cocciapelata, dovette tapparsi le orecchie!... Appena l’inno cessò, i pappagalli presero a strillare: — Viva il nostro imperatore! viva Ciuffettino XXXV!...","NO"
"Novelli_Enrico-Ciuffettino-1902","Novelli Enrico","Ciuffettino","1902","E incominciarono la festa. Allora Ciuffettino disse, in confidenza, a Beccolungo e a Beccocorto: — Sentite: non per offendervi: vi son grato delle vostre dimostrazioni di affetto e dei vostri inni: ma vi sarei anche più grato se voleste offrirmi qualcosina da buttar giù, nello stomaco... — C’è tempo! – disse, con una riverenza, Beccolungo.","NO"
"Novelli_Enrico-Ciuffettino-1902","Novelli Enrico","Ciuffettino","1902","— ...tempo! – ripetè Beccocorto. — Ma io ho fame!","NO"
"Novelli_Enrico-Ciuffettino-1902","Novelli Enrico","Ciuffettino","1902","– strillò Ciuffettino, col pianto alla gola. — Vergogna! Un imperatore non deve mai aver fame – ribattè Beccolungo.","NO"
"Novelli_Enrico-Ciuffettino-1902","Novelli Enrico","Ciuffettino","1902","— ...mai fame! – ripetè Beccocorto. — Fino a stasera non si mangia – sentenziò Beccolungo.","NO"
"Novelli_Enrico-Ciuffettino-1902","Novelli Enrico","Ciuffettino","1902","— Pazienza! – sospirò l’imperatore dei pappagalli – vuol dire che, per ammazzare il tempo, schiaccierò un sonnellino. E incominciava ad appisolarsi davvero, quando grida orribili risuonarono nella foresta.","NO"
"Novelli_Enrico-Ciuffettino-1902","Novelli Enrico","Ciuffettino","1902","— Che cosa succede? – borbottò Ciuffettino, stropicciandosi gli occhi – chi è quel maleducato... — Il nemico! il nemico!","NO"
"Novelli_Enrico-Ciuffettino-1902","Novelli Enrico","Ciuffettino","1902","– si udiva gridare da ogni parte. — Il nemico! – ripeterono in coro Beccolungo e Beccocorto che non abbandonavano mai il loro signore.","NO"
"Novelli_Enrico-Ciuffettino-1902","Novelli Enrico","Ciuffettino","1902","— Il nemico? quale nemico? – chiese Ciuffettino, trasognato.","NO"
"Novelli_Enrico-Ciuffettino-1902","Novelli Enrico","Ciuffettino","1902","— I macacchi! i macacchi!... – esclamavano i pappagalli della foresta, correndo di qua, di là, intimoriti.","NO"
"Novelli_Enrico-Ciuffettino-1902","Novelli Enrico","Ciuffettino","1902","Eccoti il vecchio kakatoa con gli occhiali che arriva nel nido del nostro amico, ciangottando: — Il popolo ti chiede, eccelso imperatore!... — Ma io, veramente, ho sonno! – bofonchiò Ciuffettino.","NO"
"Novelli_Enrico-Ciuffettino-1902","Novelli Enrico","Ciuffettino","1902","— Non c’è sonno che tenga: i macacchi, gli eterni nostri nemici, gli abitatori delle isole vicine, stanno per dare un nuovo e terribile assalto alla nostra terra!... Difendici! Guidaci alla vittoria!...","NO"
"Novelli_Enrico-Ciuffettino-1902","Novelli Enrico","Ciuffettino","1902","— Ho fame! – sospirò l’imperatore, sbadigliando. — Dopo la battaglia, mangerai – ammonì severamente Beccolungo.","NO"
"Novelli_Enrico-Ciuffettino-1902","Novelli Enrico","Ciuffettino","1902","— ...mangerai – ripetè Beccocorto. — Bah! – fece Ciuffettino, prendendo la cosa con filosofia – andiamo pure alla battaglia, purchè dopo ci sia un buon pranzetto.","NO"
"Novelli_Enrico-Ciuffettino-1902","Novelli Enrico","Ciuffettino","1902","Vi avverto che le mandorle mi piacciono infinitamente... Oh! ma dico: non ci sarà pericolo di nulla, in questa battaglia?","YES"
"Novelli_Enrico-Ciuffettino-1902","Novelli Enrico","Ciuffettino","1902","— Un imperatore non deve mai aver paura – sentenziò ancora Beccolungo. — ...mai paura! – aggiunse Beccocorto.","NO"
"Novelli_Enrico-Ciuffettino-1902","Novelli Enrico","Ciuffettino","1902","— Eh, lo so, non deve: ma io, all’idea di doverne buscare, mi sento venir freddo... — Certo, sublime imperatore, tu dovrai dimostrare una grande sagacia ed un grande coraggio contro un nemico così numeroso e così forte: ma io credo che con l’aiuto dei tuoi sudditi, finirai col vincere... come vinse il grande Ciuffettino XXIV. — Anche lui ebbe da fare con quei noiosi di macacchi? — Ciuffettino XXIV riuscì a vincere..!","NO"
"Novelli_Enrico-Ciuffettino-1902","Novelli Enrico","Ciuffettino","1902","Uccise in singolar tenzone il re dei macacchi e lo spellò sotto gli sguardi dei pappagalli festanti... La pelle del nemico si trova nel Museo storico... Perchè non dovresti tu fare altrettanto? — Ma io non le so spellare, le scimmie... — Vergogna!","NO"
"Novelli_Enrico-Ciuffettino-1902","Novelli Enrico","Ciuffettino","1902","Quella pelle è un trofeo di gloria!... — Davvero? se non è intignata, me ne farò una pelliccia per questo inverno...","NO"
"Novelli_Enrico-Ciuffettino-1902","Novelli Enrico","Ciuffettino","1902","Ma io ti domando ancora: e se perdo? — Se perdi, i Giudici superiori ti condanneranno ad aver le orecchie strappate... — Eh!... — E ti lasceranno due mesi senza mangiare.","NO"
"Novelli_Enrico-Ciuffettino-1902","Novelli Enrico","Ciuffettino","1902","— Allora bisogna vincere per forza! — Decidi tu, eccelso imperatore! – concluse Beccolungo.","NO"
"Novelli_Enrico-Ciuffettino-1902","Novelli Enrico","Ciuffettino","1902","— ...tu! – aggiunse Beccocorto, che aveva una gran voglia di ridere, ma faceva finta di nulla. — Ho bell’e deciso: andiamo contro i macacchi!","NO"
"Novelli_Enrico-Ciuffettino-1902","Novelli Enrico","Ciuffettino","1902","Alti dignitari, seguitemi! E Ciuffettino scivolò lungo il tronco dell’albero, e si avviò per la foresta, seguito dal valoroso principe Beccolungo e dall’integerrimo duca Beccocorto. In cui Ciuffettino XXXV vince i terribili macacchi con uno stratagemma meraviglioso.","NO"
"Novelli_Enrico-Ciuffettino-1902","Novelli Enrico","Ciuffettino","1902","Tutti i pappagalli componenti l’esercito erano appollaiati su i primi alberi del bosco, proprio contro la spiaggia del mare, alla quale approdavano le zattere degli infami macacchi, abitatori delle isolette vicine. L’imperatore, che sebbene piccino, aveva molta più intelligenza di tutti i macacchi messi insieme, capì che l’esercito invasore si sarebbe potuto facilmente respingere con una semplicissima burla. E infatti, dopo lanciata un’occhiata sprezzante su gli avversarî, disse a Beccolungo e a Beccocorto: — Guidatemi al Museo storico!...","NO"
"Novelli_Enrico-Ciuffettino-1902","Novelli Enrico","Ciuffettino","1902","ho bisogno della pelle del re dei macacchi. — La pelle..! – esclamò Beccolungo, stupefatto.","NO"
"Novelli_Enrico-Ciuffettino-1902","Novelli Enrico","Ciuffettino","1902","— La pelle! – ripetè Beccocorto, sbattendo le ali per la meraviglia. — Sì... obbeditemi!","NO"
"Novelli_Enrico-Ciuffettino-1902","Novelli Enrico","Ciuffettino","1902","sono o non sono il vostro imperatore? I due dignitari, almeno una volta tanto, obbedirono, e trasportarono Ciuffettino, con il sistema già adottato poco tempo prima, su di una palma gigantesca che si inalzava nel folto della foresta. In cima alla palma i pappagalli dell’isola avevano depositati i ricordi e i documenti più preziosi della loro storia.","YES"
"Novelli_Enrico-Ciuffettino-1902","Novelli Enrico","Ciuffettino","1902","Ciuffettino, senza badare a Beccolungo e a Beccocorto, i quali gridavano al sacrilegio, all’empietà, arruffando le penne e mettendosi la testa sotto le ali, Ciuffettino, dico, si infilò dentro la pelle del macacco e abbandonò precipitosamente il Museo storico. I dignitari lo seguirono borbottando, altamente scandalizzati. Ma egli li calmò subito.","NO"
"Novelli_Enrico-Ciuffettino-1902","Novelli Enrico","Ciuffettino","1902","— Se seguitate a brontolare così, miei cari aiutanti, vi metto allo spiedo per questa sera. Giusto, ve l’ho detto, ci ho un appetito... E voi siete belli e grassocci.","NO"
"Novelli_Enrico-Ciuffettino-1902","Novelli Enrico","Ciuffettino","1902","Delle vostre lingue, poi, me ne faccio fare un cibreino dal cuoco di Corte... Traversarono di nuovo il bosco. Quando fu sul limitare, Ciuffettino impartì alcuni ordini misteriosi: e Beccolungo e Beccocorto, divenuti improvvisamente ossequenti e premurosi, fecero due o tre rivoltoloni per terra, e promisero, anche questa volta, di obbedire.","YES"
"Novelli_Enrico-Ciuffettino-1902","Novelli Enrico","Ciuffettino","1902","Ciuffettino si avviò, solo solo, verso l’esercito nemico. Mano a mano che si avanzava, le scimmie emettevano dei grugniti di sorpresa e di gioia. Un loro compagno...!","YES"
"Novelli_Enrico-Ciuffettino-1902","Novelli Enrico","Ciuffettino","1902","nell’isola! La cosa parve di buon augurio a tutti. Il capo dei macacchi si avanzò verso l’imperatore dei pappagalli, facendo ad ogni passo una riverenza, e strofinando il muso contro la sabbia: poi quando si trovò a brevissima distanza da Ciuffettino, in atto di suprema allegrezza, si lanciò in aria, ed eseguì una serie di doppi salti mortali, con una agilità ed una eleganza che il più bravo ginnasta del globo gli avrebbe invidiate inutilmente.","NO"
"Novelli_Enrico-Ciuffettino-1902","Novelli Enrico","Ciuffettino","1902","Ciuffettino allargò le braccia, in atto amichevole: e la scimmia si precipitò per rispondere all’invito, abbracciando strettamente il ragazzo. Fu una scena proprio commovente. Tutti i macacchi si soffiavano il naso con le dita e si asciugavano le lacrime con il fazzoletto.","NO"
"Novelli_Enrico-Ciuffettino-1902","Novelli Enrico","Ciuffettino","1902","— Chi sei... fratello? – cominciò il capitano dei macacchi, con voce tremula, soffiando nel pelo del finto collega, sperando di trovarvi qualche cosina – che vuoi? — Non mi vedi?","NO"
"Novelli_Enrico-Ciuffettino-1902","Novelli Enrico","Ciuffettino","1902","Sono un macacco come te, e forse più di te. Che cosa voglio? Eh, mio caro, non voglio nulla.","NO"
"Novelli_Enrico-Ciuffettino-1902","Novelli Enrico","Ciuffettino","1902","Sono riuscito a far prigioniero l’imperatore dei pappagalli, ed ora sono padrone dell’isola... — Tu! – esclamò il vero macacco, grattandosi furiosamente. – Ma io non ti conosco, di dove vieni?","NO"
"Novelli_Enrico-Ciuffettino-1902","Novelli Enrico","Ciuffettino","1902","— Di laggiù – e Ciuffettino indicò un punto qualunque, nel mare. — Deve essere un gran bel paese! – mormorò, convinto, il macacco.","NO"
"Novelli_Enrico-Ciuffettino-1902","Novelli Enrico","Ciuffettino","1902","– E come hai trovato il coraggio di venir qui, solo solo?... E come hai conquistato l’isola senza l’aiuto di nessuno?... — Eh!","NO"
"Novelli_Enrico-Ciuffettino-1902","Novelli Enrico","Ciuffettino","1902","ti racconterò poi... Insomma: io desidero di dividere con te l’isola dei pappagalli. — Tu...","NO"
"Novelli_Enrico-Ciuffettino-1902","Novelli Enrico","Ciuffettino","1902","desideri!... Oh! generoso fratello!","NO"
"Novelli_Enrico-Ciuffettino-1902","Novelli Enrico","Ciuffettino","1902","È vero, però, che se anche tu non mi avessi fatta questa bella offerta, l’isola me la sarei presa da me... — Ma allora saresti stato costretto a combattere, perchè i pappagalli da me vinti e sottomessi sono divenuti miei schiavi e mi obbediscono in tutto e per tutto... Invece... se sei buono... ti invito a banchetto nella foresta, e poi ti lascio libero di saccheggiare metà dell’impero... — Infatti oggi ci ho poca voglia di combattere, perchè mi duole un piede...","NO"
"Novelli_Enrico-Ciuffettino-1902","Novelli Enrico","Ciuffettino","1902","Basta, caro fratello, facciamo così. Verrò a pranzo con te... – e rivolgendosi ai prodi soldati – avanti, figliuoli, si va a mangiare dal fratello macacco, che ci offre anche metà dell’isola senza colpo ferire!... Le urla e le acclamazioni salirono al cielo.","NO"
"Novelli_Enrico-Ciuffettino-1902","Novelli Enrico","Ciuffettino","1902","E l’esercito si pose in moto verso la foresta. Lo guidava Ciuffettino, il quale faceva il macacco con una abilità davvero straordinaria: sembrava che l’avesse fatto sempre. Camminarono fino ad una grande radura, nella quale i pappagalli, dietro gli ordini del loro imperatore, avevano preparato un meraviglioso banchetto.","NO"
"Novelli_Enrico-Ciuffettino-1902","Novelli Enrico","Ciuffettino","1902","In terra, erano sparse a profusione, in un disordine pittoresco, delle ghiottonerie di ogni genere. C’erano montagnole di mandorle dolci, cumuli di noci e di nocciòle tostate, piramidi di susine, colonne di dàtteri, mucchi di banane bell’e sbucciate, torri di ananassi, colline di fichi verdini: e poi un esercito di bottiglie di ogni grandezza, avanzo di un bottino memorabile fatto dai pappagalli a bordo di una nave naufragata su la spiaggia dell’isola. Cominciò il pranzo: e non vi so dire se i macacchi assaltassero con entusiasmo le delicate vivande.","NO"
"Novelli_Enrico-Ciuffettino-1902","Novelli Enrico","Ciuffettino","1902","Basti ricordare che, di lì a un’oretta, era spolverata ogni cosa. Durante il banchetto, fra il capitano dei macacchi e Ciuffettino ci fu un commovente scambio di cortesie. Il macacco vero prendeva le mandorle, le biascicava ben bene e poi voleva ficcarle per forza in bocca al macacco falso: segno di estrema riverenza e di grandissimo affetto.","NO"
"Novelli_Enrico-Ciuffettino-1902","Novelli Enrico","Ciuffettino","1902","Ma a quelle belle dimostrazioni il nostro eroe non ci era abituato, e dopo aver lottato fieramente per non subirle, finì con l’alzarsi, adducendo il pretesto di andar a prendere delle bottiglie di vino speciale, per far onore agli ospiti. Ciuffettino offrì una di quelle bottiglie al capo dei macacchi, il quale se la incollò alle labbra, piangendo di gioia. In un attimo anche alle altre scimmie venne dispensato il soave licore... e tutti bevvero avidamente.","NO"
"Novelli_Enrico-Ciuffettino-1902","Novelli Enrico","Ciuffettino","1902","Ma di lì a un quarto d’ora, i macacchi, come si fossero passati una parola d’ordine, reclinarono il capo sul petto, abbandonarono le bottiglie, e rotolarono su l’erba, come morti. I miei lettori avranno capito benissimo ciò che era avvenuto: i pappagalli, sempre dietro ordine di Ciuffettino, avevano messo dei grani d’oppio nel vino... e le scimmie, bevendo quel vino, si erano addormentate. Quando Ciuffettino si fu assicurato che tutti i macacchi avevan chiuso gli occhi, chiamò con grandi voci i suoi sudditi che se ne stavano nascosti fra gli alberi, aspettando l’esito dell’avventura.","NO"
"Novelli_Enrico-Ciuffettino-1902","Novelli Enrico","Ciuffettino","1902","E ordinò che il campo venisse subito sgombrato dai corpi dei vinti nemici. I vincitori non posero tempo in mezzo: legarono i macacchi come tanti salami, e poi, riunendosi in gruppi di sette od otto, li trasportarono, volando, ad uno ad uno, su la spiaggia. Li rimisero su le zattere, ruppero gli ormeggi a colpi di becco, e abbandonarono quei vili predoni al loro destino.","NO"
"Novelli_Enrico-Ciuffettino-1902","Novelli Enrico","Ciuffettino","1902","E, compiuta questa immane fatica, per tutta l’isola un solo grido, assordante, uscito dalla gola di diecimila pappagalli, echeggiò: — Viva Ciuffettino XXXV! In cui Ciuffettino XXXV si stanca di far l’imperatore, e ritorna un Ciuffettino qualunque, scappando dall’isola dei pappagalli su di una zucca vuota. Ciuffettino, poveraccio, dopo aver compiuta la grande impresa, si sentiva cascare dalla stanchezza e dal sonno, e perciò, dopo essersi arrampicato fin su la reggia, disse in un tono piuttosto secco ai suoi due aiutanti di campo: — Scusate, ragazzi, ma io voglio dormire.","NO"
"Novelli_Enrico-Ciuffettino-1902","Novelli Enrico","Ciuffettino","1902","Vi saluto, e arrivederci a domani. Beccolungo e Beccocorto ricominciarono ad arruffare le penne e a frignare. — Immenso imperatore, noi crediamo che tu scherzi... — Non ischerzo niente affatto: anzi, guardate!","NO"
"Novelli_Enrico-Ciuffettino-1902","Novelli Enrico","Ciuffettino","1902","E si sdraiò sul letto di piume, chiudendo gli occhi beatamente. I pappagalli vennero subito a beccarlo nel naso. — Ma che rob’è?","NO"
"Novelli_Enrico-Ciuffettino-1902","Novelli Enrico","Ciuffettino","1902","– disse, stizzito, Ciuffettino XXXV. – quando io do un ordine... — Il popolo desidera ardentemente di farti onore!... — Dite al popolo che lo ringrazio, ma ora ho sonno.","NO"
"Novelli_Enrico-Ciuffettino-1902","Novelli Enrico","Ciuffettino","1902","— Impossibile maestà: sarebbe un’offesa! Nella foresta, che era tornata tranquilla per un momento, si rinnovarono le grida rauche, discordi, assordanti. I parrocchetti, i pappagalli verdi, i giaccò, le cocorite, le are, i kakatoa, intonarono l’inno nazionale dei pappagalli.","NO"
"Novelli_Enrico-Ciuffettino-1902","Novelli Enrico","Ciuffettino","1902","Figuratevi che roba! Ciuffettino si alzò dal nido, tappandosi le orecchie, e brontolando: — Anche questa mi doveva succedere!... Speriamo che duri poco... Beccolungo, che aveva udito, rispose subito con un certo sarcasmo: — Poco?","YES"
"Novelli_Enrico-Ciuffettino-1902","Novelli Enrico","Ciuffettino","1902","Ne avrai fino a domani all’alba, grande imperatore vittorioso! — Ma io non voglio! — Sì, tu non vuoi, ma il tuo popolo lo vuole!","NO"
"Novelli_Enrico-Ciuffettino-1902","Novelli Enrico","Ciuffettino","1902","E così, per quella notte, Ciuffettino non potè chiudere occhio. La mattina dopo gli si consentì di dormire un paio d’ore: ma non appena il sole fu alto all’orizzonte, Beccolungo e Beccocorto vennero a svegliare il ragazzo, e questo, ancora con gli occhi tra i peli, dovette fare un gran discorso ai sudditi festanti. Ciuffettino torna al paese.","NO"
"Novelli_Enrico-Ciuffettino-1902","Novelli Enrico","Ciuffettino","1902","— Posso mangiare? – chiese, dopo il discorso, Ciuffettino XXXV. — Certo!","NO"
"Novelli_Enrico-Ciuffettino-1902","Novelli Enrico","Ciuffettino","1902","– rispose Beccolungo – tutto quello che vuoi.... — ...che vuoi! – ripetè Beccocorto. — Grazie, per ora mi contento di un panierino di fichi... — Impossibile!","NO"
"Novelli_Enrico-Ciuffettino-1902","Novelli Enrico","Ciuffettino","1902","— Perchè? — Perchè, i fichi ti farebbero male, e la tua salute ci è preziosa... — Come siete gentili! Allora, datemi un po’ di mandorle... — Chè!...","NO"
"Novelli_Enrico-Ciuffettino-1902","Novelli Enrico","Ciuffettino","1902","sono troppo calorose, divino imperatore. — ...troppo calorose! — Allora, pazienza: prenderò due noci... — C’è il caso che sappiano di rancido!","NO"
"Novelli_Enrico-Ciuffettino-1902","Novelli Enrico","Ciuffettino","1902","Non ci mancherebbe altro! — Se ci fossero delle susine... — Fanno dolere il corpo. — O allora, che cosa mangio?","NO"
"Novelli_Enrico-Ciuffettino-1902","Novelli Enrico","Ciuffettino","1902","— Dell’orzo bollito, soave imperatore. — Ma a me l’orzo non mi piace!... — E allora, siamo dolenti, ma digiunerai.","NO"
"Novelli_Enrico-Ciuffettino-1902","Novelli Enrico","Ciuffettino","1902","La tua salute ci è cara! — Così mi farete crepar di fame! Ciuffettino resistè fino a sera; poi dovette cedere, ed ingozzarsi l’orzo bollito.","YES"
"Novelli_Enrico-Ciuffettino-1902","Novelli Enrico","Ciuffettino","1902","Durante la notte il vecchio kakatoa lo chiamò a presiedere una seduta segreta del Consiglio Imperiale dei pappagalli. La mattina dopo fu obbligato a passare in rivista l’esercito, e poi ad esaminare il bilancio dello Stato. Dopo colazione – il solito orzo bollito – Ciuffettino ebbe un’idea.","NO"
"Novelli_Enrico-Ciuffettino-1902","Novelli Enrico","Ciuffettino","1902","— Oggi sono libero, finalmente, e voglio prendermi un po’ di svago. Andrò su la spiaggia a raccoglier granchi... Beccolungo gli tolse subito questa speranza. — C’è troppo vento oggi, per andar sulla spiaggia.","NO"
"Novelli_Enrico-Ciuffettino-1902","Novelli Enrico","Ciuffettino","1902","— ...troppo vento! – ripetè Beccocorto. — La tua salute... – cominciò Beccolungo.","NO"
