"filename","nome","titolo","anno","chunk","DIL"
"Novelli_Enrico-Ciuffettino-1902","Novelli Enrico","Ciuffettino","1902","— Prendi un paio di bottiglie... che si fa un po’ di baldoria... — O dove sono? — Vicino ai cesti dell’uva... — Ah!.. — Prendi una bottiglia di quelle con la marca gialla, e una di quelle con la marca rossa... — Non ci vedo, aspettate...","NO"
"Novelli_Enrico-Ciuffettino-1902","Novelli Enrico","Ciuffettino","1902","Ciuffettino andò presso alla finestròla della soffitta, dai vetri della quale filtrava la melanconica luce dell’alba, e guardò le due bottiglie che aveva preso a casaccio, dal mucchio; portavano appunto la marca rossa e la marca gialla: allora le staccò tutte e due e le scambiò, riattaccandole con del pane masticato. — Dunque? – berciava la vecchia, cominciando ad infuriarsi.","NO"
"Novelli_Enrico-Ciuffettino-1902","Novelli Enrico","Ciuffettino","1902","— Eccomi.... eccomi.... scusate... ho inciampato... — O bravo! – disse il lupo, stappando le bottiglie: – adesso staremo allegri! — Credi, Ciuffettino, che noi ti vogliamo un gran bene!","NO"
"Novelli_Enrico-Ciuffettino-1902","Novelli Enrico","Ciuffettino","1902","– sospirò la moglie del lupo, facendo gli occhi di triglia fradicia. — E io!... – disse Ciuffettino porgendo il proprio bicchiere al lupo mannaro, che glie lo riempi del vino della bottiglia gialla.","NO"
"Novelli_Enrico-Ciuffettino-1902","Novelli Enrico","Ciuffettino","1902","– Io vi voglio un bene dell’anima, a tutti e due! Alla vostra salute! — Alla tua!","NO"
"Novelli_Enrico-Ciuffettino-1902","Novelli Enrico","Ciuffettino","1902","– risposero i due birbaccioni, alzando i bicchieri... colmi dell’altro vino. — Che possiate campar mill’anni! — E anche te, Ciuffettino!","NO"
"Novelli_Enrico-Ciuffettino-1902","Novelli Enrico","Ciuffettino","1902","La vecchia riempì ancora il proprio bicchiere, e quello del marito: poi disse con voce spenta, e con un sorriso bonario, al nostro eroe: — E tu non bevi? Non far complimenti, sai, gioia di mamma! — Vi pare!...","NO"
"Novelli_Enrico-Ciuffettino-1902","Novelli Enrico","Ciuffettino","1902","– e giù... Ciuffettino tracannò un altro bicchiere. — E adesso va’ a dormire!","NO"
"Novelli_Enrico-Ciuffettino-1902","Novelli Enrico","Ciuffettino","1902","– comandò il lupo mannaro al ragazzo – Nel nostro letto ti troverai benone... — Giusto! va’ a letto... amoruccio mio! Ciuffettino non se lo fece dire due volte.","NO"
"Novelli_Enrico-Ciuffettino-1902","Novelli Enrico","Ciuffettino","1902","Andò nella camera vicina, che era la camera da letto dei due sposi, e si ficcò vestito sotto le coltri, aspettando ansioso. Il lupo mannaro e la megera, in cucina, sbadigliavano screanzatamente, e mugolavano. Di lì a un quarto d’ora, dormivano tutti e due come due marmotte, e russavano in modo così sfacciato, che, intorno alla capanna, per la paura, non c’era più un cardellino o un’allodola a pagarli un milione.","NO"
"Novelli_Enrico-Ciuffettino-1902","Novelli Enrico","Ciuffettino","1902","In cui Ciuffettino si trova senza volerlo in una città di sapienti. Allora Ciuffettino, piano piano, in punta di piedi, trattenendo il respiro, scese dal letto, traversò la cucina, fece due boccacce al lupo mannaro e alla degna consorte, tirò un calcio al gatto, andò all’uscio, lo aprì... e si precipitò fuori, nella foresta. Tra gli alberi altissimi penetravano i primi raggi del sole fulgido.","NO"
"Novelli_Enrico-Ciuffettino-1902","Novelli Enrico","Ciuffettino","1902","Il ragazzo, aspirando con gioia la fresca aria del mattino, e sentendosi tutto allegro per aver scampato il tremendo pericolo, si diede a correre a gambe levate per i sentieri del bosco. Di tanto in tanto, anzi, faceva anche delle capriòle e dei salti mortali. Alle volte, gli pareva di sentire un rumore di passi affrettati, e un fruscìo di fronde smosse: ma erano paure inutili; che il lupo stava dormendo la grossa nella sua capanna, e per un paio di giorni almeno non l’avrebbero destato nemmeno le cannonate.","YES"
"Novelli_Enrico-Ciuffettino-1902","Novelli Enrico","Ciuffettino","1902","Al pensiero della bella sorpresa che attendeva il lupo e la moglie al loro risvegliarsi, Ciuffettino non poteva trattenere delle risatine di contentezza. Corri corri, Ciuffettino uscì dalla foresta e si trovò in un vastissimo piano, sparso di campi coltivati, meravigliosi di verde nel trionfo della luce del sole divino. Il ragazzo si inginocchiò su l’erba e congiungendo le manine, alzò gli occhi e il ciuffo al cielo, e mormorò: — Grazie, buon Dio, di avermi salvato!...","NO"
"Novelli_Enrico-Ciuffettino-1902","Novelli Enrico","Ciuffettino","1902","forse sarà stata la mia mamma a pregare per me... perchè io non merito tanta bontà! Ma adesso torno da lei, e le chiedo perdono di tutto... e anche al mio babbo, chiederò perdono... e tornerò a lavorare... Si rialzò, e volgendo in giro gli sguardi credette di riconoscere una stradicciòla bianca, fiancheggiata di siepi e di alberelli. — Sicuro!","YES"
"Novelli_Enrico-Ciuffettino-1902","Novelli Enrico","Ciuffettino","1902","quella è la strada che dal mare va a Cocciapelata... Oh! bella!","YES"
"Novelli_Enrico-Ciuffettino-1902","Novelli Enrico","Ciuffettino","1902","e come mai l’ho ritrovata così presto, dopo aver fatto tante miglia da una parte sola? E si mise in cammino. Però, credendosi vicinissimo a casa, il ragazzo sentì sfumare a poco a poco tutti i suoi buoni propositi come nebbia al sole.","YES"
"Novelli_Enrico-Ciuffettino-1902","Novelli Enrico","Ciuffettino","1902","— Ora, ho bell’è capito... mi toccherà a ritornare dal sor Teodoro... a tirare il mantice... se pure non voglio andare a fare il garzone di bottega dal farmacista... o se non torno a scuola... Bel divertimento!... A ripensarci bene, c’è poco da stare allegri. Beato chi può girare il mondo, libero di sè, senza pensieri e senza bisogno di lavorare... Almeno si vedono dei paesi nuovi, e ci si diverte... Auf!","YES"
"Novelli_Enrico-Ciuffettino-1902","Novelli Enrico","Ciuffettino","1902","Gran brutto destino, quello di noi altri ragazzi... Cammina, cammina; il nostro eroe ad ogni svolto della via, diceva, con un palpito di cuore: – ci sono – e invece non arrivava mai. Cocciapelata non compariva. Ciuffettino provò un certo sgomento.","YES"
"Novelli_Enrico-Ciuffettino-1902","Novelli Enrico","Ciuffettino","1902","Com’era lunga quella via, e quanto silenzio da per tutto! Alla fine, eccoti apparire, in fondo in fondo alla strada, delle mura merlate, delle case, una selva di comignoli che gettavano delle colonne di fumo nero al cielo, e delle cupole. — Non è Cocciapelata di certo – pensò Ciuffettino – ma è una città, e siccome è una città, laggiù ci saranno degli uomini, e siccome ci saranno degli uomini, qualcuno mi darà da mangiare e da bere!","YES"
"Novelli_Enrico-Ciuffettino-1902","Novelli Enrico","Ciuffettino","1902","In pochi minuti giunse alla porta della città sconosciuta. Sarebbe entrato se, d’improvviso, un omaccione alto quanto un campanile non fosse sbucato fuori da uno sgabuzzino presso la porta, e non l’avesse preso per le gambe, come un fantoccio, facendo un brutto cipiglio, e susurrando con voce straordinariamente fioca: — Chi sei?","NO"
"Novelli_Enrico-Ciuffettino-1902","Novelli Enrico","Ciuffettino","1902","Dove vai? Ciuffettino rispose subito a voce alta: — Sono Ciuffettino. — Parla piano, Ciuffettino...!","NO"
"Novelli_Enrico-Ciuffettino-1902","Novelli Enrico","Ciuffettino","1902","Ciuffettino...? non conosco questa roba! — Non sono una roba, io: sono un ragazzo.","NO"
"Novelli_Enrico-Ciuffettino-1902","Novelli Enrico","Ciuffettino","1902","— Va bene, ma non ti conosco! — E neanch’io conosco voi! — Parla piano, ti dico!","NO"
"Novelli_Enrico-Ciuffettino-1902","Novelli Enrico","Ciuffettino","1902","E dove vai? — A casa. Ma che dorme qualcuno, qui vicino?","NO"
"Novelli_Enrico-Ciuffettino-1902","Novelli Enrico","Ciuffettino","1902","— Ho capito! – disse ad un tratto l’individuo, rimettendo in terra il ragazzo – sei venuto qui per studiare... — Io???... — Eh!","NO"
"Novelli_Enrico-Ciuffettino-1902","Novelli Enrico","Ciuffettino","1902","che cosa vuoi che venga a fare un bambino alla Città dei Sapienti? Bravo: mi congratulo, bella cosa istruirsi! però bada di far poco rumore con le scarpe, camminando... — Ma voi chi siete?","YES"
"Novelli_Enrico-Ciuffettino-1902","Novelli Enrico","Ciuffettino","1902","che fate? — Io? sto a guardia della porta, perchè non entrino i seccatori in città.","NO"
"Novelli_Enrico-Ciuffettino-1902","Novelli Enrico","Ciuffettino","1902","Addio, ragazzo, che gli studi ti sieno leggeri! — Ho bell’e visto! questo non è un paese per me – disse Ciuffettino, addentrandosi nelle viuzze deserte e silenziose della città.","NO"
"Novelli_Enrico-Ciuffettino-1902","Novelli Enrico","Ciuffettino","1902","E intanto leggeva – alla meglio, perchè quel monello non era ancora arrivato a leggere correntemente, figuratevi! – i manifesti che tappezzavano le cantonate. Quei manifesti portavano delle scritte su questo genere: ABBASSO L’IGNORANZA!","YES"
"Novelli_Enrico-Ciuffettino-1902","Novelli Enrico","Ciuffettino","1902","LO STUDIO È LA SORGENTE DI OGNI BENESSERE UMANO. CHI NON AMA DI ISTRUIRSI NON È DEGNO DI VIVERE! VIVA LA GRAMMATICA!","NO"
"Novelli_Enrico-Ciuffettino-1902","Novelli Enrico","Ciuffettino","1902","SOLTANTO CON LO STUDIO L’UOMO PUÒ INNALZARSI A DIO Ciuffettino scrollava il capo, scandalizzato da quelle... eresie. E brontolava: — Non vedo l’ora di andarmene, da questa brutta città!..","YES"
"Novelli_Enrico-Ciuffettino-1902","Novelli Enrico","Ciuffettino","1902","Appena ho mangiato qualcosa, scappo; quest’aria mi fa male!.. Che che!.. Ci sarebbe da diventar tisici in una settimana!...","NO"
"Novelli_Enrico-Ciuffettino-1902","Novelli Enrico","Ciuffettino","1902","Lemme lemme, parlando con se stesso, Ciuffettino giunse ad un crocevia dove si trovavano molti fanciulli, pallidi e silenziosi, seduti su le gambe, accovacciati, sdraiati in terra, intenti a consultar volumi, pergamene, papiri. Alcuni guardavano degli oggetti col microscopio: altri, armati di enormi canocchiali esploravano il cielo azzurro: altri ancora sfogliavano lentamente dei monumentali libri in cartapecora dalle pagine ricoperte di grossi caratteri strani. Tutti poi sembravano immersi in profonde meditazioni.","NO"
"Novelli_Enrico-Ciuffettino-1902","Novelli Enrico","Ciuffettino","1902","Ciuffettino ristette, stupito. Ed il suo primo pensiero fu: — Perchè quei bambini non fanno il chiasso? E il secondo: — Studiano... certo!","NO"
"Novelli_Enrico-Ciuffettino-1902","Novelli Enrico","Ciuffettino","1902","Ossia: fanno quello che io non ho mai fatto. E me ne trovo bene. Vedi che faccie che hanno!","YES"
"Novelli_Enrico-Ciuffettino-1902","Novelli Enrico","Ciuffettino","1902","Si accostò ad un fanciullo e chiese: — Oh cosino!., o che leggi, le novelle delle Fate? Il bambino lo fissò con lo sguardo profondo e rispose lentamente: — Leggo la storia greca. E tu che fai?","NO"
"Novelli_Enrico-Ciuffettino-1902","Novelli Enrico","Ciuffettino","1902","Vuoi leggerla anche tu? — Io? io vorrei mangiare.","NO"
"Novelli_Enrico-Ciuffettino-1902","Novelli Enrico","Ciuffettino","1902","L’abitante della Città dei Sapienti si rituffò nei suoi studi. Allora Ciuftettino si rivolse ad un altro, che era tutto occupato al microscopio. — Mi faresti il piacere di indicarmi l’osteria più prossima?","NO"
"Novelli_Enrico-Ciuffettino-1902","Novelli Enrico","Ciuffettino","1902","Il fanciullo cavò pigramente gli occhi dall’apparecchio, e bisbigliò: — Qui non ci sono osterie. Se vuoi andare a scuola... — Ma io mi sento tirare lo stomaco... — Qui non si mangia che di sera: il giorno si lavora. Se vuoi andare a scuola... — A scuola, neanche se m’impiccano!","NO"
"Novelli_Enrico-Ciuffettino-1902","Novelli Enrico","Ciuffettino","1902","– strillò inviperito Ciuffettino, e continuò il viaggio. Ed eccolo nella gran piazza della città, dove gli uomini sapienti erano quel giorno riuniti per istudiare nientemeno che la quadratura del circolo. Eh!","NO"
"Novelli_Enrico-Ciuffettino-1902","Novelli Enrico","Ciuffettino","1902","non fate smorfie voi altri: dico proprio la quadratura del circolo. Ciuffettino, appena vide quel gruppo di scienziati, si pose a ridere sgangheratamente. Nel quale Ciuffettino restituisce... per forza l’«Elixir di lunga vita» che il professore Sotutto gli ha offerto generosamente.","NO"
"Novelli_Enrico-Ciuffettino-1902","Novelli Enrico","Ciuffettino","1902","A dir la verità, anche voi altri, bambini miei, vedendo quegli illustri scienziati, avreste riso un pochino. Figuratevi dei vecchi lunghi, magri, sparuti, con delle grandi barbe fluenti, bianche e giallastre, con dei brutti nasi pieni di bitorzoli, con degli occhiali spaventosi, e poi, vestiti di certe lunghe cappe nere ricamate in oro, con dei cappelli a cono altissimi e dei guantoni verdi... Sembravano tanti morti in permesso, vestiti in maschera. Sul suolo di cemento della piazza era stato disegnato con del carbone un ampio circolo.","NO"
"Novelli_Enrico-Ciuffettino-1902","Novelli Enrico","Ciuffettino","1902","E i sapienti andavano entro a quello tracciando altre linee e altri disegni capricciosi, adoperando compassi, seste gigantesche e penne stilografiche mostruose Tutti disegnavano, accumulavano cifre su cifre, trinciavano l’aria con i loro arnesi, facendo segni cabalistici, ma nessuno parlava. Quell’alto silenzio venne turbato a un tratto da Ciuffettino. I dotti, sentendo le risate del ragazzo, lasciarono per qualche istante le ricerche tormentose del grande problema.","NO"
"Novelli_Enrico-Ciuffettino-1902","Novelli Enrico","Ciuffettino","1902","Erano tutti indignati. Chi poteva permettersi..? Uno dei vecchioni, scoprendo il nostro eroe, gli corse incontro, emettendo delle piccole grida gutturali, lo acciuffò per la collottola, e alzandolo all’altezza del naso, domandò, stizzosamente: — Di dove vieni?","YES"
"Novelli_Enrico-Ciuffettino-1902","Novelli Enrico","Ciuffettino","1902","Da quale scuola scappi? Perchè ridi? Ciuffettino, benchè la situazione fosse tutt’altro che allegra, continuò a sghignazzare.","NO"
"Novelli_Enrico-Ciuffettino-1902","Novelli Enrico","Ciuffettino","1902","Non poteva tenersi, proprio! — Ah! tu seguiti a ridere!","NO"
"Novelli_Enrico-Ciuffettino-1902","Novelli Enrico","Ciuffettino","1902","– aggiunse lo scienziato, tentennando il capo in atto di minaccia – devi essere un ignorantello della campagna!... Adesso la voglia di ridere te la caverò io... — O guarda! – disse Ciuffettino – che colpa ci ho io se avete quel naso che pare un peperone?","NO"
"Novelli_Enrico-Ciuffettino-1902","Novelli Enrico","Ciuffettino","1902","— Al cospetto di un uomo che da duecento anni si affatica intorno ai sublimi quesiti della natura, e che ha dato al mondo i frutti portentosi del suo genio, tu osi sghignazzare?... — Duecento anni? – esclamò Ciuffettino, meravigliato – voi avete duecento anni?..","NO"
"Novelli_Enrico-Ciuffettino-1902","Novelli Enrico","Ciuffettino","1902","li portate bene... Ve ne davo un centinaio solamente... Il dotto trascinò nel circolo dei colleghi il ragazzo, e lo presentò all’assemblea con queste parole: — È un povero idiota... una specie di minuscola scimmia... bisognerà istruirlo!... Tutti guardarono curiosamente Ciuffettino, come se fosse stato un animaletto di nuovo genere.","NO"
"Novelli_Enrico-Ciuffettino-1902","Novelli Enrico","Ciuffettino","1902","— Comincieremo a mandarlo alle scuole inferiori – proseguì il solito scienziato. — Senta, signor... signor? – chiese Ciuffettino.","NO"
"Novelli_Enrico-Ciuffettino-1902","Novelli Enrico","Ciuffettino","1902","— Mi chiamo Sotutto. — Senta, signor Sotutto: io andrei volentieri a scuola, ma a pancia piena... — Che sciocchezza! Io, per esempio, non ho mangiato da sei mesi, piccolo ignorante!","NO"
"Novelli_Enrico-Ciuffettino-1902","Novelli Enrico","Ciuffettino","1902","— E io da dieci mesi e mezzo! – ribadì un altro con uno sbadiglio. — Beati loro!","NO"
"Novelli_Enrico-Ciuffettino-1902","Novelli Enrico","Ciuffettino","1902","– disse Ciuffettino – io, invece, non mangio da stamattina, e mi sento languido, languido... — A te deve bastare, per adesso, che io ti spezzi il pane della scienza... – riprese a dire il professore Sotutto. E Ciuffettino, da quell’asino che era: — Il pane della scienza... è bianco o nero? perchè, dico la verità, preferisco il bianco...","NO"
"Novelli_Enrico-Ciuffettino-1902","Novelli Enrico","Ciuffettino","1902","Il professore levò le mani al cielo. — Che abisso di ignoranza! Vediamo: comincieremo con le scienze esatte.","NO"
"Novelli_Enrico-Ciuffettino-1902","Novelli Enrico","Ciuffettino","1902","T’insegnerò l’aritmetica. Conosci la tavola pitagorica? E Ciuffettino: — Conosco soltanto la tavola... dove si mangia.","NO"
"Novelli_Enrico-Ciuffettino-1902","Novelli Enrico","Ciuffettino","1902","Il sapiente emise un gemito. — Oh! supremo idiotismo!","NO"
"Novelli_Enrico-Ciuffettino-1902","Novelli Enrico","Ciuffettino","1902","E dimmi, animaletto, sapresti tu estrarre da un numero qualunque la radice quadrata? — Io le radici non le so estrarre, ma le so mangiare con il lesso... — Lo udite? lo udite?","NO"
"Novelli_Enrico-Ciuffettino-1902","Novelli Enrico","Ciuffettino","1902","– sbraitò il povero professor Sotutto, furibondo, ai colleghi mezzo svenuti per l’orrore. – Che ne dobbiamo fare di questo scellerato?... — Pietà – supplicava Ciuffettino, impaurito – fatemi tornare dalla mamma!..","NO"
"Novelli_Enrico-Ciuffettino-1902","Novelli Enrico","Ciuffettino","1902","Insegnatemi la strada di casa!... E se avete un briciolo di cuore, datemi almeno una fetta di panettone... — Panettone? – ripetè il professore.","NO"
"Novelli_Enrico-Ciuffettino-1902","Novelli Enrico","Ciuffettino","1902","– Che c’entra? Non comprendo. È forse il nome di tuo padre?","NO"
"Novelli_Enrico-Ciuffettino-1902","Novelli Enrico","Ciuffettino","1902","— Ho fame! — Con questi bisogni volgari non ti riuscirà mai di elevarti alle vette eccelse della scienza. Non troverai, certo, la quadratura del circolo!","NO"
"Novelli_Enrico-Ciuffettino-1902","Novelli Enrico","Ciuffettino","1902","— Pazienza: a me basterebbe di trovare... due ova al tegame! Lo scienziato riflettè a lungo. — Ma se ti do da mangiare, studierai, dopo?","NO"
"Novelli_Enrico-Ciuffettino-1902","Novelli Enrico","Ciuffettino","1902","– chiese con voce raddolcita. E Ciuffettino: — Figuratevi!... Datemi da mangiare e vedrete.","NO"
"Novelli_Enrico-Ciuffettino-1902","Novelli Enrico","Ciuffettino","1902","L’ho sempre detto, io, che di uomini come voi ce ne sono pochi!... E vi voglio un bene dell’anima! Siete la mia seconda madre!","NO"
"Novelli_Enrico-Ciuffettino-1902","Novelli Enrico","Ciuffettino","1902","— Silenzio: seguimi! Si incamminarono verso la casa del professor Sotutto: ma il vecchio procedeva così lentamente che ci vollero quattro ore e trentacinque minuti per arrivarvi. E in tutto non erano che duecento metri di strada!","NO"
"Novelli_Enrico-Ciuffettino-1902","Novelli Enrico","Ciuffettino","1902","Ciuffettino si sentiva svenire. Per andare dal portone alle scale ci vollero trenta minuti buoni. — Auf!","NO"
"Novelli_Enrico-Ciuffettino-1902","Novelli Enrico","Ciuffettino","1902","non ne posso più!... – disse il ragazzo, con le lacrime agli occhi. — Calma, figliolo: sono vecchio e non mi riesce più di correre.","NO"
"Novelli_Enrico-Ciuffettino-1902","Novelli Enrico","Ciuffettino","1902","E poi... c’è tempo a tutto. Giunsero al primo pianerottolo che era già notte fatta. — O quanti piani ci sono ancora?","YES"
"Novelli_Enrico-Ciuffettino-1902","Novelli Enrico","Ciuffettino","1902","– bisbigliò Ciuffettino. — Pochi, ragazzo mio: dodici soltanto. — Allora muoio per istrada!...","NO"
"Novelli_Enrico-Ciuffettino-1902","Novelli Enrico","Ciuffettino","1902","— Calma, ragazzo... calma... — Ma io ho fame!... Ciuffettino per la bizza si diede dei pugni sul capo. A mezzanotte erano al sesto piano.","NO"
"Novelli_Enrico-Ciuffettino-1902","Novelli Enrico","Ciuffettino","1902","— Sentite veh, fra poco mi butto a sedere, e non mi muovo più – minacciò il ragazzo, esausto. — Fa’ pure il tuo comodo, ragazzo mio: d’altronde io son vecchio, ho duecento anni, e non posso mica volare... Quando aveva la tua età, ero capace di far tutte le scale in cinque ore solamente... All’alba arrivarono al dodicesimo piano.","NO"
"Novelli_Enrico-Ciuffettino-1902","Novelli Enrico","Ciuffettino","1902","Il dotto ficcò la chiave nella toppa, aprì l’uscio ed entrò, seguito dal nostro eroe che boccheggiava. Nell’anticamera il vecchio, sedendosi su di una poltrona, mormorò: — Siedi. Ciuffettino obbedì, chiedendo: — Perchè debbo sedere?","NO"
"Novelli_Enrico-Ciuffettino-1902","Novelli Enrico","Ciuffettino","1902","— Non bisogna far mai nulla senza riflettere. Che cosa siamo venuti a fare, qui? — A mangiare, toh!","NO"
"Novelli_Enrico-Ciuffettino-1902","Novelli Enrico","Ciuffettino","1902","— Allora riflettiamo se dobbiamo mangiare per davvero. Il sapiente non imprende alcuna cosa senza prima pensarci due volte. — Auf!","NO"
"Novelli_Enrico-Ciuffettino-1902","Novelli Enrico","Ciuffettino","1902","— Calma, figliolo: pensa che non sono più un ragazzo, io... — Sfido! avete duecent’anni sul groppone, e ve li siete spesi proprio benino! Quattro ore dopo passarono nella sala da pranzo.","NO"
"Novelli_Enrico-Ciuffettino-1902","Novelli Enrico","Ciuffettino","1902","— Finalmente! – disse Ciuffettino, sedendosi a tavola, mentre il vecchio apriva un picciolo armadio incastrato nella parete, e ne estraeva due grossi bicchieri e un paio di bottiglie di forma bizzarra. Il professor Sotutto versò nei bicchieri il liquido delle bottiglie, mescolandolo: poi ordinò a Ciuffettino: — Mangia!","NO"
"Novelli_Enrico-Ciuffettino-1902","Novelli Enrico","Ciuffettino","1902","— Che cosa? questa è roba da bere...! — Questo è il mio cibo: siccome ho perduto tutti i denti, mi nutro con l’Elixir di lunga vita.","NO"
"Novelli_Enrico-Ciuffettino-1902","Novelli Enrico","Ciuffettino","1902","— Che brutto colore e che pessimo odore! – brontolò il nostro eroe, tappandosi il naso con le dita, e trangugiando il liquido misterioso come se fosse stato olio di ricino. — Ti piace?","NO"
"Novelli_Enrico-Ciuffettino-1902","Novelli Enrico","Ciuffettino","1902","– chiese il vegliardo, che nel frattempo aveva vuotato ingordamente il proprio bicchiere, e si stava leccando i baffi. – Eccellente, vero? — Buonissimo... – balbettò Ciuffettino: e, alzandosi su la sedia, in una contrazione dolorosa dello stomaco... restituì su la tovaglia candida l’Elixir di lunga vita.","NO"
"Novelli_Enrico-Ciuffettino-1902","Novelli Enrico","Ciuffettino","1902","— Com’è buono... ohi, ohi... Il vecchio, livido, puntò lentamente il dito lungo ed ossuto verso Ciuffettino. — Che hai fatto!!...","NO"
"Novelli_Enrico-Ciuffettino-1902","Novelli Enrico","Ciuffettino","1902","— Eh!... in fin dei conti, abbiate pazienza, bella educazione di invitar le persone a bere certa roba... — Tu... osi?!...","NO"
"Novelli_Enrico-Ciuffettino-1902","Novelli Enrico","Ciuffettino","1902","— Sì – aggiunse il ragazzo con fuoco – e adesso, ho più fame di prima! Voglio una coscia di pollo o una fetta di mortadella! — Bene!","NO"
"Novelli_Enrico-Ciuffettino-1902","Novelli Enrico","Ciuffettino","1902","Il professor Sotutto prese Ciuffettino, se lo mise sotto il braccio, mugolando, e lo portò per le vie tranquille della Città dei Sapienti, fino alla porta. Costì lo riconsegnò a quella guardia che conosciamo, esclamando: — Mettete fuori della città questo ignorantello! E se ritorna, prendetelo a calci!","NO"
"Novelli_Enrico-Ciuffettino-1902","Novelli Enrico","Ciuffettino","1902","La guardia scaraventò il fanciullo, come se fosse stato una palla di gomma, in un prato vicino. — Sono morto! – pensò il nostro amico – addio, mamma!","NO"
"Novelli_Enrico-Ciuffettino-1902","Novelli Enrico","Ciuffettino","1902","addio babbo! E, credendosi morto, si pose a dormire tranquillamente. Quando si svegliò, il sole era alto nell’orizzonte purissimo.","NO"
"Novelli_Enrico-Ciuffettino-1902","Novelli Enrico","Ciuffettino","1902","Dove Ciuffettino dichiara di esser figlio di un banchiere, e poi accetta di affogare Melampo... per quattro soldi e un po’ di aleatico. — Ecco – bofonchiava Ciuffettino, allontanandosi dalla Città dei Sapienti – che cosa tocca a un ragazzaccio svogliato e ignorante come me!... E intanto, così, non ho mangiato!","YES"
"Novelli_Enrico-Ciuffettino-1902","Novelli Enrico","Ciuffettino","1902","E mi sta bene, ih! ih! ih!","NO"
"Novelli_Enrico-Ciuffettino-1902","Novelli Enrico","Ciuffettino","1902","perchè se avessi obbedito il babbo... ed il maestro... Oh... ma se faccio tanto di tornar a casa, quant’è vero Iddio, mi metto a lavorare, e divengo un buon ragazzo sul serio. E i miei genitori dovranno piangere di gioia, dovranno...!","YES"
"Novelli_Enrico-Ciuffettino-1902","Novelli Enrico","Ciuffettino","1902","Un giorno, poi, quando sarò grande, troverò un bell’impiego, e guadagnerò i denari a palate... E per le vie di Cocciapelata tutti diranno: quello era Ciuffettino... quel monellaccio... non par vero! adesso è il presidente del Consiglio dei ministri... Che ingegno!","YES"
