"filename","nome","titolo","anno","chunk","DIL"
"Righetti_Carlo-Nana_a_Milano-1880","Righetti Carlo","Nana a Milano","1880","- Non il cento per cento - sclamava Enrico - ma il mille per cento io sarei pronto a pagare per avere quel danaro da presentare a Nanà questa sera. Per me è questione di vita o di morte. Che vale il danaro se non rappresenta appunto il valore dei nostri desideri?","NO"
"Righetti_Carlo-Nana_a_Milano-1880","Righetti Carlo","Nana a Milano","1880","Si dica quel si vuole, la è logica anche codesta; logica pericolosa, ruinosa, da scavezzacollo, da uomo passionato, ma logica. Persuadere un giovane di ventiquattr'anni, generoso, ardente desioso, innamorato che il prender a interesse del danaro al cento per cento è una grulleria, una bestialità economica, una ridicolaggine di cui s'avrà certo a pentire più tardi, è cosa tanto vana, come sarebbe per esempio il mettersi a persuader i pesci a vivere fuori dell'acqua, dove noi ci si annega, mentre loro ci stanno a lor agio, dove anzi non possono a meno di stare per vivere. Pei giovani il danaro non è - parlo in generale - che il mezzo per soddisfare i bisogni del cuore, i capricci della mente, le necessità dei sensi, delle passioni.","NO"
"Righetti_Carlo-Nana_a_Milano-1880","Righetti Carlo","Nana a Milano","1880","Quanto più troveranno ostacoli, non naturali, non fatali a soddisfar queste loro passioni tanto più s'aumenterà in essi la smania di soddisfarle. Nititur in vetitum. L'idea del dissesto finanziario, della povertà, della rovina, non entra in cervelli giovani privi di esperienza e di vivere di mondo.","NO"
"Righetti_Carlo-Nana_a_Milano-1880","Righetti Carlo","Nana a Milano","1880","L'economia è una parola che ha senso soltanto per coloro che guadagnano il danaro a stento. Se i tutori ed i padri pensassero a queste verità forse le pazzie dei figli sarebbero meno frequenti. Il fatto è che la stessa sera Enrico potè annunciare a Nanà che fra tre giorni avrebbe avuti i diecimila franchi.","YES"
"Righetti_Carlo-Nana_a_Milano-1880","Righetti Carlo","Nana a Milano","1880","* * * Dal giorno che Enrico O'Stiary portò a Nanà i diecimila franchi, che dovevano dare un altro strappo alla sua sostanza, quelle due belle creature si videro tutti i giorni. Rotto il ghiaccio essi entrarono nel secondo stadio dell'amore... sentimentale.","NO"
"Righetti_Carlo-Nana_a_Milano-1880","Righetti Carlo","Nana a Milano","1880","Enrico non aveva il coraggio di esigere di più da quella donna, che gli appariva armata di virtù come l'antica Minerva. E forse se avesse anche saputo chi ella era sarebbe stato troppo tardi lo stesso. La sua fantasia, l'amor proprio, i nervi, i muscoli il sangue erano troppo invasi dal magnetico di quella donna per concedergli di desistere dall'immenso desio.","NO"
"Righetti_Carlo-Nana_a_Milano-1880","Righetti Carlo","Nana a Milano","1880","Ogni volta che egli montava le scale di Nanà giurava di riuscire a conquistarla; dinanzi a lei si trovava di aver il cuore di coniglio, il cervello di ghiaccio e la lingua mozza. Tutte le ragioni, le preghiere, le astuzie pensate, come quelle del povero Renzo in presenza dell'Azzeccagarbugli sfumavano. Non sapeva più che cosa dirle, da dove incominciare, come pigliarla.","YES"
"Righetti_Carlo-Nana_a_Milano-1880","Righetti Carlo","Nana a Milano","1880","Pativa suggezione della Parigina! Ell'era incantevolmente graziosa con lui; lo riceveva con vera e schietta gioia; non lo lasciava partire s'egli accennava di volersene andar più presto del solito. Ma se egli arrischiava un gesto, una frase di desiderio, una preghiera o non faceva mostra di capirli, o li vietava cogli occhi, colla mano, col broncio, o si sottraeva alle sue carezze.","YES"
"Righetti_Carlo-Nana_a_Milano-1880","Righetti Carlo","Nana a Milano","1880","Nanà manovrava con lui con una tattica degna d'un generale di genio. Ella aveva fissato di sposare Enrico, mescendo l'utile al dolce; sposare un giovane che le piaceva e diventare contessa. Conosceva troppo la regola più elementare della civetteria femminile, per la quale avviene che gli amanti stiano legati assai più col rifiutarsi che col concedersi.","NO"
"Righetti_Carlo-Nana_a_Milano-1880","Righetti Carlo","Nana a Milano","1880","E la sua continenza era cosa tanto insolita in lei che ne andava orgogliosa. Enrico sentiva d'essere stretto nelle spire d'un adorabile serpente e non sapeva levarsene. Già cento volte Nanà aveva letto negli occhi di Enrico il poema delle sue sofferenze fisiche e morali, e ne gioiva.","NO"
"Righetti_Carlo-Nana_a_Milano-1880","Righetti Carlo","Nana a Milano","1880","C'era in questa gioia di Nanà un piccolo sentimento di vendetta. Ella faceva pagar cari al giovane innamorato il tentativo di sottrarsi al suo fascino, spiegato da lui nella prima sera, quand'essa, non aveva potuto cavargli una sola dichiarazione, e aveva dovuto ella stessa fare i primi approcci. Siamo in villa, sul lago di Como.","YES"
"Righetti_Carlo-Nana_a_Milano-1880","Righetti Carlo","Nana a Milano","1880","Potevano essere le otto d'un bel giorno di settembre. Il notaio faceva il suo solito sonnetto del dopo pranzo. La signora Eugenia era salita a trovare la cameriera, che s'era messa a letto con un febbrone.","NO"
"Righetti_Carlo-Nana_a_Milano-1880","Righetti Carlo","Nana a Milano","1880","Elisa era uscita sul terrazzo, che dava sul lago, e stava là colle braccia a gomitello sul davanzale a guardar nel vuoto con quell'abbandono un po' languido e sconfortato di chi soffre un cordoglio che vuolsi dissimulato a tutti e che nella solitudine si fa sentire con raddoppiata amarezza. Povera fanciulla! Sua madre aveva già tentato qualche volta di dissuaderla dal pensare ancora a quello scapigliato di Enrico, ed essa faceva di tutto per compiacere a sua madre e non ci riusciva.","YES"
"Righetti_Carlo-Nana_a_Milano-1880","Righetti Carlo","Nana a Milano","1880","Chè anzi, il martello dell'amor proprio offeso, e il disinganno, e il contrasto raddoppiavano nel suo animo il dolore e la desolazione. Stava così volgendo nella sua testolina i mesti progetti dell'avvenire, pur non disperando ancora del tutto, quando le parve udire dietro di sè il passo di Enrico. Essa lo distingueva bene fra tutti quanti.","NO"
"Righetti_Carlo-Nana_a_Milano-1880","Righetti Carlo","Nana a Milano","1880","Enrico, il giorno prima, aveva portato a Nanà i diecimila franchi avuti dalla ditta Marliani e C., e Nanà li aveva accettati; ma era stata con lui più fiera che mai. Uscendo da lei, era stato preso per reazione da una specie di rimorso, da una resipiscenza amorosa per la sua bella Elisa; aveva giurato di star lontano per qualche giorno da Nanà ed era venuto alla villa Martelli per riveder la fanciulla come se sperasse in quel dolce e onesto sguardo trovare la consolazione al disinganno de' sensi. Le giunse a ridosso credendo di non essere stato udito, e ristette ad ammirarla; e in quel punto sentì il suo amore per lei moltiplicato dal dispetto e dal tormento che Nanà gli aveva fatto durare il dì prima; le si mise accanto.","NO"
"Righetti_Carlo-Nana_a_Milano-1880","Righetti Carlo","Nana a Milano","1880","Essa alzò lentamente le pupille addolorate in viso ad Enrico sorrise e la sua fisonomia fu come illuminata da un raggio di gioia divina. Stese la mano al giovine, e gli disse: - Sei qui, Enrico? Oh, non ti aspettavo più.","NO"
"Righetti_Carlo-Nana_a_Milano-1880","Righetti Carlo","Nana a Milano","1880","Enrico vide negli occhi della fanciulla brillar due lagrime, preziosi gioielli dell'immeritato tesoro di tenerezza, ch'egli aveva racchiuso in quell'anima innamorata. - Che hai Elisa?... Tu sei malinconica - le disse Enrico mettendosi con lei al davanzale.","NO"
"Righetti_Carlo-Nana_a_Milano-1880","Righetti Carlo","Nana a Milano","1880","- Ti pare? - sclamò sorridendo la fanciulla con molta dignità. - La balia ieri sera mi parlò di te.","NO"
"Righetti_Carlo-Nana_a_Milano-1880","Righetti Carlo","Nana a Milano","1880","- Che cosa la ti disse? - Che tu credi che io non ti ami più. - È vero.","NO"
"Righetti_Carlo-Nana_a_Milano-1880","Righetti Carlo","Nana a Milano","1880","- domandò Elisa. - Ebbene, ti giuro di no - riprese con accento sincero il conte. - Credilo, Elisa, io ti giuro che sento di non voler bene davvero che a te sola.","NO"
"Righetti_Carlo-Nana_a_Milano-1880","Righetti Carlo","Nana a Milano","1880","Elisa sospirò, ma non disse parola. - Però, siccome non sono capace di fingere con te, mia buona Elisa, ti dirò tutto. Forse sì, sono andato a rischio di cadere nei lacci di una donna... una donna che non vale un tuo capello... ma per puro capriccio, vedi, non per cuore.","NO"
"Righetti_Carlo-Nana_a_Milano-1880","Righetti Carlo","Nana a Milano","1880","Ma quando ti vedo, quando sento la tua voce, quando guardo nei tuoi occhi tanto belli e sinceri, mi par impossibile di avere avuto un pensiero per un'altra donna. - Ah! dunque non mi sono ingannata - disse la Elisa.","NO"
"Righetti_Carlo-Nana_a_Milano-1880","Righetti Carlo","Nana a Milano","1880","- Qualche cosa c'è per cui io non debba più sperare...? - No, te lo giuro - interruppe Enrico - non c'è nulla. Tu mi credi, n'è vero Elisa?","NO"
"Righetti_Carlo-Nana_a_Milano-1880","Righetti Carlo","Nana a Milano","1880","Tu lo senti che io sono sincero, e che non ti voglio bene proprio di cuore che a te sola.... - Ebbene sì, ti credo - rispose la fanciulla con infinita grazia - perchè guai a te se poi tu m'ingannassi. Sarebbe come ingannare un bambino. Io non so nulla di ciò che voi pensiate, nè che proviate per certe donne... ma so che tu mi fai soffrire.","NO"
"Righetti_Carlo-Nana_a_Milano-1880","Righetti Carlo","Nana a Milano","1880","Queste parole furono dette dalla vergine, con una ineffabile espansione. - Ah, se anche tuo padre non fosse l'uomo che egli è - sclamò Enrico quasi per scusarsi - se non fosse lui che mi sforzò a far la vita che faccio. - Oh, ma perchè?","NO"
"Righetti_Carlo-Nana_a_Milano-1880","Righetti Carlo","Nana a Milano","1880","- Perchè io sento di essere indipendente e superbo, ed egli mi trattò sempre come un fanciullo, e non come un uomo di ventiquattro anni che fra poco sarà padrone del proprio avere. Lui crede che io debba pensare come lui, far la vita che fa lui, avere le sue abitudini, le sue idee, le sue spilorcerie. Egli mi ha fino rimproverato un giorno, perchè avevo fatto un'elemosina.","NO"
"Righetti_Carlo-Nana_a_Milano-1880","Righetti Carlo","Nana a Milano","1880","È insoffribile. Non è degno d'essere tuo padre. - Ah, Enrico, non dire così!","NO"
"Righetti_Carlo-Nana_a_Milano-1880","Righetti Carlo","Nana a Milano","1880","- È vero, Elisa, scusami - sclamò il conte ridendo. - Ma tu, sarai per me la più cara creatura di questo mondo. Fin da quando avevo dieci anni e tu non ne avevi che cinque, il primo pensiero d'amore che passò nella mia testa fu per te.","NO"
"Righetti_Carlo-Nana_a_Milano-1880","Righetti Carlo","Nana a Milano","1880","Io sento di essere tuo e che nessuna donna potrà prendere il tuo posto qui nel mio cuore. - Allora giurami - disse la Elisa - che non la vedrai più questa donna. - Ebbene, te lo giuro - rispose Enrico sincero.","NO"
"Righetti_Carlo-Nana_a_Milano-1880","Righetti Carlo","Nana a Milano","1880","Ma poi soggiunse: - Ti giuro che ci andrò ben di rado e che non le dirò mai più nulla che ti possa dar ombra. - Ah no, tu non devi vederla mai più. - Ma, mia cara, farei una figura molto ridicola co' miei amici.... Si direbbe ch'ella mi ha messo alla porta.","NO"
"Righetti_Carlo-Nana_a_Milano-1880","Righetti Carlo","Nana a Milano","1880","Tu non vuoi, Elisa, ch'io diventi ridicolo. - No, ma io vorrei che tu mi promettessi almeno di non vederla più da solo a sola. - Ebbene, questo te lo posso promettere - rispose Enrico.","NO"
"Righetti_Carlo-Nana_a_Milano-1880","Righetti Carlo","Nana a Milano","1880","In questo s'intese la voce vibrata e severa di donna Eugenia che chiamava: Elisa. E la madre comparve sulla soglia della terrazza. - T'ho pur detto tante volte - ripigliò - che sulla terrazza non amo che tu ci stia di sera, se non con tua madre; speravo che tu m'avessi a obbedire.","NO"
"Righetti_Carlo-Nana_a_Milano-1880","Righetti Carlo","Nana a Milano","1880","Rientrarono tutti e tre in sala, dove il notaio stava russando ancora placidamente nel suo seggiolone. Quella serata fu piena, pe' due giovani amanti, di misteriose dolcezze, mentre una noia feroce regnava in quella sala, che a poco a poco s'era andata popolando di visite. Erano i villeggianti dei contorni che venivano, come al solito, a passar la sera in casa Martelli.","NO"
"Righetti_Carlo-Nana_a_Milano-1880","Righetti Carlo","Nana a Milano","1880","La Elisa, prima suonava qualche pezzo sul piano, poi si giuocava a mercante in fiera, fin verso le undici. Donna Elena aveva già dato ordine al servitore di far preparare per il conte una delle camere dei forestieri in una casina attigua alla villa. - Spero che ti fermerai un po' di giorni - aveva domandato il notaio al conte.","NO"
"Righetti_Carlo-Nana_a_Milano-1880","Righetti Carlo","Nana a Milano","1880","- Non posso - gli aveva risposto Enrico - sono venuto a far una visita alla sfuggita. Ma ho sul cavalletto un ritratto che non voglio lasciar prosciugare. Il giorno dopo infatti Enrico salutava i suoi ospiti e partiva.","NO"
"Righetti_Carlo-Nana_a_Milano-1880","Righetti Carlo","Nana a Milano","1880","E in viaggio sentiva lievemente, gradatamente andarsene in fumo la promessa data alla Elisa ad ogni chilometro che si scostava da lei e che si avvicinava a Nanà. La storia della lotta fra la passione d'Enrico e la calcolata freddezza di Nanà - è inutile dissimularlo - non potrebbe essere cosa nuova, per la ragione che essa dura fin dal primo giorno, in cui la mistica coppia, imaginata dalla Bibbia, sentì il primo palpito, che doveva perpetuar nel mondo la razza umana. Essa durerà pei secoli dei secoli, e sempre uguale, finchè su questa pallottola abitata ci sarà un seno di femmina, che palpitando rifiuti e un petto di maschio che sbuffando, desideri.","NO"
"Righetti_Carlo-Nana_a_Milano-1880","Righetti Carlo","Nana a Milano","1880","Era dunque, come tutte queste battaglie d'amore, combattuta ad armi assai disuguali; perchè egli amava ed essa calcolava; perchè egli pativa ed essa godeva. Quel ruolo di donna onesta non è a dirsi come qualche volta pesasse anche a Nanà. Ella amava di quando in quando lasciar intravedere al suo amante di quali pazze delizie, di quali frenesie lo avrebbe inebbriato s'egli avesse saputo meritare o carpire i di lei favori.","NO"
"Righetti_Carlo-Nana_a_Milano-1880","Righetti Carlo","Nana a Milano","1880","Allora Enrico, infiammato, delirante, furioso si faceva più ardito, ed ella lo lasciava arrivar fino all'estremo punto, poi lo arrestava negando, con un sangue freddo e una costanza, che avrebbero fatto onore a Penelope e a Lucrezia romana. - No, Enrico, no - gli diceva fingendo di soffrire ella stessa - io non potrei essere l'amante di un uomo che è già promesso ad altra donna. - Io voglio che tu non mi disprezzi, nè che tu rida di me co' tuoi amici....","YES"
"Righetti_Carlo-Nana_a_Milano-1880","Righetti Carlo","Nana a Milano","1880","Enrico protestava.... - Io non potrei essere tua che diventando tua moglie. Devi scegliere o me o lei. La prima volta che Nanà diede così il fuoco alla bomba, Enrico restò interdetto.","NO"
"Righetti_Carlo-Nana_a_Milano-1880","Righetti Carlo","Nana a Milano","1880","- Mia moglie? - sclamò. E per due minuti non aggiunse altro.","NO"
"Righetti_Carlo-Nana_a_Milano-1880","Righetti Carlo","Nana a Milano","1880","Nanà si guardava le unghie e taceva anch'essa. * * * - Ti ricordi, Nanà - riprese Enrico con calma - d'avermi detto un giorno che non avresti sposato mai un artista?","NO"
"Righetti_Carlo-Nana_a_Milano-1880","Righetti Carlo","Nana a Milano","1880","- Mi ricordo - rispose ella ridendo - ma allora io non ti conoscevo come ti conosco adesso e non sapevo che tu mi avessi amata così. Oggi io, pigliandoti, sposerei un uomo che sono certa non ha per me soltanto un capriccio, ma un sentimento sincero e profondo. - Ma io ti volevo molto bene fin d'allora, perchè credo d'essermi invaghito di te fin dal primo momento che i miei occhi hanno incontrato i tuoi.","NO"
"Righetti_Carlo-Nana_a_Milano-1880","Righetti Carlo","Nana a Milano","1880","- Sempre la stessa cosa! - sclamò volubilmente Nanà. «Da quel dì che t'ho veduta Bella come un primo amore»","NO"
"Righetti_Carlo-Nana_a_Milano-1880","Righetti Carlo","Nana a Milano","1880","E come se scordasse sull'istante che in quel punto Eurico le stava parlando appassionatamente d'amore, ella si mise sul tabourè del piano e cominciò a cantare la cavatina di Verdi. Enrico restò come atterrato. Egli non conosceva ancora quella donna.","YES"
"Righetti_Carlo-Nana_a_Milano-1880","Righetti Carlo","Nana a Milano","1880","Se Nanà, quando le era cascato in mente di trarre dai tasti del piano la cavatina di Carlo V, si fosse trattenuta e ne avrebbe fatta una piccola malattia. È isterismo, dicono i medici. Chi non lo sa?","YES"
"Righetti_Carlo-Nana_a_Milano-1880","Righetti Carlo","Nana a Milano","1880","Quand'ebbe toccati dei tasti, rinchiuse il piano e tornò presso Enrico, che era rimasto lì abbacinato, credendo ch'ella si burlasse di lui. - Dunque, che ne dici? - gli domandò.","NO"
"Righetti_Carlo-Nana_a_Milano-1880","Righetti Carlo","Nana a Milano","1880","- Sei decisa a non vedere in me altra stoffa d'uomo, che quella di cui si fanno fuori i mariti? - Decisa. - Mi concederai, Nanà, che la cosa è poco lusinghiera per me.","NO"
"Righetti_Carlo-Nana_a_Milano-1880","Righetti Carlo","Nana a Milano","1880","- Hai torto. Tu calunnii la mia scelta. A Parigi, se io avessi voluto essere cento volte contessa, duchessa, principessa lo avrei potuto.","NO"
"Righetti_Carlo-Nana_a_Milano-1880","Righetti Carlo","Nana a Milano","1880","Come pure se volessi avere un amante, potrei sceglierne qui a Milano mille più ricchi di te. Ma come sposo, non ci sei che tu, Enrico, a' miei occhi che mi possa far felice. E poi assolutamente io non vorrei per amante un uomo che è già sposo di un'altra.","YES"
"Righetti_Carlo-Nana_a_Milano-1880","Righetti Carlo","Nana a Milano","1880","O me, o lei. - Mi concederai che la è una determinazione gravissima quella che mi cerchi - disse Enrico, che schivava sempre di alludere alla Elisa. - Non lo nego.","NO"
"Righetti_Carlo-Nana_a_Milano-1880","Righetti Carlo","Nana a Milano","1880","Ma per me essa è meno grave che decidermi ad una relazione intima quale la vorresti tu... Come mio marito io avrei interesse a non rovinarti e a non disonorarti; come amante forse non meriteresti da me questi riguardi. Vedi che ti parlo schietto! - -E se io acconsentissi e ti promettessi di sposarti?","NO"
"Righetti_Carlo-Nana_a_Milano-1880","Righetti Carlo","Nana a Milano","1880","- ripigliò Enrico - saresti tu pronta a raccontarmi il tuo passato? - Certamente - rispose Nanà franca come una torre. - E chi dovrà essere il primo a promettere?","NO"
"Righetti_Carlo-Nana_a_Milano-1880","Righetti Carlo","Nana a Milano","1880","- Tu. - E perchè non tu, piuttosto? - Perchè sarebbe perfettamente inutile, che io raccontassi la storia della mia vita ad un uomo, che non dovesse poi essere nulla per me.","NO"
"Righetti_Carlo-Nana_a_Milano-1880","Righetti Carlo","Nana a Milano","1880","- Puoi tu giurarmi fin d'ora che il tuo passato non ha nulla, che sia indegno di un gentiluomo il quale promettesse di darti il suo nome? Nanà non arrossì ma non rispose subito. Chiamò a raccolta in un attimo tutte le facoltà della simulazione e della dissimulazione, poi disse con calore: - Tu sai bene, Enrico, che io sono un'artista da teatro, e non una vestale.","NO"
"Righetti_Carlo-Nana_a_Milano-1880","Righetti Carlo","Nana a Milano","1880","- Questo non conta! Io non parlo di errori, parlo di macchie indelebili. Una volta che tu fossi divenuta la contessa O'Stiary nessuno avrebbe più il diritto di richiamare il tuo passato, tranne nel caso che fosse un passato infame.","NO"
"Righetti_Carlo-Nana_a_Milano-1880","Righetti Carlo","Nana a Milano","1880","Ciò che io ti domando si è se la tua mano possa mettersi nella mia senza tremare che un giorno o l'altro un uomo abbia il diritto di dirti una di quelle frasi che io non potrei lavare che a prezzo della vita dell'uno o dell'altro. Nanà lo ascoltava cogli occhi fissati ne' suoi. Ella ripetè la sua scusa.","NO"
"Righetti_Carlo-Nana_a_Milano-1880","Righetti Carlo","Nana a Milano","1880","- Già ti dissi che non fui maritata e che ho un figlio. Il mio povero Louiset non ha mai conosciuto suo padre. Fu un errore di giovinezza.","NO"
"Righetti_Carlo-Nana_a_Milano-1880","Righetti Carlo","Nana a Milano","1880","Se nondimeno tu hai il coraggio di farmi tua moglie, ti giuro che diventerò il modello delle spose, giacchè ho conosciuto il mondo e sono certa di poterti assicurare su quel punto. Se non accetti, Enrico, sarà meglio che non ci rivediamo. Io ti restituirò, a suo tempo, la somma che mi hai favorita...","NO"
"Righetti_Carlo-Nana_a_Milano-1880","Righetti Carlo","Nana a Milano","1880","E tal sia di noi. Enrico la interruppe con un gesto... - Sarà meglio che non ci vediamo più - proseguì Nanà - giacchè la nostra situazione diventerebbe assurda e pericolosa per entrambi. Per quanto il giovine fosse appassionato non aveva perduto però fin l'ultimo lume della ragione e della prudenza.","NO"
"Righetti_Carlo-Nana_a_Milano-1880","Righetti Carlo","Nana a Milano","1880","Forse l'imagine sofferente e bella della Elisa vegliava ancora per lui in un cantuccio del suo cuore. Si diede a passeggiare pensieroso. - Dunque?","YES"
"Righetti_Carlo-Nana_a_Milano-1880","Righetti Carlo","Nana a Milano","1880","- domandò Nanà poco dopo. - Se io dovessi promettere, crederesti tu alla mia parola? - Come a Dio!","NO"
"Righetti_Carlo-Nana_a_Milano-1880","Righetti Carlo","Nana a Milano","1880","- rispose Nanà con entusiasmo non finto. Questa frase diè coraggio ad Enrico. Prese le due mani di Nanà, la attirò a sè e le disse: - Mi vuoi tu un po'di bene?","NO"
"Righetti_Carlo-Nana_a_Milano-1880","Righetti Carlo","Nana a Milano","1880","- Come al miglior amico che io mi abbia - rispose la donna. Enrico la strinse sul petto. Ella si sciolse, scivolando fuori dell'abbraccio, e dicendo in francese: - Voyons!","NO"
"Righetti_Carlo-Nana_a_Milano-1880","Righetti Carlo","Nana a Milano","1880","Pas de bêtises! * * * La frase fu crudele per Enrico.","NO"
"Righetti_Carlo-Nana_a_Milano-1880","Righetti Carlo","Nana a Milano","1880","Prese il cappello e uscì. Nanà non lo richiamò. Ella si conosceva.","YES"
"Righetti_Carlo-Nana_a_Milano-1880","Righetti Carlo","Nana a Milano","1880","Temeva che il subitaneo bollor del sangue non le facesse perdere il frutto della sua lunga resistenza. Ma Enrico era troppo leale e troppo inesperto per una simile donna. Del resto, cogli ardimenti della fantasia Nanà aveva risolto il problema di restare casta, con Enrico, pur non soffrendo.","YES"
"Righetti_Carlo-Nana_a_Milano-1880","Righetti Carlo","Nana a Milano","1880","Ella non avrebbe potuto resistere altrimenti. Trovava il suo amante così timido, così riguardoso e così bello, che anche con tutta la potenza del calcolo di cui si era armata, ella era sicura che non avrebbe saputo sempre trovare la virtù della resistenza, se la fantasia, avvezza a ben altro, non le avesse prestato spontaneamente collo sfogo, il suo aiuto. Quando Enrico, al colmo della passione le ricingeva la vita e la copriva di insaziabili baci, ella si abbandonava per un istante alle voluttà di quell'adorazione e gemeva come donna a cui pel soverchio piacere sta per mancare la vita; poi si scioglieva a un tratto da lui, sicura ormai di non cedere.","NO"
"Righetti_Carlo-Nana_a_Milano-1880","Righetti Carlo","Nana a Milano","1880","Era l'abbominazione d'una depravazione parigina, che, se Dio vuole, non è ancora comune fra le nostre donne! * * * Questo giuoco andava da più settimane, quando avvenne un caso che diede una grande rinfiammata alla passione di Enrico.","YES"
"Righetti_Carlo-Nana_a_Milano-1880","Righetti Carlo","Nana a Milano","1880","Nanà in quel tempo stava con lui buona parte del giorno. Essa andava al di lui studio al mattino e vi stava fino alle due. Al dopo pranzo Enrico tornava da lei fino a mezzanotte e ne partiva congedato sempre, e sempre più appassionato.","NO"
"Righetti_Carlo-Nana_a_Milano-1880","Righetti Carlo","Nana a Milano","1880","Ma appena partito lui, un ombra d'uomo, che si spiccava da un angolo buio, dov'era stato a vedetta, scivolava lungo il muro della casa d'onde era uscito il sofferente giovine, lo seguiva da lungi per un tratto e quando lo vedeva bene avviato, e s'era assicurato che non pensava a spiare, tornava rapido, metteva la chiave nella toppa dello sportello di Nanà e spariva in esso. Quell'ombra, che alla luce appariva essere quella del marchesino Sappia, l'intimo amico di Enrico, usciva poi da quello sportello, verso le cinque del mattino. Enrico non aveva pensato ancora di essere geloso.","NO"
"Righetti_Carlo-Nana_a_Milano-1880","Righetti Carlo","Nana a Milano","1880","Un'idea fissa lo consolava dei rifiuti costanti di quella donna, ch'egli amava ormai alla follia; un'idea che l'amor proprio gli faceva sembrare eminentemente logica e chiara. Se Nanà era tanto riservata con lui, come avrebbe potuto egli accogliere il sospetto ch'ella non lo fosse con tutti? Alle necessità della sua vita dispendiosa egli ci aveva già pensato assai.","YES"
"Righetti_Carlo-Nana_a_Milano-1880","Righetti Carlo","Nana a Milano","1880","Era pronto a rinnovar la dose appena Nanà gli avesse lasciato intendere di non aver più danaro, e glielo aveva detto esplicitamente. Non le doveva mancar nulla! Perchè lo avrebbe essa tradito?","YES"
