"filename","nome","titolo","anno","chunk","DIL"
"Righetti_Carlo-Nana_a_Milano-1880","Righetti Carlo","Nana a Milano","1880","* * * La mattina seguente al bel primo svegliarsi si affacciarono alla mente di Filippo Marliani due imagini e due idee importantissime, di cui l'una voluttuosamente splendida, l'altra sgarbatamente molesta. La prima era Nanà.","NO"
"Righetti_Carlo-Nana_a_Milano-1880","Righetti Carlo","Nana a Milano","1880","Quella donna che tutti desideravano, che aveva prodotta nella gioventù dorata di Milano una insolita effervescenza, per posseder la quale molti avrebbero dato, se non la vita, gran parte dei loro averi, era ridivenuta senza farlo basire, la sua amorosa. La seconda idea, che attraversava e che smorzava quella superba gioia era la ripetizione di un fastidio e di un rimorso che già egli aveva risentito il dì prima, non appena Nanà lo aveva lasciato solo nella sua cameretta. Era prodotta da due fatti egualmente gravi e umilianti: quello di trovarsi senza più il becco d'un quattrino indosso, e quello di non aver potuto pagare nelle ventiquattr'ore il debito di giuoco di ottocento franchi, contratto la notte dianzi.","YES"
"Righetti_Carlo-Nana_a_Milano-1880","Righetti Carlo","Nana a Milano","1880","Egli, infatti, di nascosto di Nanà, la quale - credeva. - non avrebbe voluto più accettare il suo dono le aveva scivolato nel portamonete il suo ultimo biglietto da mille franchi, che avrebbe dovuto servire a quell'ufficio indispensabile per chi voglia comparire ancora in una sala di giucco. E si trovava perfettamente al verde.","YES"
"Righetti_Carlo-Nana_a_Milano-1880","Righetti Carlo","Nana a Milano","1880","E - ciò che non è indifferente a notarsi - non teneva più in casa neppur un filo con cui far danaro. L'abbiamo veduto fare la barba ai solini da collo sfilacciati. Segno di grande arsura!","YES"
"Righetti_Carlo-Nana_a_Milano-1880","Righetti Carlo","Nana a Milano","1880","Se non che l'anima umana è così avida di felicità e si sottrae così volentieri al dolore e all'umiliazione, che sulle prime il pensiero di Filippo figgendosi ardentemente nell'imagine di Nanà gli fe' riprovare soltanto la gioia e l'estasi vivissima d'averla ancora posseduta. - Nanà, mia Nanà, bella Nanà terribile - andava egli dicendo mentre si vestiva; e non si saziava di ripetere quel nome come per tener occupata la mente e ributtar indietro le idee importune. - Che splendida creatura!","YES"
"Righetti_Carlo-Nana_a_Milano-1880","Righetti Carlo","Nana a Milano","1880","Che occhi, che capelli, che denti, che profumo di donna sana! Ma l'orgasmo erotico durò poco. Bisognava pensar all'avvenire, e provvedere alla vita.","YES"
"Righetti_Carlo-Nana_a_Milano-1880","Righetti Carlo","Nana a Milano","1880","Quell'ultimo biglietto da mille, che avrebbe dovuto servire, per tre quarti a pagar un debito di giucco, e pel resto ad essere arrischiato, e a produrre chissà che risorsa, sfumato in quel modo gli toglieva la speranza di potere la sera tentare di nuovo la sorte. Ad ogni modo in bisca egli non ci sarebbe andato che di sera. Ma intanto?","YES"
"Righetti_Carlo-Nana_a_Milano-1880","Righetti Carlo","Nana a Milano","1880","I due piccoli problemi della giornata: la colazione ed il pranzo, come si risolveranno? «Potrei - cominciò passando in rassegna i mezzi leciti - potrei andar in cerca d'un amico e farmi invitare da lui dicendo di avere dimenticato a casa il portamonete. O potrei anche fingere al restaurant di averlo lasciato a casa.","YES"
"Righetti_Carlo-Nana_a_Milano-1880","Righetti Carlo","Nana a Milano","1880","Ma questo stratagemma andrà bene un paio di volte! E poi? Chi me ne darà?","YES"
"Righetti_Carlo-Nana_a_Milano-1880","Righetti Carlo","Nana a Milano","1880","Erano però i due espedienti più ragionevoli pel momento; risolse di metter in pratica l'uno o l'altro a seconda del caso, e uscì. Non trovando l'amico da cui farsi invitare fece colazione come il solito al suo caffè, ordinò al cameriere di fargli il conto, poi frugando in tasca colla più gran disinvoltura del mondo, finse d'aver lasciati a casa dei biglietti da mille, che ci avrebbero dovuto esser dentro, e si levò tutto turbato per paura che... la donna che rigoverna la camera... non si sa mai!... - Si figuri!","YES"
"Righetti_Carlo-Nana_a_Milano-1880","Righetti Carlo","Nana a Milano","1880","- gli aveva già detto il cameriere, prima ch'ei fingesse quelle smanie. - Pagherà domani! Anche quel pagherà domani fece a Filippo un effetto singolare... «Chi è che mi insegna come si fa a guadagnar danaro?» - pensava avviandosi senza saper dove.","YES"
"Righetti_Carlo-Nana_a_Milano-1880","Righetti Carlo","Nana a Milano","1880","- Domani se non pesco danaro non potrò neppur tornar qui a far colazione. Gli amici li ho già gonfiati tutti. Non c'è più da cavarne nulla.","YES"
"Righetti_Carlo-Nana_a_Milano-1880","Righetti Carlo","Nana a Milano","1880","È terribile!» La farsa del portamonete lasciato a casa fu ripetuto da lui per il pranzo in altro luogo. Ma venne il vero punto tòpico, anche per Filippo Marliani; quello cioè di non poter più passare dinanzi a certi caffè nè a certe trattorie per non farsi vedere, e di non saper più quale albergo scegliere ancora da mistificare. Per capir bene questa situazione in tutta la sua verità, in tutti i suoi spaventevoli particolari, in tutti i suoi segreti inesplorati, è necessario saper bene che cosa voglia dire patir la fame per mancanza fin di un paio di soldi da comperarsi almeno del pane.","NO"
"Righetti_Carlo-Nana_a_Milano-1880","Righetti Carlo","Nana a Milano","1880","E si badi! A questa fame, per mancanza di pane, non vanno soggetti che gli uomini della condizione di Filippo Marliani, a cui è vietato il guadagnar sia pure due soldi. Il miserabile, che vuol lavorare, non sa che cosa sia.","YES"
"Righetti_Carlo-Nana_a_Milano-1880","Righetti Carlo","Nana a Milano","1880","Se non trova da guadagnar i due soldi, stende magari la mano all'elemosina e li raccatta. Marliani no. Per capir bene, ripeto, questa situazione, è necessario l'essere andato qualche volta a letto verso il tramonto, quando la fame più assaetta lo stomaco, a tentar di dormire per non provar gli spasimi e l'umiliazione.","YES"
"Righetti_Carlo-Nana_a_Milano-1880","Righetti Carlo","Nana a Milano","1880","È necessario sapere qual grado di carattere e di probità abbisogni ad un uomo che veste di panno per affrontare e cacciare indietro le idee invadenti, che fanno ressa e rivolta in faccia al senso morale, protestando rabbioso contro la ingiustizia distributiva, contro il sistema sociale, contro tutto ciò che i politici chiamano l'ordine stabilito. Filippo Marliani però non pensava che del suo trovarsi in quell'orrendo disagio aveva colpa lui stesso. Amava meglio prendersela contro l'ordine stabilito.","YES"
"Righetti_Carlo-Nana_a_Milano-1880","Righetti Carlo","Nana a Milano","1880","Camminando alla ventura delle ore intere, resistendo all'idea di andar a trovare Nanà, alla quale non voleva presentarsi a mani e a tasche vuote, egli andava facendo, senz'accorgersi, una quantità di ragionamenti nuovi e di piccole operazioni strane, inusate, senza senso comune. Era capace di tener dei quarti d'ora gli occhi a terra, sperando di trovare sul cammino un biglietto da mille, smarrito da qualche banchiere distratto, o un brillante uscito fuori da un orecchino di donna, o una borsetta piena d'oro, perduta da qualche inglese in viaggio. E in quel momento l'idea dell'obbligo di portar queste cose al Municipio, non gli era nemmeno apparsa in ombra.","NO"
"Righetti_Carlo-Nana_a_Milano-1880","Righetti Carlo","Nana a Milano","1880","Nella sua testa non sbucciavano che idee malsane, come in un campo sterile e dimenticato non germogliano che male erbaccie. Disperando a un tratto di trovare pe' sassi qualche oggetto di valore, alzò gli occhi a caso e si trovò accanto alla vetrina di un cambiavalute. Si fermò di botto ed ebbe anche la stupidità di credere che questo fosse un buon augurio.","YES"
"Righetti_Carlo-Nana_a_Milano-1880","Righetti Carlo","Nana a Milano","1880","Là dinanzi, cogli occhi intenti sulle monete d'oro e sui biglietti di banca sciorinati nell'interno della vetrina, il povero affamato sentì svilupparsi nel capo dei miasmi di cupidigia morbosa, e nel pugno una smania di sferrar un colpo nella lastra di vetro. Cose tutte che non aveva mai provate di sua vita. «Se si potesse far un buco senza che nessuno se ne accorgesse?","YES"
"Righetti_Carlo-Nana_a_Milano-1880","Righetti Carlo","Nana a Milano","1880","Lì c'è appunto un biglietto da mille. Andrei a pranzo, poi stasera pagherei il debito, poi cogli altri dugento... chissà!» Guardossi intorno come trasognato. Rinsavì; ebbe vergogna de' proprî pensieri; odiò quelle tentazioni; pure il suo sguardo, tra lo spaventato e il suppligante, pareva dire ancora: Chi mi dà un biglietto da mille?","YES"
"Righetti_Carlo-Nana_a_Milano-1880","Righetti Carlo","Nana a Milano","1880","Si staccò da quella vetrina - già, per la intenzione, ladro! - proseguì il suo cammino sempre intontito e in preda al più desolante scoraggiamento. La fame aumentava.","YES"
"Righetti_Carlo-Nana_a_Milano-1880","Righetti Carlo","Nana a Milano","1880","Intorno a' suoi pensieri scattavano, ondeggiando come in nebbia opaca, delle fantasticherie di delitto e di rapina. A un certo punto fece anche improvvisa comparsa l'idea del suicidio, ed ei l'accolse di fronte come un ospite che non si attende, ma che fa piacere a vederlo. «No - diss'egli dopo averci pensato su qualche poco - sono sempre in tempo per questo.» «E Nanà?» Questo nome ch'egli aveva dimenticato dacchè il pùngolo della fame era incominciato e il suo amor proprio era stato messo a così dura prova dalla necessità di fingere parecchie volte la scena del portamonete dimenticato - in tre o quattro restaurants dov'era conosciuto - gli portò al cuore un'angoscia intollerabile.","YES"
"Righetti_Carlo-Nana_a_Milano-1880","Righetti Carlo","Nana a Milano","1880","«Ah, bisogna uscirne a ogni costo - pensò. - Io non posso lasciare Nanà. Essa mi abbisogna più che il pane da sfamarmi.","NO"
"Righetti_Carlo-Nana_a_Milano-1880","Righetti Carlo","Nana a Milano","1880","Non vivo così! È troppo tormento! È necessario ch'io abbia molto danaro.","YES"
"Righetti_Carlo-Nana_a_Milano-1880","Righetti Carlo","Nana a Milano","1880","Essa non mi ama al punto da volermi gratuitamente, per me solo. Essa fu mia ancora... senza interesse... è vero. Ma chissà... per temperamento forse.","YES"
"Righetti_Carlo-Nana_a_Milano-1880","Righetti Carlo","Nana a Milano","1880","Ma non vorrei io stesso!» La risultante di tale ragionamento fu questa frase: «È necessario aver danaro.» E fra tutte le mariuolerie di cui potesse avere in testa un'idea, andò cercandone qualcuna da metter subito in pratica. Tutt'a un tratto un'idea luminosa lo colpì. Gli tornarono in mente certe parole misteriose che aveva udite per caso, alcuni mesi prima... da un certo tale... parole a cui allora non aveva posto la più piccola attenzione e che ora gli comparivano, come ad un brick che naufraga, l'ancora di salvezza.","YES"
"Righetti_Carlo-Nana_a_Milano-1880","Righetti Carlo","Nana a Milano","1880","Fu per lui un momento d'immenso sollievo; la speranza, la meretrice dell'anima, illuminò il suo volto che era divenuto a poco a poco emaciato, e senza pensarci sopra più che tanto, s'avviò. * * * «Chissà che non sia in tempo io stesso a pigliar quel posto» - diceva fra sè.","YES"
"Righetti_Carlo-Nana_a_Milano-1880","Righetti Carlo","Nana a Milano","1880","- «Il signor Giacomino me ne saprà dire qualche cosa.» Andò difilato in piazza del Duomo. Là cercò l'omnibus per Porta Garibaldi, e tutto infervorato nella sua idea, senza pensare che non teneva in tasca neppur il becco d'un quattrino, vi si cacciò dentro. L'omnibus si mosse e il conduttore gli stese la mano per avere il prezzo della corsa.","NO"
"Righetti_Carlo-Nana_a_Milano-1880","Righetti Carlo","Nana a Milano","1880","Fu allora che Marliani si ricordò di non aver danaro. Ma avvezzo ormai a fingere quella manovra del portamonete, mise bravamente la mano destra nella tasca interna dell'abito, poi frugò di qua, frugò di là, fingendo una crescente inquietudine, e finì collo sclamare: - Cristo! M'han rubato il portafogli!","NO"
"Righetti_Carlo-Nana_a_Milano-1880","Righetti Carlo","Nana a Milano","1880","- Màghero allora! - disse il conduttore dell'omnibus. - Sicuro.","NO"
"Righetti_Carlo-Nana_a_Milano-1880","Righetti Carlo","Nana a Milano","1880","O me l'han rubato o l'ho lasciato in... quella bottega.... Oh povero me! - Scenda, scenda... non importa.","NO"
"Righetti_Carlo-Nana_a_Milano-1880","Righetti Carlo","Nana a Milano","1880","Pagherà un'altra volta. Filippo non se lo fece dire due volte. Discese, fe' mostra di rifar la strada verso quella bottega, poi, quando l'omnibus fu scomparso, svoltò di nuovo verso Porta Garibaldi.","YES"
"Righetti_Carlo-Nana_a_Milano-1880","Righetti Carlo","Nana a Milano","1880","Giunto a un centinaio di passi oltre il teatro Fossati, entrò in una bottega di parrucchiere - che oggi non c'è più - e ad un figuro di vecchietto che stava là seduto su uno sgabello col sedile a vite, ad aspettare forse qualche pratica, disse: - Lei è il signor Giovannino, non è vero? - Per servirla. Vuol fare la barba?","NO"
"Righetti_Carlo-Nana_a_Milano-1880","Righetti Carlo","Nana a Milano","1880","- No, per ora. La faremo dopo, in caso. Io sono venuto da lei per vedere se.... Si ricorda lei di avermi veduto, sarà un paio di mesi, col signor Silvestre Bonaventuri?","NO"
"Righetti_Carlo-Nana_a_Milano-1880","Righetti Carlo","Nana a Milano","1880","- Mi ricordo. Lei è il signor Filippo Marliani. - Bravo!","NO"
"Righetti_Carlo-Nana_a_Milano-1880","Righetti Carlo","Nana a Milano","1880","Allora ella disse al mio amico che non gli era ancora riuscito di trovare un giovine un po' educato e vestito bene, che volesse assumersi quell'incarico, ancorchè avesse offerto cinquecento franchi al mese.... Si ricorda? - Altro che ricordarmi. - Ebbene, l'ha trovato?","NO"
"Righetti_Carlo-Nana_a_Milano-1880","Righetti Carlo","Nana a Milano","1880","- domandò il Marliani col cuore in sospeso; giacchè quella risposta poteva forse decidere della sua vita. - No - rispose il signor Giovannino. - Tutti hanno paura di cader in trappola.","NO"
"Righetti_Carlo-Nana_a_Milano-1880","Righetti Carlo","Nana a Milano","1880","- Si può sapere di che si tratta? Se si tratta di avere del coraggio, sono qua. Il signor Giovannino espose la faccenda a Marliani.","NO"
"Righetti_Carlo-Nana_a_Milano-1880","Righetti Carlo","Nana a Milano","1880","Questi domandò se si poteva parlare coi signori che proponevano l'affare. - Sicuro che si può. Me ne parlarono giusto anche stamattina.","NO"
"Righetti_Carlo-Nana_a_Milano-1880","Righetti Carlo","Nana a Milano","1880","La signora Bibiana sopratutti è scaldata e vorrebbe trovare un giovine come dice lei, che sarebbe certo di far fortuna. - Chi è la signora Bibiana? - È quella che ha il morto.","YES"
"Righetti_Carlo-Nana_a_Milano-1880","Righetti Carlo","Nana a Milano","1880","Una vedovona, che ce ne voglion tre di noi per abbracciarla. - Potrei parlare a questi signori? - Lei?","YES"
"Righetti_Carlo-Nana_a_Milano-1880","Righetti Carlo","Nana a Milano","1880","È pronto lei ad accettare? - Sì - rispose secco il Marliani. - È giusto l'ora che son riuniti in bottega - soggiunse il parrucchiere.","NO"
"Righetti_Carlo-Nana_a_Milano-1880","Righetti Carlo","Nana a Milano","1880","- Andiamoci allora. - Andiamo pure. Cecco, dove sei?","NO"
"Righetti_Carlo-Nana_a_Milano-1880","Righetti Carlo","Nana a Milano","1880","Cecco uscì dalla retro-bottega. - Io vado un momento con questo signore, e torno subito. Così detto, uscì seguito da Marliani.","NO"
"Righetti_Carlo-Nana_a_Milano-1880","Righetti Carlo","Nana a Milano","1880","Dati una ventina di passi parlando fra loro sottovoce, il parrucchiere svoltò dentro in una bottega da rigattiere. Una donnicciuola che se ne stava ebetamente seduta in un canto di quella uggiosa camera all'avvicinarsi dei due sconosciuti allungò il collo e ravvisato il signor Giovannino tornò a raggomitolarsi nella sua cretina immobilità. Il parrucchiere si avvicinò ad un uscio a due battenti socchiusi, che s'apriva nella parte di faccia all'entrata e che metteva in una tetanzuccia o retrobottega e fe' cenno a Marliani di fermarsi.","NO"
"Righetti_Carlo-Nana_a_Milano-1880","Righetti Carlo","Nana a Milano","1880","Mise l'occhio allo spiraglio e pronunciò a voce melliflua: - È permesso? - Avanti - s'intese rispondere una voce secca; e sgarbata dal didentro. Il vecchietto si volse al suo compagno gli fè cenno di venir innanzi e schiuse l'uscio.","NO"
"Righetti_Carlo-Nana_a_Milano-1880","Righetti Carlo","Nana a Milano","1880","Nella stanza dove erano per entrare il parrucchiere e Filippo Marliani stavano raccolte tre persone due uomini e una donna. Gli uomini erano entrambi in quell'età che non è giovinezza ma che non si potrebbe ancor dire maturità. La donna nei quarant'anni, che vestiva con volgare eleganza e mostrava un viso campagnuolo e rubicondo da farla giudicare per una fittavola o per la moglie d'un pizzicagnolo, era la signora Bibiana.","NO"
"Righetti_Carlo-Nana_a_Milano-1880","Righetti Carlo","Nana a Milano","1880","Quelle persone se ne stavano sedute in silenzio a ridosso della luce che entrava da due finestre a vetri smerigliati, a destra e a sinistra d'un altro uscio, che metteva nel cortile. In tal modo i tratti del loro viso restavano in ombra mentre essi avevano il destro di vedere perfettamente rischiarato il volto di chi fosse venuto a parlar con loro. Facevano come certe donne sul tramonto che vogliono nascondere le grinze ai loro visitatori.","NO"
"Righetti_Carlo-Nana_a_Milano-1880","Righetti Carlo","Nana a Milano","1880","- Venga avanti signor Giovannino - disse un di coloro al parrucchiere, che aveva domandato licenza di entrare. Questi si fermò accanto all'uscio lasciando il passo a Filippo Marliani. Gli occhi dei radunati si fissarono curiosamente; nelle sembianze del giovane sconosciuto.","NO"
"Righetti_Carlo-Nana_a_Milano-1880","Righetti Carlo","Nana a Milano","1880","- La chiuda l'uscio - disse la signora Bibiana al signor Giovannino. - E lei - ripigliò volgendosi a Filippo con un sorriso - la tenga pure il suo cappello in capo e s'accomodi. - Comodissimo - rispose questi sedendosi sulla prima sedia che si trovò d'accanto.","NO"
"Righetti_Carlo-Nana_a_Milano-1880","Righetti Carlo","Nana a Milano","1880","In questa il parrucchiere domandò licenza di andarsene, ma venne trattenuto dalla donna. - Che fretta! Stia qui un pò anche lei a sentire.","NO"
"Righetti_Carlo-Nana_a_Milano-1880","Righetti Carlo","Nana a Milano","1880","Poi voltasi al Marliani: - Lei sarà già informato spero della cosa. - Gli ho spiegato io l'affare all'ingrosso - rispose il signor Giovannino. - Egli è pronto a firmare il contratto basta che entro domani gli sieno sborsate due mila lire.","NO"
"Righetti_Carlo-Nana_a_Milano-1880","Righetti Carlo","Nana a Milano","1880","- Andiamo adagio - sclamò uno dei tre uomini levando la mano verso il vecchio - una cosa per volta e senza alzar la voce che nessuno qui è sordo. La donna volgendosi allora al giovine riprese. - Capirà anche lei... signor... signor?","NO"
"Righetti_Carlo-Nana_a_Milano-1880","Righetti Carlo","Nana a Milano","1880","- Marliani - rispose questi. - Signor Marliani, che prima di stringere un contratto importante come questo, bisogna conoscersi un poco, perchè dove c'è da obbligarsi in faccia ai terzi; le cautele dei galantuomi non sono mai bastanti. - Troppo giusto - disse Marliani piegando il capo in segno di assentimento.","NO"
"Righetti_Carlo-Nana_a_Milano-1880","Righetti Carlo","Nana a Milano","1880","Ma i suoi occhi si socchiusero nello stesso tempo con una espressione di ironica malizia. Quel sorriso non isfuggì all'occhio della donna la quale dissimulando riprese. - Dica dunque lei le sue intenzioni su quello che già le comunicò il signor Giovannino.","NO"
"Righetti_Carlo-Nana_a_Milano-1880","Righetti Carlo","Nana a Milano","1880","- Il signor Giovannino mi propose di entrare come socio e col mio nome in una ditta commerciale senza esposizione da parte mia di alcun capitale - rispose Marliani. - Va bene - rispose la signora Bibiana. - I signori che lei vede qui riuniti sarebbero appunto i soci fondatori di una casa in pannine, di cui ella assumerebbe la gerenza alle condizioni che forse già conosce.","NO"
"Righetti_Carlo-Nana_a_Milano-1880","Righetti Carlo","Nana a Milano","1880","- Le condizioni sarebbero di firmare col mio nome le cambiali della ditta. - Primo. - Nel caso di fallimento ch'io sia pronto a subire tutte le conseguenze conservando il massimo segreto sugli affari della casa.","NO"
"Righetti_Carlo-Nana_a_Milano-1880","Righetti Carlo","Nana a Milano","1880","- Va bene. - Che in caso fosse necessario per salvare la ditta di far in prigione l'anno ed il giorno, io debbo esser pronto a prestarmi, e nel caso invece che la ditta credesse meglio, ch'io sia pronto a fuggire. Il giovine si fermò per avere un segno di assentimento.","NO"
"Righetti_Carlo-Nana_a_Milano-1880","Righetti Carlo","Nana a Milano","1880","Le tre persone che gli stavano di contro erano immobili come cariatidi. - Non credo si esigano da me altri sacrifizi - rispose il giovine con una espressione di mal celata amarezza. Uno dei due uomini che non aveva ancora aperta bocca, alla nuova intonazione con cui il Marliani aveva pronunciate le ultime parole gli ficcò in viso gli occhi e disse: - Non sono sagrifizî codesti; sono condizioni naturalissime in chiunque si assume obblighi di questa specie.","NO"
"Righetti_Carlo-Nana_a_Milano-1880","Righetti Carlo","Nana a Milano","1880","Non c'è nulla che sia fuori del consueto, anzi non faceva neppur bisogno di parlarne, giacchè poi si spera di non aver bisogno di fallire o di andar in prigione o di scappare. - Ho voluto enumerarli! - rispose il Marliani per mostrare a loro signori che io conosco le eventualità a cui posso andare incontro mettendomi in questo affare e per togliere loro il sospetto che io possa essere un novizio o un guastamestiere.","NO"
"Righetti_Carlo-Nana_a_Milano-1880","Righetti Carlo","Nana a Milano","1880","- Ora parliamo delle condizioni in favore - disse la signora Bibiana. - Il signor Giovannino ha parlato di due mila lire subito. - Mi sono indispensabili.","NO"
"Righetti_Carlo-Nana_a_Milano-1880","Righetti Carlo","Nana a Milano","1880","- Due mila lire è una bella somma - sclamò uno dei tre - ci vorrebbe una piccola garanzia. Marliani si alzò in piedi. - Cari signori - disse - se avessi una garanzia non sarei venuto a esporre il mio nome ai pericoli d'una gerenza commerciale di cui non dovrò tenere la cassa, nè avere neppure una piccola parte nell'amministrazione.","NO"
"Righetti_Carlo-Nana_a_Milano-1880","Righetti Carlo","Nana a Milano","1880","Se avessi una garanzia andrei a levar i denari al dieci o al dodici per cento dal primo onesto banchiere che passa in strada, e il signor Giovannino non sarebbe venuto ad offrirmi di fare il prestanome. - Lei s'inganna - rispose la signora Bibiana con voce insinuante. - Io le dirò che prima di tutto non è vero che lei dovrà servire soltanto di prestanome perchè invece dovrà trattare in persona con me gli affari della ditta, far qualche viaggio e avere la sua brava parte di utili nei dividendi.","NO"
"Righetti_Carlo-Nana_a_Milano-1880","Righetti Carlo","Nana a Milano","1880","- Se ce ne saranno - osservò uno dei tre. - Sicuro già, se ce ne saranno! - sclamò la donna stizzosamente.","NO"
"Righetti_Carlo-Nana_a_Milano-1880","Righetti Carlo","Nana a Milano","1880","- In secondo luogo lei s'inganna se al giorno d'oggi crede di poter trovar danaro al dieci o al dodici per cento, a mena che non porga la garanzia di un proprietario. - Vedo insomma che lor signori non sono disposti a sborsarmi le duemila lire di cui ho bisogno - disse il Marliani. - Caro signore - rispose la donna sempre più dolce.","NO"
"Righetti_Carlo-Nana_a_Milano-1880","Righetti Carlo","Nana a Milano","1880","- Il commercio è arenato. Per vivere col decoro che porterà la di lei posizione di rappresentante la ditta Marliani e C. bisognerà che noi le fissiamo anche una bella mesata. Vede bene che farle oggi una anticipazione di due mila lire ci sarebbe impossibile.","YES"
"Righetti_Carlo-Nana_a_Milano-1880","Righetti Carlo","Nana a Milano","1880","- Di quanto sarebbe questa mesata? - domandò il Marliani. - Di trecento franchi - rispose la donna.","NO"
"Righetti_Carlo-Nana_a_Milano-1880","Righetti Carlo","Nana a Milano","1880","Marliani si alzò e mosse un passo verso la porta lisciando il pelo del suo cappello a tuba e disse: - Siccome i patti non sono quelli che m'aveva lasciato sperare il signor Giovannino, che mi parlò di cinquecento franchi al mese, così mi duole di non poter accettare, e mi tocca di rivolgermi ad altre offerte. - A un'altra volta - rispose uno dei due uomini. - E nel caso che la ditta si risolvesse a fare maggiori sacrifizî il signor Giovannino lo avviserà.","NO"
"Righetti_Carlo-Nana_a_Milano-1880","Righetti Carlo","Nana a Milano","1880","Marliani uscì lasciando l'uscio socchiuso. * * * Si capiva che la signora Bibiana era desolata.","NO"
"Righetti_Carlo-Nana_a_Milano-1880","Righetti Carlo","Nana a Milano","1880","Un bel giovine di quella fatta! - La chiuda quell'uscio, Giovannino - disse ella. Poi voltasi ai compagni proruppe: - Non bisogna lasciarlo scappare.","NO"
"Righetti_Carlo-Nana_a_Milano-1880","Righetti Carlo","Nana a Milano","1880","Sembra fatto a posta pel nostro affare. - Ritornerà. Scommettiamo che ritorna da sè senza mandarlo a chiamare?","NO"
