"filename","nome","titolo","anno","chunk","DIL"
"Verga_Giovanni-Vita_Dei_Campi-1880","Verga Giovanni","Vita Dei Campi","1880","Vita dei campi Giovanni Verga Fantasticheria Una volta, mentre il treno passava vicino ad Aci-Trezza, voi, affacciandovi allo sportello del vagone, esclamaste: ""Vorrei starci un mese laggiù!""","NO"
"Verga_Giovanni-Vita_Dei_Campi-1880","Verga Giovanni","Vita Dei Campi","1880","Noi vi ritornammo e vi passammo non un mese, ma quarantott'ore; i terrazzani che spalancavano gli occhi vedendo i vostri grossi bauli avranno creduto che ci sareste rimasta un par d'anni. La mattina del terzo giorno, stanca di vedere eternamente del verde e dell'azzurro, e di contare i carri che passavano per via, eravate alla stazione, e gingillandovi impaziente colla catenella della vostra boccettina da odore, allungavate il collo per scorgere un convoglio che non spuntava mai. In quelle quarantott'ore facemmo tutto ciò che si può fare ad Aci-Trezza: passeggiammo nella polvere della strada e ci arrampicammo sugli scogli; col pretesto d'imparare a remare vi faceste sotto il guanto delle bollicine che rubavano i baci; passammo sul mare una notte romanticissima, gettando le reti tanto per far qualche cosa che a' barcaiuoli potesse parer meritevole di buscare dei reumatismi; e l'alba ci sorprese nell'alto del fariglione, un'alba modesta e pallida, che ho ancora dinanzi agli occhi, striata di larghi riflessi violetti, sul mare di un verde cupo; raccolta come una carezza su quel gruppetto di casuccie che dormivano quasi raggomitolate sulla riva, e in cima allo scoglio, sul cielo trasparente e profondo, si stampava netta la vostra figurina, colle linee sapienti che ci metteva la vostra sarta, e il profilo fine ed elegante che ci mettevate voi.","NO"
"Verga_Giovanni-Vita_Dei_Campi-1880","Verga Giovanni","Vita Dei Campi","1880","- Avevate un vestitino grigio che sembrava fatto apposta per intonare coi colori dell'alba. - Un bel quadretto davvero! e si indovinava che lo sapevate anche voi dal modo col quale vi modellavate nel vostro scialletto, e sorridevate coi grandi occhioni sbarrati e stanchi a quello strano spettacolo, e a quell'altra stranezza di trovarvici anche voi presente.","YES"
"Verga_Giovanni-Vita_Dei_Campi-1880","Verga Giovanni","Vita Dei Campi","1880","Che cosa avveniva nella vostra testolina mentre contemplavate il sole nascente? Gli domandavate forse in qual altro emisfero vi avrebbe ritrovata fra un mese? Diceste soltanto ingenuamente: ""Non capisco come si possa viver qui tutta la vita"".","YES"
"Verga_Giovanni-Vita_Dei_Campi-1880","Verga Giovanni","Vita Dei Campi","1880","Eppure, vedete, la cosa è più facile che non sembri: basta non possedere centomila lire di entrata, prima di tutto; e in compenso patire un po' di tutti gli stenti fra quegli scogli giganteschi, incastonati nell'azzurro, che vi facevano batter le mani per ammirazione. Così poco basta perché quei poveri diavoli che ci aspettavano sonnecchiando nella barca, trovino fra quelle loro casipole sgangherate e pittoresche, che viste da lontano vi sembravano avessero il mal di mare anch'esse, tutto ciò che vi affannate a cercare a Parigi, a Nizza ed a Napoli. È una cosa singolare; ma forse non è male che sia così - per voi, e per tutti gli altri come voi.","NO"
"Verga_Giovanni-Vita_Dei_Campi-1880","Verga Giovanni","Vita Dei Campi","1880","Quel mucchio di casipole è abitato da pescatori; ""gente di mare"", dicon essi, come altri direbbe ""gente di toga"", i quali hanno la pelle più dura del pane che mangiano, quando ne mangiano, giacché il mare non è sempre gentile, come allora che baciava i vostri guanti... Nelle sue giornate nere, in cui brontola e sbuffa, bisogna contentarsi di stare a guardarlo dalla riva, colle mani in mano, o sdraiati bocconi, il che è meglio per chi non ha desinato; in quei giorni c'è folla sull'uscio dell'osteria, ma suonano pochi soldoni sulla latta del banco, e i monelli che pullulano nel paese, come se la miseria fosse un buon ingrasso, strillano e si graffiano quasi abbiano il diavolo in corpo. Di tanto in tanto il tifo, il colèra, la malannata, la burrasca, vengono a dare una buona spazzata in quel brulicame, il quale si crederebbe che non dovesse desiderar di meglio che esser spazzato, e scomparire; eppure ripullula sempre nello stesso luogo; non so dirvi come, né perché. Vi siete mai trovata, dopo una pioggia di autunno, a sbaragliare un esercito di formiche tracciando sbadatamente il nome del vostro ultimo ballerino sulla sabbia del viale?","YES"
"Verga_Giovanni-Vita_Dei_Campi-1880","Verga Giovanni","Vita Dei Campi","1880","Qualcuna di quelle povere bestioline sarà rimasta attaccata alla ghiera del vostro ombrellino, torcendosi di spasimo; ma tutte le altre, dopo cinque minuti di pànico e di viavai, saranno tornate ad aggrapparsi disperatamente al loro monticello bruno. Voi non ci tornereste davvero, e nemmen io; ma per poter comprendere siffatta caparbietà, che è per certi aspetti eroica, bisogna farci piccini anche noi, chiudere tutto l'orizzonte fra due zolle, e guardare col microscopio le piccole cause che fanno battere i piccoli cuori. Volete metterci un occhio anche voi, a cotesta lente, voi che guardate la vita dall'altro lato del cannocchiale?","NO"
"Verga_Giovanni-Vita_Dei_Campi-1880","Verga Giovanni","Vita Dei Campi","1880","Lo spettacolo vi parrà strano, e perciò forse vi divertirà. Noi siamo stati amicissimi, ve ne rammentate? e mi avete chiesto di dedicarvi qualche pagina.","NO"
"Verga_Giovanni-Vita_Dei_Campi-1880","Verga Giovanni","Vita Dei Campi","1880","Perché? à quoi bon? come dite voi?","NO"
"Verga_Giovanni-Vita_Dei_Campi-1880","Verga Giovanni","Vita Dei Campi","1880","Che cosa potrà valere quel che scrivo per chi vi conosce? e per chi non vi conosce che cosa siete voi? Tant'è, mi son rammentato del vostro capriccio un giorno che ho rivisto quella povera donna cui solevate far l'elemosina col pretesto di comperar le sue arancie messe in fila sul panchettino dinanzi all'uscio.","YES"
"Verga_Giovanni-Vita_Dei_Campi-1880","Verga Giovanni","Vita Dei Campi","1880","Ora il panchettino non c'è più; hanno tagliato il nespolo del cortile, e la casa ha una finestra nuova. La donna sola non aveva mutato, stava un po' più in là a stender la mano ai carrettieri, accoccolata sul mucchietto di sassi che barricano il vecchio posto della guardia nazionale; ed io girellando, col sigaro in bocca, ho pensato che anche lei, così povera com'è, vi avea vista passare, bianca e superba. Non andate in collera se mi son rammentato di voi in tal modo a questo proposito.","NO"
"Verga_Giovanni-Vita_Dei_Campi-1880","Verga Giovanni","Vita Dei Campi","1880","Oltre i lieti ricordi che mi avete lasciati, ne ho cento altri, vaghi, confusi, disparati, raccolti qua e là, non so più dove; forse alcuni son ricordi di sogni fatti ad occhi aperti; e nel guazzabuglio che facevano nella mia mente, mentre io passava per quella viuzza dove son passate tante cose liete e dolorose, la mantellina di quella donnicciola freddolosa, accoccolata, poneva un non so che di triste e mi faceva pensare a voi, sazia di tutto, perfino dell'adulazione che getta ai vostri piedi il giornale di moda, citandovi spesso in capo alla cronaca elegante - sazia così da inventare il capriccio di vedere il vostro nome sulle pagine di un libro. Quando scriverò il libro, forse non ci penserete più; intanto i ricordi che vi mando, così lontani da voi in ogni senso, da voi inebbriata di feste e di fiori, vi faranno l'effetto di una brezza deliziosa, in mezzo alle veglie ardenti del vostro eterno carnevale. Il giorno in cui ritornerete laggiù, se pur ci ritornerete, e siederemo accanto un'altra volta, a spinger sassi col piede, e fantasie col pensiero, parleremo forse di quelle altre ebbrezze che ha la vita altrove.","NO"
"Verga_Giovanni-Vita_Dei_Campi-1880","Verga Giovanni","Vita Dei Campi","1880","Potete anche immaginare che il mio pensiero siasi raccolto in quel cantuccio ignorato del mondo, perché il vostro piede vi si è posato, - o per distogliere i miei occhi dal luccichìo che vi segue dappertutto, sia di gemme o di febbri - oppure perché vi ho cercata inutilmente per tutti i luoghi che la moda fa lieti. Vedete quindi che siete sempre al primo posto, qui come al teatro. Vi ricordate anche di quel vecchietto che stava al timone della nostra barca?","YES"
"Verga_Giovanni-Vita_Dei_Campi-1880","Verga Giovanni","Vita Dei Campi","1880","Voi gli dovete questo tributo di riconoscenza perché egli vi ha impedito dieci volte di bagnarvi le vostre belle calze azzurre. Ora è morto laggiù all'ospedale della città, il povero diavolo, in una gran corsìa tutta bianca, fra dei lenzuoli bianchi, masticando del pane bianco, servito dalle bianche mani delle suore di carità, le quali non avevano altro difetto che di non saper capire i meschini guai che il poveretto biascicava nel suo dialetto semibarbaro. Ma se avesse potuto desiderare qualche cosa egli avrebbe voluto morire in quel cantuccio nero vicino al focolare, dove tanti anni era stata la sua cuccia ""sotto le sue tegole"", tanto che quando lo portarono via piangeva guaiolando, come fanno i vecchi.","YES"
"Verga_Giovanni-Vita_Dei_Campi-1880","Verga Giovanni","Vita Dei Campi","1880","Egli era vissuto sempre fra quei quattro sassi, e di faccia a quel mare bello e traditore col quale dové lottare ogni giorno per trarre da esso tanto da campare la vita e non lasciargli le ossa; eppure in quei momenti in cui si godeva cheto cheto la sua ""occhiata di sole"" accoccolato sulla pedagna della barca, coi ginocchi fra le braccia, non avrebbe voltato la testa per vedervi, ed avreste cercato invano in quegli occhi attoniti il riflesso più superbo della vostra bellezza; come quando tante fronti altere s'inchinano a farvi ala nei saloni splendenti, e vi specchiate negli occhi invidiosi delle vostre migliori amiche. La vita è ricca, come vedete, nella sua inesauribile varietà; e voi potete godervi senza scrupoli quella parte di ricchezza che è toccata a voi, a modo vostro. Quella ragazza, per esempio, che faceva capolino dietro i vasi di basilico, quando il fruscìo della vostra veste metteva in rivoluzione la viuzza, se vedeva un altro viso notissimo alla finestra di faccia, sorrideva come se fosse stata vestita di seta anch'essa.","NO"
"Verga_Giovanni-Vita_Dei_Campi-1880","Verga Giovanni","Vita Dei Campi","1880","Chi sa quali povere gioie sognava su quel davanzale, dietro quel basilico odoroso, cogli occhi intenti in quell'altra casa coronata di tralci di vite? E il riso dei suoi occhi non sarebbe andato a finire in lagrime amare, là, nella città grande, lontana dai sassi che l'avevano vista nascere e la conoscevano, se il suo nonno non fosse morto all'ospedale. e suo padre non si fosse annegato, e tutta la sua famiglia non fosse stata dispersa da un colpo di vento che vi avea soffiato sopra - un colpo di vento funesto, che avea trasportato uno dei suoi fratelli fin nelle carceri di Pantelleria: ""nei guai!""","YES"
"Verga_Giovanni-Vita_Dei_Campi-1880","Verga Giovanni","Vita Dei Campi","1880","come dicono laggiù. Miglior sorte toccò a quelli che morirono; a Lissa l'uno, il più grande, quello che vi sembrava un David di rame, ritto colla sua fiocina in pugno, e illuminato bruscamente dalla fiamma dell'ellera. Grande e grosso com'era, si faceva di brace anch'esso se gli fissavate in volto i vostri occhi arditi; nondimeno è morto da buon marinaio, sulla verga di trinchetto, fermo al sartiame, levando in alto il berretto, e salutando un'ultima volta la bandiera col suo maschio e selvaggio grido d'isolano.","NO"
"Verga_Giovanni-Vita_Dei_Campi-1880","Verga Giovanni","Vita Dei Campi","1880","L'altro, quell'uomo che sull'isolotto non osava toccarvi il piede per liberarlo dal lacciuolo teso ai conigli nel quale v'eravate impigliata da stordita che siete, si perdé in una fosca notte d'inverno, solo, fra i cavalloni scatenati, quando fra la barca e il lido, dove stavano ad aspettarlo i suoi, andando di qua e di là come pazzi, c'erano sessanta miglia di tenebre e di tempesta. Voi non avreste potuto immaginare di qual disperato e tetro coraggio fosse capace per lottare contro tal morte quell'uomo che lasciavasi intimidire dal capolavoro del vostro calzolaio. Meglio per loro che son morti, e non ""mangiano il pane del re"", come quel poveretto che è rimasto a Pantelleria, e quell'altro pane che mangia la sorella, e non vanno attorno come la donna delle arancie, a viver della grazia di Dio; una grazia assai magra ad Aci-Trezza.","YES"
"Verga_Giovanni-Vita_Dei_Campi-1880","Verga Giovanni","Vita Dei Campi","1880","Quelli almeno non hanno più bisogno di nulla! Lo disse anche il ragazzo dell'ostessa, l'ultima volta che andò all'ospedale per chieder del vecchio e portargli di nascosto dì quelle chiocciole stufate che son così buone a succiare per chi non ha più denti, e trovò il letto vuoto, colle coperte belle e distese, e sgattaiolando nella corte andò a piantarsi dinanzi a una porta tutta brandelli di cartaccie, sbirciando dal buco della chiave una gran sala vuota, sonora e fredda anche di estate, e l'estremità di una lunga tavola di marmo, su cui era buttato un lenzuolo, greve e rigido. E dicendo che quelli là almeno non avevano più bisogno di nulla, si mise a succiare ad una ad una le chiocciole che non servivano più, per passare il tempo.","YES"
"Verga_Giovanni-Vita_Dei_Campi-1880","Verga Giovanni","Vita Dei Campi","1880","Voi, stringendovi al petto il manicotto di volpe azzurra, vi rammenterete con piacere che gli avete dato cento lire al povero vecchio. Ora rimangono quei monellucci che vi scortavano come sciacalli e assediavano le arancie; rimangono a ronzare attorno alla mendica, a brancicarle le vesti come se ci avesse sotto del pane, a raccattar torsi di cavolo, buccie d'arancie e mozziconi di sigari, tutte quelle cose che si lasciano cadere per via ma che pure devono avere ancora qualche valore, perché c'è della povera gente che ci campa su; ci campa anzi così bene che quei pezzentelli paffuti e affamati cresceranno in mezzo al fango e alla polvere della strada, e si faranno grandi e grossi come il loro babbo e come il loro nonno, e popoleranno Aci-Trezza di altri pezzentelli, i quali tireranno allegramente la vita coi denti più a lungo che potranno, come il vecchio nonno, senza desiderare altro; e se vorranno fare qualche cosa diversamente da lui, sarà di chiudere gli occhi là dove li hanno aperti, in mano del medico del paese che viene tutti i giorni sull'asinello, come Gesù, ad aiutare la buona gente che se ne va. - Insomma l'ideale dell'ostrica!","NO"
"Verga_Giovanni-Vita_Dei_Campi-1880","Verga Giovanni","Vita Dei Campi","1880","direte voi. - Proprio l'ideale dell'ostrica, e noi non abbiamo altro motivo di trovarlo ridicolo che quello di non esser nati ostriche anche noi. Per altro il tenace attaccamento di quella povera gente allo scoglio sul quale la fortuna li ha lasciati cadere mentre seminava principi di qua e duchesse di là, questa rassegnazione coraggiosa ad una vita di stenti, questa religione della famiglia, che si riverbera sul mestiere, sulla casa, e sui sassi che la circondano, mi sembrano - forse pel quarto d'ora - cose serissime e rispettabilissime anch'esse.","YES"
"Verga_Giovanni-Vita_Dei_Campi-1880","Verga Giovanni","Vita Dei Campi","1880","Parmi che le irrequietudini del pensiero vagabondo s'addormenterebbero dolcemente nella pace serena di quei sentimenti miti, semplici, che si succedono calmi e inalterati di generazione in generazione. - Parmi che potrei vedervi passare, al gran trotto dei vostri cavalli, col tintinnìo allegro dei loro finimenti e salutarvi tranquillamente. Forse perché ho troppo cercato di scorgere entro al turbine che vi circonda e vi segue, mi è parso ora di leggere una fatale necessità nelle tenaci affezioni dei deboli, nell'istinto che hanno i piccoli di stringersi fra loro per resistere alle tempeste della vita, e ho cercato di decifrare il dramma modesto e ignoto che deve aver sgominati gli attori plebei che conoscemmo insieme.","NO"
"Verga_Giovanni-Vita_Dei_Campi-1880","Verga Giovanni","Vita Dei Campi","1880","Un dramma che qualche volta forse vi racconterò e di cui parmi tutto il nodo debba consistere in ciò: - che allorquando uno di quei piccoli, o più debole, o più incauto, o più egoista degli altri, volle staccarsi dal gruppo per vaghezza dell'ignoto, o per brama di meglio, o per curiosità di conoscere il mondo, il mondo da pesce vorace com'è, se lo ingoiò, e i suoi più prossimi con lui. - E sotto questo aspetto vedete che il dramma non manca d'interesse. Per le ostriche l'argomento più interessante deve esser quello che tratta delle insidie del gambero, o del coltello del palombaro che le stacca dallo scoglio.","YES"
"Verga_Giovanni-Vita_Dei_Campi-1880","Verga Giovanni","Vita Dei Campi","1880","Jeli il pastore Jeli, il guardiano di cavalli, aveva tredici anni quando conobbe don Alfonso, il signorino; ma era così piccolo che non arrivava alla pancia della bianca, la vecchia giumenta che portava il campanaccio della mandra. Lo si vedeva sempre di qua e di là, pei monti e nella pianura, dove pascolavano le sue bestie, ritto ed immobile su qualche greppo, o accoccolato su di un gran sasso. Il suo amico don Alfonso, mentre era in villeggiatura, andava a trovarlo tutti i giorni che Dio mandava a Tebidi, e divideva con lui il suo pezzetto di cioccolata e il pane d'orzo del pastorello, e le frutta rubate al vicino.","NO"
"Verga_Giovanni-Vita_Dei_Campi-1880","Verga Giovanni","Vita Dei Campi","1880","Dapprincipio, Jeli dava dell'eccellenza al signorino, come si usa in Sicilia, ma dopo che si furono accapigliati per bene, la loro amicizia fu stabilita solidamente. Jeli insegnava al suo amico come si fa ad arrampicarsi sino ai nidi delle gazze, sulle cime dei noci più alti del campanile di Licodia, a cogliere un passero a volo con una sassata, e montare con un salto sul dorso nudo delle sue bestie mezze selvaggie, acciuffando per la criniera la prima che passava a tiro, senza lasciarsi sbigottire dai nitriti di collera dei puledri indomiti, e dai loro salti disperati. Ah!","NO"
"Verga_Giovanni-Vita_Dei_Campi-1880","Verga Giovanni","Vita Dei Campi","1880","le belle scappate pei campi mietuti, colle criniere al vento! i bei giorni d'aprile, quando il vento accavallava ad onde l'erba verde, e le cavalle nitrivano nei pascoli; i bei meriggi d'estate, in cui la campagna, bianchiccia, taceva, sotto il cielo fosco, e i grilli scoppiettavano fra le zolle, come se le stoppie si incendiassero! il bel cielo d'inverno attraverso i rami nudi del mandorlo, che rabbrividivano al rovajo, e il viottolo che suonava gelato sotto lo zoccolo dei cavalli, e le allodole che trillavano in alto, al caldo, nell'azzurro!","YES"
"Verga_Giovanni-Vita_Dei_Campi-1880","Verga Giovanni","Vita Dei Campi","1880","le belle sere di estate che salivano adagio adagio come la nebbia; il buon odore del fieno in cui si affondavano i gomiti, e il ronzìo malinconico degli insetti della sera, e quelle due note dello zufolo di Jeli, sempre le stesse - iuh! iuh! iuh!","NO"
"Verga_Giovanni-Vita_Dei_Campi-1880","Verga Giovanni","Vita Dei Campi","1880","che facevano pensare alle cose lontane, alla festa di San Giovanni, alla notte di Natale, all'alba della scampagnata, a tutti quei grandi avvenimenti trascorsi, che sembrano mesti, così lontani, e facevano guardare in alto, cogli occhi umidi, quasi tutte le stelle che andavano accendendosi in cielo vi piovessero in cuore, e l'allagassero! Jeli, lui, non pativa di quella malinconia; se ne stava accoccolato sul ciglione, colle gote enfiate, intentissimo a suonare iuh! iuh!","NO"
"Verga_Giovanni-Vita_Dei_Campi-1880","Verga Giovanni","Vita Dei Campi","1880","iuh! Poi radunava il branco a furia di gridi e di sassate, e lo spingeva nella stalla, di là del poggio alla Croce. Ansando, saliva la costa, di là dal vallone, e gridava qualche volta al suo amico Alfonso: - Chiamati il cane!","NO"
"Verga_Giovanni-Vita_Dei_Campi-1880","Verga Giovanni","Vita Dei Campi","1880","ohé, chiamati il cane; oppure: - Tirami una buona sassata allo zaino, che mi fa il signorino, e se ne viene adagio adagio, gingillandosi colle macchie del vallone; oppure: - Domattina portami un ago grosso, di quelli della gnà Lia. Ei sapeva fare ogni sorta di lavori coll'ago; e ci aveva un batuffoletto di cenci nella sacca di tela, per rattoppare al bisogno le brache e le maniche del giubbone; sapeva anche tessere dei trecciuoli di crini di cavallo, e si lavava anche da sé colla creta del vallone il fazzoletto che si metteva al collo, quando aveva freddo. Insomma, purché ci avesse la sua sacca ad armacollo, non aveva bisogno di nessuno al mondo, fosse stato nei boschi di Resecone, o perduto in fondo alla piana di Caltagirone.","NO"
"Verga_Giovanni-Vita_Dei_Campi-1880","Verga Giovanni","Vita Dei Campi","1880","La gnà Lia soleva dire: - Vedete Jeli il pastore? è stato sempre solo pei campi come se l'avessero figliato le sue cavalle, ed è perciò che sa farsi la croce con le due mani! Del rimanente è vero che Jeli non aveva bisogno di nessuno, ma tutti quelli della fattoria avrebbero fatto volentieri qualche cosa per lui, poiché era un ragazzo servizievole, e ci era sempre il caso di buscarci qualche cosa da lui.","NO"
"Verga_Giovanni-Vita_Dei_Campi-1880","Verga Giovanni","Vita Dei Campi","1880","La gnà Lia gli cuoceva il pane per amor del prossimo, ed ei la ricambiava con bei panierini di vimini per le ova, arcolai di canna, ed altre coserelle. - Facciamo come fanno le sue bestie, diceva la gnà Lia, che si grattano il collo a vicenda. A Tebidi tutti lo conoscevano da piccolo, che non si vedeva fra le code dei cavalli, quando pascolavano nel piano del lettighiere, ed era cresciuto, si può dire, sotto i loro occhi, sebbene nessuno lo vedesse mai, e ramingasse sempre di qua e di là col suo armento!","NO"
"Verga_Giovanni-Vita_Dei_Campi-1880","Verga Giovanni","Vita Dei Campi","1880","""Era piovuto dal cielo, e la terra l'aveva raccolto"" come dice il proverbio; era proprio di quelli che non hanno né casa né parenti. La sua mamma stava a servire a Vizzini, e non lo vedeva altro che una volta all'anno quando egli andava coi puledri alla fiera di San Giovanni; e il giorno in cui era morta, erano venuti a chiamarlo, un sabato sera, ed il lunedì Jeli tornò alla mandra, sicché il contadino che l'aveva surrogato nella guardia dei cavalli, non perse nemmeno la giornata; ma il povero ragazzo era ritornato così sconvolto che alle volte lasciava scappare i puledri nel seminato. - Ohé!","NO"
"Verga_Giovanni-Vita_Dei_Campi-1880","Verga Giovanni","Vita Dei Campi","1880","Jeli! gli gridava allora Massaro Agrippino dall'aja; o che vuoi assaggiare le nerbate delle feste, figlio di cagna? - Jeli si metteva a correre dietro i puledri sbrancati, e li spingeva mogio mogio verso la collina; però davanti agli occhi ci aveva sempre la sua mamma, col capo avvolto nel fazzoletto bianco, che non gli parlava più.","YES"
"Verga_Giovanni-Vita_Dei_Campi-1880","Verga Giovanni","Vita Dei Campi","1880","Suo padre faceva il vaccaro a Ragoleti, di là di Licodia, ""dove la malaria si poteva mietere"" dicevano i contadini dei dintorni; ma nei terreni di malaria i pascoli sono grassi, e le vacche non prendono le febbri. Jeli quindi se ne stava nei campi tutto l'anno, o a Don Ferrante, o nelle chiuse della Commenda, o nella valle del Jacitano, e i cacciatori, o i viandanti che prendevano le scorciatoie lo vedevano sempre qua e là, come un cane senza padrone. Ei non ci pativa, perché era avvezzo a stare coi cavalli che gli camminavano dinanzi, passo passo, brucando il trifoglio, e cogli uccelli che girovagavano a stormi, attorno a lui, tutto il tempo che il sole faceva il suo viaggio lento lento, sino a che le ombre si allungavano e poi si dileguavano; egli avea il tempo di veder le nuvole accavallarsi a poco a poco e figurar monti e vallate; conosceva come spira il vento quando porta il temporale, e di che colore sia il nuvolo quando sta per nevicare.","NO"
"Verga_Giovanni-Vita_Dei_Campi-1880","Verga Giovanni","Vita Dei Campi","1880","Ogni cosa aveva il suo aspetto e il suo significato, e c'era sempre che vedere e che ascoltare in tutte le ore del giorno. Così, verso il tramonto quando il pastore si metteva a suonare collo zufolo di sambuco, la cavalla mora si accostava masticando il trifoglio svogliatamente, e stava anch'essa a guardarlo, con grandi occhi pensierosi. Dove soffriva soltanto un po' di malinconia era nelle lande deserte di Passanitello, in cui non sorge macchia né arbusto, e ne' mesi caldi non ci vola un uccello.","NO"
