"filename","nome","titolo","anno","chunk","DIL"
"Verga_Giovanni-Vita_Dei_Campi-1880","Verga Giovanni","Vita Dei Campi","1880","Sta' attento se cascano dall'alto dei sassolini o della rena grossa"". Tutt'a un tratto non disse più nulla, e Malpelo, che si era voltato a riporre i ferri nel corbello, udì un rumore sordo e soffocato, come fa la rena allorché si rovescia tutta in una volta; ed il lume si spense. Quella sera in cui vennero a cercare in tutta fretta l'ingegnere che dirigeva i lavori della cava ei si trovava a teatro, e non avrebbe cambiato la sua poltrona con un trono, perch'era gran dilettante.","NO"
"Verga_Giovanni-Vita_Dei_Campi-1880","Verga Giovanni","Vita Dei Campi","1880","Rossi rappresentava l'Amleto, e c'era un bellissimo teatro. Sulla porta si vide accerchiato da tutte le femminucce di Monserrato, che strillavano e si picchiavano il petto per annunziare la gran disgrazia ch'era toccata a comare Santa, la sola, poveretta, che non dicesse nulla, e sbatteva i denti quasi fosse in gennaio. L'ingegnere, quando gli ebbero detto che il caso era accaduto da circa quattro ore, domandò cosa venissero a fare da lui dopo quattro ore.","NO"
"Verga_Giovanni-Vita_Dei_Campi-1880","Verga Giovanni","Vita Dei Campi","1880","Nondimeno ci andò con scale e torcie a vento, ma passarono altre due ore, e fecero sei, e lo sciancato disse che a sgomberare il sotterraneo dal materiale caduto ci voleva una settimana. Altro che quaranta carra di rena! Della rena ne era caduta una montagna, tutta fina e ben bruciata dalla lava, che si sarebbe impastata colle mani e dovea prendere il doppio di calce.","NO"
"Verga_Giovanni-Vita_Dei_Campi-1880","Verga Giovanni","Vita Dei Campi","1880","Ce n'era da riempire delle carra per delle settimane. Il bell'affare di mastro Bestia! L'ingegnere se ne tornò a veder seppellire Ofelia; e gli altri minatori si strinsero nelle spalle, e se ne tornarono a casa ad uno ad uno.","YES"
"Verga_Giovanni-Vita_Dei_Campi-1880","Verga Giovanni","Vita Dei Campi","1880","Nella ressa e nel gran chiacchierìo non badarono a una voce di fanciullo, la quale non aveva più nulla di umano, e strillava: - Scavate! scavate qui! presto!","NO"
"Verga_Giovanni-Vita_Dei_Campi-1880","Verga Giovanni","Vita Dei Campi","1880","- To'! - disse lo sciancato - è Malpelo! - Da dove è venuto fuori Malpelo?","NO"
"Verga_Giovanni-Vita_Dei_Campi-1880","Verga Giovanni","Vita Dei Campi","1880","- Se tu non fossi stato Malpelo, non te la saresti scappata, no! - Gli altri si misero a ridere, e chi diceva che Malpelo avea il diavolo dalla sua, un altro che avea il cuoio duro a mo' dei gatti. Malpelo non rispondeva nulla, non piangeva nemmeno, scavava colle unghie colà nella rena, dentro la buca, sicché nessuno s'era accorto di lui; e quando si accostarono col lume gli videro tal viso stravolto, e tali occhiacci invetrati, e tale schiuma alla bocca da far paura; le unghie gli si erano strappate e gli pendevano dalle mani tutte in sangue.","YES"
"Verga_Giovanni-Vita_Dei_Campi-1880","Verga Giovanni","Vita Dei Campi","1880","Poi quando vollero toglierlo di là fu un affar serio; non potendo più graffiare, mordeva come un cane arrabbiato e dovettero afferrarlo pei capelli, per tirarlo via a viva forza. Però infine tornò alla cava dopo qualche giorno, quando sua madre piagnuccolando ve lo condusse per mano; giacché, alle volte il pane che si mangia non si può andare a cercarlo di qua e di là. Anzi non volle più allontanarsi da quella galleria, e sterrava con accanimento, quasi ogni corbello di rena lo levasse di sul petto a suo padre.","YES"
"Verga_Giovanni-Vita_Dei_Campi-1880","Verga Giovanni","Vita Dei Campi","1880","Alle volte, mentre zappava, si fermava bruscamente, colla zappa in aria, il viso torvo e gli occhi stralunati, e sembrava che stesse ad ascoltare qualche cosa che il suo diavolo gli susurrava negli orecchi, dall'altra parte della montagna di rena caduta. In quei giorni era più tristo e cattivo del solito, talmente che non mangiava quasi, e il pane lo buttava al cane, come se non fosse grazia di Dio. Il cane gli voleva bene, perché i cani non guardano altro che la mano la quale dà loro il pane.","NO"
"Verga_Giovanni-Vita_Dei_Campi-1880","Verga Giovanni","Vita Dei Campi","1880","Ma l'asino grigio, povera bestia, sbilenca e macilenta, sopportava tutto lo sfogo della cattiveria di Malpelo; ei lo picchiava senza pietà, col manico della zappa, e borbottava: - Così creperai più presto! Dopo la morte del babbo pareva che gli fosse entrato il diavolo in corpo, e lavorava al pari di quei bufali feroci che si tengono coll'anello di ferro al naso. Sapendo che era malpelo, ei si acconciava ad esserlo il peggio che fosse possibile, e se accadeva una disgrazia, o che un operaio smarriva i ferri, o che un asino si rompeva una gamba, o che crollava un pezzo di galleria, si sapeva sempre che era stato lui; e infatti ei si pigliava le busse senza protestare, proprio come se le pigliano gli asini che curvano la schiena, ma seguitano a fare a modo loro.","YES"
"Verga_Giovanni-Vita_Dei_Campi-1880","Verga Giovanni","Vita Dei Campi","1880","Cogli altri ragazzi poi era addirittura crudele, e sembrava che si volesse vendicare sui deboli di tutto il male che s'immaginava gli avessero fatto, a lui e al suo babbo. Certo ei provava uno strano diletto a rammentare ad uno ad uno tutti i maltrattamenti ed i soprusi che avevano fatto subire a suo padre, e del modo in cui l'avevano lasciato crepare. E quando era solo borbottava: ""Anche con me fanno così!","YES"
"Verga_Giovanni-Vita_Dei_Campi-1880","Verga Giovanni","Vita Dei Campi","1880","e a mio padre gli dicevano Bestia, perché ei non faceva così!"". E una volta che passava il padrone, accompagnandolo con un'occhiata torva: ""È stato lui, per trentacinque tarì!"". E un'altra volta, dietro allo sciancato: ""E anche lui!","YES"
"Verga_Giovanni-Vita_Dei_Campi-1880","Verga Giovanni","Vita Dei Campi","1880","e si metteva a ridere! Io l'ho udito, quella sera! "".","NO"
"Verga_Giovanni-Vita_Dei_Campi-1880","Verga Giovanni","Vita Dei Campi","1880","Per un raffinamento di malignità sembrava aver preso a proteggere un povero ragazzetto, venuto a lavorare da poco tempo nella cava, il quale per una caduta da un ponte s'era lussato il femore, e non poteva far più il manovale. Il poveretto, quando portava il suo corbello di rena in spalla, arrancava in modo che sembrava ballasse la tarantella, e aveva fatto ridere tutti quelli della cava, così che gli avevano messo nome Ranocchio; ma lavorando sotterra, così ranocchio com'era, il suo pane se lo buscava; e Malpelo gliene dava anche del suo, per prendersi il gusto di tiranneggiarlo, dicevano. Infatti egli lo tormentava in cento modi.","YES"
"Verga_Giovanni-Vita_Dei_Campi-1880","Verga Giovanni","Vita Dei Campi","1880","Ora lo batteva senza un motivo e senza misericordia, e se Ranocchio non si difendeva, lo picchiava più forte, con maggiore accanimento, e gli diceva: - To'! Bestia! Bestia sei!","NO"
"Verga_Giovanni-Vita_Dei_Campi-1880","Verga Giovanni","Vita Dei Campi","1880","Se non ti senti l'animo di difenderti da me che non ti voglio male, vuol dire che ti lascerai pestare il viso da questo e da quello! O se Ranocchio si asciugava il sangue che gli usciva dalla bocca o dalle narici: - Così, come ti cuocerà il dolore delle busse, imparerai a darne anche tu! - Quando cacciava un asino carico per la ripida salita del sotterraneo, e lo vedeva puntare gli zoccoli, rifinito, curvo sotto il peso, ansante e coll'occhio spento, ei lo batteva senza misericordia, col manico della zappa, e i colpi suonavano secchi sugli stinchi e sulle costole scoperte.","NO"
"Verga_Giovanni-Vita_Dei_Campi-1880","Verga Giovanni","Vita Dei Campi","1880","Alle volte la bestia si piegava in due per le battiture, ma stremo di forze non poteva fare un passo, e cadeva sui ginocchi, e ce n'era uno il quale era caduto tante volte, che ci aveva due piaghe alle gambe; e Malpelo allora confidava a Ranocchio: - L'asino va picchiato, perché non può picchiar lui; e s'ei potesse picchiare, ci pesterebbe sotto i piedi e ci strapperebbe la carne a morsi. Oppure: - Se ti accade di dar delle busse, procura di darle più forte che puoi; così coloro su cui cadranno ti terranno per da più di loro, e ne avrai tanti di meno addosso. Lavorando di piccone o di zappa poi menava le mani con accanimento, a mo' di uno che l'avesse con la rena, e batteva e ribatteva coi denti stretti, e con quegli ah!","NO"
"Verga_Giovanni-Vita_Dei_Campi-1880","Verga Giovanni","Vita Dei Campi","1880","ah! che aveva suo padre. - La rena è traditora, diceva a Ranocchio sottovoce; somiglia a tutti gli altri, che se sei più debole ti pestano la faccia, e se sei più forte, o siete in molti, come fa lo Sciancato, allora si lascia vincere.","YES"
"Verga_Giovanni-Vita_Dei_Campi-1880","Verga Giovanni","Vita Dei Campi","1880","Mio padre la batteva sempre, ed egli non batteva altro che la rena, perciò lo chiamavano Bestia, e la rena se lo mangiò a tradimento, perché era più forte di lui. Ogni volta che a Ranocchio toccava un lavoro troppo pesante, e Ranocchio piagnuccolava a guisa di una femminuccia, Malpelo lo picchiava sul dorso e lo sgridava: - Taci pulcino! - e se Ranocchio non la finiva più, ei gli dava una mano, dicendo con un certo orgoglio: - Lasciami fare; io sono più forte di te.","NO"
"Verga_Giovanni-Vita_Dei_Campi-1880","Verga Giovanni","Vita Dei Campi","1880","- Oppure gli dava la sua mezza cipolla, e si contentava di mangiarsi il pane asciutto, e si stringeva nelle spalle, aggiungendo: - Io ci sono avvezzo. Era avvezzo a tutto lui, agli scapaccioni, alle pedate, ai colpi di manico di badile, o di cinghia da basto, a vedersi ingiuriato e beffato da tutti, a dormire sui sassi, colle braccia e la schiena rotta da quattordici ore dì lavoro; anche a digiunare era avvezzo, allorché il padrone lo puniva levandogli il pane o la minestra. Ei diceva che la razione di busse non gliela aveva levata mai il padrone; ma le busse non costavano nulla.","YES"
"Verga_Giovanni-Vita_Dei_Campi-1880","Verga Giovanni","Vita Dei Campi","1880","Non si lamentava però, e si vendicava di soppiatto, a tradimento, con qualche tiro di quelli che sembrava ci avesse messo la coda il diavolo: perciò ei si pigliava sempre i castighi anche quando il colpevole non era stato lui; già se non era stato lui sarebbe stato capace di esserlo, e non si giustificava mai: per altro sarebbe stato inutile. E qualche volta come Ranocchio spaventato lo scongiurava piangendo di dire la verità e di scolparsi, ei ripeteva: - A che giova? Sono malpelo!","YES"
"Verga_Giovanni-Vita_Dei_Campi-1880","Verga Giovanni","Vita Dei Campi","1880","- e nessuno avrebbe potuto dire se quel curvare il capo e le spalle sempre fosse effetto di bieco orgoglio o di disperata rassegnazione, e non si sapeva nemmeno se la sua fosse salvatichezza o timidità. Il certo era che nemmeno sua madre aveva avuta mai una carezza da lui, e quindi non gliene faceva mai. Il sabato sera, appena arrivava a casa con quel suo visaccio imbrattato di lentiggini e di rena rossa, e quei cenci che gli piangevano addosso da ogni parte, la sorella afferrava il manico della scopa se si metteva sull'uscio in quell'arnese, ché avrebbe fatto scappare il suo damo se avesse visto che razza di cognato gli toccava sorbirsi; la madre era sempre da questa o da quella vicina, e quindi egli andava a rannicchiarsi sul suo saccone come un cane malato.","YES"
"Verga_Giovanni-Vita_Dei_Campi-1880","Verga Giovanni","Vita Dei Campi","1880","Adunque, la domenica, in cui tutti gli altri ragazzi del vicinato si mettevano la camicia pulita per andare a messa o per ruzzare nel cortile, ei sembrava non avesse altro spasso che di andar randagio per le vie degli orti, a dar la caccia a sassate alle povere lucertole, le quali non gli avevano fatto nulla, oppure a sforacchiare le siepi dei fichidindia. Per altro le beffe e le sassate degli altri fanciulli non gli piacevano. La vedova di mastro Misciu era disperata di aver per figlio quel malarnese, come dicevano tutti, ed egli era ridotto veramente come quei cani, che a furia di buscarsi dei calci e delle sassate da questo e da quello, finiscono col mettersi la coda fra le gambe e scappare alla prima anima viva che vedono, e diventano affamati, spelati e selvatici come lupi.","YES"
"Verga_Giovanni-Vita_Dei_Campi-1880","Verga Giovanni","Vita Dei Campi","1880","Almeno sottoterra, nella cava della rena, brutto e cencioso e sbracato com'era, non lo beffavano più, e sembrava fatto apposta per quel mestiere persin nel colore dei capelli, e in quegli occhiacci di gatto che ammiccavano se vedevano il sole. Così ci sono degli asini che lavorano nelle cave per anni ed anni senza uscirne mai più, ed in quei sotterranei, dove il pozzo di ingresso è verticale, ci si calan colle funi, e ci restano finché vivono. Sono asini vecchi, è vero, comprati dodici o tredici lire, quando stanno per portarli alla Plaja, a strangolarli; ma pel lavoro che hanno da fare laggiù sono ancora buoni; e Malpelo, certo, non valeva di più, e se veniva fuori dalla cava il sabato sera, era perché aveva anche le mani per aiutarsi colla fune, e doveva andare a portare a sua madre la paga della settimana.","YES"
"Verga_Giovanni-Vita_Dei_Campi-1880","Verga Giovanni","Vita Dei Campi","1880","Certamente egli avrebbe preferito di fare il manovale, come Ranocchio, e lavorare cantando sui ponti, in alto, in mezzo all'azzurro del cielo, col sole sulla schiena - o il carrettiere, come compare Gaspare che veniva a prendersi la rena della cava, dondolandosi sonnacchioso sulle stanghe, colla pipa in bocca, e andava tutto il giorno per le belle strade di campagna - o meglio ancora avrebbe voluto fare il contadino che passa la vita fra i campi, in mezzo al verde, sotto i folti carrubbi, e il mare turchino là in fondo, e il canto degli uccelli sulla testa. Ma quello era stato il mestiere di suo padre, e in quel mestiere era nato lui. E pensando a tutto ciò, indicava a Ranocchio il pilastro che era caduto addosso al genitore, e dava ancora della rena fina e bruciata che il carrettiere veniva a caricare colla pipa in bocca, e dondolandosi sulle stanghe, e gli diceva che quando avrebbero finito di sterrare si sarebbe trovato il cadavere di suo padre, il quale doveva avere dei calzoni di fustagno quasi nuovi.","YES"
"Verga_Giovanni-Vita_Dei_Campi-1880","Verga Giovanni","Vita Dei Campi","1880","Ranocchio aveva paura, ma egli no. Ei narrava che era stato sempre là, da bambino, e aveva sempre visto quel buco nero, che si sprofondava sotterra, dove il padre soleva condurlo per mano. Allora stendeva le braccia a destra e a sinistra, e descriveva come l'intricato laberinto delle gallerie si stendesse sotto i loro piedi dappertutto, di qua e di là, sin dove potevano vedere la sciara nera e desolata, sporca di ginestre riarse, e come degli uomini ce n'erano rimasti tanti, o schiacciati, o smarriti nel buio, e che camminano da anni e camminano ancora, senza poter scorgere lo spiraglio del pozzo pel quale sono entrati, e senza poter udire le strida disperate dei figli, i quali li cercano inutilmente.","YES"
"Verga_Giovanni-Vita_Dei_Campi-1880","Verga Giovanni","Vita Dei Campi","1880","Ma una volta in cui riempiendo i corbelli si rinvenne una delle scarpe di mastro Misciu, ei fu colto da tal tremito che dovettero tirarlo all'aria aperta colle funi, proprio come un asino che stesse per dar dei calci al vento. Però non si poterono trovare né i calzoni quasi nuovi, né il rimanente di mastro Misciu; sebbene i pratici asserissero che quello dovea essere il luogo preciso dove il pilastro gli si era rovesciato addosso; e qualche operaio, nuovo del mestiere, osservava curiosamente come fosse capricciosa la rena, che aveva sbatacchiato il Bestia di qua e di là, le scarpe da una parte e i piedi dall'altra. Dacché poi fu trovata quella scarpa, Malpelo fu colto da tal paura di veder comparire fra la rena anche il piede nudo del babbo, che non volle mai più darvi un colpo di zappa; gliela dessero a lui sul capo, la zappa.","YES"
"Verga_Giovanni-Vita_Dei_Campi-1880","Verga Giovanni","Vita Dei Campi","1880","Egli andò a lavorare in un altro punto della galleria e non volle più tornare da quelle parti. Due o tre giorni dopo scopersero infatti il cadavere di mastro Misciu, coi calzoni indosso, e steso bocconi che sembrava imbalsamato. Lo zio Mommu osservò che aveva dovuto stentar molto a morire, perché il pilastro gli si era piegato in arco addosso, e l'aveva seppellito vivo; si poteva persino vedere tuttora che mastro Bestia avea tentato istintivamente di liberarsi scavando nella rena, e avea le mani lacerate e le unghie rotte.","NO"
"Verga_Giovanni-Vita_Dei_Campi-1880","Verga Giovanni","Vita Dei Campi","1880","- Proprio come suo figlio Malpelo! - ripeteva lo sciancato - ei scavava di qua, mentre suo figlio scavava di là. - Però non dissero nulla al ragazzo per la ragione che lo sapevano maligno e vendicativo.","NO"
"Verga_Giovanni-Vita_Dei_Campi-1880","Verga Giovanni","Vita Dei Campi","1880","Il carrettiere sbarazzò il sotterraneo dal cadavere al modo istesso che lo sbarazzava dalla rena caduta e dagli asini morti, ché stavolta oltre al lezzo del carcame, c'era che il carcame era di carne battezzata; e la vedova rimpiccolì i calzoni e la camicia, e li adattò a Malpelo, il quale così fu vestito quasi a nuovo per la prima volta, e le scarpe furono messe in serbo per quando ei fosse cresciuto, giacché rimpiccolirsi le scarpe non si potevano, e il fidanzato della sorella non ne aveva volute di scarpe del morto. Malpelo se li lisciava sulle gambe quei calzoni di fustagno quasi nuovo, gli pareva che fossero dolci e lisci come le mani del babbo che solevano accarezzargli i capelli, così ruvidi e rossi com'erano. Quelle scarpe le teneva appese ad un chiodo, sul saccone, quasi fossero state le pantofole del papa, e la domenica se le pigliava in mano, le lustrava e se le provava; poi le metteva per terra, l'una accanto all'altra, e stava a contemplarsele coi gomiti sui ginocchi, e il mento nelle palme per delle ore intere, rimugginando chi sa quali idee in quel cervellaccio.","YES"
"Verga_Giovanni-Vita_Dei_Campi-1880","Verga Giovanni","Vita Dei Campi","1880","Ei possedeva delle idee strane, Malpelo! Siccome aveva ereditato anche il piccone e la zappa del padre, se ne serviva, quantunque fossero troppo pesanti per l'età sua; e quando gli aveano chiesto se voleva venderli, che glieli avrebbero pagati come nuovi, egli aveva risposto di no; suo padre li ha resi così lisci e lucenti nel manico colle sue mani, ed ei non avrebbe potuto farsene degli altri più lisci e lucenti di quelli, se ci avesse lavorato cento e poi cento anni. In quel tempo era crepato di stenti e di vecchiaia l'asino grigio; e il carrettiere era andato a buttarlo lontano nella sciara.","YES"
"Verga_Giovanni-Vita_Dei_Campi-1880","Verga Giovanni","Vita Dei Campi","1880","- Così si fa, brontolava Malpelo; gli arnesi che non servono più si buttano lontano. - Ei andava a visitare il carcame del grigio in fondo al burrone, e vi conduceva a forza anche Ranocchio, il quale non avrebbe voluto andarci; e Malpelo gli diceva che a questo mondo bisogna avvezzarsi a vedere in faccia ogni cosa bella o brutta; e stava a considerare con l'avida curiosità di un monellaccio i cani che accorrevano da tutte le fattorie dei dintorni a disputarsi le carni del grigio. I cani scappavano guaendo, come comparivano i ragazzi, e si aggiravano ustolando sui greppi dirimpetto, ma il Rosso non lasciava che Ranocchio li scacciasse a sassate.","YES"
"Verga_Giovanni-Vita_Dei_Campi-1880","Verga Giovanni","Vita Dei Campi","1880","- Vedi quella cagna nera, gli diceva, che non ha paura delle tue sassate; non ha paura perché ha più fame degli altri. Gliele vedi quelle costole! Adesso non soffriva più, l'asino grigio, e se ne stava tranquillo colle quattro zampe distese, e lasciava che i cani si divertissero a vuotargli le occhiaie profonde e a spolpargli le ossa bianche e i denti che gli laceravano le viscere non gli avrebbero fatto piegar la schiena come il più semplice colpo di badile che solevano dargli onde mettergli in corpo un po' di vigore quando saliva la ripida viuzza.","YES"
"Verga_Giovanni-Vita_Dei_Campi-1880","Verga Giovanni","Vita Dei Campi","1880","Ecco come vanno le cose! Anche il grigio ha avuto dei colpi di zappa e delle guidalesche, e anch'esso quando piegava sotto il peso e gli mancava il fiato per andare innanzi, aveva di quelle occhiate, mentre lo battevano, che sembrava dicesse: Non più! non più!","YES"
"Verga_Giovanni-Vita_Dei_Campi-1880","Verga Giovanni","Vita Dei Campi","1880","Ma ora gli occhi se li mangiano i cani, ed esso se ne ride dei colpi e delle guidalesche con quella bocca spolpata e tutta denti. E se non fosse mai nato sarebbe stato meglio. La sciara si stendeva malinconica e deserta fin dove giungeva la vista, e saliva e scendeva in picchi e burroni, nera e rugosa, senza un grillo che vi trillasse, o un uccello che vi volasse su.","YES"
"Verga_Giovanni-Vita_Dei_Campi-1880","Verga Giovanni","Vita Dei Campi","1880","Non si udiva nulla, nemmeno i colpi di piccone di coloro che lavoravano sotterra. E ogni volta Malpelo ripeteva che al di sotto era tutta scavata dalle gallerie, per ogni dove, verso il monte e verso la valle; tanto che una volta un minatore c'era entrato coi capelli neri, e n'era uscito coi capelli bianchi, e un altro cui s'era spenta la torcia aveva invano gridato aiuto ma nessuno poteva udirlo. Egli solo ode le sue stesse grida!","YES"
"Verga_Giovanni-Vita_Dei_Campi-1880","Verga Giovanni","Vita Dei Campi","1880","diceva, e a quell'idea, sebbene avesse il cuore più duro della sciara, trasaliva. - Il padrone mi manda spesso lontano, dove gli altri hanno paura d'andare. Ma io sono Malpelo, e se io non torno più, nessuno mi cercherà.","YES"
"Verga_Giovanni-Vita_Dei_Campi-1880","Verga Giovanni","Vita Dei Campi","1880","Pure, durante le belle notti d'estate, le stelle splendevano lucenti anche sulla sciara, e la campagna circostante era nera anch'essa, come la sciara, ma Malpelo stanco della lunga giornata di lavoro, si sdraiava sul sacco, col viso verso il cielo, a godersi quella quiete e quella luminaria dell'alto; perciò odiava le notti di luna, in cui il mare formicola di scintille, e la campagna si disegna qua e là vagamente - allora la sciara sembra più brulla e desolata. - Per noi che siamo fatti per vivere sotterra, pensava Malpelo, ci dovrebbe essere buio sempre e dappertutto. - La civetta strideva sulla sciara, e ramingava di qua e di là; ei pensava: - Anche la civetta sente i morti che son qua sotterra e si dispera perché non può andare a trovarli.","YES"
"Verga_Giovanni-Vita_Dei_Campi-1880","Verga Giovanni","Vita Dei Campi","1880","Ranocchio aveva paura delle civette e dei pipistrelli; ma il Rosso lo sgridava perché chi è costretto a star solo non deve aver paura di nulla, e nemmeno l'asino grigio aveva paura dei cani che se lo spolpavano, ora che le sue carni non sentivano più il dolore di esser mangiate. - Tu eri avvezzo a lavorar sui tetti come i gatti - gli diceva - e allora era tutt'altra cosa. Ma adesso che ti tocca a viver sotterra, come i topi, non bisogna più aver paura dei topi, né dei pipistrelli, che son topi vecchi con le ali, e i topi ci stanno volentieri in compagnia dei morti.","YES"
"Verga_Giovanni-Vita_Dei_Campi-1880","Verga Giovanni","Vita Dei Campi","1880","Ranocchio invece provava una tale compiacenza a spiegargli quel che ci stessero a far le stelle lassù in alto; e gli raccontava che lassù c'era il paradiso, dove vanno a stare i morti che sono stati buoni e non hanno dato dispiaceri ai loro genitori. - Chi te l'ha detto? - domandava Malpelo, e Ranocchio rispondeva che glielo aveva detto la mamma.","NO"
"Verga_Giovanni-Vita_Dei_Campi-1880","Verga Giovanni","Vita Dei Campi","1880","Allora Malpelo si grattava il capo, e sorridendo gli faceva un certo verso da monellaccio malizioso che la sa lunga. - Tua madre ti dice così perché, invece dei calzoni, tu dovresti portar la gonnella. E dopo averci pensato su un po':","NO"
"Verga_Giovanni-Vita_Dei_Campi-1880","Verga Giovanni","Vita Dei Campi","1880","- Mio padre era buono e non faceva male a nessuno, tanto che gli dicevano Bestia. Invece è là sotto, ed hanno persino trovato i ferri e le scarpe e questi calzoni qui che ho indosso io. Da lì a poco, Ranocchio il quale deperiva da qualche tempo, si ammalò in modo che la sera dovevano portarlo fuori dalla cava sull'asino, disteso fra le corbe, tremante di febbre come un pulcin bagnato.","YES"
"Verga_Giovanni-Vita_Dei_Campi-1880","Verga Giovanni","Vita Dei Campi","1880","Un operaio disse che quel ragazzo non ne avrebbe fatto osso duro a quel mestiere, e che per lavorare in una miniera senza lasciarvi la pelle bisognava nascervi. Malpelo allora si sentiva orgoglioso di esserci nato e di mantenersi così sano e vigoroso in quell'aria malsana, e con tutti quegli stenti. Ei si caricava Ranocchio sulle spalle, e gli faceva animo alla sua maniera, sgridandolo e picchiandolo.","YES"
"Verga_Giovanni-Vita_Dei_Campi-1880","Verga Giovanni","Vita Dei Campi","1880","Ma una volta nel picchiarlo sul dorso Ranocchio fu colto da uno sbocco di sangue, allora Malpelo spaventato si affannò a cercargli nel naso e dentro la bocca cosa gli avesse fatto, e giurava che non avea potuto fargli quel gran male, così come l'aveva battuto, e a dimostrarglielo, si dava dei gran pugni sul petto e sulla schiena con un sasso; anzi un operaio, lì presente, gli sferrò un gran calcio sulle spalle, un calcio che risuonò come su di un tamburo, eppure Malpelo non si mosse, e soltanto dopo che l'operaio se ne fu andato, aggiunse: - Lo vedi? Non mi ha fatto nulla! E ha picchiato più forte di me, ti giuro!","YES"
