"filename","nome","titolo","anno","chunk","DIL"
"Vivanti_Anna_Emilia-Mea_culpa-1927","Vivanti Anna Emilia","Mea culpa","1927","E in quel clima torrido ella cresceva rapida, come un fiore dei tropici; cresceva selvaggia, strana, con mille capricci e mille fantasie. Voleva le lontananze e voleva la solitudine; voleva la musica e voleva il silenzio; voleva saper tutto e non voleva imparar nulla; voleva giocare coi piccoli bambini neri, correre scalza attraverso la sabbia gridando con loro; o allora starsene muta e silenziosa sul terrazzo ad ascoltare il lamentoso canto dei barcaioli del Nilo e il cigolio monotono del sakkyeh, la ruota dell’antico pozzo, che girava girava perennemente, trascinata da un vecchio cavallo grigio con gli occhi bendati. Era ritrosa è schiva di carezze.","NO"
"Vivanti_Anna_Emilia-Mea_culpa-1927","Vivanti Anna Emilia","Mea culpa","1927","Talvolta ad Astrid pareva che non fosse una bambina sua, una bambina umana; le sembrava uno spiritello, una creatura selvatica e aerea, che con tremolio d’ali posasse un istante sulla soglia, prima di riprendere il volo. Il Tribunale militare anglo-egiziano del Cairo aveva condannato a morte i due studenti, rei confessi dell’uccisione del Sirdar. E i leader del giovane partito nazionalista, sospetti di incitamento al crimine, furono rinchiusi in un campo di concentramento nel Sudan e tenuti prigionieri per sette anni.","YES"
"Vivanti_Anna_Emilia-Mea_culpa-1927","Vivanti Anna Emilia","Mea culpa","1927","Sette volte erano fiorite e sfiorite le rose del grande giardino al di là del Canale Zomor, prima che il passo rapido e deciso del padrone della Villa risonasse sulla ghiaia dei viali, prima che i suoi occhi di falco spaziassero, nuovamente liberi e indomati, dall’alto della gradinata marmorea, misurando la lontana spianata del deserto fino al remoto orizzonte. I fedeli servi l’attendevano; si prostrarono a baciargli le vesti e a benedirlo. Il vecchio Ibrahim – più grigio e fantomatico che mai – gli narrò quanto era avvenuto durante la sua lunga prigionia, e gli diede le nuove che più interessavano il suo cuore.","NO"
"Vivanti_Anna_Emilia-Mea_culpa-1927","Vivanti Anna Emilia","Mea culpa","1927","Silenzioso il padrone lo ascoltò. Quindi, prima ancora di ricercare e radunare i dispersi compagni di fede per ritessere nell’ombra la trama che i fati avversi avevano lacerato, scese in una luminosa alba d’ottobre alla riva del Nilo. Al pontile d’imbarco, dondolante sulle chiare acque lo attendeva la bianca dahabyeh.","NO"
"Vivanti_Anna_Emilia-Mea_culpa-1927","Vivanti Anna Emilia","Mea culpa","1927","... Il potente cuore della macchina pulsò; e solcando il lucido fiume, portò Saad Nassir verso El Wasta. Nell’ardente meriggio la Loggia delle Mimose sonnecchiava.","NO"
"Vivanti_Anna_Emilia-Mea_culpa-1927","Vivanti Anna Emilia","Mea culpa","1927","Tra ciuffi di fiammeggianti gerani, l’hibiscus levava languida al cielo la frale coppa rosata. Qualche falco roteava pigro nella radiosa azzurrità del cielo. Astrid, uscendo sul terrazzo, scorse legata all’approdo sull’altra sponda del fiume, una dahabyeh dondolante nel sole.","NO"
"Vivanti_Anna_Emilia-Mea_culpa-1927","Vivanti Anna Emilia","Mea culpa","1927","Appoggiò i bianchi gomiti sul parapetto, volgendo intorno lo sguardo sul torrido paesaggio. Era deserto. Soltanto una ragazzetta bruna, in succinto camice arancino, saliva dal fiume reggendo sul capo un otre gocciolante… Sparve.","NO"
"Vivanti_Anna_Emilia-Mea_culpa-1927","Vivanti Anna Emilia","Mea culpa","1927","E la solitudine immensa regnò all’intorno. Lontano, la grande ruota del sakkyeh girava, girava, col suo perenne tormentoso cigolio... Astrid stava per rientrare in casa, quando vide la dahabyeh staccarsi dalla riva opposta e attraversare lentamente il fiume.","NO"
"Vivanti_Anna_Emilia-Mea_culpa-1927","Vivanti Anna Emilia","Mea culpa","1927","Facendosi schermo agli occhi con la mano, essa guardò con curiosità la lussuosa imbarcazione: il bianco ponte chiazzato di tappeti e cuscini multicolori; qualche sedia a sdraio; e a poppa, in candidi lini e sciarpe scarlatte, due marinai e un mozzo. Chi veniva a trovarla a quell’ora? Che fosse qualche visita dal Cairo?","YES"
"Vivanti_Anna_Emilia-Mea_culpa-1927","Vivanti Anna Emilia","Mea culpa","1927","O, forse, la dahabyeh del colonnello James che riconduceva Norman, da tanti giorni assente? Ma no; Norman si trovava ancora nell’Alto Egitto dove era andato ad accompagnare il duca di Buckley nella sua spedizione alla nuova diga di Makwar. D’improvviso Astrid trasalì.","YES"
"Vivanti_Anna_Emilia-Mea_culpa-1927","Vivanti Anna Emilia","Mea culpa","1927","Dalla casa una voce angosciata la chiamava. – Signora!... mio Dio!...","NO"
"Vivanti_Anna_Emilia-Mea_culpa-1927","Vivanti Anna Emilia","Mea culpa","1927","signora!... – Miss O’ Neill! Che c’è?","NO"
"Vivanti_Anna_Emilia-Mea_culpa-1927","Vivanti Anna Emilia","Mea culpa","1927","La povera Miss O’ Neill comparve, pallida, stravolta. – Là... là... sulla veranda... un serpe... Astrid sorrise.","NO"
"Vivanti_Anna_Emilia-Mea_culpa-1927","Vivanti Anna Emilia","Mea culpa","1927","– Ancora!! – Poi con un ansito: – Dov’è Darling? Senza attendere la risposta attraversò di corsa l’oscuro corridoio, e si slanciò fuori sulla veranda.","NO"
"Vivanti_Anna_Emilia-Mea_culpa-1927","Vivanti Anna Emilia","Mea culpa","1927","Un barbaglio di sole, un soffio caldo la investì. Accoccolata nella poltrona di vimini, Darling si chinava innanzi curiosa a guardare in terra vicino a lei un cerchio verdastro e luccicante, mosso da lievi fremiti. Impietrita sul limitare, Astrid non osava avanzare d’un passo, non osava respirare.","NO"
"Vivanti_Anna_Emilia-Mea_culpa-1927","Vivanti Anna Emilia","Mea culpa","1927","L’istinto la spingeva a precipitarsi verso la sua creatura, la ragione le imponeva l’immobilità. La bimba piegava il visetto ridente verso il rettile. – Che fai?","NO"
"Vivanti_Anna_Emilia-Mea_culpa-1927","Vivanti Anna Emilia","Mea culpa","1927","dormi!... Muoviti un po’! E allungò il piedino nudo verso quel cerchio lievemente ondulante.","YES"
"Vivanti_Anna_Emilia-Mea_culpa-1927","Vivanti Anna Emilia","Mea culpa","1927","Con un rantolo di terrore Astrid si precipitò... ma prima di lei – e mentre già il serpe snodandosi dava un guizzo – qualcuno nel giardino s’era slanciato fulmineo a schiacciarne col piede la maligna testa. Darling balzò in piedi con un grido. – Perché...","NO"
"Vivanti_Anna_Emilia-Mea_culpa-1927","Vivanti Anna Emilia","Mea culpa","1927","perché!... – E volse gli occhi lampeggianti sull’intruso. Alto, magro, vestito di tela bianca all’europea, lo sconosciuto stava immobile e la guardava.","NO"
"Vivanti_Anna_Emilia-Mea_culpa-1927","Vivanti Anna Emilia","Mea culpa","1927","Anche la bimba tenne per un istante gli occhi fissi su lui; poi scorgendo ai suoi piedi il rettile che a scatti e guizzi si contorceva ancora, scoppiò in pianto, e corse a rifugiarsi in casa da Miss O’ Neill. Astrid, ancora agghiacciata dallo spavento, cercava una frase, una parola per esprimere allo sconosciuto la sua ardente gratitudine. Egli si era voltato e col piede spingeva fuori sulla ghiaia il serpente morto.","NO"
"Vivanti_Anna_Emilia-Mea_culpa-1927","Vivanti Anna Emilia","Mea culpa","1927","Chi era? si domandava Astrid. Chi era quella figura così nota?...","NO"
"Vivanti_Anna_Emilia-Mea_culpa-1927","Vivanti Anna Emilia","Mea culpa","1927","Il nome non le veniva alle labbra... poi, di colpo, con una scossa nel sangue, lo ravvisò; e rimase atterrita a contemplarlo. Egli si volse e fissò in lei lo sguardo profondo, intenso. – Astrid!...","NO"
"Vivanti_Anna_Emilia-Mea_culpa-1927","Vivanti Anna Emilia","Mea culpa","1927","(Ah! quella voce morbida e grave!...) Non mi riconoscete più?","YES"
"Vivanti_Anna_Emilia-Mea_culpa-1927","Vivanti Anna Emilia","Mea culpa","1927","Invero, le pareva di non più riconoscerlo, di non più ricordarlo. Quel viso ascetico, affilato dalla sofferenza, spiritualizzato dal martirio, le sembrava estraneo, ignoto. – Astrid!...","YES"
"Vivanti_Anna_Emilia-Mea_culpa-1927","Vivanti Anna Emilia","Mea culpa","1927","da tanti anni aspetto e sogno questo istante. E voi... non avete per me una parola di saluto? Ella avrebbe voluto rispondere; ma la commozione le chiudeva la gola, le suggellava le labbra.","YES"
"Vivanti_Anna_Emilia-Mea_culpa-1927","Vivanti Anna Emilia","Mea culpa","1927","Vide il pallore stendersi come un velo su quel fine volto olivastro. Balbettò: – Vi ringrazio... con tutta l’anima... Egli con un gesto la fermò.","NO"
"Vivanti_Anna_Emilia-Mea_culpa-1927","Vivanti Anna Emilia","Mea culpa","1927","– Ditemi di voi. Ditemi... siete felice? – Sì... – mormorò lei a capo chino.","NO"
"Vivanti_Anna_Emilia-Mea_culpa-1927","Vivanti Anna Emilia","Mea culpa","1927","Vi fu un attimo di silenzio. – Io sono sempre quale mi conosceste, Astrid. Il mio cuore non è cambiato.","NO"
"Vivanti_Anna_Emilia-Mea_culpa-1927","Vivanti Anna Emilia","Mea culpa","1927","Essa alzò su lui le pupille sperdute; e nella sua mente turbinavano i dubbi, le ansie. Che voleva da lei quest’uomo? Perché era venuto?","YES"
"Vivanti_Anna_Emilia-Mea_culpa-1927","Vivanti Anna Emilia","Mea culpa","1927","Questo estraneo, per il quale ella aveva un giorno tanto spasimato e sofferto, perché ritornava nella sua vita? Egli si avvicinò d’un passo. – Avete qualche volta pensato a me?","YES"
"Vivanti_Anna_Emilia-Mea_culpa-1927","Vivanti Anna Emilia","Mea culpa","1927","– Sì... si... ho pensato... – Tremava, smarrita, sconvolta. – Ma dovete comprendere... che ormai tra noi tutto è finito. – Ah no!","NO"
"Vivanti_Anna_Emilia-Mea_culpa-1927","Vivanti Anna Emilia","Mea culpa","1927","– esclamò lui con veemenza, – non lo comprendo. Non lo voglio comprendere! Un’improvvisa ondata di spavento la invase; una vampa le salì al viso.","NO"
"Vivanti_Anna_Emilia-Mea_culpa-1927","Vivanti Anna Emilia","Mea culpa","1927","Che fosse vero quello che diceva Norman? Che gli arabi erano tutti subdoli, falsi, pericolosi? Veniva forse a minacciarla costui?","YES"
"Vivanti_Anna_Emilia-Mea_culpa-1927","Vivanti Anna Emilia","Mea culpa","1927","A riportare nella sua vita lo scompiglio e il disastro? Quasi leggendole negli occhi questi pensieri il viso dell’orientale si trasmutò, il suo pallore divenne più intenso. – Non abbiate timore di me.","YES"
"Vivanti_Anna_Emilia-Mea_culpa-1927","Vivanti Anna Emilia","Mea culpa","1927","– Vi era nel suo accento una dignitosa tristezza che la umiliò. – E perdonatemi se ho osato sperare di non esservi completamente estraneo. Poi, col respiro più breve, si chinò verso di lei: – Ma è possibile, è possibile che mentre io, in quell’orrendo campo di prigionieri, vi sognavo, vi invocavo come un assetato invoca una fonte d’acqua nel deserto... mentre, benedicendovi, sentivo in voi la luce e la meta della mia esistenza... è possibile che dal vostro ricordo io fossi già sparito?","NO"
"Vivanti_Anna_Emilia-Mea_culpa-1927","Vivanti Anna Emilia","Mea culpa","1927","Che per voi non fossi più nulla? È possibile che io oggi sia un estraneo, un passante, un intruso nella vostra casa? – Stese la mano verso di lei con gesto disperato.","NO"
"Vivanti_Anna_Emilia-Mea_culpa-1927","Vivanti Anna Emilia","Mea culpa","1927","– Ma allora perché, perché sentivo sempre il vostro spirito vicino a me? Perché, nel profondo della mia anima udivo sempre una voce che mi gridava: «Ella ritornerà nella tua vita!...»? Perché?","NO"
"Vivanti_Anna_Emilia-Mea_culpa-1927","Vivanti Anna Emilia","Mea culpa","1927","Si abbatté sulla seggiola coprendosi il viso. Astrid rimase a contemplarlo, trasognata, attonita. Il passato le rifluiva alla mente come una marea tumultuosa; come una visione di delirio.","NO"
"Vivanti_Anna_Emilia-Mea_culpa-1927","Vivanti Anna Emilia","Mea culpa","1927","Era lei, Astrid, che un giorno si era data a quest’uomo? Che aveva sognato di andare a vivere per sempre nel deserto con lui?... Quale abisso tra la donna d’allora e quella d’oggi!","YES"
"Vivanti_Anna_Emilia-Mea_culpa-1927","Vivanti Anna Emilia","Mea culpa","1927","La vergine folle, sbattuta dalla tormenta, che in un impeto di esaltazione gli si era gettata nelle braccia, non esisteva più. Ora tra lei e quel passato di tempesta s’innalzava l’arco azzurro dei suoi giorni sereni. Tra lei e questa tragica figura che le stava dinanzi, si ergeva la fiorita barriera della sua felicità.","YES"
"Vivanti_Anna_Emilia-Mea_culpa-1927","Vivanti Anna Emilia","Mea culpa","1927","– Saad Nassir, – diss’ella a bassa voce, – il passato è morto. Scordatelo. Noi non dobbiamo rivederci mai più.","NO"
"Vivanti_Anna_Emilia-Mea_culpa-1927","Vivanti Anna Emilia","Mea culpa","1927","L’arabo scattò in piedi: i suoi occhi lampeggiarono. – Ma dunque per voi, quello che accadde... non fu che un’avventura? «Un’avventura!...» L’aspra parola la colpì in pieno petto come una pugnalata.","NO"
"Vivanti_Anna_Emilia-Mea_culpa-1927","Vivanti Anna Emilia","Mea culpa","1927","Un’avventura, quella tragedia che aveva macchiato d’orrore e d’onta la sua anima? che aveva fatto di lei una mentitrice e una fedifraga? che l’aveva spinta a volersi precipitare nella tomba con la sua creatura non nata?","YES"
"Vivanti_Anna_Emilia-Mea_culpa-1927","Vivanti Anna Emilia","Mea culpa","1927","Un’avventura!... Tutti gli spasimi del passato si ridestarono, si riabbatterono sul suo cuore. Proruppe in disperati singhiozzi.","YES"
"Vivanti_Anna_Emilia-Mea_culpa-1927","Vivanti Anna Emilia","Mea culpa","1927","– Crudele!... Siete crudele! – Perdonatemi... – anche la voce di lui si spezzò in un singulto.","NO"
"Vivanti_Anna_Emilia-Mea_culpa-1927","Vivanti Anna Emilia","Mea culpa","1927","– È il mio strazio che parla, è la mia disperazione. Pensate, Astrid! io avevo creduto che un vincolo eterno ci unisse, un vincolo umano e sacro: la vostra creatura!","NO"
"Vivanti_Anna_Emilia-Mea_culpa-1927","Vivanti Anna Emilia","Mea culpa","1927","Sì!... sì!... – le parlava convulso, con gli occhi negli occhi; il suo caldo respiro la sfiorava, – nonostante quel vostro messaggio che mi strappava dal cuore la speranza, nel momento stesso in cui mi veniva strappata la libertà... io ho sempre creduto che la vostra creatura fosse mia!","NO"
"Vivanti_Anna_Emilia-Mea_culpa-1927","Vivanti Anna Emilia","Mea culpa","1927","Astrid! Io non so... non so...» se non lo credo ancor oggi! – No!","NO"
"Vivanti_Anna_Emilia-Mea_culpa-1927","Vivanti Anna Emilia","Mea culpa","1927","– La voce di Astrid era quasi un grido. – Non è così! voi sognate!","NO"
"Vivanti_Anna_Emilia-Mea_culpa-1927","Vivanti Anna Emilia","Mea culpa","1927","Egli indietreggiò. L’espressione del suo viso terreo la sconvolse; la mosse a pietà. – Voi dovete dimenticare, Saad Nassir; dimenticare... me e lei.","NO"
"Vivanti_Anna_Emilia-Mea_culpa-1927","Vivanti Anna Emilia","Mea culpa","1927","Ma dimenticateci senza rancore, senza amarezza! E col pianto nella voce, congiungendo le mani, implorò: – E beneditela... beneditela lo stesso, la mia creatura! Si volse; e con mano tremante scostò la tenda calata davanti alla porta d’ingresso.","NO"
"Vivanti_Anna_Emilia-Mea_culpa-1927","Vivanti Anna Emilia","Mea culpa","1927","– Darling Quasi subito, sullo sfondo scuro dell’andito, apparve la figuretta infantile – diafana, eterea, occhichiara – visione serafica in un nimbo di capelli biondi. Arrestata nello slancio verso la madre, la bimba ristette in quel suo caratteristico atteggiamento di volo, alzando verso lo sconosciuto l’azzurra meraviglia del suo sguardo. Saad Nassir mosse avanti d’un passo; poi si irrigidì.","NO"
"Vivanti_Anna_Emilia-Mea_culpa-1927","Vivanti Anna Emilia","Mea culpa","1927","Sul suo volto la commozione passava contraendone la torturata bellezza; le sue nere pupille si affondavano nelle chiare iridi della bambina. Astrid, spinta da un palpito d’ansia ch’ella stessa non avrebbe saputo definire, si piegò e cinse con le braccia la sua piccina. – Darling!","NO"
"Vivanti_Anna_Emilia-Mea_culpa-1927","Vivanti Anna Emilia","Mea culpa","1927","Ma quella teneva gli occhi fissi sul volto dell’arabo. Egli con un gesto incerto, quasi timoroso, le stese le mani; e subito, come inconsciamente attratta, la bambina abbandonò il cerchio delle materne braccia e mosse con brevi passsi verso di lui. In quelle mani scure ch’egli le tendeva posò fidente le candide mani piccoline.","NO"
"Vivanti_Anna_Emilia-Mea_culpa-1927","Vivanti Anna Emilia","Mea culpa","1927","Saad non si mosse, né parlò, temendo di spaventarla, temendo di rompere l’incanto. Chino verso di lei, la guardava: scrutava il delicato viso dall’epidermide di tuberosa; lo scintillio degli aurati capelli; e tra le frangiate ciglia gli occhi d’un chiarissimo celeste. Così si guardarono a lungo.","NO"
"Vivanti_Anna_Emilia-Mea_culpa-1927","Vivanti Anna Emilia","Mea culpa","1927","Astrid sentì fremere nel profondo del suo essere un’oscura inquietudine: le pareva che con quello sguardo magnetico, l’arabo traesse a sé l’anima della bambina. – Lasciatela!... lasciatela!...","YES"
"Vivanti_Anna_Emilia-Mea_culpa-1927","Vivanti Anna Emilia","Mea culpa","1927","– mormorò. Subito egli aperse le dita, liberando le manine annidate nella sua stretta. Poi si raddrizzò.","NO"
"Vivanti_Anna_Emilia-Mea_culpa-1927","Vivanti Anna Emilia","Mea culpa","1927","E volgendo ad Astrid un viso che sembrava essersi fatto subitamente più terreo e più sparuto, mormorò una parola: – Eppure!... Impallidendo, Astrid con rapido passo s’avanzò, e sollevando tra le braccia la bambina la tenne stretta a sé. L’uomo contemplò quel gruppo di pura umana bellezza, e il suo cuore solitario vibrò; una immensa tristezza lo invase.","NO"
"Vivanti_Anna_Emilia-Mea_culpa-1927","Vivanti Anna Emilia","Mea culpa","1927","Ah, poterle rapire entrambe!... Portare nella sua tragica vita senza gioia, quelle due creature di luce! Ancora una volta il suo sguardo percorse il piccolo viso d’angelo; e sulle sue labbra ritornò quella parola: – Eppure!...","YES"
"Vivanti_Anna_Emilia-Mea_culpa-1927","Vivanti Anna Emilia","Mea culpa","1927","... Il sole precipitava verso il Sahara, incendiando il cielo; un fulgore roseo invase la veranda, il giardino. E da tutti i lontani minareti si alzò il richiamo alla preghiera.","NO"
"Vivanti_Anna_Emilia-Mea_culpa-1927","Vivanti Anna Emilia","Mea culpa","1927","Da tutta la terra d’Egitto sorgeva verso i cieli la consacrata invocazione: – Iddio è grande. Non vi è altro Dio all’infuori di Lui. I fellah tra le dune s’inginocchiavano.","NO"
"Vivanti_Anna_Emilia-Mea_culpa-1927","Vivanti Anna Emilia","Mea culpa","1927","Sulle dahahyeh i marinai si prostravano con la fronte a terra. E Astrid vide l’uomo davanti a lei irrigidirsi e volgersi verso l’Occidente. Tutta la luce del tramonto folgorò su quel pallido viso.","NO"
"Vivanti_Anna_Emilia-Mea_culpa-1927","Vivanti Anna Emilia","Mea culpa","1927","Così egli rimase immobile, statuario, con le mani lungo i fianchi, finché il richiamo dei muezzin cessò. Poi, quasi il raccoglimento lo avesse rinfrancato, si volse di nuovo a lei, con lo sguardo più fermo e più tranquillo. – Astrid; se mai un giorno la tua felicità crollasse; se la tua gioia svanisse come un castello di sabbia che il vento disperde; se mai, o Astrid, tu fossi triste, solitaria e sperduta... ricordati di me.","NO"
"Vivanti_Anna_Emilia-Mea_culpa-1927","Vivanti Anna Emilia","Mea culpa","1927","Astrid chiuse gli occhi, e strinse più forte a sé la sua bambina. – Il giuramento che un giorno ti feci presso l’oasi di El Kara, nella tenda sotto le libere stelle, oggi io lo ripeto: Per il candido dono d’amore e pietà che un giorno mi recasti, per le lacrime di dolore che versasti per me, per lo strazio infinito che per te ho sofferto e soffro, io giuro... – alzò con gesto solenne la destra, – giuro di consacrare ad Allah il mio spirito; all’Egitto il mio sangue; a te il mio cuore. S’inchinò, recando la mano alla fronte e alle labbra.","NO"
"Vivanti_Anna_Emilia-Mea_culpa-1927","Vivanti Anna Emilia","Mea culpa","1927","Poi senza un’altra parola, senza un altro sguardo, si volse e la lasciò. Essa lo vide allontanarsi, attraversare il giardino, scendere verso il Nilo. Dopo breve tempo la bianca dahabyeh ricomparve sull’acqua radiosa... ridiscese il fiume... dileguò e disparve nel rutilante occaso.","NO"
"Vivanti_Anna_Emilia-Mea_culpa-1927","Vivanti Anna Emilia","Mea culpa","1927","Così si chiudeva il dramma del passato. Così sull’oscura colpa calava la pietra sepolcrale dell’oblio. Ma talvolta, nelle sue notti solitarie e insonni, Astrid, china sopra la sua creatura dormente tra i candidi lini, pur vedendola bianca come un giglio e bionda come le spiche – sentiva nella sua mente, nella sua coscienza, nel suo sangue stesso, echeggiare una parola enigmatica, misteriosa: – Eppure!...","YES"
"Vivanti_Anna_Emilia-Mea_culpa-1927","Vivanti Anna Emilia","Mea culpa","1927","Caro maggiore Grey, – disse il Duca di Buckley, mentre scendeva con Norman dal battello che li aveva portati da Wady Haifa a Shellal, – siete stato un’ottima guida e un ammirevole compagno di viaggio. Avete saputo sottrarmi agli indiscreti, liberarmi dai noiosi, e illuminarmi su certi punti oscuri della nostra situazione in questo paese. – Passò con cordiale familiarità il suo braccio in quello di Norman.","NO"
"Vivanti_Anna_Emilia-Mea_culpa-1927","Vivanti Anna Emilia","Mea culpa","1927","– Sulle vostre qualità e i vostri meriti ero già informato dal Governatore. Orbene, se vi riuscisse gradito l’apporre al vostro nome il piccolo prefisso di «Sir», io sarei ben lieto, al mio ritorno a Londra, di proporvi per il titolo di baronetto. Norman Grey ringraziò.","NO"
"Vivanti_Anna_Emilia-Mea_culpa-1927","Vivanti Anna Emilia","Mea culpa","1927","– Prima di lasciare l’Egitto, – continuò il nobiluomo, – mi sarebbe grato presentare i miei omaggi alla futura «Lady» Grey. Mia moglie non è mai riuscita a vederla al Cairo. Dove la tenete dunque sequestrata?","NO"
"Vivanti_Anna_Emilia-Mea_culpa-1927","Vivanti Anna Emilia","Mea culpa","1927","Grey sorrise. – In una villetta sul Nilo, presso El Wasta, Se Vostra Grazia vorrà onorarci... Così avvenne che un giorno, dal treno di lusso Cairo-Luxor scesero, in vista della nera Piramide di Illahûn, degli illustri visitatori.","NO"
"Vivanti_Anna_Emilia-Mea_culpa-1927","Vivanti Anna Emilia","Mea culpa","1927","Accompagnati da Norman Grey, si recavano alla Loggia delle Mimose il duca e la duchessa di Buckley coi loro tre figli: due ragazzine gemelle – Lady Muriel e Lady Maisie – e il cadetto navale dodicenne, Lord Harold, visconte di Durham. Astrid non aspettava visite. Seduta nel bow-window del salotto ombreggiato al di fuori da fitte fronde, ella teneva aperto sulle ginocchia un quaderno azzurro.","NO"
"Vivanti_Anna_Emilia-Mea_culpa-1927","Vivanti Anna Emilia","Mea culpa","1927","Sulla prima pagina stavano scritte poche parole: «Darling!... un giorno, quando sarai grande, sfoglierai questo libriccino dove oggi vado notando i miei pensieri, mentre accanto a me sboccia e fiorisce la tua divina infanzia...» Lo scritto si fermava lì. Era stata la cugina Elsy a suggerirle l’idea di un diario.","NO"
"Vivanti_Anna_Emilia-Mea_culpa-1927","Vivanti Anna Emilia","Mea culpa","1927","Elsy viveva felice a Londra, col marito e i due bimbi, in casa di Lady Taylor; e mandava ad Astrid lunghe ed affettuose lettere. «Segui il mio consiglio», le aveva scritto un giorno, «tieni anche tu un libro d’impressioni e di ricordi, perché più tardi la tua bimba possa in quelle pagine rivivere la sua infanzia e comprendere l’amore che ha accompagnato i suoi primi passi nella vita...» E Astrid aveva cominciato per Darling il Diario Azzurro. Ma quelle prime righe erano rimaste le ultime; non le riusciva di proseguire.","NO"
"Vivanti_Anna_Emilia-Mea_culpa-1927","Vivanti Anna Emilia","Mea culpa","1927","L’intensità stessa del suo amore per Darling gliene rendeva difficile l’espressione; ancor meno le riusciva di analizzare e descrivere le sfumature di quella piccola anima delicata, che schiudendosi tra le immense solitudini e i silenzi del deserto, sembrava aleggiare inafferrabile in una scintillante nebulosità di poesia. ... Mentre Astrid così pensava, udì il rombo d’una automobile, e vide Darling spaurita attraversare correndo la veranda per rifugiarsi da Fatma, come faceva sempre quando arrivavano visite.","YES"
"Vivanti_Anna_Emilia-Mea_culpa-1927","Vivanti Anna Emilia","Mea culpa","1927","Pochi istanti dopo, la famiglia ducale entrò: il duca sorridente e bonario; ampia e maestosa la duchessa; graziose le due ragazzine gemelle coi lunghi riccioli fulvi; e il giovanissimo Lord composto e corretto nella sua divisa del collegio navale di Osborne. Astrid li accolse con cortesia sorridente, offrendo ai loro sguardi un poco attoniti la sua pacata leggiadria e la fresca tranquillità della sua casa. La piccola Darling non aveva fatto a tempo a fuggire.","NO"
"Vivanti_Anna_Emilia-Mea_culpa-1927","Vivanti Anna Emilia","Mea culpa","1927","Suo padre, scorgendola mentre con Fatma prendeva la corsa verso le dune, la fermò. – Dove fuggi, lodoletta? E presala in braccio la riportò in casa.","NO"
"Vivanti_Anna_Emilia-Mea_culpa-1927","Vivanti Anna Emilia","Mea culpa","1927","Nella sala da musica venne servito il thè. La duchessa, seduta sul divano, si guardava intorno con benevola approvazione. – Ma è delizioso qui!","NO"
