"filename","nome","titolo","anno","chunk","DIL"
"Vivanti_Anna_Emilia-Mea_culpa-1927","Vivanti Anna Emilia","Mea culpa","1927","Egoisti tutti quanti che non erano altro! Ah, valeva proprio la pena di allevare delle ragazze, di sacrificarsi per delle creature aride e senza cuore, che pensavano soltanto a divertirsi, a sposarsi, ad andarsene in viaggio di nozze col primo venuto!... Lo sapevano pure che lei soffriva di cefalea, di vertigini e di palpitazioni di cuore, e che il dottore, a Londra, aveva raccomandato di evitare le emozioni spiacevoli.","YES"
"Vivanti_Anna_Emilia-Mea_culpa-1927","Vivanti Anna Emilia","Mea culpa","1927","Ed ecco, se ne andavano tutti, e la lasciavano sola! sola, in un orribile albergo pieno di negri, in un abominevole paese pieno di tombe e di cammelli e di mosche. E se adesso le veniva la palpitazione?","YES"
"Vivanti_Anna_Emilia-Mea_culpa-1927","Vivanti Anna Emilia","Mea culpa","1927","La cefalea? La vertigine? A questo punto Lady Taylor proruppe in amare lacrime di autocommiserazione; e avendo passato l’intera notte a vestirsi, a spogliarsi, e a rivestirsi, decise di mettersi definitivamente a letto.","YES"
"Vivanti_Anna_Emilia-Mea_culpa-1927","Vivanti Anna Emilia","Mea culpa","1927","Vi rimase tutto il giorno, senza colazione, senza pranzo, senza cena; avendo per unica compagnia la Cefalea, la Vertigine e la Palpitazione. A tarda notte sollevò di scatto la dolente testa dal guanciale. C’era qualcuno nella camera vicina!","YES"
"Vivanti_Anna_Emilia-Mea_culpa-1927","Vivanti Anna Emilia","Mea culpa","1927","Sì!... sentiva muovere qualcuno. Dei passi leggieri e cauti movevano qua e là, si soffermavano accanto alla porta...","YES"
"Vivanti_Anna_Emilia-Mea_culpa-1927","Vivanti Anna Emilia","Mea culpa","1927","Chi era? Chi poteva essere a quest’ora? Astrid?","YES"
"Vivanti_Anna_Emilia-Mea_culpa-1927","Vivanti Anna Emilia","Mea culpa","1927","La cameriera? Un negro?... quel terribile negro che puliva le scarpe e che l’aveva seguita nella penembra dei lunghi corridoi, nascondendosi negli angoli quando lei si voltava?...","YES"
"Vivanti_Anna_Emilia-Mea_culpa-1927","Vivanti Anna Emilia","Mea culpa","1927","I nervi tesi di Lady Taylor non ressero oltre: gettò un urlo, poi un altro, poi una sequela di strilli prolungati e sopracuti» Sulla soglia della stanza da bagno comparve una figuretta rosea e raggiante: Elsy! Era Elsy! Mamma!","YES"
"Vivanti_Anna_Emilia-Mea_culpa-1927","Vivanti Anna Emilia","Mea culpa","1927","Cara!... Ti ho spaventata? – Elsy, Elsy!...","NO"
"Vivanti_Anna_Emilia-Mea_culpa-1927","Vivanti Anna Emilia","Mea culpa","1927","– singhiozzò sua madre. Poi, presa da nuovo sgomento, si raddrizzò: – Che cos’è accaduto? Perché sei qui?","NO"
"Vivanti_Anna_Emilia-Mea_culpa-1927","Vivanti Anna Emilia","Mea culpa","1927","– John è partito questa notte per Khartoum. Concentrano le nostre truppe laggiù. Ma come!...","NO"
"Vivanti_Anna_Emilia-Mea_culpa-1927","Vivanti Anna Emilia","Mea culpa","1927","Non sai che c’è la rivolta nel Sudan? – La rivolta! – sospirò con sollievo Lady Taylor.","NO"
"Vivanti_Anna_Emilia-Mea_culpa-1927","Vivanti Anna Emilia","Mea culpa","1927","– Meno male. Temevo che tu avessi già litigato con tuo marito. – Oh no!...","NO"
"Vivanti_Anna_Emilia-Mea_culpa-1927","Vivanti Anna Emilia","Mea culpa","1927","– protestò Elsy arrossendo. – Tutt’altro, mamma! Lady Taylor posò il viso travagliato sull’onero di sua figlia.","NO"
"Vivanti_Anna_Emilia-Mea_culpa-1927","Vivanti Anna Emilia","Mea culpa","1927","E dalla camera piena di sorrisi e di tenerezze, si dipartirono pian piano le superflue visitatrici: la Cefalea, la Vertigine, e la Palpitazione. – Dunque, – concluse Lady Taylor alla fine della sua narrazione, – bisognerà avvertire subito il Consolato, il presidio e la polizia perché la rintraccino... – Per carità! – interruppe Elsy, – evitiamo le inutili pubblicità.","NO"
"Vivanti_Anna_Emilia-Mea_culpa-1927","Vivanti Anna Emilia","Mea culpa","1927","Pensa, ma pensa dunque alla gioia dei Forresters, dei Harter, di tutti gli sfaccendati della colonia, famelica di pettegolezzi e di scandali! Lady Taylor rabbrividì. – Senti, mamma; noi conosciamo Astrid.","YES"
"Vivanti_Anna_Emilia-Mea_culpa-1927","Vivanti Anna Emilia","Mea culpa","1927","Lasciamo svaporare le sue bizze! Sta sicura che entro oggi ce la vedremo ricomparire, tutta mortificata e compunta... Ma la giornata passò e Astrid non fece ritorno.","YES"
"Vivanti_Anna_Emilia-Mea_culpa-1927","Vivanti Anna Emilia","Mea culpa","1927","Col calar della notte l’inquietudine di Elsy si accrebbe, mentre l’ansia di Lady Taylor suggeriva alla sua mente le più fosche immaginazioni. – Dev’essere caduta in qualche tranello, – gemeva, pallida e disfatta. – L’avranno trascinata in uno di quegli antri dove si fuma l’oppio... –- E sbarrava terrorizzata i rotondi occhi di bambola.","NO"
"Vivanti_Anna_Emilia-Mea_culpa-1927","Vivanti Anna Emilia","Mea culpa","1927","Poi, con un nuovo scoppio di disperazione: – Oppure si sarà gettata nel Nilo! Sì! sì!","NO"
"Vivanti_Anna_Emilia-Mea_culpa-1927","Vivanti Anna Emilia","Mea culpa","1927","ho il presentimento che si sia gettata nel Nilo! La seconda notte passò, angosciata, insonne. Nella scialba luce mattutina le due donne si guardarono in viso.","YES"
"Vivanti_Anna_Emilia-Mea_culpa-1927","Vivanti Anna Emilia","Mea culpa","1927","Erano livide e disfatte. Bisognava agire; invocare l’aiuto delle autorità britanniche, affrontare la pubblicità, lo scàndalo. Tuttavia Elsy esitava ancora.","YES"
"Vivanti_Anna_Emilia-Mea_culpa-1927","Vivanti Anna Emilia","Mea culpa","1927","Appena l’ora lo permise, scese nell’atrio e interrogò con aria di ostentata disinvoltura il portiere. Dopo pochi istanti risalì, accompagnata da un «boy» siriano in livrea azzurra. Lady Taylor, accasciata sul divano, si sollevò tremante.","NO"
"Vivanti_Anna_Emilia-Mea_culpa-1927","Vivanti Anna Emilia","Mea culpa","1927","– Mamma, questo giovane era di guardia davanti all’albergo ieri l’altro a sera; ha visto uscire Astrid. – E rivolta al sorridente «boy»: – È vero? – Sì, signora.","NO"
"Vivanti_Anna_Emilia-Mea_culpa-1927","Vivanti Anna Emilia","Mea culpa","1927","Per l’emozione Lady Taylor si sentì mancare. Elsy con ansia repressa continuava l’interrogatorio del giovane. – Ha preso una carrozza?","NO"
"Vivanti_Anna_Emilia-Mea_culpa-1927","Vivanti Anna Emilia","Mea culpa","1927","Un «arabyeh»? – Ha preso un’automobile. Ho chiuso io lo sportello.","NO"
"Vivanti_Anna_Emilia-Mea_culpa-1927","Vivanti Anna Emilia","Mea culpa","1927","– Che indirizzo ha dato? Il siriano rifletté un momento. Lo ricordava perfettamente, ma era incerto se gli conveniva dirlo.","YES"
"Vivanti_Anna_Emilia-Mea_culpa-1927","Vivanti Anna Emilia","Mea culpa","1927","Alzò gli occhi al cielo e non rispose. – Ricordate il numero dell’automobile? – No, signora.","NO"
"Vivanti_Anna_Emilia-Mea_culpa-1927","Vivanti Anna Emilia","Mea culpa","1927","– L’automobile in questione stazionava in quel momento sull’asfalto davanti all’albergo, e il «boy» stesso, cinque minuti prima, aveva scambiato una serie di circonvolute contumelie arabe col vecchio chauffeur dal berretto di pelo piantato sopra il turbante. Ma questo il siriano non disse. Invece, dopo prolungata riflessione, dichiarò: – Potrei forse riconoscere lo chauffeur.","NO"
"Vivanti_Anna_Emilia-Mea_culpa-1927","Vivanti Anna Emilia","Mea culpa","1927","Con un ansito Lady Taylor si lasciò ricadere indietro sul divano. Elsy le lanciò uno sguardo d’incoraggiamento. Poi rivolta al giovane: – Come vi chiamate?","NO"
"Vivanti_Anna_Emilia-Mea_culpa-1927","Vivanti Anna Emilia","Mea culpa","1927","– Ahmed. – Ebbene, Ahmed, andate! Cercate quello chauffeur!","NO"
"Vivanti_Anna_Emilia-Mea_culpa-1927","Vivanti Anna Emilia","Mea culpa","1927","Cercatelo per tutta la città. E conducetelo qui. Ahmed scese, senza affrettarsi, la gradinata della terrazza; attraversò il marciapiede e andò verso la fila d’automobili che stazionava in mezzo alla strada.","NO"
"Vivanti_Anna_Emilia-Mea_culpa-1927","Vivanti Anna Emilia","Mea culpa","1927","Si fermò davanti alla penultima. – Baroudi, – disse al vecchio conducente che seduto al volante leggeva il giornale «El Ahram»; – quella Sitt dai capelli chiari, vestita di bianco, che hai condotto fuori ier l’altro a sera, dove l’hai portata? Il conducente rispose con un florilegio d’ingiurie in cui vi erano molte allusioni ad Allah e ai fulmini ch’egli tiene in serbo per gli indiscreti e i curiosi.","NO"
"Vivanti_Anna_Emilia-Mea_culpa-1927","Vivanti Anna Emilia","Mea culpa","1927","– Oh lurido parente degli scorpioni! – ribatté Ahmed. – Non avrai la mancia.","NO"
"Vivanti_Anna_Emilia-Mea_culpa-1927","Vivanti Anna Emilia","Mea culpa","1927","– E fece le viste di voler rientrare nell’albergo. Allora lo chauffeur lo richiamò. – Vieni qui, sozzo figlio d’uno sciacallo, e dimmi perché mi hai fatto quella domanda.","NO"
"Vivanti_Anna_Emilia-Mea_culpa-1927","Vivanti Anna Emilia","Mea culpa","1927","Ma il giovane, volgendogli le spalle, ripeté: – Non importa. La mancia me la terrò io. E rimase fermo, per lasciar passare una fila di carrozze che gli impedivano di attraversare la strada.","NO"
"Vivanti_Anna_Emilia-Mea_culpa-1927","Vivanti Anna Emilia","Mea culpa","1927","Ma Baroudi non pensava a mance. Pensava alla «Sitt», a quella divina Sitt, dolce come il latte, bianca come il fiore della magnolia, generosa come la figlia di un Khedive, ch’egli aveva lasciata tutta sola in riva al canale Zomor. Che ne era di lei?","YES"
"Vivanti_Anna_Emilia-Mea_culpa-1927","Vivanti Anna Emilia","Mea culpa","1927","Quella sera gl’inglesi avevano incendiato il villaggio là vicino... Che le fosse accaduto qualche cosa? – Rispondi! – gridò al siriano.","YES"
"Vivanti_Anna_Emilia-Mea_culpa-1927","Vivanti Anna Emilia","Mea culpa","1927","– Perché vuoi saperlo? Ahmed gli tornò accanto, e alzando il volto malizioso, disse con una strizzatina d’occhi – Quella Sitt non è più ritornata. La sua gente vuole parlarti; vuol sapere dove l’hai portata.","NO"
"Vivanti_Anna_Emilia-Mea_culpa-1927","Vivanti Anna Emilia","Mea culpa","1927","La fronte scura di Baroudi sotto il berretto e il turbante, si corrugò. Ma come! la dolce Sitt, l’agnelletta bianca e spaurita che si recava a trovare il condottiero, il salvatore degli oppressi, l’apostolo della libertà, Saad Nassir Effendi, non era rientrata?","YES"
"Vivanti_Anna_Emilia-Mea_culpa-1927","Vivanti Anna Emilia","Mea culpa","1927","Un immenso desiderio di proteggerla, di difenderla, gli strinse il vecchio cuore. Dopo un istante d’intensa riflessione, si levò lentamente dal suo sedile è fece per scendere a terra. – Andiamo, – disse ad Ahmed.","NO"
"Vivanti_Anna_Emilia-Mea_culpa-1927","Vivanti Anna Emilia","Mea culpa","1927","– No! no! – rise questi.","NO"
"Vivanti_Anna_Emilia-Mea_culpa-1927","Vivanti Anna Emilia","Mea culpa","1927","– Aspetta pure. Adesso io vado a cercarti per tutta la città. E con una smorfia allegra, arrotolando una sigaretta, si allontanò a passo dondolante, dirigendosi verso il Bazar Khan Kalili, dove suo padre teneva un negozio di reliquie di Tebe, piatti di Rodi e tappeti di Bukkara «made in Germany».","NO"
"Vivanti_Anna_Emilia-Mea_culpa-1927","Vivanti Anna Emilia","Mea culpa","1927","Dopo un paio d’ore ritornò verso il Shepheard’s; ma l’automobile del vecchio Baroudi non c’era più. Ahmed ebbe per un momento il dubbio atroce che quel vile discendente d’un camelloo orbo fosse entrato nell’albergo senza di lui; ma quasi subito lo vide giungere, guidando la sua macchina un poco sgangherata, e portando al vicino Hotel Continental una comitiva di americane in veli verdi. Appena libero, Baroudi affidò l’automobile alle cure d’un policeman ed entrò nell’albergo col siriano.","YES"
"Vivanti_Anna_Emilia-Mea_culpa-1927","Vivanti Anna Emilia","Mea culpa","1927","Questi lo precedette per la scala di servizio e lungo un ampio corridoio; poi batté alla porta del numero 161. Gli fu subito aperto. – Eccolo!","NO"
"Vivanti_Anna_Emilia-Mea_culpa-1927","Vivanti Anna Emilia","Mea culpa","1927","L’ho trovato! – disse in tono di modesto compiacimento Ahmed, sospingendo l’accigliato Baroudi nell’appartamento dove due signore parevano aspettarlo. Baroudi, fosco e arcigno, si fermò presso la soglia.","NO"
"Vivanti_Anna_Emilia-Mea_culpa-1927","Vivanti Anna Emilia","Mea culpa","1927","Tanto, non parlava che l’arabo; e non si fidava né di Ahmed né di quelle due straniere che lo scrutavano con occhi così intenti. Più che mai sentì che col silenzio o con la menzogna, bisognava difendere la Sitt. Ma l’accorata ansia delle due dame e le sommesse invettive di Ahmed lo decisero infine a parlare.","YES"
"Vivanti_Anna_Emilia-Mea_culpa-1927","Vivanti Anna Emilia","Mea culpa","1927","Egli aveva dunque condotto la Sitt... (il «boy» traduceva la fantasiosa narrazione con le varianti che gli parevano opportune) all’Hotel Semiramis. Poi nella sua automobile erano salite altre due signore... anzi, tre... (si; erano tre signore, non tre!...) e si erano fatte portare di qua e di là: al Ghezireh Palace... al Café Anglais... al Café Maure...","YES"
"Vivanti_Anna_Emilia-Mea_culpa-1927","Vivanti Anna Emilia","Mea culpa","1927","Erano rimaste molto tardi al Café Maure quelle tre signore... cioè, quelle quattro signore… – Ma com’erano queste signore? queste signore salite al Semiramis? – interruppe Elsy.","YES"
"Vivanti_Anna_Emilia-Mea_culpa-1927","Vivanti Anna Emilia","Mea culpa","1927","Vi fu una breve confabulazione in arabo. Poi Ahmed tradusse: – Dice che erano signore bianche. Così... come tutte.","NO"
"Vivanti_Anna_Emilia-Mea_culpa-1927","Vivanti Anna Emilia","Mea culpa","1927","Lady Taylor, fino allora tremula e muta, si volse ad Elsy. – Potrebbe darsi che fossero le norvegesi…, sai pure, quelle studentesse di Upsala. Alloggiavano infatti al Semiramis... – Telefoneremo subito a domandare, – disse Elsy, di cui gli occhi brillavano e le guance avevano ripreso il consueto color di rosa.","NO"
"Vivanti_Anna_Emilia-Mea_culpa-1927","Vivanti Anna Emilia","Mea culpa","1927","Vi fu una nuova rapida confabulazione tra Ahmed e lo chauffeur. Poi Ahmed dichiarò: – Dice che è inutile telefonare. Quelle signore non stanno più al Semiramis.","NO"
"Vivanti_Anna_Emilia-Mea_culpa-1927","Vivanti Anna Emilia","Mea culpa","1927","Sono partite. – Partite?! – Sì; sono andate via.","NO"
"Vivanti_Anna_Emilia-Mea_culpa-1927","Vivanti Anna Emilia","Mea culpa","1927","Tutte insieme. Anche la Sitt. Hanno preso un dragomanno, e sono andate nel deserto.","YES"
"Vivanti_Anna_Emilia-Mea_culpa-1927","Vivanti Anna Emilia","Mea culpa","1927","– Nel deserto?! – Sì. Hanno preso dei portatori, e un cuoco, e il dragomanno... un bravo dragomanno, chiamato Smain... e sono andate con tende e cammelli nel deserto.","NO"
"Vivanti_Anna_Emilia-Mea_culpa-1927","Vivanti Anna Emilia","Mea culpa","1927","– Ma è possibile! – esclamò incredula Elsy. – Nel deserto?!","NO"
"Vivanti_Anna_Emilia-Mea_culpa-1927","Vivanti Anna Emilia","Mea culpa","1927","Ma a far che? – fece eco sbigottita Lady Taylor. Ahmed ebbe un largo sorriso.","NO"
"Vivanti_Anna_Emilia-Mea_culpa-1927","Vivanti Anna Emilia","Mea culpa","1927","– Ma tutti i forestieri, tutte le Sitt americane e inglesi vanno con cuoco e cammelli nel deserto. E Baroudi, qui, – additò lo chauffeur, che pur senza capire faceva energicamente cenno di sì con la testa, – dice di stare pur tranquilli che Smani è un bravo dragomanno; e chiama a testimonio Allah e i suoi Angeli che quelle signore stanno bene, e sono nel deserto. E ci staranno... finché tornano, – concluse Ahmed.","NO"
"Vivanti_Anna_Emilia-Mea_culpa-1927","Vivanti Anna Emilia","Mea culpa","1927","Dopo un breve silenzio di stupefazione Lady Taylor domandò: – Ma si può sapere quando sono partite? Non quella sera, certo! se era già così tardi... Ahmed si informò; poi tradusse: – Dice che nel deserto si va appunto di notte, perché di giorno fa troppo caldo.","NO"
"Vivanti_Anna_Emilia-Mea_culpa-1927","Vivanti Anna Emilia","Mea culpa","1927","Poi aggiunse con molti sorrisi: – Dice che conosce un dragomanno, un molto bravo dragomanno, che si chiama Mahmoud. Quello potrà condurre anche voi nel deserto a cercare la Sitt. In quattro o cinque giorni, con tende e cammelli, troverete la Sitt; e bravo dragomanno Mahmoud farà pagare poco.","NO"
"Vivanti_Anna_Emilia-Mea_culpa-1927","Vivanti Anna Emilia","Mea culpa","1927","Le due signore si consultarono. Erano un poco tranquillizzate riguardo ad Astrid; e l’idea di andare a cercarla nel deserto non sorrideva affatto a Lady Taylor. Elsy, a dir vero, sarebbe stata propensa all’avventura; ma se ne lasciò dissuadere da sua madre.","YES"
"Vivanti_Anna_Emilia-Mea_culpa-1927","Vivanti Anna Emilia","Mea culpa","1927","– Ma pensa, Elsy! Potrebbe accadere che Astrid ritornasse mentre noi vaghiamo nel deserto a cercarla... proprio come nell’«Evangelina» di Longfellow... Infine congedarono Ahmed con una generosa mancia; e ne offrirono una anche più generosa allo chauffeur.","NO"
"Vivanti_Anna_Emilia-Mea_culpa-1927","Vivanti Anna Emilia","Mea culpa","1927","Ma questi ebbe un gesto dignitoso di rifiuto, alzando la scarna mano in atteggiamento ieratico e solenne. Allora le due signore, non sapendo in qual modo esprimergli la loro gratitudine, presero quella mano nera, e la strinsero fortemente e a lungo. Inchinandosi, Baroudi si recò alle labbra la mano ch’esse si erano degnate di toccare.","NO"
"Vivanti_Anna_Emilia-Mea_culpa-1927","Vivanti Anna Emilia","Mea culpa","1927","Rimaste sole, Elsy e sua madre si abbracciarono, convulse, sorridenti, con le lacrime agli occhi. Quella fantastica, quella stravagante Astrid era dunque sana e salva nel deserto, con le studentesse norvegesi, col bravo dragomanno Smain, coi cammelli e col cuoco! Non occorreva suscitare pettegolezzi e scandali mettendo in moto il Consolato e la polizia!","YES"
"Vivanti_Anna_Emilia-Mea_culpa-1927","Vivanti Anna Emilia","Mea culpa","1927","E neppure era il caso di farne cenno nelle loro lettere a Norman e a John. Inutile turbare la loro tranquillità. Le due signore decisero di non far nulla; di non dir nulla a nessuno; di aspettare con pazienza il ritorno della fuggitiva.","YES"
"Vivanti_Anna_Emilia-Mea_culpa-1927","Vivanti Anna Emilia","Mea culpa","1927","Per maggiore sicurezza, Elsy telefonò al Semiramis Hotel e domandò al portiere se in quell’albergo alloggiassero veramente delle studentesse norvegesi. Sì. Ma adesso non c’erano.","NO"
"Vivanti_Anna_Emilia-Mea_culpa-1927","Vivanti Anna Emilia","Mea culpa","1927","Erano partite con portatori e cammelli per passare alcuni giorni nel deserto. E avevano per guida un dragomanno chiamato Smain? Precisamente.","YES"
"Vivanti_Anna_Emilia-Mea_culpa-1927","Vivanti Anna Emilia","Mea culpa","1927","Era forse con loro una giovinetta inglese, bionda, che abitava al Shepheard’s? Questo il portiere del Semiramis non lo poteva affermare; ma era possibile. Elsy tornò da sua madre, tranquillizzata.","YES"
"Vivanti_Anna_Emilia-Mea_culpa-1927","Vivanti Anna Emilia","Mea culpa","1927","Tutto s’accordava esattamente con la narrazione dello chauffeur. – Già; gli si leggeva in volto ch’era un’anima candida, – commentò Lady Taylor. Lo chauffeur Baroudi (cugino del dragomanno Smain, e quindi bene informato) aveva infatti accompagnato fin sul limitare del deserto le signore norvegesi che stavano al Semiramis Hotel.","YES"
"Vivanti_Anna_Emilia-Mea_culpa-1927","Vivanti Anna Emilia","Mea culpa","1927","Ben sapeva egli, nella sua saggezza orientale, che se si vuole far bere a qualcuno una secchia di bugie, è opportuno aggiungervi qualche goccia di verità. Astrid si appoggiò al davanzale della finestra. Era già l’imbrunire; e i grandi alberi nel giardino del Shepheard’s Hotel nereggiavano, guglie d’ombra, sul perlaceo grigiore del cielo.","NO"
"Vivanti_Anna_Emilia-Mea_culpa-1927","Vivanti Anna Emilia","Mea culpa","1927","Scrosci di musica e gaie risate giungevano tratto tratto fino a lei, dai saloni dabbasso dove si stava preparando per quella sera l’albero natalizio. La Vigilia di Natale! Mancavano dieci giorni alla data fissata per le sue nozze!...","YES"
"Vivanti_Anna_Emilia-Mea_culpa-1927","Vivanti Anna Emilia","Mea culpa","1927","Una folata di vento, il dolce vento serale dal Nilo, le sfiorò il viso, e con un lieve brivido Astrid si ritrasse. Il grande specchio in fondo alla stanza rifletté la sua immagine, fantastica, spettrale. Ella sostò, guardandosi con larghi occhi smarriti.","NO"
"Vivanti_Anna_Emilia-Mea_culpa-1927","Vivanti Anna Emilia","Mea culpa","1927","Le pareva di non riconoscersi più. La passione, brandendo la torcia incendiatrice, era passata su lei, lasciandole nell’anima e sul volto il suo marchio rovente. Sì!","YES"
"Vivanti_Anna_Emilia-Mea_culpa-1927","Vivanti Anna Emilia","Mea culpa","1927","anche sul volto. Quella pallida, strana immagine che la fissava con occhi di mistero non era più Astrid, la spensierata Astrid di Richmond e di Mayfair. In quegli occhi fluttuava un bagliore nuovo; sfolgorava un novello ardore.","YES"
"Vivanti_Anna_Emilia-Mea_culpa-1927","Vivanti Anna Emilia","Mea culpa","1927","Con un senso d’indefinita angoscia Astrid indietreggiò, volgendo lo sguardo intorno nella tranquilla camera già invasa dall’ombra crepuscolare. Sette giorni prima ella era fuggita come folle da questa stanza. E la sera innanzi, coll’anima preparata alla tragedia, ne aveva varcato di nuovo la soglia.","NO"
"Vivanti_Anna_Emilia-Mea_culpa-1927","Vivanti Anna Emilia","Mea culpa","1927","Quante volte sotto la bianca tenda, nella profonda calma della notte desertica, ella si era figurata questo ritorno! E a tale pensiero si era sentita agghiacciare il sangue nelle vene. Saad Nassir, focoso e temerario amante, cedendo ai terrori di lei, faceva levare le tende per inoltrarsi sempre più nel cuore del deserto, fuggendo le tracce battute dalle carovane e i consueti luoghi di accampamento.","YES"
"Vivanti_Anna_Emilia-Mea_culpa-1927","Vivanti Anna Emilia","Mea culpa","1927","Mentre il senso del pericolo, della minaccia incombente, aggiungeva fiamma all’ardore di lui, febbre al suo delirio, Astrid, bianca preda nelle sue fosche braccia, palpitava e tremava al pensiero dell’imminente espiazione. Quale dramma si stava svolgendo al Cairo durante la sua assenza?... Quale angoscia e costernazione aveva lasciato dietro di sé!...","YES"
"Vivanti_Anna_Emilia-Mea_culpa-1927","Vivanti Anna Emilia","Mea culpa","1927","Certo a quest’ora la pubblicità, lo scandalo avevano ghermito il suo nome, straziandolo, infuriando intorno a lei come il khamâsîn del deserto. Allora, con un sussulto più profondo, le si affacciava il pensiero del ritorno. Come avrebbe varcato la soglia del Shepheard’s Hotel?","YES"
"Vivanti_Anna_Emilia-Mea_culpa-1927","Vivanti Anna Emilia","Mea culpa","1927","Come avrebbe affrontato lo sguardo atterrito della zia Mary? Il suo gesto d’esecrazione che respinge e discaccia? E Norman?...","YES"
"Vivanti_Anna_Emilia-Mea_culpa-1927","Vivanti Anna Emilia","Mea culpa","1927","Al pensiero di lui le si fermava di colpo il respiro. Norman, il soldato orgoglioso e puro, in qual modo avrebbe vendicato l’oltraggio fatto al suo onore e alla sua razza? Essa lo immaginava, lo vedeva, livido in volto, terribile, con la mano levata a colpire e a maledire.","YES"
"Vivanti_Anna_Emilia-Mea_culpa-1927","Vivanti Anna Emilia","Mea culpa","1927","Certo, l’errore di lei e della sua colpa lo avrebbe spinto all’atto di violenza suprema! E fosse pure! La morte sarebbe più facile a sopportare che non il gelo del suo disprezzo.","YES"
"Vivanti_Anna_Emilia-Mea_culpa-1927","Vivanti Anna Emilia","Mea culpa","1927","La morte! Ecco l’unica soluzione all’aggrovigliato problema della sua vita, l’unico finale al breve dramma di passione che l’aveva travolta. La morte!...","YES"
"Vivanti_Anna_Emilia-Mea_culpa-1927","Vivanti Anna Emilia","Mea culpa","1927","Ella non sarebbe mai più ritornata a Saad Nassir! La voce del deserto l’avrebbe richiamata invano... ...Così, con lo spirito teso fino allo schianto, la pallida errabonda aveva varcato la sera innanzi quella soglia, dov’ella credeva la attendesse a spada alzata il Destino.","YES"
"Vivanti_Anna_Emilia-Mea_culpa-1927","Vivanti Anna Emilia","Mea culpa","1927","*** E invece... nulla! Nulla di quanto aveva previsto e paventato era accaduto. Elsy e Lady Taylor l’avevano accolta con esultanza, con sorrisi di rapimento; avevano versato lacrime di gioia, mormorando tra i baci qualche rimprovero tenero e commosso.","YES"
"Vivanti_Anna_Emilia-Mea_culpa-1927","Vivanti Anna Emilia","Mea culpa","1927","Ma non avevano chiesto spiegazioni; Lady Taylor asseriva di sapere tutto, di perdonare tutto... E Norman Grey era lontano! Norman non sapeva nulla; non avrebbe mai saputo nulla.","YES"
"Vivanti_Anna_Emilia-Mea_culpa-1927","Vivanti Anna Emilia","Mea culpa","1927","A che pro, ragionava Lady Taylor, narrargli la scappata fanciullesca, il capriccio stolto e innocuo della fidanzata? Turbare per una sventatezza senza importanza la vigilia beta delle imminenti nozze? Partendo, egli aveva lasciato Astrid al Shepheard’s Hotel; ritornando ve l’avrebbe ritrovata.","YES"
"Vivanti_Anna_Emilia-Mea_culpa-1927","Vivanti Anna Emilia","Mea culpa","1927","E tutto finiva lì. Basta. Non gli avrebbero detto nulla.","YES"
